,title,link
684,Allcargo Signs MoU with Maharashtra State Skill Development Society (MSSDS) under the CSR Initiative ‘Nipun’,https://www.newsvoir.com/release/allcargo-signs-mou-with-maharashtra-state-skill-development-society-mssds-under-the-csr-initiative-nipun--8571.html
685,Mentoring Frontline Health Workers as the Champions of NCD Prevention,https://www.newsvoir.com/release/mentoring-frontline-health-workers-as-the-champions-of-ncd-prevention-8567.html
686,Telenor India Spreads the Joy of Reading amongst Children to Celebrate World Book Day,https://www.newsvoir.com/release/telenor-india-spreads-the-joy-of-reading-amongst-children-to-celebrate-world-book-day-8562.html
687,Government of Karnataka to Host India's First 'National Trade Fair for Organics and Millets 2017' ,https://www.newsvoir.com/release/government-of-karnataka-to-host-india-s-first-national-trade-fair-for-organics-and-millets-2017-8545.html
688,Infosys Foundation Joins Hands with ‘Sahapedia’ to Promote a Penchant for Cultural and Historical Knowledge of India among the Masses,https://www.newsvoir.com/release/infosys-foundation-joins-hands-with-sahapedia-to-promote-a-penchant-for-cultural-and-historical-knowledge-of-india-among-the-masses-8544.html
689,"Vodafone M-Pesa Felicitated by Uttar Pradesh CM, for Fulfilling PM’s Ideal Village Dream at Nagepur",https://www.newsvoir.com/release/vodafone-m-pesa-felicitated-by-uttar-pradesh-cm-for-fulfilling-pm-s-ideal-village-dream-at-nagepur-8543.html
690,Pune Gets 100 Young Fire Marshals during National Fire Service Week,https://www.newsvoir.com/release/pune-gets-100-young-fire-marshals-during-national-fire-service-week-8528.html
691,"Huawei India Reiterates its Support for Digital India, Signs MoU with CAF India for School Digitalization in Telangana",https://www.newsvoir.com/release/huawei-india-reiterates-its-support-for-digital-india-signs-mou-with-caf-india-for-school-digitalization-in-telangana-8485.html
692,INTEX Partners with LIFE NGO to Set-up its First Entrepreneur Development Centre for Training Rural Youth in Maharashtra,https://www.newsvoir.com/release/intex-partners-with-life-ngo-to-set-up-its-first-entrepreneur-development-centre-for-training-rural-youth-in-maharashtra-8476.html
693,HTC Launches Initiative ‘Aarzoo: Ek Wish Har Aarzoo Poori Karneki’ In Partnership with CRY to Make Quality Education Accessible to Girl Child,https://www.newsvoir.com/release/htc-launches-initiative-aarzoo-ek-wish-har-aarzoo-poori-karneki-in-partnership-with-cry-to-make-quality-education-accessible-to-girl-child-8475.html
694,Preethi Kitchen Appliances Kick - Starts “500KG Grinding Marathon”,https://www.newsvoir.com/release/preethi-kitchen-appliances-kick---starts-500kg-grinding-marathon--8423.html
695,Infosys Chennai Celebrates its 20th Year Anniversary ,https://www.newsvoir.com/release/infosys-chennai-celebrates-its-20th-year-anniversary-8384.html
696,"Ashiana Dwarka Honored as ""Budget Apartment Project of the Year”",https://www.newsvoir.com/release/ashiana-dwarka-honored-as-budget-apartment-project-of-the-year--8362.html
697,Emaar India Celebrates 46th National Safety Day & Week,https://www.newsvoir.com/release/emaar-india-celebrates-46th-national-safety-day-week-8360.html
698,Intex Women Leaders Honoured at Femina’s 4th World Women Leadership Congress,https://www.newsvoir.com/release/intex-women-leaders-honoured-at-femina-s-4th-world-women-leadership-congress-8346.html
699,"Vodafone Foundation to Recognize 50 Bold, Brave & Brilliant Women of Pure Wonder",https://www.newsvoir.com/release/vodafone-foundation-to-recognize-50-bold-brave-brilliant-women-of-pure-wonder-8337.html
700,Samsung India Partners Government of Karnataka for ‘School Kit Programme’,https://www.newsvoir.com/release/samsung-india-partners-government-of-karnataka-for-school-kit-programme--8324.html
701,"Ministry of Skill Development and Entrepreneurship and Wadhwani Operating Foundation
Sign Contribution Agreement to Upscale ‘Pradhan Mantri Yuva Udyamita Vikas Abhiyaan’",https://www.newsvoir.com/release/ministry-of-skill-development-and-entrepreneurship-and-wadhwani-operating-foundation-sign-contribution-agreement-to-upscale-pradhan-mantri-yuva-udyamita-vikas-abhiyaan--8301.html
702,SRL Diagnostics Launches ‘Sugar Trendz’ to Monitor Sugar Levels ,https://www.newsvoir.com/release/srl-diagnostics-launches-sugar-trendz-to-monitor-sugar-levels--8283.html
703,Essel Infraprojects Ltd. (EIL) Pledges Rs 5700 Cr for Jharkhand Government towards Infrastructure Development at Momentum Jharkhand,https://www.newsvoir.com/release/essel-infraprojects-ltd-eil-pledges-rs-5700-cr-for-jharkhand-government-towards-infrastructure-development-at-momentum-jharkhand-8269.html
704,Intex Technologies Partners with ‘Teach For India’ to Provide Education to the Underprivileged,https://www.newsvoir.com/release/intex-technologies-partners-with-teach-for-india-to-provide-education-to-the-underprivileged-8228.html
705,Tata Consultancy Services Certified as a Top Employer in North America 2017,https://www.newsvoir.com/release/tata-consultancy-services-certified-as-a-top-employer-in-north-america-2017-8230.html
706,Use the Wings of Knowledge at 13th Edition of Tata Crucible Campus Quiz with New ‘Gamification’ Format,https://www.newsvoir.com/release/use-the-wings-of-knowledge-at-13th-edition-of-tata-crucible-campus-quiz-with-new-gamification-format-8217.html
707,SRL Diagnostics WOMAN OF SUBSTANCE’17: Kick Starts its Nomination ,https://www.newsvoir.com/release/srl-diagnostics-woman-of-substance-17-kick-starts-its-nomination--8207.html
708,"‘Learning With Vodafone’ Brings Digitally Enabled Classrooms to 20 Schools in Alibag, District Raigad, Maharashtra",https://www.newsvoir.com/release/-learning-with-vodafone-brings-digitally-enabled-classrooms-to-20-schools-in-alibag-district-raigad-maharashtra-8197.html
709,Dalal Street Investment Journal Launches “India's Best Business Schools – 2017 Ranking”,https://www.newsvoir.com/release/dalal-street-investment-journal-launches-india-s-best-business-schools-2017-ranking--8132.html
710,Pentavalent Bio Sciences Emerges Winner of Tata Social Enterprise Challenge 2016-17,https://www.newsvoir.com/release/pentavalent-bio-sciences-emerges-winner-of-tata-social-enterprise-challenge-2016-17-8100.html
711,"Pacific Mall, Tagore Garden Welcomes New Year by Spreading Cheer and Happiness to the Underprivileged",https://www.newsvoir.com/release/pacific-mall-tagore-garden-welcomes-new-year-by-spreading-cheer-and-happiness-to-the-underprivileged-8036.html
712,Ashiana Senior Living's Christmas Surprise Proves #MiraclesDoHappen,https://www.newsvoir.com/release/ashiana-senior-living-s-christmas-surprise-proves-miraclesdohappen-8011.html
713,Over 18000 Patients in Punjab Receive Free Treatment for Hepatitis C,https://www.newsvoir.com/release/over-18000-patients-in-punjab-receive-free-treatment-for-hepatitis-c-7999.html
714,AI Shaping the Future of Content and Commerce,https://www.newsvoir.com/release/ai-shaping-the-future-of-content-and-commerce-7996.html
715,Vodafone Spreads Warmth this Winter,https://www.newsvoir.com/release/vodafone-spreads-warmth-this-winter-7990.html
716,Allcargo Logistics Partners with Sadhguru’s Isha Foundation for ‘Make a Life’ Golf Jaunt,https://www.newsvoir.com/release/allcargo-logistics-partners-with-sadhguru-s-isha-foundation-for-make-a-life-golf-jaunt-7985.html
717,Kiren Rijiju & Bikram Singh Majithia Laid the Foundation Stone of Ultra Modern Campus of National Disaster Response Force,https://www.newsvoir.com/release/kiren-rijiju-bikram-singh-majithia-laid-the-foundation-stone-of-ultra-modern-campus-of-national-disaster-response-force-7987.html
718,Akali Dal Announces Free Pilgrimage to Sri Nankana Sahib and Sri Panja Sahib,https://www.newsvoir.com/release/akali-dal-announces-free-pilgrimage-to-sri-nankana-sahib-and-sri-panja-sahib-7974.html
719,India’s First of its Kind Air-Conditioned Inter-State Bus Terminus at Mohali Commences Operations,https://www.newsvoir.com/release/india-s-first-of-its-kind-air-conditioned-inter-state-bus-terminus-at-mohali-commences-operations-7969.html
720,Punjab Govt. Opens 2000 Free Medicine & 660 Free Diagnostic Centers Across State,https://www.newsvoir.com/release/punjab-govt-opens-2000-free-medicine-660-free-diagnostic-centers-across-state-7949.html
721,Free-of-Cost Gas Stoves to BPL Families in Punjab,https://www.newsvoir.com/release/free-of-cost-gas-stoves-to-bpl-families-in-punjab-7942.html
722,The Second Edition of ‘40 CEOs Sing for GF Kids’ Ends on a Rocking Note,https://www.newsvoir.com/release/the-second-edition-of-40-ceos-sing-for-gf-kids-ends-on-a-rocking-note-7933.html
723,Paediatric Run for Children to Spread Awareness on Kidney Disorders in Children,https://www.newsvoir.com/release/paediatric-run-for-children-to-spread-awareness-on-kidney-disorders-in-children-7911.html
724,Commemorating World AIDS Day - Leadership Awards that Celebrated Emerging Leadership and Saluted the Established ,https://www.newsvoir.com/release/commemorating-world-aids-day-leadership-awards-that-celebrated-emerging-leadership-and-saluted-the-established-7883.html
725,Emaar India Celebrates World AIDS Day at its Project Sites,https://www.newsvoir.com/release/emaar-india-celebrates-world-aids-day-at-its-project-sites-7878.html
726,India Inc’s 40 CEOs Sing to Raise Funds for Treatment of Critically ill Under-Privileged Children,https://www.newsvoir.com/release/india-inc-s-40-ceos-sing-to-raise-funds-for-treatment-of-critically-ill-under-privileged-children-7866.html
727,ICICI Bank to Transform 100 Villages into ‘ICICI Digital Villages’ in 100 Days,https://www.newsvoir.com/release/icici-bank-to-transform-100-villages-into-icici-digital-villages-in-100-days-7855.html
728,"Assotech Realty Pvt Ltd. Organises Plantation Drive
",https://www.newsvoir.com/release/assotech-realty-pvt-ltd-organises-plantation-drive-7840.html
729,Bridge of Hope Felicitates Underprivileged Children on Children’s Day,https://www.newsvoir.com/release/bridge-of-hope-felicitates-underprivileged-children-on-children-s-day-7784.html
730,Infosys Foundation Invests in IUCAA to Support Advanced Instrument Development and Scientific Discoveries,https://www.newsvoir.com/release/infosys-foundation-invests-in-iucaa-to-support-advanced-instrument-development-and-scientific-discoveries-7771.html
731,Teradata Joins Forces with SOS Children’s Villages of India,https://www.newsvoir.com/release/teradata-joins-forces-with-sos-children-s-villages-of-india-7769.html
732,Freshmen’s Valley Brightens up Diwali for the Villagers of Bahjoi ,https://www.newsvoir.com/release/freshmen-s-valley-brightens-up-diwali-for-the-villagers-of-bahjoi--7689.html
733,K.P. Yohannan Led Believers Church Organizes Free Medical Camps,https://www.newsvoir.com/release/k-p-yohannan-led-believers-church-organizes-free-medical-camps-7682.html
734,Social Initiative Help India Learn Expands Reach to over 120 Schools with over 50 Volunteer Teachers On-Board,https://www.newsvoir.com/release/social-initiative-help-india-learn-expands-reach-to-over-120-schools-with-over-50-volunteer-teachers-on-board-7663.html
735,Infosys Foundation and Infosys Bhubaneswar Partner with Central Institute of Plastics Engineering and Technology (CIPET) to Provide Technical Training ,https://www.newsvoir.com/release/infosys-foundation-and-infosys-bhubaneswar-partner-with-central-institute-of-plastics-engineering-and-technology-cipet-to-provide-technical-training-7652.html
736,"Intex Technologies Donates 50,000 Stationary kits Worth Rs 5 lakhs to Underprivileged kids",https://www.newsvoir.com/release/intex-technologies-donates-50-000-stationary-kits-worth-rs-5-lakhs-to-underprivileged-kids-7623.html
737,CrazyPrints.in and Icontribute to Distribute Stationery Kits to Make this Diwali Special for Underprivileged Children,https://www.newsvoir.com/release/crazyprints-in-and-icontribute-to-distribute-stationery-kits-to-make-this-diwali-special-for-underprivileged-children-7619.html
738,PHFI uses Durga Puja as an Opportunity to Raise Mental Health Awareness Amongst Youth in Delhi,https://www.newsvoir.com/release/phfi-uses-durga-puja-as-an-opportunity-to-raise-mental-health-awareness-amongst-youth-in-delhi-7613.html
739,"Intex Technologies and Snapdeal Partner to Make this Diwali Special for the Underprivileged, Celebrate the ‘Joy of Giving Week’ ",https://www.newsvoir.com/release/intex-technologies-and-snapdeal-partner-to-make-this-diwali-special-for-the-underprivileged-celebrate-the-joy-of-giving-week--7563.html
740,Public Relations Integral to Brand Communications: PRCAI,https://www.newsvoir.com/release/public-relations-integral-to-brand-communications-prcai-7523.html
741,Freecharge Plans to Launch ‘Donations’ Category on its App in September,https://www.newsvoir.com/release/freecharge-plans-to-launch-donations-category-on-its-app-in-september-7509.html
742,TCS Recognized for Leading CSR Practices ,https://www.newsvoir.com/release/tcs-recognized-for-leading-csr-practices-7505.html
743,"AB InBev, in Association with UBER, Sets Off on a Mission to Promote Responsible Drinking and to Address the Issue of Drunk Driving, Under its Better World Initiative",https://www.newsvoir.com/release/ab-inbev-in-association-with-uber-sets-off-on-a-mission-to-promote-responsible-drinking-and-to-address-the-issue-of-drunk-driving-under-its-better-world-initiative-7490.html
744,"Ola Teams Up with Local Authorities to Create Safer Roads, Campaigns Against Drunken Driving",https://www.newsvoir.com/release/ola-teams-up-with-local-authorities-to-create-safer-roads-campaigns-against-drunken-driving-7486.html
745,K. P. Yohannan Led Believers Church Completes Nation Wide Activities to Mark World Literacy Day,https://www.newsvoir.com/release/k-p-yohannan-led-believers-church-completes-nation-wide-activities-to-mark-world-literacy-day-7481.html
746,IndusInd Bank Launched “JeetkaHalla” an Initiative to Support the Para-Athletes,https://www.newsvoir.com/release/indusind-bank-launched-jeetkahalla-an-initiative-to-support-the-para-athletes-7433.html
747,3Pillar Global Launches In-House Car Pool App for Employee Safety and Convenience,https://www.newsvoir.com/release/3pillar-global-launches-in-house-car-pool-app-for-employee-safety-and-convenience-7404.html
748,K.P. Yohannan Led Believers Church to Help 9700 Families in Flood Hit Regions of Bihar and Assam,https://www.newsvoir.com/release/k-p-yohannan-led-believers-church-to-help-9700-families-in-flood-hit-regions-of-bihar-and-assam-7400.html
749,"Rudreswar Deka Emerges Winner of Run Raise Respond NorthEast- Guwahati Half-Marathon on Abhiruchi Sports Day
",https://www.newsvoir.com/release/rudreswar-deka-emerges-winner-of-run-raise-respond-northeast-guwahati-half-marathon-on-abhiruchi-sports-day-7396.html
750,"Wadhwani Chair in US-India Policy Studies, Announces the Launch of US-India Innovation Forum",https://www.newsvoir.com/release/wadhwani-chair-in-us-india-policy-studies-announces-the-launch-of-us-india-innovation-forum-7369.html
751,Samarth: Launch of a Professional Initiative to Keep Senior Citizens Independent and Happy in Our Cities,https://www.newsvoir.com/release/samarth-launch-of-a-professional-initiative-to-keep-senior-citizens-independent-and-happy-in-our-cities-7354.html
752,"Department of School & Mass Education, Govt. of Odisha and Wadhwani Foundation’s Skills Development Network Sign MoU to Make Odisha a Leader in ‘Smart State’ Initiative",https://www.newsvoir.com/release/department-of-school-mass-education-govt-of-odisha-and-wadhwani-foundation-s-skills-development-network-sign-mou-to-make-odisha-a-leader-in-smart-state-initiative-7352.html
753,International Entrepreneur Nigel Eastwood in Association with North East Development Foundation (NEDF) Announces Charitable Runs in North-East to Support Local Entrepreneurship and Flood Relief Operations,https://www.newsvoir.com/release/international-entrepreneur-nigel-eastwood-in-association-with-north-east-development-foundation-nedf-announces-charitable-runs-in-north-east-to-support-local-entrepreneurship-and-flood-relief-operations-7297.html
754,Avashya Foundation Meets Partner NGOs to Discuss the Way Forward for CSR Initiatives  ,https://www.newsvoir.com/release/avashya-foundation-meets-partner-ngos-to-discuss-the-way-forward-for-csr-initiatives-7296.html
755,Pacific Mall Partners with Tihar Jail to Promote TJs - “Redefining Life Behind Bars”,https://www.newsvoir.com/release/pacific-mall-partners-with-tihar-jail-to-promote-tjs---redefining-life-behind-bars--7287.html
756,4th PHD Chamber Global Sports Convention Held to Mark International Youth Day,https://www.newsvoir.com/release/4th-phd-chamber-global-sports-convention-held-to-mark-international-youth-day-7280.html
757,"Believers Church is Helping over 74,000 Underprivileged Children: K. P. Yohannan",https://www.newsvoir.com/release/believers-church-is-helping-over-74-000-underprivileged-children-k-p-yohannan-7276.html
758,The Fifth Edition of Tata Social Enterprise Challenge Kicks-Off,https://www.newsvoir.com/release/the-fifth-edition-of-tata-social-enterprise-challenge-kicks-off-7270.html
759,"Wadhwani Foundation Intensifies its Focus on India, South-East Asia, Latin America and East Africa",https://www.newsvoir.com/release/wadhwani-foundation-intensifies-its-focus-on-india-south-east-asia-latin-america-and-east-africa-7264.html
760,Mphasis Gives Impetus to Improved Learning Outcomes in Government Schools Via Customized Digital Solutions,https://www.newsvoir.com/release/mphasis-gives-impetus-to-improved-learning-outcomes-in-government-schools-via-customized-digital-solutions-7214.html
761,Believers Church Launches Mosquito Net Distribution Campaign for Slum Dwellers Across India ,https://www.newsvoir.com/release/believers-church-launches-mosquito-net-distribution-campaign-for-slum-dwellers-across-india-7151.html
762,Infosys Foundation Builds Houses to Rehabilitate Communities Affected by Cyclone Hudhud that Struck Andhra Pradesh in 2014 ,https://www.newsvoir.com/release/infosys-foundation-builds-houses-to-rehabilitate-communities-affected-by-cyclone-hudhud-that-struck-andhra-pradesh-in-2014-7142.html
763,Çelebi Organises Cancer Awareness & Detection Camps,https://www.newsvoir.com/release/-elebi-organises-cancer-awareness-detection-camps-7118.html
764,Stylam Industries Limited Adopts Abheypur Village in Haryana,https://www.newsvoir.com/release/stylam-industries-limited-adopts-abheypur-village-in-haryana-7107.html
765,sbiINTOUCH Offers Convenient Shopping Experience at Big Bazaar and Food Bazaar,https://www.newsvoir.com/release/sbiintouch-offers-convenient-shopping-experience-at-big-bazaar-and-food-bazaar-7084.html
766,Believers Church Reaches Out to Thousands of BPL Widows Across India to Mark International Widows Day,https://www.newsvoir.com/release/believers-church-reaches-out-to-thousands-of-bpl-widows-across-india-to-mark-international-widows-day-7017.html
767,Tata Consultancy Services Wins Top Employee Engagement and Social Responsibility Awards,https://www.newsvoir.com/release/tata-consultancy-services-wins-top-employee-engagement-and-social-responsibility-awards-6999.html
768,Tata Consultancy Services Wins Achievers Award for 50 Most Engaged Workplaces™ in North America for Fourth Consecutive Year,https://www.newsvoir.com/release/tata-consultancy-services-wins-achievers-award-for-50-most-engaged-workplaces-in-north-america-for-fourth-consecutive-year-6944.html
769,"Bridge of Hope Concludes 15 Day Sapling Plantation Drive to Mark World Environment Day
",https://www.newsvoir.com/release/bridge-of-hope-concludes-15-day-sapling-plantation-drive-to-mark-world-environment-day-6941.html
770,IContribute Launches Tweet a Cloth Social Media Campaign,https://www.newsvoir.com/release/icontribute-launches-tweet-a-cloth-social-media-campaign-6930.html
771,OIL Super 30 Achieves Landmark Success in the 2016 IIT Entrance Examination,https://www.newsvoir.com/release/oil-super-30-achieves-landmark-success-in-the-2016-iit-entrance-examination-6901.html
772,Infosys Foundation Partners with Sankara Eye Hospitals to Provide Sustainable Eye Care Services,https://www.newsvoir.com/release/infosys-foundation-partners-with-sankara-eye-hospitals-to-provide-sustainable-eye-care-services-6875.html
773,Believers Church Installs 101 Bore Wells in Drought Hit Regions of Maharashtra,https://www.newsvoir.com/release/believers-church-installs-101-bore-wells-in-drought-hit-regions-of-maharashtra-6865.html
774,Believers Church Adds Momentum to PM Modi’s “Skill India” Campaign,https://www.newsvoir.com/release/believers-church-adds-momentum-to-pm-modi-s-skill-india-campaign-6778.html
775,Aeris India Set to Enhance Indian Social Sector,https://www.newsvoir.com/release/aeris-india-set-to-enhance-indian-social-sector-6776.html
776,Mphasis Unleashes the Next in Digital Accessibility - Continues to Transform Lives of Persons with Disabilities in both the Physical and Digital Worlds,https://www.newsvoir.com/release/mphasis-unleashes-the-next-in-digital-accessibility-continues-to-transform-lives-of-persons-with-disabilities-in-both-the-physical-and-digital-worlds-6758.html
777,Tech Mahindra Foundation Launches ‘SMART Academy’ for Healthcare,https://www.newsvoir.com/release/tech-mahindra-foundation-launches-smart-academy-for-healthcare-6739.html
778,Infosys Foundation to Provide Grants Worth INR 24 Crore to IIIT-Delhi for Research on Artificial Intelligence ,https://www.newsvoir.com/release/infosys-foundation-to-provide-grants-worth-inr-24-crore-to-iiit-delhi-for-research-on-artificial-intelligence-6488.html
779,"Vodafone India Celebrates ‘Pledge for Parity’ during International Women’s Week 7-11 March
",https://www.newsvoir.com/release/vodafone-india-celebrates-pledge-for-parity-during-international-women-s-week-7-11-march--6306.html
780,OPPO Brings Memorable Selfie Experience for Kids from UNICEF’s Swachh Clinic Initiative with ICC WT20 Trophy,https://www.newsvoir.com/release/oppo-brings-memorable-selfie-experience-for-kids-from-unicef-s-swachh-clinic-initiative-with-icc-wt20-trophy-6193.html
781,"Citi Foundation Grants INR 130 Million to Advance Financial Inclusion for more
than 300,000 Women, Youth and Children",https://www.newsvoir.com/release/citi-foundation-grants-inr-130-million-to-advance-financial-inclusion-for-more-than-300-000-women-youth-and-children-6138.html
782,"BetiBachao, BetiPadhao Kicks off Well in Punjab",https://www.newsvoir.com/release/betibachao-betipadhao-kicks-off-well-in-punjab-6124.html
783,IDBI Bank Contributes Rs. 1 Crore to the Tamil Nadu Chief Minister’s Public Relief Fund for Chennai Floods,https://www.newsvoir.com/release/idbi-bank-contributes-rs-1-crore-to-the-tamil-nadu-chief-minister-s-public-relief-fund-for-chennai-floods-6116.html
784,"Mission Swachh Punjab: 1015 Gram Panchayats Declared Themselves Open Defecation Free
 
",https://www.newsvoir.com/release/mission-swachh-punjab-1015-gram-panchayats-declared-themselves-open-defecation-free-6111.html
785,22744 Patients Benefited from Mukhmantri Cancer RahatKosh Scheme,https://www.newsvoir.com/release/22744-patients-benefited-from-mukhmantri-cancer-rahatkosh-scheme-6087.html
786,Mohit Kamboj Re-elected as National President of India Bullion and Jewelers Association,https://www.newsvoir.com/release/mohit-kamboj-re-elected-as-national-president-of-india-bullion-and-jewelers-association-6052.html
787,CorStone’s Cutting-Edge ‘Girls First’ Resilience Program Significantly Improves Emotional and Physical Well Being of Adolescent Girls in Bihar ,https://www.newsvoir.com/release/corstone-s-cutting-edge-girls-first-resilience-program-significantly-improves-emotional-and-physical-well-being-of-adolescent-girls-in-bihar--6019.html
788,ACME Celebrates Road Safety Awareness Week,https://www.newsvoir.com/release/acme-celebrates-road-safety-awareness-week-6003.html
789,Suzuki Partners with CredR.com to Launch India’s First Auto-Relief Campaign in Chennai,https://www.newsvoir.com/release/suzuki-partners-with-credr-com-to-launch-india-s-first-auto-relief-campaign-in-chennai-5998.html
790,Mr. Bikram Singh Majithia Distributes 395 Cycles to Girl Students under Mai Bhago Vidya Scheme,https://www.newsvoir.com/release/mr-bikram-singh-majithia-distributes-395-cycles-to-girl-students-under-mai-bhago-vidya-scheme-5996.html
791,PNB Housing Facilitates two ‘Day-Care Centres’ through NGO Mobile Crèches ,https://www.newsvoir.com/release/pnb-housing-facilitates-two-day-care-centres-through-ngo-mobile-cr-ches--5985.html
792,"""The Air Seller"" Social Campaign from #HawaBadlo Piques the Curiosity of the Citizens of Delhi NCR",https://www.newsvoir.com/release/the-air-seller-social-campaign-from-hawabadlo-piques-the-curiosity-of-the-citizens-of-delhi-ncr-5967.html
793,Allcargo Undertakes a Noble CSR Initiative by Setting up a Skill Development Center for villagers of Maharashtra,https://www.newsvoir.com/release/allcargo-undertakes-a-noble-csr-initiative-by-setting-up-a-skill-development-center-for-villagers-of-maharashtra-5964.html
794,Yes Bank Partners Navi Mumbai Traffic Police for Road Safety Week 2016,https://www.newsvoir.com/release/yes-bank-partners-navi-mumbai-traffic-police-for-road-safety-week-2016-5963.html
795,Mahindra & Mahindra Celebrates National Road Safety Week 2016,https://www.newsvoir.com/release/mahindra-mahindra-celebrates-national-road-safety-week-2016-5949.html
796,"CM Punjab, Mr. Prakash Singh Badal Orders to Ban Manufacturing of ‘Guthka’/'Pan Masala' in Punjab",https://www.newsvoir.com/release/cm-punjab-mr-prakash-singh-badal-orders-to-ban-manufacturing-of-guthka-pan-masala-in-punjab-5944.html
797,Sukhbir Singh Badal Launches 1905 Web Portal and Mobile App for Grievance Redress,https://www.newsvoir.com/release/sukhbir-singh-badal-launches-1905-web-portal-and-mobile-app-for-grievance-redress-5934.html
