,title,link
497,Standard Chartered Bank Launches The Good Life platform in India Providing Dining offers to its Debit and Credit Card Base,https://www.newsvoir.com/release/standard-chartered-bank-launches-the-good-life-platform-in-india-providing-dining-offers-to-its-debit-and-credit-card-base-9289.html
498,Daily Staples from Daawat Devaaya Now Offer up to Rs. 75 Paytm Cash,https://www.newsvoir.com/release/daily-staples-from-daawat-devaaya-now-offer-up-to-rs-75-paytm-cash-9014.html
499,Alliances Galore Plugs Dining Offers to the Samsung Pay Platform,https://www.newsvoir.com/release/alliances-galore-plugs-dining-offers-to-the-samsung-pay-platform-9176.html
500,Restaurant & Catering Show Plays Host to the Biggest Gourmet and Cuisine Competition in Mumbai,https://www.newsvoir.com/release/restaurant-catering-show-plays-host-to-the-biggest-gourmet-and-cuisine-competition-in-mumbai-9138.html
501,RECA to host India’s Biggest Gourmet and Cuisine Competition in association with U.S. Premium Agricultural Products ,https://www.newsvoir.com/release/reca-to-host-india-s-biggest-gourmet-and-cuisine-competition-in-association-with-u-s-premium-agricultural-products--9146.html
502,Seven Hills Beverages Limited to Enter Capital Market,https://www.newsvoir.com/release/seven-hills-beverages-limited-to-enter-capital-market-9104.html
503,Kwality Ltd.’s Board Approves Appointment of New Statutory Auditors,https://www.newsvoir.com/release/kwality-ltd-s-board-approves-appointment-of-new-statutory-auditors-9101.html
504,Food Hospitality World Show Plays Host to the Biggest Culinary and Mixology Competition in Bangalore,https://www.newsvoir.com/release/food-hospitality-world-show-plays-host-to-the-biggest-culinary-and-mixology-competition-in-bangalore-9095.html
505,The Grand New Flagship Period Dining Experience of Oudh 1590 Opened its Door at Southern Avenue,https://www.newsvoir.com/release/the-grand-new-flagship-period-dining-experience-of-oudh-1590-opened-its-door-at-southern-avenue-9085.html
506,Food Hospitality World Show to Host South India’s Biggest Culinary and Mixology Competition in Association with U.S. Premium Agricultural Products ,https://www.newsvoir.com/release/food-hospitality-world-show-to-host-south-india-s-biggest-culinary-and-mixology-competition-in-association-with-u-s-premium-agricultural-products--9069.html
507,Alliances Galore Curates an Unbelievable 33% off at the Finest Restaurants for the ICICI Bank Debit and Credit Card Base,https://www.newsvoir.com/release/alliances-galore-curates-an-unbelievable-33-off-at-the-finest-restaurants-for-the-icici-bank-debit-and-credit-card-base-9066.html
508,"Memoire Transports Indian Homes to the Era of Italian Edgy-chic, with Versace’s Exquisite Collection of Fine Cutlery",https://www.newsvoir.com/release/memoire-transports-indian-homes-to-the-era-of-italian-edgy-chic-with-versace-s-exquisite-collection-of-fine-cutlery-9034.html
509,Consuming Walnuts may Help Keep the Gut Healthy ,https://www.newsvoir.com/release/consuming-walnuts-may-help-keep-the-gut-healthy-9023.html
510,KENT RO Systems Ltd. Signs up as Principal Sponsor of Pro Kabaddi League Team Haryana Steelers,https://www.newsvoir.com/release/kent-ro-systems-ltd-signs-up-as-principal-sponsor-of-pro-kabaddi-league-team-haryana-steelers-9000.html
511,"Dream Hotel Group Signs New Delhi, India Location ",https://www.newsvoir.com/release/dream-hotel-group-signs-new-delhi-india-location-8981.html
512,HGS Ties up with Jaldhaara Foundation to Provide Clean Drinking Water to Underserved Communities in Bengaluru ,https://www.newsvoir.com/release/hgs-ties-up-with-jaldhaara-foundation-to-provide-clean-drinking-water-to-underserved-communities-in-bengaluru-8934.html
513,Fortify your Immune this Monsoon with Yakult’s Globally Acclaimed Lactobacillus Casei Strain Shirota (LcS),https://www.newsvoir.com/release/fortify-your-immune-this-monsoon-with-yakult-s-globally-acclaimed-lactobacillus-casei-strain-shirota-lcs--8926.html
514,"Jugnoo Turns EBITDA Positive, on Track for INR 70 Crores Annual Net Revenue",https://www.newsvoir.com/release/jugnoo-turns-ebitda-positive-on-track-for-inr-70-crores-annual-net-revenue-8917.html
515,Chowman Awarded for “Best Foreign Cuisine Restaurant of the Year-Chinese” & Oudh 1590 for “Best Theme Based Restaurant of the Year”,https://www.newsvoir.com/release/chowman-awarded-for-best-foreign-cuisine-restaurant-of-the-year-chinese-oudh-1590-for-best-theme-based-restaurant-of-the-year--8885.html
516,Diets Rich in Polyunsaturated Fats May Alter Appetite Hormones Among Millennials,https://www.newsvoir.com/release/diets-rich-in-polyunsaturated-fats-may-alter-appetite-hormones-among-millennials-8854.html
517,Prodeb Introduces Advanced Belgian Technology Micro-Brewery Equipment in India,https://www.newsvoir.com/release/prodeb-introduces-advanced-belgian-technology-micro-brewery-equipment-in-india-8853.html
518,IBD Wins the KC Milk Creative Mandate in a Multi-Agency Pitch,https://www.newsvoir.com/release/ibd-wins-the-kc-milk-creative-mandate-in-a-multi-agency-pitch-8826.html
519,"Bollywood’s Own Royalty Kareena Kapoor Khan Makes a Comeback with Marvel Tea’s Latest Campaign Shot in London, “Har Lamha Naya ho jaye""",https://www.newsvoir.com/release/bollywood-s-own-royalty-kareena-kapoor-khan-makes-a-comeback-with-marvel-tea-s-latest-campaign-shot-in-london-har-lamha-naya-ho-jaye--8803.html
520,Chowman Kolkata Adds Another Feather to its Cap,https://www.newsvoir.com/release/chowman-kolkata-adds-another-feather-to-its-cap-8783.html
521,Jugnoo Takes a Big Leap in Restaurant Aggregation; Launches Menus in 21 Cities,https://www.newsvoir.com/release/jugnoo-takes-a-big-leap-in-restaurant-aggregation-launches-menus-in-21-cities-8749.html
522,KENT RO Hosted Live Cooking Session with Master Chef Pankaj Bhadouria,https://www.newsvoir.com/release/kent-ro-hosted-live-cooking-session-with-master-chef-pankaj-bhadouria-8721.html
523,"Cox & Kings' Survey Reveals Dubai, UK and Singapore are the Top Vegetarian-Friendly Destinations for Indians",https://www.newsvoir.com/release/cox-kings-survey-reveals-dubai-uk-and-singapore-are-the-top-vegetarian-friendly-destinations-for-indians-8695.html
524,California Walnut Commission Participates in the INC World Nut and Dried Fruit Congress in Chennai,https://www.newsvoir.com/release/california-walnut-commission-participates-in-the-inc-world-nut-and-dried-fruit-congress-in-chennai-8683.html
525,Washington Apple Wagon Tour Pledges for a Healthy Living,https://www.newsvoir.com/release/washington-apple-wagon-tour-pledges-for-a-healthy-living-8666.html
526,"Parry Nutraceuticals’ Indian Microalgae Facility Receives U.S. FDA Approval; 
Ramps up New Product Development",https://www.newsvoir.com/release/parry-nutraceuticals-indian-microalgae-facility-receives-u-s-fda-approval-ramps-up-new-product-development-8654.html
527,Tata Tea Urges Parents to Share an Important Message with their Children this Exam Season,https://www.newsvoir.com/release/tata-tea-urges-parents-to-share-an-important-message-with-their-children-this-exam-season-8643.html
528,"Magnum Ice Cream Ties Up with Online Fashion Label, TheLabelLife.Com to Create a Stunningly Wild, Limited Edition Fashion Collection",https://www.newsvoir.com/release/magnum-ice-cream-ties-up-with-online-fashion-label-thelabellife-com-to-create-a-stunningly-wild-limited-edition-fashion-collection-8629.html
529,Jugnoo Announces Special Offers on Food Orders for the IPL Season this Year,https://www.newsvoir.com/release/jugnoo-announces-special-offers-on-food-orders-for-the-ipl-season-this-year-8619.html
530,"Magnum Ice cream and Sussanne, Malaika, Bipasha Tell you How to 'Unleash Your Wild Side'",https://www.newsvoir.com/release/magnum-ice-cream-and-sussanne-malaika-bipasha-tell-you-how-to-unleash-your-wild-side-8586.html
531,Indian Participation Continues to Grow at SIAL China 2017,https://www.newsvoir.com/release/indian-participation-continues-to-grow-at-sial-china-2017-8578.html
532,Government of Karnataka to Host India's First 'National Trade Fair for Organics and Millets 2017' ,https://www.newsvoir.com/release/government-of-karnataka-to-host-india-s-first-national-trade-fair-for-organics-and-millets-2017-8545.html
533,Zeta Launches the First E-Meal Voucher on RuPay Platform,https://www.newsvoir.com/release/zeta-launches-the-first-e-meal-voucher-on-rupay-platform-8518.html
534,Washington Apple Commission Unveils the Washington Apple Cook Book in India,https://www.newsvoir.com/release/washington-apple-commission-unveils-the-washington-apple-cook-book-in-india-8500.html
535,Washington Apple Wagon Tour Starts with a Bang,https://www.newsvoir.com/release/washington-apple-wagon-tour-starts-with-a-bang-8488.html
536,Yakult Danone India Introduces Shilpa Shetty Kundra as New Brand Ambassador,https://www.newsvoir.com/release/yakult-danone-india-introduces-shilpa-shetty-kundra-as-new-brand-ambassador-8446.html
537,HyperCITY Presents Summer Refresh 2017,https://www.newsvoir.com/release/hypercity-presents-summer-refresh-2017-8426.html
538,Preethi Kitchen Appliances Kick - Starts “500KG Grinding Marathon”,https://www.newsvoir.com/release/preethi-kitchen-appliances-kick---starts-500kg-grinding-marathon--8423.html
539,Gujarat-based E-commerce Startup CouponClue.com Emerges as India's Top Coupons Site,https://www.newsvoir.com/release/gujarat-based-e-commerce-startup-couponclue-com-emerges-as-india-s-top-coupons-site-8398.html
540,New Research Indicates Regular Fresh Pear Consumption May Improve Blood Pressure in Middle-Aged Men and Women with Metabolic Syndrome,https://www.newsvoir.com/release/new-research-indicates-regular-fresh-pear-consumption-may-improve-blood-pressure-in-middle-aged-men-and-women-with-metabolic-syndrome-8297.html
541,"Celebrate Valentines Week with the ‘Epitome of Love’ - Taj Mahal, Specially Created at Pacific Mall",https://www.newsvoir.com/release/celebrate-valentines-week-with-the-epitome-of-love---taj-mahal-specially-created-at-pacific-mall-8245.html
542,Sodexo Conducts the first-ever CXO Food Walk with Kalyan Karmakar,https://www.newsvoir.com/release/sodexo-conducts-the-first-ever-cxo-food-walk-with-kalyan-karmakar-8214.html
543,Grab Hold of Your very Own “Deliciously Small” Vaya Tyffyn – Now Available in 600 ml,https://www.newsvoir.com/release/grab-hold-of-your-very-own-deliciously-small-vaya-tyffyn-now-available-in-600-ml-8209.html
544,Manpasand Beverages Ltd. PAT up 49% at Rs.7.24 crore in Q3 of FY 2016-17,https://www.newsvoir.com/release/manpasand-beverages-ltd-pat-up-49-at-rs-7-24-crore-in-q3-of-fy-2016-17-8200.html
545,KFC gives Customers a Chance to Unlock the Legendary Taste of ‘Nashville Chicken’ Using the Power of their Minds,https://www.newsvoir.com/release/kfc-gives-customers-a-chance-to-unlock-the-legendary-taste-of-nashville-chicken-using-the-power-of-their-minds-8173.html
546,SRAM & MRAM Invests in TN based Organic Products Firm,https://www.newsvoir.com/release/sram-mram-invests-in-tn-based-organic-products-firm-8141.html
547,Yakult Lady System Committed to Bring Good Health and Cheer to Your Doorstep,https://www.newsvoir.com/release/yakult-lady-system-committed-to-bring-good-health-and-cheer-to-your-doorstep-8119.html
548,Herbalife India Congratulates Virat Kohli for Being Appointed as Captain of the Indian Cricket Team for All Formats,https://www.newsvoir.com/release/herbalife-india-congratulates-virat-kohli-for-being-appointed-as-captain-of-the-indian-cricket-team-for-all-formats-8091.html
549,Celebrity Chef Shazia Khan at Phoenix Marketcity,https://www.newsvoir.com/release/celebrity-chef-shazia-khan-at-phoenix-marketcity-8084.html
550,Now Pay for Your Daily Need Groceries using FreeCharge on Grofers,https://www.newsvoir.com/release/now-pay-for-your-daily-need-groceries-using-freecharge-on-grofers-8042.html
551,"Pacific Mall, Tagore Garden Welcomes New Year by Spreading Cheer and Happiness to the Underprivileged",https://www.newsvoir.com/release/pacific-mall-tagore-garden-welcomes-new-year-by-spreading-cheer-and-happiness-to-the-underprivileged-8036.html
552,FreeCharge and Food Tech Platform Faasos Tie Up for e-Wallet Payment Solution,https://www.newsvoir.com/release/freecharge-and-food-tech-platform-faasos-tie-up-for-e-wallet-payment-solution-8027.html
553,"Bring on the Year End Festivities at Ansal Plaza, Delhi’s First Mall",https://www.newsvoir.com/release/bring-on-the-year-end-festivities-at-ansal-plaza-delhi-s-first-mall-8026.html
554,FreeCharge Launches “Eat-Shop-Love” Festival,https://www.newsvoir.com/release/freecharge-launches-eat-shop-love-festival-8009.html
555,Frshly offers Hot Food on the Move,https://www.newsvoir.com/release/frshly-offers-hot-food-on-the-move-8001.html
556,Feast and Fiesta with Your Friendly Neighbourhood - HyperCITY,https://www.newsvoir.com/release/feast-and-fiesta-with-your-friendly-neighbourhood-hypercity-7997.html
557,Nissin Scores with 2nd Edition of Manchester United Soccer School,https://www.newsvoir.com/release/nissin-scores-with-2nd-edition-of-manchester-united-soccer-school-7962.html
558,Manpasand Beverages Ropes in Taapsee Pannu as Brand Ambassador for ‘FruitsUp’,https://www.newsvoir.com/release/manpasand-beverages-ropes-in-taapsee-pannu-as-brand-ambassador-for-fruitsup--7956.html
559,USA Pears Celebrates National Pear Month in India,https://www.newsvoir.com/release/usa-pears-celebrates-national-pear-month-in-india-7930.html
560,Dr. Kavitha Simha's View on the Importance of  'Nutrition and Diet' in this Sedentary Life-style,https://www.newsvoir.com/release/dr-kavitha-simha-s-view-on-the-importance-of-nutrition-and-diet-in-this-sedentary-life-style-7929.html
561,Going Digital from Dosas to Donuts,https://www.newsvoir.com/release/going-digital-from-dosas-to-donuts-7924.html
562,"Top Industry Experts Discuss Trends and Usage of America’s Original Superfruit, US Cranberries",https://www.newsvoir.com/release/top-industry-experts-discuss-trends-and-usage-of-america-s-original-superfruit-us-cranberries-7903.html
563,"Top Industry Experts Discuss Trends and Usage of America’s Original Superfruit, US Cranberries ",https://www.newsvoir.com/release/top-industry-experts-discuss-trends-and-usage-of-america-s-original-superfruit-us-cranberries--7871.html
564,"Prominent Royal Families Came Together for the ""Royal Feast"" by Harper's Bazaar Bride",https://www.newsvoir.com/release/prominent-royal-families-came-together-for-the-royal-feast-by-harper-s-bazaar-bride-7836.html
565,“BIOFACH INDIA Together with INDIA ORGANIC 2016” Starts on a Positive Note in New Delhi,https://www.newsvoir.com/release/-biofach-india-together-with-india-organic-2016-starts-on-a-positive-note-in-new-delhi-7774.html
566,Delhi-Based QD's Raised Funds to Expand its Network of Restaurants,https://www.newsvoir.com/release/delhi-based-qd-s-raised-funds-to-expand-its-network-of-restaurants-7707.html
567,Freshmen’s Valley Brightens up Diwali for the Villagers of Bahjoi ,https://www.newsvoir.com/release/freshmen-s-valley-brightens-up-diwali-for-the-villagers-of-bahjoi--7689.html
568,HyperCITY's Hyper Budding Chef Contest Announces the Winner for the Noida – City Finale,https://www.newsvoir.com/release/hypercity-s-hyper-budding-chef-contest-announces-the-winner-for-the-noida-city-finale-7674.html
569,New Study Finds Adult Fresh Pear Consumers had a Lower Body Weight than Non‐Pear Consumers,https://www.newsvoir.com/release/new-study-finds-adult-fresh-pear-consumers-had-a-lower-body-weight-than-non-pear-consumers-7664.html
570,"Enjoy a 5-Star Wedding within Your Budget at Ritz Banquets
",https://www.newsvoir.com/release/enjoy-a-5-star-wedding-within-your-budget-at-ritz-banquets-7642.html
571,Sania Mirza Scores an Ace by Becoming the Face of Mankind’s ‘Kaloree1’,https://www.newsvoir.com/release/sania-mirza-scores-an-ace-by-becoming-the-face-of-mankind-s-kaloree1--7600.html
572,Budding Chefs and Mixologists Create Magic with U.S. Premium Agricultural Products at Seventh Edition of Restaurant & Catering Show,https://www.newsvoir.com/release/budding-chefs-and-mixologists-create-magic-with-u-s-premium-agricultural-products-at-seventh-edition-of-restaurant-catering-show-7574.html
573,"Top Industry Experts Discuss Trends and Usage of America’s Original Superfruit, US Cranberries",https://www.newsvoir.com/release/top-industry-experts-discuss-trends-and-usage-of-america-s-original-superfruit-us-cranberries-7549.html
574,Mumbai’s Biggest Culinary and Mixology Competition with US Premium Agricultural Products Planned During Seventh Edition of Restaurant & Catering Show,https://www.newsvoir.com/release/mumbai-s-biggest-culinary-and-mixology-competition-with-us-premium-agricultural-products-planned-during-seventh-edition-of-restaurant-catering-show-7519.html
575,Fake Kent RO’s Seized and Duplicator Arrested in Bhatinda,https://www.newsvoir.com/release/fake-kent-ro-s-seized-and-duplicator-arrested-in-bhatinda-7501.html
576,Manpasand’s ‘Fruits Up’ to Sponsor Mountain Cycling Event ‘NorthQuest Challenge Ladakh 2016’,https://www.newsvoir.com/release/manpasand-s-fruits-up-to-sponsor-mountain-cycling-event-northquest-challenge-ladakh-2016--7495.html
577,Major Trends Driving the Canadian Fish & Seafood Market - Ken Research ,https://www.newsvoir.com/release/major-trends-driving-the-canadian-fish-seafood-market-ken-research-7477.html
578,The Battle of ‘The Goan Chef Award’ Won with Preethi Kitchen Appliances,https://www.newsvoir.com/release/the-battle-of-the-goan-chef-award-won-with-preethi-kitchen-appliances-7475.html
579,BlackSoil Capital Private Limited Closes its First Venture Debt Deal of INR 15 Crore with ‘nearbuy’ ,https://www.newsvoir.com/release/blacksoil-capital-private-limited-closes-its-first-venture-debt-deal-of-inr-15-crore-with-nearbuy--7443.html
580,IBD Secures the Strategic and Creative Mandate for “TOKRI.COM”,https://www.newsvoir.com/release/ibd-secures-the-strategic-and-creative-mandate-for-tokri-com--7442.html
581,"Del Monte Launches New Mayonnaise Campaign, Promotes Versatility of the Condiment",https://www.newsvoir.com/release/del-monte-launches-new-mayonnaise-campaign-promotes-versatility-of-the-condiment-7413.html
582,SmartCooky.com to Champion #FitIndia Campaign as Knowledge Partner,https://www.newsvoir.com/release/smartcooky-com-to-champion-fitindia-campaign-as-knowledge-partner-7355.html
583,Boost in Flavored Alcoholic Beverages Market in West Europe: Ken Research,https://www.newsvoir.com/release/boost-in-flavored-alcoholic-beverages-market-in-west-europe-ken-research-7343.html
584,Manpasand Beverages New Manufacturing Facility in Haryana Completed,https://www.newsvoir.com/release/manpasand-beverages-new-manufacturing-facility-in-haryana-completed-7330.html
585,Pacific Mall Partners with Tihar Jail to Promote TJs - “Redefining Life Behind Bars”,https://www.newsvoir.com/release/pacific-mall-partners-with-tihar-jail-to-promote-tjs---redefining-life-behind-bars--7287.html
586,Consumption of Walnuts in Combination with Other Whole Foods is Beneficial for Inflammation and Metabolism,https://www.newsvoir.com/release/consumption-of-walnuts-in-combination-with-other-whole-foods-is-beneficial-for-inflammation-and-metabolism-7257.html
587,"India Planning Record Participation at SIAL Paris, the World’s No.1 Food and Beverage Exhibition",https://www.newsvoir.com/release/india-planning-record-participation-at-sial-paris-the-world-s-no-1-food-and-beverage-exhibition-7227.html
588,Now Pay at Zomato with Freecharge,https://www.newsvoir.com/release/now-pay-at-zomato-with-freecharge-7211.html
589,Bangalore Gets its First Premium Lifestyle ‘Quirk Card’ for Dinners,https://www.newsvoir.com/release/bangalore-gets-its-first-premium-lifestyle-quirk-card-for-dinners-7209.html
590,Iced Tea Slated to Penetrate Deeper into Eastern European Countries by 2020: Ken Research ,https://www.newsvoir.com/release/iced-tea-slated-to-penetrate-deeper-into-eastern-european-countries-by-2020-ken-research-7173.html
591,Holachef Brings New Engagement Drive to Celebrate 2 Years of Successful Operations in Mumbai,https://www.newsvoir.com/release/holachef-brings-new-engagement-drive-to-celebrate-2-years-of-successful-operations-in-mumbai-7096.html
592,"Freshmen’s Valley Forays into Dairy Business, Inaugurates Plant in Bahjoi",https://www.newsvoir.com/release/freshmen-s-valley-forays-into-dairy-business-inaugurates-plant-in-bahjoi-7066.html
593,SpiceJet Unveils an All-New Bouquet of In-Flight Meals,https://www.newsvoir.com/release/spicejet-unveils-an-all-new-bouquet-of-in-flight-meals-7059.html
594,"Quality, Organic and Indigenous Products Sales Driving the Business Growth for Patanjali Ayurved Limited: Ken Research ",https://www.newsvoir.com/release/quality-organic-and-indigenous-products-sales-driving-the-business-growth-for-patanjali-ayurved-limited-ken-research-7052.html
595,Molson Coors India Unveils Thunderbolt in New Premium Packaging ,https://www.newsvoir.com/release/molson-coors-india-unveils-thunderbolt-in-new-premium-packaging-6981.html
596,IHG Opens First Crowne Plaza® Hotel in Pune,https://www.newsvoir.com/release/ihg-opens-first-crowne-plaza-hotel-in-pune-6887.html
597,Holiday Inn® Turns New Kids Menu Dishes into Masterpieces,https://www.newsvoir.com/release/holiday-inn-turns-new-kids-menu-dishes-into-masterpieces-6880.html
598,Herbalife’s Nutrition At Work Survey reveals Women are More Aware of the Health Issues Associated with Sedentary Lifestyles as Compared to Men,https://www.newsvoir.com/release/herbalife-s-nutrition-at-work-survey-reveals-women-are-more-aware-of-the-health-issues-associated-with-sedentary-lifestyles-as-compared-to-men-6873.html
599,MasterChef Australia Judge George Calombaris Finds his Sous-Chef in Godrej’s Cuisine Regale,https://www.newsvoir.com/release/masterchef-australia-judge-george-calombaris-finds-his-sous-chef-in-godrej-s-cuisine-regale-6850.html
600,"SpiceJet Launches Premium Lounges at Varanasi, Jaipur and Guwahati",https://www.newsvoir.com/release/spicejet-launches-premium-lounges-at-varanasi-jaipur-and-guwahati-6792.html
601,"Wonder Cement to Provide Clean and Cold Drinking Water to People Across 29 Districts in the States of Rajasthan, Madhya Pradesh and Gujarat",https://www.newsvoir.com/release/wonder-cement-to-provide-clean-and-cold-drinking-water-to-people-across-29-districts-in-the-states-of-rajasthan-madhya-pradesh-and-gujarat-6766.html
602,Manpasand Beverages Launches Packaged Tender Coconut Water Under ‘Coco Sip’ Brand Name,https://www.newsvoir.com/release/manpasand-beverages-launches-packaged-tender-coconut-water-under-coco-sip-brand-name-6743.html
603,Alcobrew to be One of Top 5 Liquor Companies by 2020,https://www.newsvoir.com/release/alcobrew-to-be-one-of-top-5-liquor-companies-by-2020-6628.html
604,City’s Influential Men Came Together to Raise Awareness Against Child Abuse at Men n Fashion,https://www.newsvoir.com/release/city-s-influential-men-came-together-to-raise-awareness-against-child-abuse-at-men-n-fashion-6518.html
605,Men of Substance Come Together to Raise Awareness Against Abuse of the Girl Child at 'Men n Fashion' Event in New Delhi,https://www.newsvoir.com/release/men-of-substance-come-together-to-raise-awareness-against-abuse-of-the-girl-child-at-men-n-fashion-event-in-new-delhi-6507.html
606,India’s First Organic Fast Food Brand ‘YumBox’ Launched in Gurgaon,https://www.newsvoir.com/release/india-s-first-organic-fast-food-brand-yumbox-launched-in-gurgaon-6485.html
607,Fresh To Home Announces Official Brand Launch in India,https://www.newsvoir.com/release/fresh-to-home-announces-official-brand-launch-in-india-6427.html
608,"Percept Sports & Entertainment Executes the Tetra Pak SAM Kick off 2016
",https://www.newsvoir.com/release/percept-sports-entertainment-executes-the-tetra-pak-sam-kick-off-2016-6416.html
609,Start-ups Such as RentSher - Redefining Cricket Viewing Experience,https://www.newsvoir.com/release/start-ups-such-as-rentsher-redefining-cricket-viewing-experience-6407.html
610,Whiskin Spirits Launches Whiskin Craft Whisky,https://www.newsvoir.com/release/whiskin-spirits-launches-whiskin-craft-whisky-6405.html
611,"India Hyperlocal Market is Expected to Reach INR 2,306 Crore by 2020 - Ken Research",https://www.newsvoir.com/release/india-hyperlocal-market-is-expected-to-reach-inr-2-306-crore-by-2020-ken-research-6365.html
612,Manpasand to Flavour Baskin-Robbins Experience with Fruit Drinks Magic at 250 Ice Cream Outlets ,https://www.newsvoir.com/release/manpasand-to-flavour-baskin-robbins-experience-with-fruit-drinks-magic-at-250-ice-cream-outlets-6319.html
613,Celebrate Women’s Day with Maharaja Whiteline,https://www.newsvoir.com/release/celebrate-women-s-day-with-maharaja-whiteline-6311.html
614,MILKFED to Put up Kiosks at IOCL Outlets,https://www.newsvoir.com/release/milkfed-to-put-up-kiosks-at-iocl-outlets-6300.html
615,Petrified Travellers Salute Punjabi Hospitality in Haryana,https://www.newsvoir.com/release/petrified-travellers-salute-punjabi-hospitality-in-haryana-6251.html
616,Indigo Live Music Bar Presents the Nirmika ‘Jhoote’ Tour,https://www.newsvoir.com/release/indigo-live-music-bar-presents-the-nirmika-jhoote-tour-6210.html
617,YES BANK - MoFPI - CII Report Highlights Key Opportunities to Leverage Food Processing Sector & Boost Make in India,https://www.newsvoir.com/release/yes-bank-mofpi-cii-report-highlights-key-opportunities-to-leverage-food-processing-sector-boost-make-in-india-6175.html
618,Punjab to Abolish Vat on Raw Honey and Equipment Required for Bee Keeping,https://www.newsvoir.com/release/punjab-to-abolish-vat-on-raw-honey-and-equipment-required-for-bee-keeping-6113.html
619,Lahore’s Food Street to Come Alive at “Urban Haat” in Amritsar,https://www.newsvoir.com/release/lahore-s-food-street-to-come-alive-at-urban-haat-in-amritsar-6109.html
