,title,link
119,"Hapusa, World's First Himalayan Dry Gin, Bags a Gold at The International Wines & Spirits Competition 2021",https://www.newsvoir.com/release/hapusa-world-s-first-himalayan-dry-gin-bags-a-gold-at-the-international-wines-spirits-competition-2021-16973.html
120,Come and Savor Some of the World-famous Cherries from the U.S. Pacific Northwest,https://www.newsvoir.com/release/come-and-savor-some-of-the-world-famous-cherries-from-the-u-s-pacific-northwest-16948.html
121,"Hatsun Agro Product Ltd. Launches Paneer under ""Arokya"" Brand",https://www.newsvoir.com/release/hatsun-agro-product-ltd-launches-paneer-under-arokya-brand-16931.html
122,India's Nutrition Brand that Promises to Never Put an End to Celebrating Pride,https://www.newsvoir.com/release/india-s-nutrition-brand-that-promises-to-never-put-an-end-to-celebrating-pride-16926.html
123,Changing Face of Indian Food and Beverage Industry,https://www.newsvoir.com/release/changing-face-of-indian-food-and-beverage-industry-16841.html
124,"Achieve Your Health Goals with Walnuts, This International Yoga Day",https://www.newsvoir.com/release/achieve-your-health-goals-with-walnuts-this-international-yoga-day-16818.html
125,"Glenfiddich Celebrates the Relentless Spirit of Ingenious Minds and Risk Takers through 'Fathers of Innovation'
",https://www.newsvoir.com/release/glenfiddich-celebrates-the-relentless-spirit-of-ingenious-minds-and-risk-takers-through-fathers-of-innovation-16815.html
126,"Chai Chun Plans Global Expansion, Acquires Renowned Okayti Tea Estate ",https://www.newsvoir.com/release/chai-chun-plans-global-expansion-acquires-renowned-okayti-tea-estate-16814.html
127,"Skholla.in Mango Festival Sale Lines Up 10+ Farm Fresh, Chemical-free Mango Varieties for Door Delivery",https://www.newsvoir.com/release/skholla-in-mango-festival-sale-lines-up-10-farm-fresh-chemical-free-mango-varieties-for-door-delivery-16731.html
128,"Southern Health Foods Launches Manna iStrong - A New Iron Fortified Women's Health Drink
",https://www.newsvoir.com/release/southern-health-foods-launches-manna-istrong-a-new-iron-fortified-women-s-health-drink-16696.html
129,American Pistachios are a Go-to Snack for International Soccer Superstar,https://www.newsvoir.com/release/american-pistachios-are-a-go-to-snack-for-international-soccer-superstar-16675.html
130,Max Protein Launches its First-ever Protein Peanut Butter in 5 Different Flavours,https://www.newsvoir.com/release/max-protein-launches-its-first-ever-protein-peanut-butter-in-5-different-flavours-16654.html
131,Technologically Advanced Professional Cooking Systems can Bring Efficiencies in your Food Business Operations,https://www.newsvoir.com/release/technologically-advanced-professional-cooking-systems-can-bring-efficiencies-in-your-food-business-operations-16554.html
132,"Tilaknagar Industries Marks Turnaround Led by Debt-restructuring, Positions Company for Long-term Growth",https://www.newsvoir.com/release/tilaknagar-industries-marks-turnaround-led-by-debt-restructuring-positions-company-for-long-term-growth-16518.html
133,Celebrating the Goodness of Walnuts On National Walnut Day,https://www.newsvoir.com/release/celebrating-the-goodness-of-walnuts-on-national-walnut-day-16500.html
134,Amla Trade Gets a Major Boost in Korea with KoreaShop 24,https://www.newsvoir.com/release/amla-trade-gets-a-major-boost-in-korea-with-koreashop-24-16471.html
135,Chozen Foods to Launch India's First Cold Water Ice Cream Mix,https://www.newsvoir.com/release/chozen-foods-to-launch-india-apos-s-first-cold-water-ice-cream-mix-16311.html
136,Madhur Sugar Hits the Sweet Spot with its Latest Campaign,https://www.newsvoir.com/release/madhur-sugar-hits-the-sweet-spot-with-its-latest-campaign-16282.html
137,Dairy Day Launches New Range of Ice Cream Cakes,https://www.newsvoir.com/release/dairy-day-launches-new-range-of-ice-cream-cakes-16276.html
138,Original Accessories from RATIONAL for Precision Cooking Experience from your Combi-steamer,https://www.newsvoir.com/release/original-accessories-from-rational-for-precision-cooking-experience-from-your-combi-steamer-16249.html
139,"Madhur Sugar Reassures Commitment to Create Sweet Moments with New Campaign – ""Madhur Pal""",https://www.newsvoir.com/release/madhur-sugar-reassures-commitment-to-create-sweet-moments-with-new-campaign-quot-madhur-pal-quot-16250.html
140,Novotel Goa Resorts & Spa Introduces Cashew Trail,https://www.newsvoir.com/release/novotel-goa-resorts-spa-introduces-cashew-trail-16224.html
141,Fresca Juices Ropes in Amyra Dastur & Shreyas Iyer as their First Brand Ambassador,https://www.newsvoir.com/release/fresca-juices-ropes-in-amyra-dastur-shreyas-iyer-as-their-first-brand-ambassador-16143.html
142,Five Reasons you Need to Incorporate Omega-3 in your Diet,https://www.newsvoir.com/release/five-reasons-you-need-to-incorporate-omega-3-in-your-diet-16136.html
143,CCSCSB Appreciates Dr. Anuj Choudhary for Incredibly Promoting Professional Bodybuilding,https://www.newsvoir.com/release/ccscsb-appreciates-dr-anuj-choudhary-for-incredibly-promoting-professional-bodybuilding-16125.html
144,How Zoop is Redefining Online Food Ordering on your Train Journeys,https://www.newsvoir.com/release/how-zoop-is-redefining-online-food-ordering-on-your-train-journeys-16123.html
145,Legacy Property 'Pebble' Partners with NuAir in a Unique Merger Promising a Dining Experience Like no Other,https://www.newsvoir.com/release/legacy-property-apos-pebble-apos-partners-with-nuair-in-a-unique-merger-promising-a-dining-experience-like-no-other-16083.html
146,Drunken Monkey Closes the Financial Year with 100 Plus Outlets in 50 Plus Cities - Clocks a Turnover of 60 Crores in 2020-21,https://www.newsvoir.com/release/drunken-monkey-closes-the-financial-year-with-100-plus-outlets-in-50-plus-cities-clocks-a-turnover-of-60-crores-in-2020-21-16051.html
147,Sunflame Healthy Bites Announces Season 2: Immunity Booster Special,https://www.newsvoir.com/release/sunflame-healthy-bites-announces-season-2-immunity-booster-special-16040.html
148,"Catch Spices Sets a Positive Tone for 2021, with 'Umeedon ka Saal' Campaign ",https://www.newsvoir.com/release/catch-spices-sets-a-positive-tone-for-2021-with-apos-umeedon-ka-saal-apos-campaign-16016.html
149,New-Age Dairy Brand Healthways Launches Initiative to Promote Healthy Breakfast Regimen,https://www.newsvoir.com/release/new-age-dairy-brand-healthways-launches-initiative-to-promote-healthy-breakfast-regimen-16001.html
150,Chai Sutta Bar Spreads Taste of Kulhad with Yet Another Exclusive Venture in Mumbai Sub-urban Andheri West,https://www.newsvoir.com/release/chai-sutta-bar-spreads-taste-of-kulhad-with-yet-another-exclusive-venture-in-mumbai-sub-urban-andheri-west-15986.html
151,Teamonk Global's Specialty Teas Sales Peak During COVID-19 on the Back of Global Consciousness for Healthy Lifestyle,https://www.newsvoir.com/release/teamonk-global-apos-s-specialty-teas-sales-peak-during-covid-19-on-the-back-of-global-consciousness-for-healthy-lifestyle-15972.html
152,"Southern Health Foods Launches Manna Go Grains Malt Enters the 6000+ Crore Malt Food Drink (MFD) Market Space
",https://www.newsvoir.com/release/southern-health-foods-launches-manna-go-grains-malt-enters-the-6000-crore-malt-food-drink-mfd-market-space-15930.html
153,"International Women's Day - How to Start 2021 Stronger, Healthier and Fitter",https://www.newsvoir.com/release/international-women-apos-s-day-how-to-start-2021-stronger-healthier-and-fitter-15917.html
154,Sanjeev Kapoor Cookery Show and the Grand Finale of Zaayka Presents Jito Master Chef was Held at ITC Grand Chola Chennai,https://www.newsvoir.com/release/sanjeev-kapoor-cookery-show-and-the-grand-finale-of-zaayka-presents-jito-master-chef-was-held-at-itc-grand-chola-chennai-15910.html
155,Dole Launches Sunshine for All Fund Fueling Innovation to Close the Gaps on Good Nutrition,https://www.newsvoir.com/release/dole-launches-sunshine-for-all-fund-fueling-innovation-to-close-the-gaps-on-good-nutrition-15882.html
156,Max Protein Forays into Cookies Segment with Soft Protein Cookies,https://www.newsvoir.com/release/max-protein-forays-into-cookies-segment-with-soft-protein-cookies-15884.html
157,Cloud Kitchen Startup 'Kouzina' Celebrates 7 Years with All-India Expansion,https://www.newsvoir.com/release/cloud-kitchen-startup-apos-kouzina-apos-celebrates-7-years-with-all-india-expansion-15878.html
158,"California Walnuts Launches Global Marketing Initiative with Coordinated ""Power of 3"" Events Across the Globe",https://www.newsvoir.com/release/california-walnuts-launches-global-marketing-initiative-with-coordinated-quot-power-of-3-quot-events-across-the-globe-15877.html
159,Nilon's Hassle-free and Nutritious Ginger Garlic Paste Make Your Dishes More Tasty and Healthy,https://www.newsvoir.com/release/nilon-apos-s-hassle-free-and-nutritious-ginger-garlic-paste-make-your-dishes-more-tasty-and-healthy-15857.html
160,"After KFC, Pizza Hut, More Stores to Open up at Galaxy's Blue Sapphire Plaza",https://www.newsvoir.com/release/after-kfc-pizza-hut-more-stores-to-open-up-at-galaxy-apos-s-blue-sapphire-plaza-15831.html
161,Little Caesars Pizza Names Paula Vissing Chief Operating Officer,https://www.newsvoir.com/release/little-caesars-pizza-names-paula-vissing-chief-operating-officer-15812.html
162,Herbalife Nutrition Continues Innovation Spree with Auto Sales Centre,https://www.newsvoir.com/release/herbalife-nutrition-continues-innovation-spree-with-auto-sales-centre-15808.html
163,"Health and Nutrition Start-Up, Habbit Makes Consumer Debut with a Range of Innovative & Delicious Products",https://www.newsvoir.com/release/health-and-nutrition-start-up-habbit-makes-consumer-debut-with-a-range-of-innovative-delicious-products-15794.html
164,Hapusa - A Slice of the Himalayas Reaches Bengaluru,https://www.newsvoir.com/release/hapusa-a-slice-of-the-himalayas-reaches-bengaluru-15790.html
165,Planet Organic India - an Initiative towards Affordable and Healthy Lifestyle,https://www.newsvoir.com/release/planet-organic-india-an-initiative-towards-affordable-and-healthy-lifestyle-15788.html
166,Paras Dairy Digitally Integrating and Empowering Dairy Farmers with mooPay,https://www.newsvoir.com/release/paras-dairy-digitally-integrating-and-empowering-dairy-farmers-with-moopay-15765.html
167,Khansaama - A Delivery Venture Offering Authentic Mughlai Food From Royal Bawarchis,https://www.newsvoir.com/release/khansaama-a-delivery-venture-offering-authentic-mughlai-food-from-royal-bawarchis-15763.html
168,Hatsun Agro Product Ltd. Becomes India's Largest Exclusive Brand Retail Network with 3600 Outlets,https://www.newsvoir.com/release/hatsun-agro-product-ltd-becomes-india-apos-s-largest-exclusive-brand-retail-network-with-3600-outlets-15758.html
169,WayCool Foods & IIFPT Collaborate to Develop Solutions for Reducing Food Wastage,https://www.newsvoir.com/release/waycool-foods-iifpt-collaborate-to-develop-solutions-for-reducing-food-wastage-15700.html
170,'Animal Booster Nutrition' Company Creating Landmark Success in India,https://www.newsvoir.com/release/apos-animal-booster-nutrition-apos-company-creating-landmark-success-in-india-15693.html
171,Responsible Whatr Offers Indian Consumers Spring Water in Infinitely Recyclable Aluminum Cans ,https://www.newsvoir.com/release/responsible-whatr-offers-indian-consumers-spring-water-in-infinitely-recyclable-aluminum-cans-15690.html
172,"Foodtech Player Bhojan Plans to Sell 150,000 Affordable Meals a Day Across the Nation by December 2021",https://www.newsvoir.com/release/foodtech-player-bhojan-plans-to-sell-150-000-affordable-meals-a-day-across-the-nation-by-december-2021-15677.html
173,"Mai Bao, a Singaporean Delight Launched at DLF Avenue, Saket",https://www.newsvoir.com/release/mai-bao-a-singaporean-delight-launched-at-dlf-avenue-saket-15585.html
174,Sonal Barmecha Bags The Power Woman Award for Food and Beverage,https://www.newsvoir.com/release/sonal-barmecha-bags-the-power-woman-award-for-food-and-beverage-15601.html
175,Wiggles.in Introduces 100% Human Grade Wet Food for Dogs,https://www.newsvoir.com/release/wiggles-in-introduces-100-human-grade-wet-food-for-dogs-15580.html
176,Thirumala Launches 'White Gold' 100% Thick & Creamy Buffalo Milk and Curd,https://www.newsvoir.com/release/thirumala-launches-apos-white-gold-apos-100-thick-creamy-buffalo-milk-and-curd-15556.html
177,"Citymandi Launches ""Uber-ized"" Mobile Mart Model Following ""Atmanirbhar Bharat"" Generating Large Number of Urban Livelihood Opportunities ",https://www.newsvoir.com/release/citymandi-launches-quot-uber-ized-quot-mobile-mart-model-following-quot-atmanirbhar-bharat-quot-generating-large-number-of-urban-livelihood-opportunities-15548.html
178,"Cold Chain Startup Inficold Raises USD 900,000 from RVCF and Other Investors",https://www.newsvoir.com/release/cold-chain-startup-inficold-raises-usd-900-000-from-rvcf-and-other-investors-15545.html
179,"Get Ready to Chill this Long Weekend at Phoenix Marketcity, Pune
",https://www.newsvoir.com/release/get-ready-to-chill-this-long-weekend-at-phoenix-marketcity-pune-15544.html
180,Boost Immunity with Key Nutrients Found in Pistachios,https://www.newsvoir.com/release/boost-immunity-with-key-nutrients-found-in-pistachios-15529.html
181,WayCool Foods Join hands with IIT-Hyderabad to Develop Packaging Solution to Reduce Food Wastage,https://www.newsvoir.com/release/waycool-foods-join-hands-with-iit-hyderabad-to-develop-packaging-solution-to-reduce-food-wastage-15511.html
182,"India's Favourite Popcorn Brand 'Popcorn & Company', Makes its Way to 24Seven",https://www.newsvoir.com/release/india-apos-s-favourite-popcorn-brand-apos-popcorn-company-apos-makes-its-way-to-24seven-15485.html
183,Easy Ideas to Fit Walnuts into your Daily Meals,https://www.newsvoir.com/release/easy-ideas-to-fit-walnuts-into-your-daily-meals-15482.html
184,Dairy Products Brand 'Milk Magic' Penetrates in Indian B2C Domestic Market,https://www.newsvoir.com/release/dairy-products-brand-apos-milk-magic-apos-penetrates-in-indian-b2c-domestic-market-15370.html
185,Coolberg Sets Eyes on Fizzy Drink Market with Launch of its New Cranberry Drink 'Cranito Fizzy Cranberry',https://www.newsvoir.com/release/coolberg-sets-eyes-on-fizzy-drink-market-with-launch-of-its-new-cranberry-drink-apos-cranito-fizzy-cranberry-apos-15315.html
186,"Red, Delectable and Nutritive Cherries from Chile Promoted for the First Time in India",https://www.newsvoir.com/release/red-delectable-and-nutritive-cherries-from-chile-promoted-for-the-first-time-in-india-15308.html
187,California Walnuts: Making Everyday Healthy,https://www.newsvoir.com/release/california-walnuts-making-everyday-healthy-15306.html
188,JanaJal 'Water on Wheels' Electric Vehicle Recommended by Jal Shakti Ministry for Delivery of Safe Water,https://www.newsvoir.com/release/janajal-apos-water-on-wheels-apos-electric-vehicle-recommended-by-jal-shakti-ministry-for-delivery-of-safe-water-15307.html
189,"On International Tea Day, Teamonk Global Reiterates its Commitment to Premium Teas that Promotes Health and Wellness",https://www.newsvoir.com/release/on-international-tea-day-teamonk-global-reiterates-its-commitment-to-premium-teas-that-promotes-health-and-wellness-15282.html
190,India's Homegrown Green Jackfruit Flour for Diabetes Gets Recognition from American Diabetes Association,https://www.newsvoir.com/release/india-apos-s-homegrown-green-jackfruit-flour-for-diabetes-gets-recognition-from-american-diabetes-association-15260.html
191,Drunken Monkey Expands During the Pandemic,https://www.newsvoir.com/release/drunken-monkey-expands-during-the-pandemic-15256.html
192,Jagdale Healthcare Announces Recent Clinical Study Results on Mulmina® for its Immune Boosting Benefits ,https://www.newsvoir.com/release/jagdale-healthcare-announces-recent-clinical-study-results-on-mulmina-for-its-immune-boosting-benefits-15237.html
193,The Korean Wave in India Helps Korikart Continue to Grow by Leaps and Bounds,https://www.newsvoir.com/release/the-korean-wave-in-india-helps-korikart-continue-to-grow-by-leaps-and-bounds-15214.html
194,Teamonk Global Launches Four Unique Variants of Ayurveda Green Tea,https://www.newsvoir.com/release/teamonk-global-launches-four-unique-variants-of-ayurveda-green-tea-15208.html
195,American Pistachios Growers (APG) Celebrates its Record-breaking Harvest of One-Billion Pounds,https://www.newsvoir.com/release/american-pistachios-growers-apg-celebrates-its-record-breaking-harvest-of-one-billion-pounds-15184.html
196,5th Edition of the World Week of Italian Cuisine in India Celebrates Home Cooking,https://www.newsvoir.com/release/5th-edition-of-the-world-week-of-italian-cuisine-in-india-celebrates-home-cooking-15172.html
197,Hatsun Agro Product Ltd. Reaches Retail Milestone with 3000th Outlet ,https://www.newsvoir.com/release/hatsun-agro-product-ltd-reaches-retail-milestone-with-3000th-outlet-15164.html
198,Therapeutic Food Makers Look to Collaborate with Govt. in Fighting Malnutrition,https://www.newsvoir.com/release/therapeutic-food-makers-look-to-collaborate-with-govt-in-fighting-malnutrition-15120.html
199,Airowater Charts National and Global Expansion; Expands Tamil Nadu Business on the Back of High Demand from the Region,https://www.newsvoir.com/release/airowater-charts-national-and-global-expansion-expands-tamil-nadu-business-on-the-back-of-high-demand-from-the-region-15091.html
200,Yoga Bar Launches an Exotic Range of All-Natural Nut Butters,https://www.newsvoir.com/release/yoga-bar-launches-an-exotic-range-of-all-natural-nut-butters-15086.html
201,Nilon's Brings 'Khushiyan' back Home with Nilon's Utsav Sweet Box,https://www.newsvoir.com/release/nilon-apos-s-brings-apos-khushiyan-apos-back-home-with-nilon-apos-s-utsav-sweet-box-15044.html
202,"This Diwali, Indian Manufacturers Launch Home-made Sweets namely 'Mishtabhuj' ",https://www.newsvoir.com/release/this-diwali-indian-manufacturers-launch-home-made-sweets-namely-apos-mishtabhuj-apos-15008.html
203,Source Natural Foods and Herbal Supplements Ltd. Signs MOU with Verstegen Spices & Sauces B.V.,https://www.newsvoir.com/release/source-natural-foods-and-herbal-supplements-ltd-signs-mou-with-verstegen-spices-sauces-b-v-14952.html
204,Anannke Foundation Supports Over 10 Lakh People Every Month Amid COVID-19 Crisis,https://www.newsvoir.com/release/anannke-foundation-supports-over-10-lakh-people-every-month-amid-covid-19-crisis-14946.html
205,Jacob's Creek Joins Hands with India's Largest Wedding Exhibition 'Bridal Asia',https://www.newsvoir.com/release/jacob-apos-s-creek-joins-hands-with-india-apos-s-largest-wedding-exhibition-apos-bridal-asia-apos-14900.html
206,"Accor, Hard Rock and Gordon Ramsey's Hell's Kitchen Setting the Benchmark with My Menu",https://www.newsvoir.com/release/accor-hard-rock-and-gordon-ramsey-apos-s-hell-apos-s-kitchen-setting-the-benchmark-with-my-menu-14895.html
207,"Khaaugully Delivers the Food you Want, Launches Online Store having 2,500 Items",https://www.newsvoir.com/release/khaaugully-delivers-the-food-you-want-launches-online-store-having-2-500-items-14869.html
208,Your Guide to Indulging Without Overindulging this Festive Season with California Walnuts,https://www.newsvoir.com/release/your-guide-to-indulging-without-overindulging-this-festive-season-with-california-walnuts-14863.html
209,"Leading Coffee Chain ""Barista"" Opens Biggest Tricity & Punjab Cafe at Sector-68 Mohali",https://www.newsvoir.com/release/leading-coffee-chain-quot-barista-quot-opens-biggest-tricity-punjab-cafe-at-sector-68-mohali-14829.html
210,Responsible Whatr's Sustainable Aluminium Cans Reach the Mark of 1 Lakh Sales Pan India,https://www.newsvoir.com/release/responsible-whatr-apos-s-sustainable-aluminium-cans-reach-the-mark-of-1-lakh-sales-pan-india-14805.html
211,Glenfiddich Exhibits The Spirit of Ingenuity by Re-inventing The Flagship Range Design,https://www.newsvoir.com/release/glenfiddich-exhibits-the-spirit-of-ingenuity-by-re-inventing-the-flagship-range-design-14738.html
212,Nilon's Brings Emphasis on Health in a Pickle with Nilon's Achaar,https://www.newsvoir.com/release/nilon-apos-s-brings-emphasis-on-health-in-a-pickle-with-nilon-apos-s-achaar-14606.html
213,Tilaknagar Industries Reports Rs. 270 Crore Profit After Tax,https://www.newsvoir.com/release/tilaknagar-industries-reports-rs-270-crore-profit-after-tax-14603.html
214,Anannke Foundation Partners with DSGMC for 'Langar on Wheels' Amid COVID-19 Crisis,https://www.newsvoir.com/release/anannke-foundation-partners-with-dsgmc-for-apos-langar-on-wheels-apos-amid-covid-19-crisis-14481.html
215,BigMuscles Nutrition Launches New Campaign #FitnessRefreshed with Brand Ambassador Ranveer Singh,https://www.newsvoir.com/release/bigmuscles-nutrition-launches-new-campaign-fitnessrefreshed-with-brand-ambassador-ranveer-singh-14454.html
216,SOLO Launches TopCare - Plans to Expand to HORECA and to End Consumers,https://www.newsvoir.com/release/solo-launches-topcare-plans-to-expand-to-horeca-and-to-end-consumers-14442.html
217,ShopX - Omnipresent get Govt. Approval to Start Ecom Drone Delivery Trials from Sept 1 ,https://www.newsvoir.com/release/shopx-omnipresent-get-govt-approval-to-start-ecom-drone-delivery-trials-from-sept-1-14385.html
218,Make Achaar Great Again - Nilon's Launches #AchaarWithVichaar as its Latest Campaign,https://www.newsvoir.com/release/make-achaar-great-again-nilon-apos-s-launches-achaarwithvichaar-as-its-latest-campaign-14374.html
219,Coimbatore Company Launches Ozone-based Disinfectant that Makes Food 100% Safe from Coronavirus,https://www.newsvoir.com/release/coimbatore-company-launches-ozone-based-disinfectant-that-makes-food-100-safe-from-coronavirus-14297.html
220,"Wazir Advisors Announces the Launch of Agriculture, Dairy and Food Processing (ADFP) Vertical",https://www.newsvoir.com/release/wazir-advisors-announces-the-launch-of-agriculture-dairy-and-food-processing-adfp-vertical-14249.html
221,KKR Group's Nirapara Launches 'N Nattukada' in Kerala,https://www.newsvoir.com/release/kkr-group-apos-s-nirapara-launches-apos-n-nattukada-apos-in-kerala-14180.html
222,SK Intech Metchems Signs MoU with KMV to Market and Distribute Eco Clean Across India,https://www.newsvoir.com/release/sk-intech-metchems-signs-mou-with-kmv-to-market-and-distribute-eco-clean-across-india-14130.html
223,Five Star Unveils Two Flagship Stores in Delhi NCR Region,https://www.newsvoir.com/release/five-star-unveils-two-flagship-stores-in-delhi-ncr-region-14060.html
224,Fuel Your Health Goals with Wonderful Crunch of Walnuts this Yoga Day,https://www.newsvoir.com/release/fuel-your-health-goals-with-wonderful-crunch-of-walnuts-this-yoga-day-14045.html
225,Cloud Kitchen Platform Hoi Foods Raises Pre-series A Funding,https://www.newsvoir.com/release/cloud-kitchen-platform-hoi-foods-raises-pre-series-a-funding-14029.html
226,Kareena Inspires Everyone to be a Part of the #HappinessZone ,https://www.newsvoir.com/release/kareena-inspires-everyone-to-be-a-part-of-the-happinesszone-14015.html
227,Shanti Foundation Distributes Thousands of Ration Bags to the Needy Amid COVID-19 Crisis,https://www.newsvoir.com/release/shanti-foundation-distributes-thousands-of-ration-bags-to-the-needy-amid-covid-19-crisis-13943.html
228,Fiinovation Partners with Dhampur Sugar to help Delhi Slums Fight COVID-19 Pandemic ,https://www.newsvoir.com/release/fiinovation-partners-with-dhampur-sugar-to-help-delhi-slums-fight-covid-19-pandemic-13923.html
229,Cyril Amarchand Mangaldas Advises ITC Limited (ITC) on Acquisition of 100% Stake in Sunrise Foods Private Limited,https://www.newsvoir.com/release/cyril-amarchand-mangaldas-advises-itc-limited-itc-on-acquisition-of-100-stake-in-sunrise-foods-private-limited-13919.html
230,"Hindrise NGO Serves 2 Lakh Plus Migrants in Delhi NCR, Distributes Free Masks, Groceries  ",https://www.newsvoir.com/release/hindrise-ngo-serves-2-lakh-plus-migrants-in-delhi-ncr-distributes-free-masks-groceries-13911.html
231,"Khanvel Resort Turns ""Atmanirbhar"", Uses Resort Property to Grow Veggies",https://www.newsvoir.com/release/khanvel-resort-turns-quot-atmanirbhar-quot-uses-resort-property-to-grow-veggies-13904.html
232,Lactalis India Pledges INR 1.5 Crores to PM Cares & State Funds; Joins the Fight Against COVID-19,https://www.newsvoir.com/release/lactalis-india-pledges-inr-1-5-crores-to-pm-cares-state-funds-joins-the-fight-against-covid-19-13891.html
233,Easy Ways to Plan your Meals with California Walnuts,https://www.newsvoir.com/release/easy-ways-to-plan-your-meals-with-california-walnuts-13875.html
234,Sakthi Masala Contributes to the Chief Minister's Public Relief Fund for The Second Time by Donating Rs. 5.10 Crore ,https://www.newsvoir.com/release/sakthi-masala-contributes-to-the-chief-minister-apos-s-public-relief-fund-for-the-second-time-by-donating-rs-5-10-crore-13867.html
235,Healthy Dietary Regimen at Home During COVID-19 Lockdown,https://www.newsvoir.com/release/healthy-dietary-regimen-at-home-during-covid-19-lockdown-13846.html
236,#EggsForImmunity is Setting the Trend for a Healthy Lifestyle on Social Media,https://www.newsvoir.com/release/eggsforimmunity-is-setting-the-trend-for-a-healthy-lifestyle-on-social-media-13796.html
237,WayCool Supplies Essentials Directly to Customers and Boosts Small Business Economy,https://www.newsvoir.com/release/waycool-supplies-essentials-directly-to-customers-and-boosts-small-business-economy-13791.html
238,Ivar Agro Joins Hand with Misty Interactive Studios for Global Launch of Organic Spices ,https://www.newsvoir.com/release/ivar-agro-joins-hand-with-misty-interactive-studios-for-global-launch-of-organic-spices-13780.html
239,Tata Tea JaagoRe is Back with a New Cause - Iss Baar #BadonKeLiye JaagoRe,https://www.newsvoir.com/release/tata-tea-jaagore-is-back-with-a-new-cause-iss-baar-badonkeliye-jaagore-13767.html
