,title,link
240,Annamrita Foundation Stands by Needy in COVID-19 Tough Times,https://www.newsvoir.com/release/annamrita-foundation-stands-by-needy-in-covid-19-tough-times-13766.html
241,Tilaknagar Industries Completes Settlement with Bank of India,https://www.newsvoir.com/release/tilaknagar-industries-completes-settlement-with-bank-of-india-13756.html
242,AIPL Aids Daily Wage Workers and Stray Dogs in their Fight Against COVID-19 ,https://www.newsvoir.com/release/aipl-aids-daily-wage-workers-and-stray-dogs-in-their-fight-against-covid-19-13726.html
243,5 Ways to Add more Nutrition to your Diet with California Walnuts,https://www.newsvoir.com/release/5-ways-to-add-more-nutrition-to-your-diet-with-california-walnuts-13723.html
244,WTC Chandigarh to Set up a Center of Excellence for Food and Agriculture,https://www.newsvoir.com/release/wtc-chandigarh-to-set-up-a-center-of-excellence-for-food-and-agriculture-13667.html
245,AMAI Increases Outreach Activity for Chlorine Disinfection and Combating COVID-19,https://www.newsvoir.com/release/amai-increases-outreach-activity-for-chlorine-disinfection-and-combating-covid-19-13654.html
246,India's Prime Plant Protein Supplement 'Protuff' by Aarnix Healthsciences,https://www.newsvoir.com/release/india-apos-s-prime-plant-protein-supplement-apos-protuff-apos-by-aarnix-healthsciences-13637.html
247,#CustomerFirst - McDonald's India Upholds its Promise of Serving Safe and Hygienic Food ,https://www.newsvoir.com/release/customerfirst-mcdonald-apos-s-india-upholds-its-promise-of-serving-safe-and-hygienic-food-13613.html
248,"Nu-Shakti Ventures into E-commerce, Boosting Customer Reach
",https://www.newsvoir.com/release/nu-shakti-ventures-into-e-commerce-boosting-customer-reach-13601.html
249,Welcome Group Graduate School of Hotel Management (WGSHA) of Manipal Academy of Higher Education Enters Limca Book of Records for its India's First Living Culinary Arts Museum at WGSHA,https://www.newsvoir.com/release/welcome-group-graduate-school-of-hotel-management-wgsha-of-manipal-academy-of-higher-education-enters-limca-book-of-records-for-its-india-apos-s-first-living-culinary-arts-museum-at-wgsha-13592.html
250,T.S. Rahaman Students Bag Top Award in the EverestBKCC Grand Finale Round,https://www.newsvoir.com/release/t-s-rahaman-students-bag-top-award-in-the-everestbkcc-grand-finale-round-13572.html
251,Retail Chains in Dairy Stand in Unison with World Animal Protection,https://www.newsvoir.com/release/retail-chains-in-dairy-stand-in-unison-with-world-animal-protection-13539.html
252,Oakridger Rishi Verma’s Start-up Initiative “Swayamkrushi” Empowers Rural Indian Women  ,https://www.newsvoir.com/release/oakridger-rishi-verma-s-start-up-initiative-swayamkrushi-empowers-rural-indian-women-13517.html
253,Whizdom Club Launches Whiz Cafe to Inspire Collaboration,https://www.newsvoir.com/release/whizdom-club-launches-whiz-cafe-to-inspire-collaboration-13486.html
254,‘Clean Food Movement’ Initiative Launched by Phalada Pure & Sure,https://www.newsvoir.com/release/clean-food-movement-initiative-launched-by-phalada-pure-sure-13464.html
255,Finland Chamber of Commerce in India (FINCHAM India) Launches ‘Resilient Schools’ in New Delhi,https://www.newsvoir.com/release/finland-chamber-of-commerce-in-india-fincham-india-launches-resilient-schools-in-new-delhi-13453.html
256,Environest JV with Biopipe of U.S.,https://www.newsvoir.com/release/environest-jv-with-biopipe-of-u-s-13441.html
257,ICL Organic IPO Oversubscribed by 2.92 Times on Final Day of Bidding ,https://www.newsvoir.com/release/icl-organic-ipo-oversubscribed-by-2-92-times-on-final-day-of-bidding-13404.html
258,ISBT Announces BevTech India with a Major Regional 2020 Meeting,https://www.newsvoir.com/release/isbt-announces-bevtech-india-with-a-major-regional-2020-meeting-13383.html
259,California Walnuts Launches First-Ever Global Marketing Initiative Encouraging Consumers to Embrace “The Power of 3”,https://www.newsvoir.com/release/california-walnuts-launches-first-ever-global-marketing-initiative-encouraging-consumers-to-embrace-the-power-of-3-13362.html
260,The Maiden Edition of Right To Protein Recently Concluded in Mumbai,https://www.newsvoir.com/release/the-maiden-edition-of-right-to-protein-recently-concluded-in-mumbai-13360.html
261,Startup Brings Automation to Kitchen; Launches World’s First Multi-cuisine Food Printer,https://www.newsvoir.com/release/startup-brings-automation-to-kitchen-launches-world-s-first-multi-cuisine-food-printer-13337.html
262,"Bruxie, A Californian Brand Enters Indian Market with Waffle Chicken Sandwich",https://www.newsvoir.com/release/bruxie-a-californian-brand-enters-indian-market-with-waffle-chicken-sandwich-13299.html
263,Fun-filled Food Carnival Organized for New Gurugram Residence,https://www.newsvoir.com/release/fun-filled-food-carnival-organized-for-new-gurugram-residence-13298.html
264,Chitkara University Leading an International Erasmus+ Project on Prevention and Risk Management of Antibiotic Resistance,https://www.newsvoir.com/release/chitkara-university-leading-an-international-erasmus-project-on-prevention-and-risk-management-of-antibiotic-resistance-13259.html
265,Wagga Wagga Offers Cooking Oil Grown in Non Polluted Environment,https://www.newsvoir.com/release/wagga-wagga-offers-cooking-oil-grown-in-non-polluted-environment-13249.html
266,Elpro City Square Mall to Bring in Republic Day 2020 with Flat 50% Sale,https://www.newsvoir.com/release/elpro-city-square-mall-to-bring-in-republic-day-2020-with-flat-50-sale-13252.html
267,Milkbasket Turns Profitable in Gurgaon,https://www.newsvoir.com/release/milkbasket-turns-profitable-in-gurgaon-13241.html
268,"HiGrocer India, Tech Enabled Consumer Product Company, Addresses Need of Last Minute Comfort Food in Todays Fast Changing Urban Lifestyle",https://www.newsvoir.com/release/higrocer-india-tech-enabled-consumer-product-company-addresses-need-of-last-minute-comfort-food-in-todays-fast-changing-urban-lifestyle-13238.html
269,"Shang Palace Pop-up Tours Shangri-La's Resorts in Maldives,  Muscat and Mauritius",https://www.newsvoir.com/release/shang-palace-pop-up-tours-shangri-la-s-resorts-in-maldives-muscat-and-mauritius-13205.html
270,Over 1600 People Demand Better Dairy and Welfare of Dairy Animals in Delhi,https://www.newsvoir.com/release/over-1600-people-demand-better-dairy-and-welfare-of-dairy-animals-in-delhi-13204.html
271,Education and Sustainability to be Focus Areas for M3M Foundation in 2020: Dr. Payal Kanodia,https://www.newsvoir.com/release/education-and-sustainability-to-be-focus-areas-for-m3m-foundation-in-2020-dr-payal-kanodia-13184.html
272,Ramagya Foundation Launches Innovative CSR Initiatives 'Donation Locker' and 'Happy Fridge',https://www.newsvoir.com/release/ramagya-foundation-launches-innovative-csr-initiatives-donation-locker-and-happy-fridge-13167.html
273,"BrightStar, Franchise Partner of Californian Burger Chain, Carl's Jr. Plans to Triple its Footprint and Seek Investment in India ",https://www.newsvoir.com/release/brightstar-franchise-partner-of-californian-burger-chain-carl-s-jr-plans-to-triple-its-footprint-and-seek-investment-in-india-13155.html
274,Local Kirana Stores Get their Own E-store - NeoMart,https://www.newsvoir.com/release/local-kirana-stores-get-their-own-e-store-neomart-13139.html
275,Golfer’s Shot Indulges Delhi NCR with the ‘Good Life Soiree’,https://www.newsvoir.com/release/golfer-s-shot-indulges-delhi-ncr-with-the-good-life-soiree--13090.html
276,"Star & Endemol Shine India Bring Cricket and Food Together
",https://www.newsvoir.com/release/star-endemol-shine-india-bring-cricket-and-food-together-13092.html
277,Ministry of Women and Child Development Signs MoU with Tasting India Symposium,https://www.newsvoir.com/release/ministry-of-women-and-child-development-signs-mou-with-tasting-india-symposium-13082.html
278,Olive Oil for India - Indian Olive Association's Annual Event,https://www.newsvoir.com/release/olive-oil-for-india-indian-olive-association-apos-s-annual-event-13064.html
279,Dilli Dilwalon ki and Amchi Mumbai Celebrate the Start of US Cranberries Week,https://www.newsvoir.com/release/dilli-dilwalon-ki-and-amchi-mumbai-celebrate-the-start-of-us-cranberries-week-13037.html
280,SUEZ to Handle Water Distribution Service in Mangalore,https://www.newsvoir.com/release/suez-to-handle-water-distribution-service-in-mangalore-13034.html
281,Food Products Grown in a Polluted Environment may Affect Health,https://www.newsvoir.com/release/food-products-grown-in-a-polluted-environment-may-affect-health-12978.html
282,Prodi Enters Sri Lanka with Twisting Scoops,https://www.newsvoir.com/release/prodi-enters-sri-lanka-with-twisting-scoops-12979.html
283,IDE Technologies Delivers a Tertiary Treatment Reverse Osmosis Plant to Chennai Metropolitan Water Supply & Sewerage Board (CMWSSB),https://www.newsvoir.com/release/ide-technologies-delivers-a-tertiary-treatment-reverse-osmosis-plant-to-chennai-metropolitan-water-supply-sewerage-board-cmwssb-12952.html
284,US Cranberries Organizes Masterclass with Chef Saransh Goila,https://www.newsvoir.com/release/us-cranberries-organizes-masterclass-with-chef-saransh-goila-12937.html
285,Power Up Your Meals with California Walnuts,https://www.newsvoir.com/release/power-up-your-meals-with-california-walnuts-12923.html
286,"Managing Food Wastage through Multidisciplinary Approach - Dr. Shivendra Bajaj, Executive Director, FSII
",https://www.newsvoir.com/release/managing-food-wastage-through-multidisciplinary-approach-dr-shivendra-bajaj-executive-director-fsii-12921.html
287,Neena Gupta and Priya Bapat Star in New Ching’s Masala Campaign,https://www.newsvoir.com/release/neena-gupta-and-priya-bapat-star-in-new-ching-s-masala-campaign-12856.html
288,Alliances Galore Hosts 5th Edition of Gourmet Fest,https://www.newsvoir.com/release/alliances-galore-hosts-5th-edition-of-gourmet-fest-12863.html
289,"Farzi Café by Zorawar Kalra Makes it into the Michelin 2020 Guide for Farzi London
",https://www.newsvoir.com/release/farzi-caf-by-zorawar-kalra-makes-it-into-the-michelin-2020-guide-for-farzi-london--12738.html
290,Subway to Celebrate World Sandwich Day with #GoodComesBack Campaign and Bogo Offer on November 1,https://www.newsvoir.com/release/subway-to-celebrate-world-sandwich-day-with-goodcomesback-campaign-and-bogo-offer-on-november-1-12741.html
291,Magnum’s Limited-edition Pop-up is the Ultimate Destination for a Luxurious Experience this Festive Season,https://www.newsvoir.com/release/magnum-s-limited-edition-pop-up-is-the-ultimate-destination-for-a-luxurious-experience-this-festive-season-12730.html
292,US Cranberries: Most Loved Superfruit Around the World,https://www.newsvoir.com/release/us-cranberries-most-loved-superfruit-around-the-world-12726.html
293,VLCC Wellscience Further Expands its Footprint in Nutraceutical Business; Retailing through Direct Selling,https://www.newsvoir.com/release/vlcc-wellscience-further-expands-its-footprint-in-nutraceutical-business-retailing-through-direct-selling-12697.html
294,Gift the Goodness of Health this Diwali with California Walnuts,https://www.newsvoir.com/release/gift-the-goodness-of-health-this-diwali-with-california-walnuts-12699.html
295,‘M3M Foundation Believes in giving Back to the Society’ Says Basant Bansal,https://www.newsvoir.com/release/-m3m-foundation-believes-in-giving-back-to-the-society-says-basant-bansal-12667.html
296,Magnum Spreads the Festive Cheer with its First ever Pop-up Store,https://www.newsvoir.com/release/magnum-spreads-the-festive-cheer-with-its-first-ever-pop-up-store-12650.html
297,European Union Organised Food and Agriculture Seminar in India to Deliberate on Ways to Boost EU-India Trade in Agri-food Products,https://www.newsvoir.com/release/european-union-organised-food-and-agriculture-seminar-in-india-to-deliberate-on-ways-to-boost-eu-india-trade-in-agri-food-products-12633.html
298,"India Wine Awards 2019 Uncorks the Best Wines and Best Places to Drink Wine in the Country
",https://www.newsvoir.com/release/india-wine-awards-2019-uncorks-the-best-wines-and-best-places-to-drink-wine-in-the-country-12629.html
299,Subway® Adds Four New Flavours to Loaded Signature Wraps as Seasonal Offer ,https://www.newsvoir.com/release/subway-adds-four-new-flavours-to-loaded-signature-wraps-as-seasonal-offer--12627.html
300,Kesarwala Brings in Corporate Gifting with Healthier Options ,https://www.newsvoir.com/release/kesarwala-brings-in-corporate-gifting-with-healthier-options-12614.html
301,"Milkbasket Ropes in Former OLA Executive, Nitin Gupta as their New Head of Engineering",https://www.newsvoir.com/release/milkbasket-ropes-in-former-ola-executive-nitin-gupta-as-their-new-head-of-engineering-12605.html
302,McDonald’s Celebrates Founder’s Day in North and East India ,https://www.newsvoir.com/release/mcdonald-s-celebrates-founder-s-day-in-north-and-east-india--12609.html
303,"After Diana Chan, CRED Hosts Sarah Todd India Masterclass Tour",https://www.newsvoir.com/release/after-diana-chan-cred-hosts-sarah-todd-india-masterclass-tour-12603.html
304,AXA XL Partners with Charity WaterAid to Bring Clean Water to Communities in Northern India,https://www.newsvoir.com/release/axa-xl-partners-with-charity-wateraid-to-bring-clean-water-to-communities-in-northern-india-12573.html
305,"US Cranberries Embark on a New Journey with Saransh Goila – Author, Restaurateur, and Maverick Chef ",https://www.newsvoir.com/release/us-cranberries-embark-on-a-new-journey-with-saransh-goila-author-restaurateur-and-maverick-chef--12564.html
306,Mobile Sales Force Automation - the Key to Improving FMCG Sector ROI,https://www.newsvoir.com/release/mobile-sales-force-automation-the-key-to-improving-fmcg-sector-roi-12554.html
307,Colatta Participated in SIAL Seeing Bright Future of Bakery Products in India,https://www.newsvoir.com/release/colatta-participated-in-sial-seeing-bright-future-of-bakery-products-in-india-12536.html
308,McDonald’s Restaurants in West and South India Eliminate All Single-use Plastic ,https://www.newsvoir.com/release/mcdonald-s-restaurants-in-west-and-south-india-eliminate-all-single-use-plastic--12527.html
309,Serving Nation through Serving Food to Children,https://www.newsvoir.com/release/serving-nation-through-serving-food-to-children-12518.html
310,California Walnuts: Nutrient Rich Powerhouse for Overall Wellness,https://www.newsvoir.com/release/california-walnuts-nutrient-rich-powerhouse-for-overall-wellness-12507.html
311,5 Easy Ways to Incorporate California Walnuts in Your Daily Diet,https://www.newsvoir.com/release/5-easy-ways-to-incorporate-california-walnuts-in-your-daily-diet-12479.html
312,Cremica Launches an Exciting Range of Mayonnaise,https://www.newsvoir.com/release/cremica-launches-an-exciting-range-of-mayonnaise-12478.html
313,MilkLane Forays into Cattle Feed Business ,https://www.newsvoir.com/release/milklane-forays-into-cattle-feed-business-12397.html
314,"EazyDiner Foodie Awards, Bengaluru 3rd Edition Recognizes Bengaluru’s Leading Restaurants and Chefs",https://www.newsvoir.com/release/eazydiner-foodie-awards-bengaluru-3rd-edition-recognizes-bengaluru-s-leading-restaurants-and-chefs-12384.html
315,Veeba’s V-Nourish to Create 500 Jobs,https://www.newsvoir.com/release/veeba-s-v-nourish-to-create-500-jobs-12353.html
316,"Cranberry Flavored Ice Creams Launched at Giani’s, Emoi and Kulfiano",https://www.newsvoir.com/release/cranberry-flavored-ice-creams-launched-at-giani-s-emoi-and-kulfiano-12325.html
317,Cremica Joins Hands with NABI & PGIMER for a New Study on Food Products to Validate their Low Glycemic Index,https://www.newsvoir.com/release/cremica-joins-hands-with-nabi-pgimer-for-a-new-study-on-food-products-to-validate-their-low-glycemic-index-12275.html
318,Superfruit Cranberry - Your Monsoon Saviour,https://www.newsvoir.com/release/superfruit-cranberry-your-monsoon-saviour-12183.html
319,India's Bubble Tea Brand to Expand its Business Nationally,https://www.newsvoir.com/release/india-s-bubble-tea-brand-to-expand-its-business-nationally-12154.html
320,Hyderabad Based Engineering Duo Design Revolutionary Solution to the Hard Water Problem,https://www.newsvoir.com/release/hyderabad-based-engineering-duo-design-revolutionary-solution-to-the-hard-water-problem-12142.html
321,Nutritious and Delicious Kiwifruit from Chile Makes Deeper Inroads into the Indian Market,https://www.newsvoir.com/release/nutritious-and-delicious-kiwifruit-from-chile-makes-deeper-inroads-into-the-indian-market-12124.html
322,Maharani The Kitchen Offers you the Best Royal Cuisine in Delhi/NCR,https://www.newsvoir.com/release/maharani-the-kitchen-offers-you-the-best-royal-cuisine-in-delhi-ncr-12127.html
323,"Mr. Charif Christian Carvajal, Marketing Director for Asia, Chilean Fruit Exporters’ Association Launched a Mega Retail Promotion for Chilean Kiwifruit at LOTS Wholesale Solutions, Noida",https://www.newsvoir.com/release/mr-charif-christian-carvajal-marketing-director-for-asia-chilean-fruit-exporters-association-launched-a-mega-retail-promotion-for-chilean-kiwifruit-at-lots-wholesale-solutions-noida-12125.html
324,Zappfresh Wins Prestigious CMO Asia National Awards for Marketing Excellence 2019,https://www.newsvoir.com/release/zappfresh-wins-prestigious-cmo-asia-national-awards-for-marketing-excellence-2019-12115.html
325,India Dairy Alternative Market to Grow at Over 20% CAGR till 2024 - TechSci Research,https://www.newsvoir.com/release/india-dairy-alternative-market-to-grow-at-over-20-cagr-till-2024-techsci-research-12093.html
326,"Chai Chun Tea Shares Expansion Plans, Poised to be the Market Leader",https://www.newsvoir.com/release/chai-chun-tea-shares-expansion-plans-poised-to-be-the-market-leader-12092.html
327,Bite into Delicious Chilean Kiwis to Boost your Health Quotient,https://www.newsvoir.com/release/bite-into-delicious-chilean-kiwis-to-boost-your-health-quotient-12077.html
328,"V-Nourish Inaugurates New Plant in Keshwana, Rajasthan to Manufacture the Range",https://www.newsvoir.com/release/v-nourish-inaugurates-new-plant-in-keshwana-rajasthan-to-manufacture-the-range-12057.html
329,"Salad Days - The Healthy Food Delivery Startup Expands Operations to Noida, Refreshes its Menu",https://www.newsvoir.com/release/salad-days-the-healthy-food-delivery-startup-expands-operations-to-noida-refreshes-its-menu-12030.html
330,This International Yoga Day Achieve Overall Wellness With California Walnuts,https://www.newsvoir.com/release/this-international-yoga-day-achieve-overall-wellness-with-california-walnuts-12006.html
331,Evocus Creates a New Segment in Bottled Drinking Water Category,https://www.newsvoir.com/release/evocus-creates-a-new-segment-in-bottled-drinking-water-category-11998.html
332,APIS India Hits Rs. 102 Crores Revenue in FY2018-19,https://www.newsvoir.com/release/apis-india-hits-rs-102-crores-revenue-in-fy2018-19-11943.html
333,SM Freshy Takes a Unique Initiative; Connects Northeast to Tourists with Freshy Product Range,https://www.newsvoir.com/release/sm-freshy-takes-a-unique-initiative-connects-northeast-to-tourists-with-freshy-product-range-11935.html
334,US Cranberries Ice Cream Carnival Being Held in NCR in June,https://www.newsvoir.com/release/us-cranberries-ice-cream-carnival-being-held-in-ncr-in-june-11934.html
335,V-Nourish Roped in Shah Rukh Khan as Brand Ambassador,https://www.newsvoir.com/release/v-nourish-roped-in-shah-rukh-khan-as-brand-ambassador-11913.html
336,Thousands of Cows’ Lives will be Transformed as Dairies Commit to Higher Welfare,https://www.newsvoir.com/release/thousands-of-cows-lives-will-be-transformed-as-dairies-commit-to-higher-welfare-11905.html
337,Zorambo Contest Offers ICC Cricket World Cup 2019 Platinum Tickets,https://www.newsvoir.com/release/zorambo-contest-offers-icc-cricket-world-cup-2019-platinum-tickets-11904.html
338,"US Cranberries Partners with Sonia Narang, Nutritionist and Dietician",https://www.newsvoir.com/release/us-cranberries-partners-with-sonia-narang-nutritionist-and-dietician-11902.html
339,OMG! Launches Innovative Fruit Juices Range,https://www.newsvoir.com/release/omg-launches-innovative-fruit-juices-range-11888.html
340,The Style Project Reveals Sonam K Ahuja’s ‘Pleasure Obsessions - 2019’,https://www.newsvoir.com/release/the-style-project-reveals-sonam-k-ahuja-s-pleasure-obsessions---2019--11870.html
341,"MilkLane, a Dairy Start-up Launches ‘Toxin & Antibiotic Safe’ Milk",https://www.newsvoir.com/release/milklane-a-dairy-start-up-launches-toxin-antibiotic-safe-milk-11875.html
342,ASIA FRUIT LOGISTICA Set to Bring Opportunity for Indian Fresh Produce Sector ,https://www.newsvoir.com/release/asia-fruit-logistica-set-to-bring-opportunity-for-indian-fresh-produce-sector-11836.html
343,Sub-Zero Wolf - The New Paradigm of Luxury Kitchens in India,https://www.newsvoir.com/release/sub-zero-wolf-the-new-paradigm-of-luxury-kitchens-in-india-11808.html
344,"Kalimark Launches 30 New Variants of Aerated Drinks, Juices and Corn under Bovonto, Zypsy, Ilani ",https://www.newsvoir.com/release/kalimark-launches-30-new-variants-of-aerated-drinks-juices-and-corn-under-bovonto-zypsy-ilani-11802.html
345,CropLife India Appoints Asitava Sen as the New Chief Executive Officer,https://www.newsvoir.com/release/croplife-india-appoints-asitava-sen-as-the-new-chief-executive-officer-11762.html
346,"Burger Singh Launches New Menu 
",https://www.newsvoir.com/release/burger-singh-launches-new-menu-11757.html
347,Invigorate Foods Plans Foray of Investments and Employment in India,https://www.newsvoir.com/release/invigorate-foods-plans-foray-of-investments-and-employment-in-india-11754.html
348,Magnum Challenges Style Diva Sonam K Ahuja,https://www.newsvoir.com/release/magnum-challenges-style-diva-sonam-k-ahuja-11743.html
349,Eat Healthy and Get Fit with ProtoJar,https://www.newsvoir.com/release/eat-healthy-and-get-fit-with-protojar-11741.html
350,Superfruit US Cranberry Celebrates Superwomen,https://www.newsvoir.com/release/superfruit-us-cranberry-celebrates-superwomen-11734.html
351,ASIA FRUIT LOGISTICA Announces Its 11th Edition in the Indian Market ,https://www.newsvoir.com/release/asia-fruit-logistica-announces-its-11th-edition-in-the-indian-market-11721.html
352,Latest Edition of delWine Summit and Excellence Awards 2019 Announced,https://www.newsvoir.com/release/latest-edition-of-delwine-summit-and-excellence-awards-2019-announced-11705.html
353,Foodhall Partners with Scootsy: An On-demand Delivery Platform,https://www.newsvoir.com/release/foodhall-partners-with-scootsy-an-on-demand-delivery-platform-11702.html
354,Sonam is Here with a Seriously Pleasurable Style Project,https://www.newsvoir.com/release/sonam-is-here-with-a-seriously-pleasurable-style-project-11693.html
355,DailyNinja Crosses 2 Million Orders Per Month in March 2019,https://www.newsvoir.com/release/dailyninja-crosses-2-million-orders-per-month-in-march-2019-11656.html
356,Rare ISO Certification for FarmLink,https://www.newsvoir.com/release/rare-iso-certification-for-farmlink-11654.html
357,This World Health Day California Walnuts Shares Top Food Trends to Watch Out for in 2019,https://www.newsvoir.com/release/this-world-health-day-california-walnuts-shares-top-food-trends-to-watch-out-for-in-2019-11639.html
358,Charcoal Eats Brings a Twist to its Menu with Mumbai-style Pav Wows and Rice Bowls,https://www.newsvoir.com/release/charcoal-eats-brings-a-twist-to-its-menu-with-mumbai-style-pav-wows-and-rice-bowls-11636.html
359,Tetra Pak Launches Connected Packaging Platform ,https://www.newsvoir.com/release/tetra-pak-launches-connected-packaging-platform-11628.html
360,Zorambo Aims to Build the World’s Largest Caftaurant Chain ,https://www.newsvoir.com/release/zorambo-aims-to-build-the-world-s-largest-caftaurant-chain--11621.html
361,India Ready  to Eat Food Market Set to Grow at Over 16% CAGR Until 2023,https://www.newsvoir.com/release/india-ready-to-eat-food-market-set-to-grow-at-over-16-cagr-until-2023-11613.html
362,Tetra Pak Introduces the “Factory of the Future” with Human and Al Collaboration at its Core,https://www.newsvoir.com/release/tetra-pak-introduces-the-factory-of-the-future-with-human-and-al-collaboration-at-its-core-11604.html
363,Academy of Pastry Arts Brings a Smile to the Under-privileged Students,https://www.newsvoir.com/release/academy-of-pastry-arts-brings-a-smile-to-the-under-privileged-students-11571.html
364,Cranberry Charisma Wins Hearts at AAHAR 2019,https://www.newsvoir.com/release/cranberry-charisma-wins-hearts-at-aahar-2019-11551.html
365,"AMAI Steps up Drive for Chlorine Disinfected Water on World Water Day
",https://www.newsvoir.com/release/amai-steps-up-drive-for-chlorine-disinfected-water-on-world-water-day-11544.html
366,DARYAGANJ Restaurant - By the inventors of Butter Chicken and Dal Makhani,https://www.newsvoir.com/release/daryaganj-restaurant-by-the-inventors-of-butter-chicken-and-dal-makhani-11538.html
367,Dive into The Finest Indulgence of Summer 2019 by Magnum,https://www.newsvoir.com/release/dive-into-the-finest-indulgence-of-summer-2019-by-magnum-11537.html
368,Cremica Joins Hands with French Company Maison Routin to Foray into Beverages Segment,https://www.newsvoir.com/release/cremica-joins-hands-with-french-company-maison-routin-to-foray-into-beverages-segment-11522.html
369,Glenfiddich Redefines the Single Malt Experience with its Latest Experiments ,https://www.newsvoir.com/release/glenfiddich-redefines-the-single-malt-experience-with-its-latest-experiments-11495.html
370,"Drunken Monkey Launches New Outlets in Navi Mumbai, Guwahati, Hyderabad and Rajahmundry",https://www.newsvoir.com/release/drunken-monkey-launches-new-outlets-in-navi-mumbai-guwahati-hyderabad-and-rajahmundry-11450.html
371,TATA Nx Zero Sugar Gives an Interesting Way to Celebrate this Valentine’s Week,https://www.newsvoir.com/release/tata-nx-zero-sugar-gives-an-interesting-way-to-celebrate-this-valentine-s-week-11343.html
