,title,link
0,"Alpino Health Foods, a Shark Tank Brand, Raises Funds through Revenue Based Financing before its Seed Round",https://www.newsvoir.com/release/alpino-health-foods-a-shark-tank-brand-raises-funds-through-revenue-based-financing-before-its-seed-round-19697.html
1,Get Naturally High this Holi with Refreshing Healthy Smoothies by Drunken Monkey,https://www.newsvoir.com/release/get-naturally-high-this-holi-with-refreshing-healthy-smoothies-by-drunken-monkey-19647.html
2,Women's Day 2022: Here's How California Walnuts May Help you Achieve your Health Goals,https://www.newsvoir.com/release/womens-day-2022-heres-how-california-walnuts-may-help-you-achieve-your-health-goals-19638.html
3,Iconic Red Gold Tomatoes from Europe Launches its Promotional Campaign in India,https://www.newsvoir.com/release/iconic-red-gold-tomatoes-from-europe-launches-its-promotional-campaign-in-india-19613.html
4,"California Walnuts Launches Global ""Power of 3"" Campaign to Address Importance of Omega-3 Consumption",https://www.newsvoir.com/release/california-walnuts-launches-global-quot-power-of-3-quot-campaign-to-address-importance-of-omega-3-consumption-19608.html
5,"Ginglani Distillers raises Rs. 6.6 Crores in its Pre-Series-A Round led by Supermorpheus, Eagle10 Ventures and Grand Anicut Angel Fund",https://www.newsvoir.com/release/ginglani-distillers-raises-rs-6-6-crores-in-its-pre-series-a-round-led-by-supermorpheus-eagle10-ventures-and-grand-anicut-angel-fund-19600.html
6,Crack Open Goodness with California Pistachios on World Pistachio Day,https://www.newsvoir.com/release/crack-open-goodness-with-california-pistachios-on-world-pistachio-day-19573.html
7,Chennai Based Food Startup BVK Biryani Launches 99-Minute Delivery in Re-usable Tin Containers,https://www.newsvoir.com/release/chennai-based-food-startup-bvk-biryani-launches-99-minute-delivery-in-re-usable-tin-containers-19508.html
8,Chai Chun Launches its Store at Kolkata International Airport,https://www.newsvoir.com/release/chai-chun-launches-its-store-at-kolkata-international-airport-19497.html
9,Alkaline Movement Starts in Hospitality Industry of India and Asia from ACOHI,https://www.newsvoir.com/release/alkaline-movement-starts-in-hospitality-industry-of-india-and-asia-from-acohi-19436.html
10,Your Guide to Eating Plant-Based Food,https://www.newsvoir.com/release/your-guide-to-eating-plant-based-food-19422.html
11,Pernod Ricard India Accelerates its Focus on Diversity and Inclusion,https://www.newsvoir.com/release/pernod-ricard-india-accelerates-its-focus-on-diversity-and-inclusion-19419.html
12,India Pavilion to Exhibit Global Investment Opportunities in Agriculture and Allied Sectors at EXPO2020,https://www.newsvoir.com/release/india-pavilion-to-exhibit-global-investment-opportunities-in-agriculture-and-allied-sectors-at-expo2020-19409.html
13,OneRare Joins Forces with Massive Restaurants to Redefine the Landscape of Blockchain Industry in India,https://www.newsvoir.com/release/onerare-joins-forces-with-massive-restaurants-to-redefine-the-landscape-of-blockchain-industry-in-india-19392.html
14,"Fast&Up Fizztival Run is Back with its Third Edition, Remote 5K Run",https://www.newsvoir.com/release/fast-up-fizztival-run-is-back-with-its-third-edition-remote-5k-run-19385.html
15,Somarka brings to India the Secret to Total Body Revitalization through Coherent Water,https://www.newsvoir.com/release/somarka-brings-to-india-the-secret-to-total-body-revitalization-through-coherent-water-19379.html
16,Tilaknagar Industries Q3 Net Revenue Up 23 Per cent at Rs. 206 Crore; Net Profit at Rs. 10 Crore,https://www.newsvoir.com/release/tilaknagar-industries-q3-net-revenue-up-23-per-cent-at-rs-206-crore-net-profit-at-rs-10-crore-19363.html
17,Seagram's Royal Stag Proudly Sponsors the West Indies Cricket Team for their Tour of India-2022,https://www.newsvoir.com/release/seagram-s-royal-stag-proudly-sponsors-the-west-indies-cricket-team-for-their-tour-of-india-2022-19354.html
18,Wow! Momo Launches its New Brand Wow! Chicken,https://www.newsvoir.com/release/wow-momo-launches-its-new-brand-wow-chicken-19337.html
19,3 Simple Tips for Living a Balanced Lifestyle,https://www.newsvoir.com/release/3-simple-tips-for-living-a-balanced-lifestyle-19321.html
20,"After Baner and Camp, Dadu's Sweet Emporio makes a Grand Entry in Kothrud ",https://www.newsvoir.com/release/after-baner-and-camp-dadu-apos-s-sweet-emporio-makes-a-grand-entry-in-kothrud-19252.html
21,Africa's Leading FMCG Company Trade Kings is Leveraging Bizom's Retail Intelligence to Multiply Distribution Reach,https://www.newsvoir.com/release/africa-apos-s-leading-fmcg-company-trade-kings-is-leveraging-bizom-apos-s-retail-intelligence-to-multiply-distribution-reach-19278.html
22,OneRare to Introduce Urban Platter as the First Brand of Ingredients in its Foodverse,https://www.newsvoir.com/release/onerare-to-introduce-urban-platter-as-the-first-brand-of-ingredients-in-its-foodverse-19287.html
23,"AARC, 3R WASTE and UNCRD Discuss Industry Best Practises and Challenges to Recycle Beverage Cartons and UBCs",https://www.newsvoir.com/release/aarc-3r-waste-and-uncrd-discuss-industry-best-practises-and-challenges-to-recycle-beverage-cartons-and-ubcs-19276.html
24,Arboreal Wins The National Startup Awards 2021 in the Food Processing Category for Accelerating the Transition to the Post Sugar World,https://www.newsvoir.com/release/arboreal-wins-the-national-startup-awards-2021-in-the-food-processing-category-for-accelerating-the-transition-to-the-post-sugar-world-19265.html
25,Living Liquidz Launches Mansionz a New Lifestyle Concept Bungalow in Mumbai with Bangalore and Pune on the Horizon,https://www.newsvoir.com/release/living-liquidz-launches-mansionz-a-new-lifestyle-concept-bungalow-in-mumbai-with-bangalore-and-pune-on-the-horizon-19227.html
26,Hey Homie: India's First WhatsApp Conversational Commerce Platform gets Launched for Passionate Home Entrepreneurs,https://www.newsvoir.com/release/hey-homie-indias-first-whatsapp-conversational-commerce-platform-gets-launched-for-passionate-home-entrepreneurs-19230.html
27,The Wonderful World of Flour: Good Flour is the Basis of Good Dough - Both Sweet and Savoury,https://www.newsvoir.com/release/the-wonderful-world-of-flour-good-flour-is-the-basis-of-good-dough-both-sweet-and-savoury-19202.html
28,Smith & Jones Macaroni Pasta Masala - Makes Macaroni Dishes Even Tastier,https://www.newsvoir.com/release/smith-jones-macaroni-pasta-masala-makes-macaroni-dishes-even-tastier-19148.html
29,"India Honey Alliance to Host ""Hive to Home 3.0"" on Friday, 28th January, 2022 from 3.00 PM to 4.30 PM",https://www.newsvoir.com/release/india-honey-alliance-to-host-hive-to-home-3-0-on-friday-28th-january-2022-from-3-00-pm-to-4-30-pm-19161.html
30,American Multinational QSR Chain Figaro's Pizza Announces its Master Franchise Partnership with FranGlobal to Expand its Presence in India,https://www.newsvoir.com/release/american-multinational-qsr-chain-figaro-s-pizza-announces-its-master-franchise-partnership-with-franglobal-to-expand-its-presence-in-india-19142.html
31,SRAM & MRAM Group to Participate in the 2022 Edition of the International Production and Processing Expo (IPPE) in the USA,https://www.newsvoir.com/release/sram-mram-group-to-participate-in-the-2022-edition-of-the-international-production-and-processing-expo-ippe-in-the-usa-19138.html
32,"Indian Consumers Embrace South African Apples and Pears, 2021 Ends on a Great Note for Hortgro India",https://www.newsvoir.com/release/indian-consumers-embrace-south-african-apples-and-pears-2021-ends-on-a-great-note-for-hortgro-india-19109.html
33,Include Walnuts in Diet for Better Sleep,https://www.newsvoir.com/release/include-walnuts-in-diet-for-better-sleep-19107.html
34,USA Dry Pea and Lentil Council Welcomes 2022 with a Focus on Sustainability,https://www.newsvoir.com/release/usa-dry-pea-and-lentil-council-welcomes-2022-with-a-focus-on-sustainability-19095.html
35,Kings Infra Creates a World Record by Harvesting 80 gm L. Vannamei Shrimps ,https://www.newsvoir.com/release/kings-infra-creates-a-world-record-by-harvesting-80-gm-l-vannamei-shrimps-19066.html
36,"Maharashtra's Yewale Group Creates Jobs for Over 5000 People Across India
",https://www.newsvoir.com/release/maharashtras-yewale-group-creates-jobs-for-over-5000-people-across-india-19041.html
37,Beverage Brand Lahori Secures USD 15 Million Series A Funding from Verlinvest,https://www.newsvoir.com/release/beverage-brand-lahori-secures-usd-15-million-series-a-funding-from-verlinvest-19012.html
38,Glenfiddich Takes Signature 18-Year-Old Expression to the Next Level,https://www.newsvoir.com/release/glenfiddich-takes-signature-18-year-old-expression-to-the-next-level-18959.html
39,Savour the Flavour with Scrumptious Delicacies of U.S. Duck and Turkey,https://www.newsvoir.com/release/savour-the-flavour-with-scrumptious-delicacies-of-u-s-duck-and-turkey-18894.html
40,Skippi Ice Pops Gets 10 Million INR Investment from Shark Tank India ,https://www.newsvoir.com/release/skippi-ice-pops-gets-10-million-inr-investment-from-shark-tank-india-18910.html
41,10 Ways to Keep you Healthy in 2022,https://www.newsvoir.com/release/10-ways-to-keep-you-healthy-in-2022-18892.html
42,'Roastea' - A Gujarat Based Complete Beverage Company Eyes Unprecedented Growth across India,https://www.newsvoir.com/release/roastea-a-gujarat-based-complete-beverage-company-eyes-unprecedented-growth-across-india-18856.html
43,Yu Now Offers All Day Meals - Enters Dessert Segment with its Unique Range of Instant Halwa Bowls,https://www.newsvoir.com/release/yu-now-offers-all-day-meals-enters-dessert-segment-with-its-unique-range-of-instant-halwa-bowls-18853.html
44,Madhuri Dixit-Nene to Appear in a New Avatar in Ram Bandhu's New Campaign for this Wedding Season,https://www.newsvoir.com/release/madhuri-dixit-nene-to-appear-in-a-new-avatar-in-ram-bandhus-new-campaign-for-this-wedding-season-18826.html
45,"Ring in Christmas and New Year with Red, Delectable and Nutritive Cherries from Chile",https://www.newsvoir.com/release/ring-in-christmas-and-new-year-with-red-delectable-and-nutritive-cherries-from-chile-18814.html
46,Drools Collaborates with Chef Sanjeev Kapoor and Chef Vikas Khanna to Introduce Gourmet Bites for Pets,https://www.newsvoir.com/release/drools-collaborates-with-chef-sanjeev-kapoor-and-chef-vikas-khanna-to-introduce-gourmet-bites-for-pets-18797.html
47,The Biryani House Aims to Open 50 District Master Franchises Across India by the End of 2022,https://www.newsvoir.com/release/the-biryani-house-aims-to-open-50-district-master-franchises-across-india-by-the-end-of-2022-18776.html
48,Orion Unveils Two Latest Innovations for Snacking: Strawberry-filled Choco Pie and the Biggest Choco Chip Cookie,https://www.newsvoir.com/release/orion-unveils-two-latest-innovations-for-snacking-strawberry-filled-choco-pie-and-the-biggest-choco-chip-cookie-18713.html
49,Season's Greetings from Pure Flour from Europe,https://www.newsvoir.com/release/season-s-greetings-from-pure-flour-from-europe-18667.html
50,"Mr Rajeev Baid Acquires One of the Oldest and Most Prized Tea Estate of Darjeeling, 'The Okayti'",https://www.newsvoir.com/release/mr-rajeev-baid-acquires-one-of-the-oldest-and-most-prized-tea-estate-of-darjeeling-the-okayti-18608.html
51,BigMuscles Nutrition Launches New Campaign 'PerformanceHiPehchaan' with Brand Ambassador Ranveer Singh,https://www.newsvoir.com/release/bigmuscles-nutrition-launches-new-campaign-apos-performancehipehchaan-apos-with-brand-ambassador-ranveer-singh-18597.html
52,CanHeal Ties up with Darjeeling Sips to Offer a Wide Range of Tea for Cancer Fighters,https://www.newsvoir.com/release/canheal-ties-up-with-darjeeling-sips-to-offer-a-wide-range-of-tea-for-cancer-fighters-18539.html
53,A Nutty Affair: Here's Why Walnuts are an Irreplaceable Part of My Diet,https://www.newsvoir.com/release/a-nutty-affair-here-s-why-walnuts-are-an-irreplaceable-part-of-my-diet-18532.html
54,"Top Celebrity Chefs Joins OneRare, the World's First Food Metaverse",https://www.newsvoir.com/release/top-celebrity-chefs-joins-onerare-the-world-s-first-food-metaverse-18474.html
55,"10,00,000 plus Max Protein Cookies being Sold within 4 Months of Initial Launch",https://www.newsvoir.com/release/10-00-000-max-protein-cookies-being-sold-within-4-months-of-initial-launch-18006.html
56,The 'Andaman Boys' Who Bring their Dream and Passion to Delhi through Grubsoul.com,https://www.newsvoir.com/release/the-andaman-boys-who-bring-their-dream-and-passion-to-delhi-through-grubsoul-com-18396.html
57,Tilaknagar Industries registers 52 per cent growth in revenue; PAT increases to Rs. 11 crore in Q2,https://www.newsvoir.com/release/tilaknagar-industries-registers-52-per-cent-growth-in-revenue-pat-increases-to-rs-11-crore-in-q2-18370.html
58,"Skyland Group Launches La Trio Pizza and Kathi Nation in Nawanshahr, Punjab",https://www.newsvoir.com/release/skyland-group-launches-la-trio-pizza-and-kathi-nation-in-nawanshahr-punjab-18336.html
59,JBC Successfully Concludes its First K-food Pop-up in Gurugram,https://www.newsvoir.com/release/jbc-successfully-concludes-its-first-k-food-pop-up-in-gurugram-18327.html
60,"Indian Consumers Embrace South African Apples and Pears, FY'21 Sees Phenomenal Demand",https://www.newsvoir.com/release/indian-consumers-embrace-south-african-apples-and-pears-fy-21-sees-phenomenal-demand-18318.html
61,Ram Bandhu Salutes Our Local Everyday Heroes this Diwali with Short Film 'A Soulful Diwali - 'Khare Prakashparva',https://www.newsvoir.com/release/ram-bandhu-salutes-our-local-everyday-heroes-this-diwali-with-short-film-a-soulful-diwali-khare-prakashparva-18266.html
62,Urban Platter Launches their Meatless Range on World Vegan Day,https://www.newsvoir.com/release/urban-platter-launches-their-meatless-range-on-world-vegan-day-18258.html
63,Brighten up your Diwali with California Walnuts,https://www.newsvoir.com/release/brighten-up-your-diwali-with-california-walnuts-18218.html
64,Mukunda Foods Launches Wokie - A Fully Automated Machine for Chinese and Indian Cuisines,https://www.newsvoir.com/release/mukunda-foods-launches-wokie-a-fully-automated-machine-for-chinese-and-indian-cuisines-18199.html
65,"Ek Tohfa Joh Dil Chho Jae, Yeh Diwali Happilo Wali",https://www.newsvoir.com/release/ek-tohfa-joh-dil-chho-jae-yeh-diwali-happilo-wali-18155.html
66,Storia® Food & Beverages gets Backed by Sixth Sense Ventures,https://www.newsvoir.com/release/storia-food-beverages-gets-backed-by-sixth-sense-ventures-18146.html
67,Washington Apple Commission Launches New Website,https://www.newsvoir.com/release/washington-apple-commission-launches-new-website-18104.html
68,"Your Guide to Indulging without Overindulging this Festive Season
",https://www.newsvoir.com/release/your-guide-to-indulging-without-overindulging-this-festive-season-18088.html
69,"Hatsun Agro Product Ltd. Financial Results for the Quarter Ended September 30, 2021",https://www.newsvoir.com/release/hatsun-agro-product-ltd-financial-results-for-the-quarter-ended-september-30-2021-18081.html
70,"Organic India Enters the Staples Segment, Announces a New Category Launch on World Food Day",https://www.newsvoir.com/release/organic-india-enters-the-staples-segment-announces-a-new-category-launch-on-world-food-day-18080.html
71,Urgent Need for Policy Makers and Industry to Collaborate for Addressing Severe Malnutrition,https://www.newsvoir.com/release/urgent-need-for-policy-makers-and-industry-to-collaborate-for-addressing-severe-malnutrition-18049.html
72,Indian Gin Distillery Shortlisted in the World's Top 5 Gin Producer's by the IWSC,https://www.newsvoir.com/release/indian-gin-distillery-shortlisted-in-the-world-s-top-5-gin-producer-s-by-the-iwsc-18048.html
73,True Elements becomes India's 1st Food Brand to be Globally Recognised as 'Clean Label' and '100 Percent Whole Grain' Certified,https://www.newsvoir.com/release/true-elements-becomes-india-s-1st-food-brand-to-be-globally-recognised-as-clean-label-and-100-percent-whole-grain-certified-18024.html
74,Twinings and Ovaltine Enters into Strategic Partnership with Nihilent for a Digital Centre in India,https://www.newsvoir.com/release/twinings-and-ovaltine-enters-into-strategic-partnership-with-nihilent-for-a-digital-centre-in-india-18032.html
75,"In a Global First, SLCM Launches 'Made in India' QC App for Food Grains",https://www.newsvoir.com/release/in-a-global-first-slcm-launches-made-in-india-qc-app-for-food-grains-18019.html
76,Captain Zack Celebrated 4th Anniversary by Unveiling Brand New Pupcake Mixes,https://www.newsvoir.com/release/captain-zack-celebrated-4th-anniversary-by-unveiling-brand-new-pupcake-mixes-18010.html
77,Alt Co. becomes the Preferred Choice for the Leading Coffee Brands,https://www.newsvoir.com/release/alt-co-becomes-the-preferred-choice-for-the-leading-coffee-brands-18002.html
78,Healthways Brings Pure and Premium Quality Paneer in 3 Varieties to Cater to all Consumers,https://www.newsvoir.com/release/healthways-brings-pure-and-premium-quality-paneer-in-3-varieties-to-cater-to-all-consumers-17990.html
79,Numix Industries Starts Transforming the Nutrition Bar Industry in India,https://www.newsvoir.com/release/numix-industries-starts-transforming-the-nutrition-bar-industry-in-india-17974.html
80,"Pure Flour from Europe: Quality, Safety and Versatility",https://www.newsvoir.com/release/pure-flour-from-europe-quality-safety-and-versatility-17881.html
81,CRISIL Research Data on Milk Procurement by Dairy Companies in India,https://www.newsvoir.com/release/crisil-research-data-on-milk-procurement-by-dairy-companies-in-india-17942.html
82,"CX Partners Controlled Biryani Brand Dindigul Thalappakatti Raises Growth Capital Increasing Current Valuation to Rs. 860 Crore
",https://www.newsvoir.com/release/cx-partners-controlled-biryani-brand-dindigul-thalappakatti-raises-growth-capital-increasing-current-valuation-to-rs-860-crore-17938.html
83,"Happilo, The King of Snac'king' Opens its Doors to Seamless Gifting",https://www.newsvoir.com/release/happilo-the-king-of-snac-king-opens-its-doors-to-seamless-gifting-17921.html
84,Walnuts from Chile Launched in India,https://www.newsvoir.com/release/walnuts-from-chile-launched-in-india-17894.html
85,"Chef Sanjeev Kapoor, Dr. SM Arif, Dean of School of Unani Medical Education and Research, Jamia Hamdard University to Shed Light on Importance of Honey",https://www.newsvoir.com/release/chef-sanjeev-kapoor-dr-sm-arif-dean-of-school-of-unani-medical-education-and-research-jamia-hamdard-university-to-shed-light-on-importance-of-honey-17852.html
86,"Celebrate A Healthy Heart this World Heart Day, with California Walnuts",https://www.newsvoir.com/release/celebrate-a-healthy-heart-this-world-heart-day-with-california-walnuts-17812.html
87,Underprivileged Children Get Immune Boost from NutriBears Gummies,https://www.newsvoir.com/release/underprivileged-children-get-immune-boost-from-nutribears-gummies-17781.html
88,Natural Remedies Launches Kamdhenu to Help Cows Recover Post Calving,https://www.newsvoir.com/release/natural-remedies-launches-kamdhenu-to-help-cows-recover-post-calving-17762.html
89,Seven Spring Unveils New Range of Nourishing Concoctions ,https://www.newsvoir.com/release/seven-spring-unveils-new-range-of-nourishing-concoctions-17734.html
90,Alt Co. Intensifies its Vision to go Green and Launches a Plant-based Oat-milk as the New Alternative,https://www.newsvoir.com/release/alt-co-intensifies-its-vision-to-go-green-and-launches-a-plant-based-oat-milk-as-the-new-alternative-17736.html
91,"DS Group's Water Conservation Initiatives Focus on Long Term Water Sustainability
",https://www.newsvoir.com/release/ds-group-s-water-conservation-initiatives-focus-on-long-term-water-sustainability-17691.html
92,Sulo Nutrition Launches Vegan Hair Supplements Catered to the Indian Taste Palate,https://www.newsvoir.com/release/sulo-nutrition-launches-vegan-hair-supplements-catered-to-the-indian-taste-palate-17682.html
93,"MQDC India and the Royal Thai Embassy in New Delhi Unveils ""Namaste Thai Flavours 2021"" Campaign
",https://www.newsvoir.com/release/mqdc-india-and-the-royal-thai-embassy-in-new-delhi-unveils-namaste-thai-flavours-2021-campaign-17661.html
94,The Biryani House Launches its District Master Franchise in Ambernath,https://www.newsvoir.com/release/the-biryani-house-launches-its-district-master-franchise-in-ambernath-17632.html
95,SMOOR Completes 5 Years; Promises Pure Artistry and Craftsmanship with Wide Array of Desserts and Chocolates,https://www.newsvoir.com/release/smoor-completes-5-years-promises-pure-artistry-and-craftsmanship-with-wide-array-of-desserts-and-chocolates-17607.html
96,Health and Happiness this Festive Season with Happilo,https://www.newsvoir.com/release/health-and-happiness-this-festive-season-with-happilo-17584.html
97,National Nutrition Month 2021: The Power of a Nutritious Meal,https://www.newsvoir.com/release/national-nutrition-month-2021-the-power-of-a-nutritious-meal-17592.html
98,"Amid Depleting Groundwater Table, Aquabrim is Promoting Water Security Across Households and Industries",https://www.newsvoir.com/release/amid-depleting-groundwater-table-aquabrim-is-promoting-water-security-across-households-and-industries-17589.html
99,Kiwifruit from Chile - Health in Every Bite,https://www.newsvoir.com/release/kiwifruit-from-chile-health-in-every-bite-17547.html
100,"From Farms to Home, OrgFarm's Healthy Value Chain Helping People Live Better",https://www.newsvoir.com/release/from-farms-to-home-orgfarm-s-healthy-value-chain-helping-people-live-better-17469.html
101,"Ram Bandhu Ropes in Madhuri Dixit to Endorse its Pickle and Papad Product Range with the Campaign ""Aapka Taste Partner""",https://www.newsvoir.com/release/ram-bandhu-ropes-in-madhuri-dixit-to-endorse-its-pickle-and-papad-product-range-with-the-campaign-aapka-taste-partner-17400.html
102,Wiggles.in Expands its Product Portfolio with the Launch of Category Disruptor Products,https://www.newsvoir.com/release/wiggles-in-expands-its-product-portfolio-with-the-launch-of-category-disruptor-products-17395.html
103,KoreaShop 24 Invites Vendors to Become New Members and Reap the Benefits from the Association,https://www.newsvoir.com/release/koreashop-24-invites-vendors-to-become-new-members-and-reap-the-benefits-from-the-association-17375.html
104,BioPlus is Revolutionizing the Water Industry with Innovative Antioxidant Alkaline Mineralised Water Products,https://www.newsvoir.com/release/bioplus-is-revolutionizing-the-water-industry-with-innovative-antioxidant-alkaline-mineralised-water-products-17339.html
105,"Ausum Launches Super Lattes - a Plant-based, Dairy Free Beverage for Zen-Like Energy",https://www.newsvoir.com/release/ausum-launches-super-lattes-a-plant-based-dairy-free-beverage-for-zen-like-energy-17330.html
106,B.L. Agro Unveils Limited Edition Packs of its Mustard Oil Brand 'Bail Kolhu' with a Meet and Greet Contest,https://www.newsvoir.com/release/b-l-agro-unveils-limited-edition-packs-of-its-mustard-oil-brand-bail-kolhu-with-a-meet-and-greet-contest-17306.html
107,VouchPro Redefines Wine Tasting Experience in the Post COVID World,https://www.newsvoir.com/release/vouchpro-redefines-wine-tasting-experience-in-the-post-covid-world-17263.html
108,B.L. Agro Ventures into E-commerce with its Nourish Online Store to Accelerate its FMCG Business,https://www.newsvoir.com/release/b-l-agro-ventures-into-e-commerce-with-its-nourish-online-store-to-accelerate-its-fmcg-business-17189.html
109,A 23 Old Kashmiri Turns a Bootstrapped Hyperlocal Platform into a Million Dollar Startup,https://www.newsvoir.com/release/a-23-old-kashmiri-turns-a-bootstrapped-hyperlocal-platform-into-a-million-dollar-startup-17185.html
110,American Pistachio Growers (APG) and Indian Dietetic Association (IDA) discuss New Insights on Pistachios,https://www.newsvoir.com/release/american-pistachio-growers-apg-and-indian-dietetic-association-ida-discuss-new-insights-on-pistachios-17159.html
111,"KoreaShop 24 Facilitates Korean Culture as it Exports Stone Veneer, and Imports Chilli and Soya Paste (Expanding across Thailand, Argentina and India)",https://www.newsvoir.com/release/koreashop-24-facilitates-korean-culture-as-it-exports-stone-veneer-and-imports-chilli-and-soya-paste-expanding-across-thailand-argentina-and-india-17147.html
112,Saffola Mealmaker teams up with Celebrity Chef Kunal Kapur to launch 'Delicious Soya Cook Book',https://www.newsvoir.com/release/saffola-mealmaker-teams-up-with-celebrity-chef-kunal-kapur-to-launch-apos-delicious-soya-cook-book-apos-17086.html
113,Sodexo and Stop Hunger Fundraiser in India Generates Heart-warming Response,https://www.newsvoir.com/release/sodexo-and-stop-hunger-fundraiser-in-india-generates-heart-warming-response-17068.html
114,Reimagine Healthy Living with Medicinal Mushrooms by Rooted Actives,https://www.newsvoir.com/release/reimagine-healthy-living-with-medicinal-mushrooms-by-rooted-actives-17046.html
115,Renowned Chef Dr. Manjit Gill Released 'Cook with Mother Cook with Punjab' Book by Chef Vikas Chawla,https://www.newsvoir.com/release/renowned-chef-dr-manjit-gill-released-apos-cook-with-mother-cook-with-punjab-apos-book-by-chef-vikas-chawla-17034.html
116,Modicare Limited Strengthens its Health and Wellness Portfolio; Launches Immunity Boosting Chyawanprash Under its Brand Well,https://www.newsvoir.com/release/modicare-limited-strengthens-its-health-and-wellness-portfolio-launches-immunity-boosting-chyawanprash-under-its-brand-well-17023.html
117,4 Simple yet Effective Ways to Help you Lead a Healthier Life,https://www.newsvoir.com/release/4-simple-yet-effective-ways-to-help-you-lead-a-healthier-life-17020.html
118,Beevi's Thalassery Biryani Masala - The Most Celebrated Dish from the Epic Malabar Cuisine,https://www.newsvoir.com/release/beevi-apos-s-thalassery-biryani-masala-the-most-celebrated-dish-from-the-epic-malabar-cuisine-17000.html
