,title,link
239,Juniper Networks Expands Unite Architecture with New EX Series Switches to Simplify Network Operations,https://www.newsvoir.com/release/juniper-networks-expands-unite-architecture-with-new-ex-series-switches-to-simplify-network-operations-6799.html
240,NASSCOM CoE-IoT Organizes Conclave to Discover New Start-ups in IoT Space,https://www.newsvoir.com/release/nasscom-coe-iot-organizes-conclave-to-discover-new-start-ups-in-iot-space-6784.html
241,TERI and Mahindra Lifespaces to Establish Center of Excellence for Sustainable Habitats,https://www.newsvoir.com/release/teri-and-mahindra-lifespaces-to-establish-center-of-excellence-for-sustainable-habitats-6764.html
242,SAP® Technology Targets Inequity in Workplaces Around the World,https://www.newsvoir.com/release/sap-technology-targets-inequity-in-workplaces-around-the-world-6753.html
243,uPVC Windows Accounted for about 60% Market Share in Overall uPVC Doors and Windows Market,https://www.newsvoir.com/release/upvc-windows-accounted-for-about-60-market-share-in-overall-upvc-doors-and-windows-market-6751.html
244,Hitachi Data Systems Launches New Converged Infrastructure Platforms for SAP HANA® Environments,https://www.newsvoir.com/release/hitachi-data-systems-launches-new-converged-infrastructure-platforms-for-sap-hana-environments-6746.html
245,Intel Bets Big on the Cloud and E-commerce Sectors in India,https://www.newsvoir.com/release/intel-bets-big-on-the-cloud-and-e-commerce-sectors-in-india-6737.html
246,AMD Appoints Swetang Vin as Corporate Vice President and Regional CFO,https://www.newsvoir.com/release/amd-appoints-swetang-vin-as-corporate-vice-president-and-regional-cfo-6734.html
247,CIITrade.in B2B E-commerce Platform Powered by cloudBuy Now Opens for Business,https://www.newsvoir.com/release/ciitrade-in-b2b-e-commerce-platform-powered-by-cloudbuy-now-opens-for-business-6688.html
248,HCC Net Profit at Rs 85 Crore in FY 2015-16,https://www.newsvoir.com/release/hcc-net-profit-at-rs-85-crore-in-fy-2015-16-6643.html
249,India’s First International Financial Services Centre at GIFT City Crosses US$ 250 Million Biz Mark,https://www.newsvoir.com/release/india-s-first-international-financial-services-centre-at-gift-city-crosses-us-250-million-biz-mark-6615.html
250,Hitachi Data Systems Appoints Raghuram Krishnan as Director of Partners and Alliances for Indian Market,https://www.newsvoir.com/release/hitachi-data-systems-appoints-raghuram-krishnan-as-director-of-partners-and-alliances-for-indian-market-6609.html
251,ICIx Announces Launch of Bare Metal Asset Class with Spot and Forward Contracts for Servers,https://www.newsvoir.com/release/icix-announces-launch-of-bare-metal-asset-class-with-spot-and-forward-contracts-for-servers-6597.html
252,India Ranks as the No. 1 Location for Global In-House Centers,https://www.newsvoir.com/release/india-ranks-as-the-no-1-location-for-global-in-house-centers-6593.html
253,TCS Recognised as One of The Times Top 50 Employers for Women in the UK ,https://www.newsvoir.com/release/tcs-recognised-as-one-of-the-times-top-50-employers-for-women-in-the-uk-6592.html
254,Accenture Opens Cyber Center to Help Organizations Tackle Complex Security Challenges,https://www.newsvoir.com/release/accenture-opens-cyber-center-to-help-organizations-tackle-complex-security-challenges-6591.html
255,"Juniper Networks to Showcase Its Leading OpenStack SDN Controller, Security and Virtual Technologies at OpenStack Summit",https://www.newsvoir.com/release/juniper-networks-to-showcase-its-leading-openstack-sdn-controller-security-and-virtual-technologies-at-openstack-summit-6589.html
256,VirtusaPolaris Announce Launch of BankConnect to Transform the Personalized Digital Banking Customer Experience,https://www.newsvoir.com/release/virtusapolaris-announce-launch-of-bankconnect-to-transform-the-personalized-digital-banking-customer-experience-6585.html
257,RentSher Helps Startups and SMEs in their Journey from Cockroach to Unicorn,https://www.newsvoir.com/release/rentsher-helps-startups-and-smes-in-their-journey-from-cockroach-to-unicorn-6584.html
258,BT Works with CIOs to Achieve the ‘Digital Possible’,https://www.newsvoir.com/release/bt-works-with-cios-to-achieve-the-digital-possible--6574.html
259,Democratized Data and an Expanded Teradata Data Warehouse Are Developing New Business Insights for Aditya Birla Financial Services Group,https://www.newsvoir.com/release/democratized-data-and-an-expanded-teradata-data-warehouse-are-developing-new-business-insights-for-aditya-birla-financial-services-group-6573.html
260,Asia Green Development Bank in Myanmar Selects Infosys Finacle to Provide a Next Generation     Banking Experience to Customers,https://www.newsvoir.com/release/asia-green-development-bank-in-myanmar-selects-infosys-finacle-to-provide-a-next-generation-banking-experience-to-customers-6572.html
261,"Infosys (NSE, BSE: INFY) Announces Results for the Quarter and Year Ended March 31, 2016",https://www.newsvoir.com/release/infosys-nse-bse-infy-announces-results-for-the-quarter-and-year-ended-march-31-2016-6556.html
262,"Satra Group Launches 41 storeyTower : “Satra Mahavir Ville” Matunga
",https://www.newsvoir.com/release/satra-group-launches-41-storeytower-satra-mahavir-ville-matunga--6555.html
263,‘LTE Innovation Summit 2016’ Concludes on a Successful Note ,https://www.newsvoir.com/release/-lte-innovation-summit-2016-concludes-on-a-successful-note--6537.html
264,Morpho Wins Major EMV (Europay MasterCard Visa) Payment Card Contract from State Bank of India,https://www.newsvoir.com/release/morpho-wins-major-emv-europay-mastercard-visa-payment-card-contract-from-state-bank-of-india-6536.html
265,Panalpina Chooses BT to Transform Global Communications Infrastructure,https://www.newsvoir.com/release/panalpina-chooses-bt-to-transform-global-communications-infrastructure-6533.html
266,"SmartSky Networks Selects Network Functions Virtualization Solution from Brocade and VMware for High-speed, In-flight Connectivity for Aviation Industry",https://www.newsvoir.com/release/smartsky-networks-selects-network-functions-virtualization-solution-from-brocade-and-vmware-for-high-speed-in-flight-connectivity-for-aviation-industry-6530.html
267,"Accenture Launches Intelligent Automation Platform to Deliver Smarter, More Efficient Application Services that Improve Business Outcomes",https://www.newsvoir.com/release/accenture-launches-intelligent-automation-platform-to-deliver-smarter-more-efficient-application-services-that-improve-business-outcomes-6529.html
268,CREDAI & ATS Infrastructure Host the Convocation Ceremony of Skill Training for Construction Workers Supported by PNB Housing Finance Limited,https://www.newsvoir.com/release/credai-ats-infrastructure-host-the-convocation-ceremony-of-skill-training-for-construction-workers-supported-by-pnb-housing-finance-limited-6527.html
269,Huawei Strives to Accelerate Digital Transformation and Jointly Build a Better Connected World,https://www.newsvoir.com/release/huawei-strives-to-accelerate-digital-transformation-and-jointly-build-a-better-connected-world-6520.html
270,Altico Capital Invests Rs 575 Crores Across Three Real Estate Developers,https://www.newsvoir.com/release/altico-capital-invests-rs-575-crores-across-three-real-estate-developers-6500.html
271,"IDFC Bank Wins Top honours at IFR Asia, Awarded ‘India Bond House’ 2015 ",https://www.newsvoir.com/release/idfc-bank-wins-top-honours-at-ifr-asia-awarded-india-bond-house-2015--6489.html
272,Huawei Reports Revenue of CNY395 Billion in 2015,https://www.newsvoir.com/release/huawei-reports-revenue-of-cny395-billion-in-2015-6475.html
273,Teradata Revolutionizes Enterprise Data Lake Design and Deployment,https://www.newsvoir.com/release/teradata-revolutionizes-enterprise-data-lake-design-and-deployment-6450.html
274,‘LTE Innovation Summit 2016’ to Showcase the Future of 4G LTE in Indian Telecom Industry,https://www.newsvoir.com/release/-lte-innovation-summit-2016-to-showcase-the-future-of-4g-lte-in-indian-telecom-industry-6440.html
275,Hong Kong SAR Government’s Efficiency Unit Implementing Speech Analytics from Verint to Help Take Citizen Service to New Heights,https://www.newsvoir.com/release/hong-kong-sar-government-s-efficiency-unit-implementing-speech-analytics-from-verint-to-help-take-citizen-service-to-new-heights-6433.html
276,Payments Bank and Unified Payment Interface with Change the Shape of Mobile Wallet Market,https://www.newsvoir.com/release/payments-bank-and-unified-payment-interface-with-change-the-shape-of-mobile-wallet-market-6389.html
277,"FusionNet Aims to Disrupt India’s Broadband Market Leveraging Juniper Networks For Best-In-Class Routing, Switching And Security",https://www.newsvoir.com/release/fusionnet-aims-to-disrupt-india-s-broadband-market-leveraging-juniper-networks-for-best-in-class-routing-switching-and-security-6388.html
278,Federal IT Survey Reveals Overreliance on Shared IP Storage Networks for Business-Critical Workloads,https://www.newsvoir.com/release/federal-it-survey-reveals-overreliance-on-shared-ip-storage-networks-for-business-critical-workloads-6386.html
279,Cross-Tab Group Secures Significant Seal from Kantar Group,https://www.newsvoir.com/release/cross-tab-group-secures-significant-seal-from-kantar-group-6327.html
280,Vodafone Business Services Organizes Vodafone Tee Walk in Pune,https://www.newsvoir.com/release/vodafone-business-services-organizes-vodafone-tee-walk-in-pune-6317.html
281,BT and Palo Alto Networks Give the Cloud a Tougher Lining,https://www.newsvoir.com/release/bt-and-palo-alto-networks-give-the-cloud-a-tougher-lining-6305.html
282,HCL Technologies Awarded Five Year Next-Generation IT Outsourcing Services Contract by Husqvarna AB,https://www.newsvoir.com/release/hcl-technologies-awarded-five-year-next-generation-it-outsourcing-services-contract-by-husqvarna-ab-6287.html
283,L&T Construction Wins Orders Valued ` 2213 Crores,https://www.newsvoir.com/release/l-t-construction-wins-orders-valued-2213-crores-6272.html
284,NEC Develops Massive-Element Antenna for 5G Base Stations,https://www.newsvoir.com/release/nec-develops-massive-element-antenna-for-5g-base-stations-6234.html
285,"Cisco Launches Ultra Services Platform to Simplify, Automate and Accelerate the Mobile Cloud",https://www.newsvoir.com/release/cisco-launches-ultra-services-platform-to-simplify-automate-and-accelerate-the-mobile-cloud-6232.html
286,IBM Watson Internet of Things Gives Lift to KONE’s Innovation in Smart Buildings,https://www.newsvoir.com/release/ibm-watson-internet-of-things-gives-lift-to-kone-s-innovation-in-smart-buildings-6196.html
287,"Nokia Launches Data Center, Cloud Transformation Services as Operators Move Towards the Telco Cloud, MWC16
",https://www.newsvoir.com/release/nokia-launches-data-center-cloud-transformation-services-as-operators-move-towards-the-telco-cloud-mwc16-6189.html
288,"Adani Power Consolidated EBIDTA Rs. 2,027 Crore in Q3FY16",https://www.newsvoir.com/release/adani-power-consolidated-ebidta-rs-2-027-crore-in-q3fy16-6154.html
289,Garware-Wall Ropes PAT Grows by 43.3% in Q3FY16,https://www.newsvoir.com/release/garware-wall-ropes-pat-grows-by-43-3-in-q3fy16-6151.html
290,"Lanco Infratech Announces Q3FY16 Earnings, Net Profit for Q3FY16 at Rs.136.49 Crore",https://www.newsvoir.com/release/lanco-infratech-announces-q3fy16-earnings-net-profit-for-q3fy16-at-rs-136-49-crore-6145.html
291,Guy Perry Joins Essel Infraprojects as Head of its Smart City Business,https://www.newsvoir.com/release/guy-perry-joins-essel-infraprojects-as-head-of-its-smart-city-business-6118.html
292,"Hitachi Data Systems Delivers Next-Generation Hyper-Converged, Scale-Out Platform for Big Data, Powered by Pentaho",https://www.newsvoir.com/release/hitachi-data-systems-delivers-next-generation-hyper-converged-scale-out-platform-for-big-data-powered-by-pentaho-6093.html
293,"SAM & Co Advises on 55% Stake Sale in Bright Power Project to Texmaco Rail & Engineering Limited 
",https://www.newsvoir.com/release/sam-co-advises-on-55-stake-sale-in-bright-power-project-to-texmaco-rail-engineering-limited-5976.html
294,"Essel Infraprojects to Develop Rs.4,000 Crore of Infrastructure Projects in West Bengal",https://www.newsvoir.com/release/essel-infraprojects-to-develop-rs-4-000-crore-of-infrastructure-projects-in-west-bengal-5948.html
295,L&T Hydrocarbon Consortium wins Rs 2450 Cr Order ,https://www.newsvoir.com/release/l-t-hydrocarbon-consortium-wins-rs-2450-cr-order-5942.html
296,'Spherical Defence Labs' is All Set to Fight Cyber Crime,https://www.newsvoir.com/release/spherical-defence-labs-is-all-set-to-fight-cyber-crime-5930.html
297,"SARE Homes Awarded the ‘World’s Greatest Brand, 2015 —Asia & GCC’",https://www.newsvoir.com/release/sare-homes-awarded-the-world-s-greatest-brand-2015-asia-gcc--5923.html
298,IRB Infra to Build SE Asia’s Longest Tunnel in J&K ,https://www.newsvoir.com/release/irb-infra-to-build-se-asia-s-longest-tunnel-in-j-k--5913.html
299,EuroSchool becomes the First in India to be Certified as ‘Safe School’,https://www.newsvoir.com/release/euroschool-becomes-the-first-in-india-to-be-certified-as-safe-school--5893.html
300,Amara Raja Excels at QCFI Awards 2015; Wins Individual Leadership Award,https://www.newsvoir.com/release/amara-raja-excels-at-qcfi-awards-2015-wins-individual-leadership-award-5876.html
301,"L&T leading the way to make Jaipur India’s first Smart City
",https://www.newsvoir.com/release/l-t-leading-the-way-to-make-jaipur-india-s-first-smart-city--5875.html
302,Law Books and Bare Acts on a Pen Drive at 43rd National Convention of ICSI,https://www.newsvoir.com/release/law-books-and-bare-acts-on-a-pen-drive-at-43rd-national-convention-of-icsi-5873.html
303,Essel Infraprojects Raises Rs. 600 Crore through NCDs,https://www.newsvoir.com/release/essel-infraprojects-raises-rs-600-crore-through-ncds-5786.html
304,LANCO on Path of Realizing Consolidated Operating Power Capacity of around 8000 MW by FY 2018,https://www.newsvoir.com/release/lanco-on-path-of-realizing-consolidated-operating-power-capacity-of-around-8000-mw-by-fy-2018-5776.html
305,Lanco Infratech - Registers Net Profit after a gap of 3 Years in Q2FY16; PAT for Q2FY16 at Rs. 989 Million; Revenue at Rs. 34934 Million,https://www.newsvoir.com/release/lanco-infratech-registers-net-profit-after-a-gap-of-3-years-in-q2fy16-pat-for-q2fy16-at-rs-989-million-revenue-at-rs-34934-million-5715.html
306,GMR Kamalanga Energy Ltd. gets Revised Tariff Order from CERC,https://www.newsvoir.com/release/gmr-kamalanga-energy-ltd-gets-revised-tariff-order-from-cerc-5687.html
307,"Subhash Bedi, Established Real Estate Investor, Launches Rising Straits Capital",https://www.newsvoir.com/release/subhash-bedi-established-real-estate-investor-launches-rising-straits-capital-5683.html
308,Reliance Infrastructure Proceeds to Complete the Acquisition of Pipavav Defence and Offshore Engineering Company Limited,https://www.newsvoir.com/release/reliance-infrastructure-proceeds-to-complete-the-acquisition-of-pipavav-defence-and-offshore-engineering-company-limited-5678.html
309,RInfra Signs Non-Binding Term Sheet with PSP Investments of Canada,https://www.newsvoir.com/release/rinfra-signs-non-binding-term-sheet-with-psp-investments-of-canada-5677.html
310,Parsvnath Developers Limited Announces Q2 FY16 Results,https://www.newsvoir.com/release/parsvnath-developers-limited-announces-q2-fy16-results-5662.html
311,Reliance Infrastructure Ltd. Q2 Results FY15-16,https://www.newsvoir.com/release/reliance-infrastructure-ltd-q2-results-fy15-16-5631.html
312,Mahindra Lifespaces Conferred with NSC Best Safety Practices Award 2015,https://www.newsvoir.com/release/mahindra-lifespaces-conferred-with-nsc-best-safety-practices-award-2015-5626.html
313,IRB Infrastructure Developers Limited Q2 Results FY16,https://www.newsvoir.com/release/irb-infrastructure-developers-limited-q2-results-fy16-5554.html
314,Lanco Infratech Pre Closes its Term Loan with Yes Bank,https://www.newsvoir.com/release/lanco-infratech-pre-closes-its-term-loan-with-yes-bank-5490.html
315,HCC Becomes India’s First ‘Water Positive’ Infrastructure Company,https://www.newsvoir.com/release/hcc-becomes-india-s-first-water-positive-infrastructure-company-5446.html
316,Colas and NEC Sign MOU on the Development of Innovative Solutions for Efficient Mobility and Car Sharing,https://www.newsvoir.com/release/colas-and-nec-sign-mou-on-the-development-of-innovative-solutions-for-efficient-mobility-and-car-sharing-5442.html
317,"Shardul Amarchand Mangaldas & Co. Advises Brookfield Asset Management Inc. on one of the Largest Buy-outs in the Infrastructure Sectors, in its Acquisition of Project Companies of the Gammon Group",https://www.newsvoir.com/release/shardul-amarchand-mangaldas-co-advises-brookfield-asset-management-inc-on-one-of-the-largest-buy-outs-in-the-infrastructure-sectors-in-its-acquisition-of-project-companies-of-the-gammon-group-5238.html
318,Subramanian Sarma Takes Over as CEO & MD of L&T Hydrocarbon,https://www.newsvoir.com/release/subramanian-sarma-takes-over-as-ceo-md-of-l-t-hydrocarbon-5126.html
319,NCML Enters into a Strategic Alliance with Adani Ports and SEZ Ltd,https://www.newsvoir.com/release/ncml-enters-into-a-strategic-alliance-with-adani-ports-and-sez-ltd-5100.html
320,"GMR Infrastructure Limited, Q1 FY 2016 Performance Highlights",https://www.newsvoir.com/release/gmr-infrastructure-limited-q1-fy-2016-performance-highlights-5080.html
321,Reliance Infrastructure Limited Q1 FY 16 Results ,https://www.newsvoir.com/release/reliance-infrastructure-limited-q1-fy-16-results-5066.html
322,BS Limited Consolidated Turnover Jumps 93% to INR 970 Crores in Q1 FY16,https://www.newsvoir.com/release/bs-limited-consolidated-turnover-jumps-93-to-inr-970-crores-in-q1-fy16-5060.html
323,Mahindra Lifespaces' Q1 FY16 Consolidated Total Income at Rs. 188 Crores with PAT of Rs. 25 Crores,https://www.newsvoir.com/release/mahindra-lifespaces-q1-fy16-consolidated-total-income-at-rs-188-crores-with-pat-of-rs-25-crores-4966.html
324,Mphasis Direct International Business Leads Growth with 10.7% QoQ and 11.4% YoY FY16,https://www.newsvoir.com/release/mphasis-direct-international-business-leads-growth-with-10-7-qoq-and-11-4-yoy-fy16-4942.html
325,SE TransStadia makes a Sports Centric Difference in India,https://www.newsvoir.com/release/se-transstadia-makes-a-sports-centric-difference-in-india-4843.html
326,"Accenture Awards 11 Research Grants to Leading Universities to Promote Greater R&D Collaboration, Accelerate Pace of Innovation",https://www.newsvoir.com/release/accenture-awards-11-research-grants-to-leading-universities-to-promote-greater-r-d-collaboration-accelerate-pace-of-innovation-4775.html
327,L&T Construction Wins Orders Valued Rs. 2278 Crores,https://www.newsvoir.com/release/l-t-construction-wins-orders-valued-rs-2278-crores-4606.html
328,IDFC Ltd. Announces the Appointment of Ajay Mahajan as Head Commercial and Wholesale Banking,https://www.newsvoir.com/release/idfc-ltd-announces-the-appointment-of-ajay-mahajan-as-head-commercial-and-wholesale-banking-4555.html
329,L&T Announces Q4 FY14-15 Results,https://www.newsvoir.com/release/l-t-announces-q4-fy14-15-results-4408.html
330,Mahindra World City Announces Joint Venture with Sumitomo Corporation for New Industrial Park,https://www.newsvoir.com/release/mahindra-world-city-announces-joint-venture-with-sumitomo-corporation-for-new-industrial-park-4389.html
331,Reliance Infrastructure Q4 Results FY 15,https://www.newsvoir.com/release/reliance-infrastructure-q4-results-fy-15-4374.html
332,"IRB Infra Bags Rs. 2,650 Crore Agra-Etawah Bypass Project from NHAI",https://www.newsvoir.com/release/irb-infra-bags-rs-2-650-crore-agra-etawah-bypass-project-from-nhai-4318.html
333,Global Manufacturing Study Shows Early Signs of Adoption of Groundbreaking Machine-to-Data Technologies with China Leading the Way,https://www.newsvoir.com/release/global-manufacturing-study-shows-early-signs-of-adoption-of-groundbreaking-machine-to-data-technologies-with-china-leading-the-way-4247.html
334,Ken Research: India Pumps Market Outlook to 2019- Driven by Government Investments and Technological Advancements,https://www.newsvoir.com/release/ken-research-india-pumps-market-outlook-to-2019-driven-by-government-investments-and-technological-advancements-4245.html
335,VMware Hosts its Partner Summit 2015 in India,https://www.newsvoir.com/release/vmware-hosts-its-partner-summit-2015-in-india-4223.html
336,NASSCOM Partners with the Maharashtra Government,https://www.newsvoir.com/release/nasscom-partners-with-the-maharashtra-government-4196.html
337,Fujitsu and ACC Wien Implement Platform for Use in Training and Development on SAP HANA®,https://www.newsvoir.com/release/fujitsu-and-acc-wien-implement-platform-for-use-in-training-and-development-on-sap-hana--4108.html
338,Vedanta Launches Career Counselling Centre in Lanjigarh,https://www.newsvoir.com/release/vedanta-launches-career-counselling-centre-in-lanjigarh-4064.html
339,KPMG: Under Pressure - Economics of Liquefied Natural Gas (LNG) Projects,https://www.newsvoir.com/release/kpmg-under-pressure-economics-of-liquefied-natural-gas-lng-projects-3998.html
340,VMware Introduces New Open Source Projects to Accelerate Enterprise Adoption of Cloud-Native Applications,https://www.newsvoir.com/release/vmware-introduces-new-open-source-projects-to-accelerate-enterprise-adoption-of-cloud-native-applications-3985.html
341,BS Ltd Bags EPC Order Worth Rs. 250 Crore,https://www.newsvoir.com/release/bs-ltd-bags-epc-order-worth-rs-250-crore-3984.html
342,MEP Infrastructure Developers Limited Initial Public Offer Opens on April 21st 2015,https://www.newsvoir.com/release/mep-infrastructure-developers-limited-initial-public-offer-opens-on-april-21st-2015-3969.html
343,"HCC Concessions to Sell its Stake in Rs.1,420-cr Dhule Palesner Tollway Ltd to the Sadbhav Group",https://www.newsvoir.com/release/hcc-concessions-to-sell-its-stake-in-rs-1-420-cr-dhule-palesner-tollway-ltd-to-the-sadbhav-group-3944.html
344,Isolux Corsan Completes its First Installation Project in India,https://www.newsvoir.com/release/isolux-corsan-completes-its-first-installation-project-in-india-3939.html
345,NAREDCO Conclave to Focus on Housing for all by 2022,https://www.newsvoir.com/release/naredco-conclave-to-focus-on-housing-for-all-by-2022-3927.html
346,VMware Inaugurates Its State-of-the-Art Campus in Bangalore,https://www.newsvoir.com/release/vmware-inaugurates-its-state-of-the-art-campus-in-bangalore-3908.html
347,Schneider Electric IT Business Wins Top Honours at CIO Choice Awards for Second Consecutive Year,https://www.newsvoir.com/release/schneider-electric-it-business-wins-top-honours-at-cio-choice-awards-for-second-consecutive-year-3899.html
348,Rich Infra - Supporting the Dreams of Investors,https://www.newsvoir.com/release/rich-infra-supporting-the-dreams-of-investors-3879.html
349,L&T Construction Wins Orders Valued Rs. 5492 Crores,https://www.newsvoir.com/release/l-t-construction-wins-orders-valued-rs-5492-crores-3817.html
350,HCC Awarded Rs 392 Crore MoRTH Contract,https://www.newsvoir.com/release/hcc-awarded-rs-392-crore-morth-contract-3772.html
351,L&T Bags Rs. 1432 Crores Defence Order for 7 Patrol Vessels,https://www.newsvoir.com/release/l-t-bags-rs-1432-crores-defence-order-for-7-patrol-vessels-3771.html
352,GMR Airports Limited (GAL) Acquires DIAL’s 10 % Equity from MAHB,https://www.newsvoir.com/release/gmr-airports-limited-gal-acquires-dial-s-10-equity-from-mahb-3725.html
353,HCC Secures Rs 217.18 Crore Arbitration Award,https://www.newsvoir.com/release/hcc-secures-rs-217-18-crore-arbitration-award-3719.html
354,Rail Vikas Nigam Ltd Selects L&T Infotech for SAP Implementation,https://www.newsvoir.com/release/rail-vikas-nigam-ltd-selects-l-t-infotech-for-sap-implementation-3630.html
355,Xavier University Bhubaneshwar Opens with End-to-End Juniper Networks Campus,https://www.newsvoir.com/release/xavier-university-bhubaneshwar-opens-with-end-to-end-juniper-networks-campus-3601.html
356,"Post Budget Views of Mr. Rajesh Agarwal, CMD, BS Ltd",https://www.newsvoir.com/release/post-budget-views-of-mr-rajesh-agarwal-cmd-bs-ltd-3531.html
357,NASSCOM Budget Reaction : Positive Thrust on Technology and Start-Ups in Union Budget 2015-16; However Concerns Persist,https://www.newsvoir.com/release/nasscom-budget-reaction-positive-thrust-on-technology-and-start-ups-in-union-budget-2015-16-however-concerns-persist-3529.html
358,"Statement from Neeraj Bansal, Head of Real Estate and Construction, KPMG in India",https://www.newsvoir.com/release/statement-from-neeraj-bansal-head-of-real-estate-and-construction-kpmg-in-india-3504.html
359,BEL Receives International Aerospace Award for ‘Innovation’,https://www.newsvoir.com/release/bel-receives-international-aerospace-award-for-innovation--3407.html
360,"Tata Group to Showcase Its Capabilities in Defence and Aerospace at Aero India 2015
",https://www.newsvoir.com/release/tata-group-to-showcase-its-capabilities-in-defence-and-aerospace-at-aero-india-2015-3371.html
361,Lakshmi Vilas Bank Enters into Strategic Alliance with NCML,https://www.newsvoir.com/release/lakshmi-vilas-bank-enters-into-strategic-alliance-with-ncml-3351.html
362,RInfra Signs MoU with US Based Innovari Inc. to Expand Automatic Demand Side Management (ADSM),https://www.newsvoir.com/release/rinfra-signs-mou-with-us-based-innovari-inc-to-expand-automatic-demand-side-management-adsm-3331.html
363,Atlanta Ltd. Q3FY15 & 9mFY15 Financial Result Highlights,https://www.newsvoir.com/release/atlanta-ltd-q3fy15-9mfy15-financial-result-highlights-3254.html
364,Supreme Infra Bags Orders Worth Rs. 413.50 Crore,https://www.newsvoir.com/release/supreme-infra-bags-orders-worth-rs-413-50-crore-3241.html
