,title,link
123,Noel N Tata Felicitated for Tata International’s Outstanding Performance in International Trade,https://www.newsvoir.com/release/noel-n-tata-felicitated-for-tata-international-s-outstanding-performance-in-international-trade-8715.html
124,An Industry First: Seclore is Now an Agent-less Data-Centric Security Solution,https://www.newsvoir.com/release/an-industry-first-seclore-is-now-an-agent-less-data-centric-security-solution-8674.html
125,"Introducing MOX@Techzone will Ensure Ground Level Success for Programs like Make in India, Digital India and Skill India: Ferguson",https://www.newsvoir.com/release/introducing-mox-techzone-will-ensure-ground-level-success-for-programs-like-make-in-india-digital-india-and-skill-india-ferguson-8675.html
126,"NRI Ram Sareen’s, Tukatech Inc., Makes India Proud Tukatech Poised to Simplify Fashion Design and Development with Solutions Starting at $29.00 Per Month
",https://www.newsvoir.com/release/nri-ram-sareen-s-tukatech-inc-makes-india-proud-tukatech-poised-to-simplify-fashion-design-and-development-with-solutions-starting-at-29-00-per-month--8663.html
127,"Cross Marketing Inc Launches “Velocity”, a New Age Market Research Company",https://www.newsvoir.com/release/cross-marketing-inc-launches-velocity-a-new-age-market-research-company-8657.html
128,Zendesk Launches Guide - A Next Generation Knowledge Solution - To Provide Smarter Customer Service ,https://www.newsvoir.com/release/zendesk-launches-guide-a-next-generation-knowledge-solution-to-provide-smarter-customer-service-8637.html
129,To Fight the Rising Pollution Levels: AUZAIR is Providing the Australian Fresh Air in India,https://www.newsvoir.com/release/to-fight-the-rising-pollution-levels-auzair-is-providing-the-australian-fresh-air-in-india-8622.html
130,"OTTOEDGE Assigned as the Official Creative, Digital and Media Agency by MAN Trucks India",https://www.newsvoir.com/release/ottoedge-assigned-as-the-official-creative-digital-and-media-agency-by-man-trucks-india-8611.html
131,Amsterdam-born Creative Office Brand ‘Spaces’ Launches in India,https://www.newsvoir.com/release/amsterdam-born-creative-office-brand-spaces-launches-in-india-8609.html
132,Schneider Electric to Make India’s First Integrated Green Field Smart City Project in Naya Raipur a Reality,https://www.newsvoir.com/release/schneider-electric-to-make-india-s-first-integrated-green-field-smart-city-project-in-naya-raipur-a-reality-8581.html
133,IndiQube Launches 4 New Centres for Shared Workspaces in Bangalore ,https://www.newsvoir.com/release/indiqube-launches-4-new-centres-for-shared-workspaces-in-bangalore-8579.html
134,"Top Leaders and Opinion Makers Discuss India In The Face Of Disruption and Changing Face of Society, Politics, Business and Governance at the 11th Mindmine Summit Hosted by Hero Enterprise",https://www.newsvoir.com/release/top-leaders-and-opinion-makers-discuss-india-in-the-face-of-disruption-and-changing-face-of-society-politics-business-and-governance-at-the-11th-mindmine-summit-hosted-by-hero-enterprise-8577.html
135,Infosys Pune Becomes the Largest Campus in the World to Earn LEED Platinum Certification from US Green Building Council,https://www.newsvoir.com/release/infosys-pune-becomes-the-largest-campus-in-the-world-to-earn-leed-platinum-certification-from-us-green-building-council-8554.html
136,"Home Credit India Recognized as a 2017 Regional Aon Best Employer, India",https://www.newsvoir.com/release/home-credit-india-recognized-as-a-2017-regional-aon-best-employer-india-8552.html
137,"India’s Largest Analytics Forum SAS Forum India to be held on April 26, 2017 at The Grand Hyatt, Mumbai",https://www.newsvoir.com/release/india-s-largest-analytics-forum-sas-forum-india-to-be-held-on-april-26-2017-at-the-grand-hyatt-mumbai-8549.html
138,Infosys Foundation Joins Hands with ‘Sahapedia’ to Promote a Penchant for Cultural and Historical Knowledge of India among the Masses,https://www.newsvoir.com/release/infosys-foundation-joins-hands-with-sahapedia-to-promote-a-penchant-for-cultural-and-historical-knowledge-of-india-among-the-masses-8544.html
139,Second Edition of Annual 4.5G & 5G Innovation Summit Concludes on a Successful Note,https://www.newsvoir.com/release/second-edition-of-annual-4-5g-5g-innovation-summit-concludes-on-a-successful-note-8537.html
140,Cisco Inaugurates Cyber Range Lab in India,https://www.newsvoir.com/release/cisco-inaugurates-cyber-range-lab-in-india-8522.html
141,FICCI Global R&D Summit 2017 Paves Way to Nurturing R&D and Innovation Ecosystem in the Country ,https://www.newsvoir.com/release/ficci-global-r-d-summit-2017-paves-way-to-nurturing-r-d-and-innovation-ecosystem-in-the-country-8499.html
142,Infosys Recognized as a ‘Leader' in NelsonHall’s NEAT Report for Big Data & Analytics Services,https://www.newsvoir.com/release/infosys-recognized-as-a-leader-in-nelsonhall-s-neat-report-for-big-data-analytics-services-8486.html
143,"Seclore Listed as 'Representative Vendor' in Recent Gartner Market Guide Report
on Enterprise Digital Rights Management (EDRM)",https://www.newsvoir.com/release/seclore-listed-as-apos-representative-vendor-apos-in-recent-gartner-market-guide-report-on-enterprise-digital-rights-management-edrm-8481.html
144,"11th Edition of Hero’s Enterprise Annual Flagship Event Mindmine Summit to be Held on April 20-21, 2017",https://www.newsvoir.com/release/11th-edition-of-hero-s-enterprise-annual-flagship-event-mindmine-summit-to-be-held-on-april-20-21-2017-8479.html
145,Second Edition of Annual 4.5G & 5G Innovation Summit to Address the Evolution of LTE to 5G,https://www.newsvoir.com/release/second-edition-of-annual-4-5g-5g-innovation-summit-to-address-the-evolution-of-lte-to-5g-8478.html
146,HTC Launches Initiative ‘Aarzoo: Ek Wish Har Aarzoo Poori Karneki’ In Partnership with CRY to Make Quality Education Accessible to Girl Child,https://www.newsvoir.com/release/htc-launches-initiative-aarzoo-ek-wish-har-aarzoo-poori-karneki-in-partnership-with-cry-to-make-quality-education-accessible-to-girl-child-8475.html
147,Gateway Rail to Start Handling Container Traffic at Viramgam,https://www.newsvoir.com/release/gateway-rail-to-start-handling-container-traffic-at-viramgam-8460.html
148,UPES Encourages Entrepreneurship with its New Placement Policy,https://www.newsvoir.com/release/upes-encourages-entrepreneurship-with-its-new-placement-policy-8427.html
149,UTI Infrastructure Fund and UTI Top 100 Fund Declares Tax-free Dividend,https://www.newsvoir.com/release/uti-infrastructure-fund-and-uti-top-100-fund-declares-tax-free-dividend-8421.html
150,Real Estate Body NAREDCO Urges Haryana Government to Expedite Work on KMP Expressway,https://www.newsvoir.com/release/real-estate-body-naredco-urges-haryana-government-to-expedite-work-on-kmp-expressway-8381.html
151,Emaar India Celebrates 46th National Safety Day & Week,https://www.newsvoir.com/release/emaar-india-celebrates-46th-national-safety-day-week-8360.html
152,Huawei's NFV Solution Awarded Best Technology Enabler at MWC 2017,https://www.newsvoir.com/release/huawei-s-nfv-solution-awarded-best-technology-enabler-at-mwc-2017-8328.html
153,MAN Trucks India Expands Reach in Maharashtra with Pune Dealership,https://www.newsvoir.com/release/man-trucks-india-expands-reach-in-maharashtra-with-pune-dealership-8326.html
154,"iSticker Witnesses Significant Growth; A Major Upsurge in Users, in 3 Months",https://www.newsvoir.com/release/isticker-witnesses-significant-growth-a-major-upsurge-in-users-in-3-months-8321.html
155,Tata Power’s Generation Capacity up by 8 Percent in Q3 FY17,https://www.newsvoir.com/release/tata-power-s-generation-capacity-up-by-8-percent-in-q3-fy17-8320.html
156,Huawei Leads the Way to 5G in China with Successful Field Performance Testing,https://www.newsvoir.com/release/huawei-leads-the-way-to-5g-in-china-with-successful-field-performance-testing-8304.html
157,APM Terminals Pipavav Welcomes One of the Largest RORO [Roll In Roll Out] Carrier,https://www.newsvoir.com/release/apm-terminals-pipavav-welcomes-one-of-the-largest-roro-roll-in-roll-out-carrier-8302.html
158,"IRB Infrastructure Private Ltd., Wholly own Subsidiary of IRB Infrastructure Developers Ltd. Appoints Mr. Rajinder Pal Singh as Independent Director and Chairman to the Board",https://www.newsvoir.com/release/irb-infrastructure-private-ltd-wholly-own-subsidiary-of-irb-infrastructure-developers-ltd-appoints-mr-rajinder-pal-singh-as-independent-director-and-chairman-to-the-board-8274.html
159,"LexisNexis and Legasis Expand Lexis® Practical Guidance Portfolio with Industry-Specific Enterprise Compliance Management Modules for Ecommerce, Pharmaceuticals and IT/ITES",https://www.newsvoir.com/release/lexisnexis-and-legasis-expand-lexis-practical-guidance-portfolio-with-industry-specific-enterprise-compliance-management-modules-for-ecommerce-pharmaceuticals-and-it-ites-8273.html
160,Essel Infraprojects Ltd. (EIL) Pledges Rs 5700 Cr for Jharkhand Government towards Infrastructure Development at Momentum Jharkhand,https://www.newsvoir.com/release/essel-infraprojects-ltd-eil-pledges-rs-5700-cr-for-jharkhand-government-towards-infrastructure-development-at-momentum-jharkhand-8269.html
161,2nd Annual Future Generation Optical Transport Networks Summit 2017 Concludes on a Successful Note,https://www.newsvoir.com/release/2nd-annual-future-generation-optical-transport-networks-summit-2017-concludes-on-a-successful-note-8253.html
162,"Tata Motors Consolidated Net Revenue Rs.67,484 crores, Consolidated PAT Rs.112 crores",https://www.newsvoir.com/release/tata-motors-consolidated-net-revenue-rs-67-484-crores-consolidated-pat-rs-112-crores-8250.html
163,NEC Updates Postal Automation System for Hong Kong Post,https://www.newsvoir.com/release/nec-updates-postal-automation-system-for-hong-kong-post-8240.html
164,India Surpasses China and Middle East in Successful Execution of Projects,https://www.newsvoir.com/release/india-surpasses-china-and-middle-east-in-successful-execution-of-projects-8234.html
165,"Vineet Relia, Managing Director, SARE Homes - RBI Monetary Policy",https://www.newsvoir.com/release/vineet-relia-managing-director-sare-homes-rbi-monetary-policy-8221.html
166,Huawei and Oracle Officially Sign Power IoT Ecosystem Partnership MOU,https://www.newsvoir.com/release/huawei-and-oracle-officially-sign-power-iot-ecosystem-partnership-mou-8203.html
167,"Aligning with Union Budget 2017, SAP Launches SAP S/4HANA Private Cloud Enabling Midsized Companies to go Digital",https://www.newsvoir.com/release/aligning-with-union-budget-2017-sap-launches-sap-s-4hana-private-cloud-enabling-midsized-companies-to-go-digital-8187.html
168,"Shardul Amarchand Mangaldas & Co Advises in Relation to Issuance and Subscription of Masala Bonds Worth Rs. 500 Cr by Zuari Cements, India to Heidelberg Cement AG",https://www.newsvoir.com/release/shardul-amarchand-mangaldas-co-advises-in-relation-to-issuance-and-subscription-of-masala-bonds-worth-rs-500-cr-by-zuari-cements-india-to-heidelberg-cement-ag-8180.html
169,Tata Consultancy Services Achieves Oracle PartnerNetwork Cloud Elite Designation,https://www.newsvoir.com/release/tata-consultancy-services-achieves-oracle-partnernetwork-cloud-elite-designation-8177.html
170,Infosys Positioned as a Leader and Star Performer 2016 in Big Data and Analytics Services in Global Banking PEAK Matrix™ by Everest Group,https://www.newsvoir.com/release/infosys-positioned-as-a-leader-and-star-performer-2016-in-big-data-and-analytics-services-in-global-banking-peak-matrix-by-everest-group-8145.html
171,Ricoh Embraces Brocade Fabric Technology to Transform Cloud Data Center,https://www.newsvoir.com/release/ricoh-embraces-brocade-fabric-technology-to-transform-cloud-data-center-8143.html
172,TCS Positioned as Leader Amongst Global Product Engineering Services,https://www.newsvoir.com/release/tcs-positioned-as-leader-amongst-global-product-engineering-services-8118.html
173,Pentavalent Bio Sciences Emerges Winner of Tata Social Enterprise Challenge 2016-17,https://www.newsvoir.com/release/pentavalent-bio-sciences-emerges-winner-of-tata-social-enterprise-challenge-2016-17-8100.html
174,"Infosys (NSE, BSE: INFY) Announces Results for the Quarter ended December 31, 2016",https://www.newsvoir.com/release/infosys-nse-bse-infy-announces-results-for-the-quarter-ended-december-31-2016-8090.html
175,Tata Power Renewable Energy Ltd. Commissions Two Projects in Andhra Pradesh and Tamil Nadu,https://www.newsvoir.com/release/tata-power-renewable-energy-ltd-commissions-two-projects-in-andhra-pradesh-and-tamil-nadu-8086.html
176,Cisco Announces Next Phase of Initiatives for Digital Rajasthan Vision,https://www.newsvoir.com/release/cisco-announces-next-phase-of-initiatives-for-digital-rajasthan-vision-8067.html
177,FreeCharge Launches India’s First e-Wallet Protection Plan for its Users,https://www.newsvoir.com/release/freecharge-launches-india-s-first-e-wallet-protection-plan-for-its-users-7982.html
178,Tata Communications Launches a New Brand Campaign in India,https://www.newsvoir.com/release/tata-communications-launches-a-new-brand-campaign-in-india-7895.html
179,CA Technologies Appoints Saivijay Khanagav to Lead its Partners and Alliances Business for India & SAARC,https://www.newsvoir.com/release/ca-technologies-appoints-saivijay-khanagav-to-lead-its-partners-and-alliances-business-for-india-saarc-7873.html
180,Emaar India Bags Industry Honour at DNA Real Estate Awards 2016,https://www.newsvoir.com/release/emaar-india-bags-industry-honour-at-dna-real-estate-awards-2016-7857.html
181,Huawei's Ryan Ding: Countdown to 5G Starts Now,https://www.newsvoir.com/release/huawei-s-ryan-ding-countdown-to-5g-starts-now-7846.html
182,Huawei Rotating CEO Ken Hu Announces X Labs for Mobile Broadband Research,https://www.newsvoir.com/release/huawei-rotating-ceo-ken-hu-announces-x-labs-for-mobile-broadband-research-7841.html
183,TCS Partners with ASML to Simplify Business Processes and Enrich Stakeholder Experience ,https://www.newsvoir.com/release/tcs-partners-with-asml-to-simplify-business-processes-and-enrich-stakeholder-experience-7837.html
184,CA Technologies Increases Agility in Application Management and Monitoring to Drive Speed in DevOps,https://www.newsvoir.com/release/ca-technologies-increases-agility-in-application-management-and-monitoring-to-drive-speed-in-devops-7803.html
185,CA Technologies CEO Mike Gregoire Predicts “Built To Change” is New Paradigm for Success,https://www.newsvoir.com/release/ca-technologies-ceo-mike-gregoire-predicts-built-to-change-is-new-paradigm-for-success-7801.html
186,Fujitsu Consulting Builds New IP Network on Brocade SDN Architecture to Support Global Business Growth,https://www.newsvoir.com/release/fujitsu-consulting-builds-new-ip-network-on-brocade-sdn-architecture-to-support-global-business-growth-7754.html
187,Green Buildings Become Economically Viable - LEED in Motion 2016 Report,https://www.newsvoir.com/release/green-buildings-become-economically-viable-leed-in-motion-2016-report-7738.html
188,GMR Airports Submits Bid for New International Airport in Greece,https://www.newsvoir.com/release/gmr-airports-submits-bid-for-new-international-airport-in-greece-7716.html
189,Manipal Hospitals is the First Hospital in the Country to Adopt IBM's 'Watson for Oncology' Supercomputer for Cancer Treatment,https://www.newsvoir.com/release/manipal-hospitals-is-the-first-hospital-in-the-country-to-adopt-ibm-s-watson-for-oncology-supercomputer-for-cancer-treatment-7715.html
190,Vodafone Launches Supernettm 4G in Ahmedabad & Vadodara,https://www.newsvoir.com/release/vodafone-launches-supernettm-4g-in-ahmedabad-vadodara-7711.html
191,Essel Propack Introduces New Tube Making Technology Named ‘SHOT’ ,https://www.newsvoir.com/release/essel-propack-introduces-new-tube-making-technology-named-shot--7681.html
192,Taiwanese Brands Bullish About the Fast-Growing ICT Market in India,https://www.newsvoir.com/release/taiwanese-brands-bullish-about-the-fast-growing-ict-market-in-india-7659.html
193,Security Watch India (SWI) Successfully Concludes its 8th Annual Conference and Exhibition on Internal Security in India,https://www.newsvoir.com/release/security-watch-india-swi-successfully-concludes-its-8th-annual-conference-and-exhibition-on-internal-security-in-india-7615.html
194,"Airtel to Offer iPhone 7 and iPhone 7 Plus in India on October 7, 2016",https://www.newsvoir.com/release/airtel-to-offer-iphone-7-and-iphone-7-plus-in-india-on-october-7-2016-7606.html
195,Vodafone Acquires Spectrum for High Speed 4G Data Services in India,https://www.newsvoir.com/release/vodafone-acquires-spectrum-for-high-speed-4g-data-services-in-india-7604.html
196,Essel Infraprojects Felicatated with the Michael Porter-IFC Mint Strategy Award for Path Breaking Innovations,https://www.newsvoir.com/release/essel-infraprojects-felicatated-with-the-michael-porter-ifc-mint-strategy-award-for-path-breaking-innovations-7598.html
197,Vodafone & Microsoft Empower Indian Enterprises with Office 365 ,https://www.newsvoir.com/release/vodafone-microsoft-empower-indian-enterprises-with-office-365-7584.html
198,GMR and Vodafone Create India’s Largest Wi-Fi Hotspot at Delhi Airport,https://www.newsvoir.com/release/gmr-and-vodafone-create-india-s-largest-wi-fi-hotspot-at-delhi-airport-7578.html
199,3rd SBI Banking & Economics Conclave,https://www.newsvoir.com/release/3rd-sbi-banking-economics-conclave-7533.html
200,Andhra Pradesh Chief Minister Pitches for Promoting Tourism to Create Employment and Better Infrastructure,https://www.newsvoir.com/release/andhra-pradesh-chief-minister-pitches-for-promoting-tourism-to-create-employment-and-better-infrastructure-7522.html
201,BT Joins Forces with Microsoft to Simplify Hybrid Cloud,https://www.newsvoir.com/release/bt-joins-forces-with-microsoft-to-simplify-hybrid-cloud-7512.html
202,DT Mobile Communications Speed Breakthrough Achieved in Berlin Using Huawei LTE Advanced Pro (4.5G) Solution,https://www.newsvoir.com/release/dt-mobile-communications-speed-breakthrough-achieved-in-berlin-using-huawei-lte-advanced-pro-4-5g-solution-7484.html
203,"Krishna Prakash Maheshwari joins as CEO, Essel Highways ",https://www.newsvoir.com/release/krishna-prakash-maheshwari-joins-as-ceo-essel-highways-7451.html
204,Reliance Infrastructure Limited Announces Q1 FY 17 Results,https://www.newsvoir.com/release/reliance-infrastructure-limited-announces-q1-fy-17-results-7446.html
205,Smart Cities - A Big Opportunity for IoT,https://www.newsvoir.com/release/smart-cities-a-big-opportunity-for-iot-7434.html
206,Tata Docomo’s Ram Prasad Mamidi Adjudged as ‘CIO of the Year’ ,https://www.newsvoir.com/release/tata-docomo-s-ram-prasad-mamidi-adjudged-as-cio-of-the-year--7431.html
207,"Indian Institute of Technology Roorkee, the First IIT to Undertake the Digital Transformation Journey with ERP Technology Deployment Across All its Three Campuses",https://www.newsvoir.com/release/indian-institute-of-technology-roorkee-the-first-iit-to-undertake-the-digital-transformation-journey-with-erp-technology-deployment-across-all-its-three-campuses-7392.html
208,Videocon d2h Enhances Video Experiences with Cisco Virtualized Video Processing,https://www.newsvoir.com/release/videocon-d2h-enhances-video-experiences-with-cisco-virtualized-video-processing-7390.html
209,Collaboration between Green Business Certification Inc (GBCI) and Philips Lighting India to Advance Sustainability and Human Health in the Built Environment,https://www.newsvoir.com/release/collaboration-between-green-business-certification-inc-gbci-and-philips-lighting-india-to-advance-sustainability-and-human-health-in-the-built-environment-7372.html
210,Indian Web Host MilesWeb Launches High Performance Dockerized WordPress Hosting Service,https://www.newsvoir.com/release/indian-web-host-milesweb-launches-high-performance-dockerized-wordpress-hosting-service-7356.html
211,TCS Platform Helps Ampleon Use Cloud to Drive Business Agility,https://www.newsvoir.com/release/tcs-platform-helps-ampleon-use-cloud-to-drive-business-agility-7213.html
212,Infosys Recognized as a Leader in Distributed Agile Delivery for ADM Services by Ovum Decision Matrix ,https://www.newsvoir.com/release/infosys-recognized-as-a-leader-in-distributed-agile-delivery-for-adm-services-by-ovum-decision-matrix-7205.html
213,"Robb La Velle Joins Infogain as VP and Global Practice Leader, Business  Assurance & Testing Services",https://www.newsvoir.com/release/robb-la-velle-joins-infogain-as-vp-and-global-practice-leader-business-assurance-testing-services-7203.html
214,Accenture Launches Fifth Season of 'Innovation Jockeys' Contest,https://www.newsvoir.com/release/accenture-launches-fifth-season-of-innovation-jockeys-contest-7195.html
215,In2IT Technologies Ranked Among Top 100 Managed Services Providers by MSPmentor 501 Global List,https://www.newsvoir.com/release/in2it-technologies-ranked-among-top-100-managed-services-providers-by-mspmentor-501-global-list-7169.html
216,HCC Awarded Rs 1750 Crore Contract by IRCON,https://www.newsvoir.com/release/hcc-awarded-rs-1750-crore-contract-by-ircon-7154.html
217,ITC Infotech’s ‘iTech 2016’ Sets a New Benchmark in Augmented Reality and Virtual Reality ,https://www.newsvoir.com/release/itc-infotech-s-itech-2016-sets-a-new-benchmark-in-augmented-reality-and-virtual-reality--7114.html
218,GIFT City Attracts Global IT/ITeS Firms,https://www.newsvoir.com/release/gift-city-attracts-global-it-ites-firms-7102.html
219,Newgen Releases eGov Suite 11.0 with Enhanced Capabilities for Digital Document Management,https://www.newsvoir.com/release/newgen-releases-egov-suite-11-0-with-enhanced-capabilities-for-digital-document-management-7083.html
220,"Infosys Announces Results for the Quarter Ended June 30, 2016",https://www.newsvoir.com/release/infosys-announces-results-for-the-quarter-ended-june-30-2016-7081.html
221,"ITC Infotech Announces the 2nd Edition of its Flagship Annual Technology Innovation & Co-creation Platform - iTech 2016
",https://www.newsvoir.com/release/itc-infotech-announces-the-2nd-edition-of-its-flagship-annual-technology-innovation-co-creation-platform-itech-2016-7074.html
222,Cisco Closes ‘Security Effectiveness Gap’ with New Services and Integrated Cloud-Based Solutions,https://www.newsvoir.com/release/cisco-closes-security-effectiveness-gap-with-new-services-and-integrated-cloud-based-solutions-7053.html
223,Infosys Implements New Sustainability Initiatives at its Chennai Campus,https://www.newsvoir.com/release/infosys-implements-new-sustainability-initiatives-at-its-chennai-campus-7032.html
224,Essar Energy Sells Entire 50 Percent Stake in KPRL to Kenyan Government,https://www.newsvoir.com/release/essar-energy-sells-entire-50-percent-stake-in-kprl-to-kenyan-government-6972.html
225,TCS’ Talent Management Platform CHROMA™ to Power Bajaj Finance,https://www.newsvoir.com/release/tcs-talent-management-platform-chroma-to-power-bajaj-finance-6957.html
226,Accenture and Automation Anywhere Collaborate to Deliver Robotic Process Automation,https://www.newsvoir.com/release/accenture-and-automation-anywhere-collaborate-to-deliver-robotic-process-automation-6956.html
227,Accenture to Help Organizations More Effectively Detect and Remediate Fraud and Abuse with New Advanced Analytics Applications,https://www.newsvoir.com/release/accenture-to-help-organizations-more-effectively-detect-and-remediate-fraud-and-abuse-with-new-advanced-analytics-applications-6917.html
228,Randstad Partners with TCS to Leverage Public Cloud Marketplace,https://www.newsvoir.com/release/randstad-partners-with-tcs-to-leverage-public-cloud-marketplace-6889.html
229,"movingDneedle Moves into a Larger Facility in Hyderabad, to Support its Aggressive Growth",https://www.newsvoir.com/release/movingdneedle-moves-into-a-larger-facility-in-hyderabad-to-support-its-aggressive-growth-6872.html
230,L&T Construction Wins Orders Valued Rs 2161 Crores,https://www.newsvoir.com/release/l-t-construction-wins-orders-valued-rs-2161-crores-6849.html
231,GIFT IFSC Signs Memorandum of Agreement with Singapore International Arbitration Centre,https://www.newsvoir.com/release/gift-ifsc-signs-memorandum-of-agreement-with-singapore-international-arbitration-centre-6838.html
232,Verizon Appoints New Managing Director for its India IT & Technology Operations,https://www.newsvoir.com/release/verizon-appoints-new-managing-director-for-its-india-it-technology-operations-6832.html
233,Huawei and Vodafone Join Forces to Turn Madrid into One of the Most Technologically Advanced Cities Around the World,https://www.newsvoir.com/release/huawei-and-vodafone-join-forces-to-turn-madrid-into-one-of-the-most-technologically-advanced-cities-around-the-world-6827.html
234,Analyst Firm Names Teradata a Leader in BigData Hadoop-Optimized Systems,https://www.newsvoir.com/release/analyst-firm-names-teradata-a-leader-in-bigdata-hadoop-optimized-systems-6823.html
235,BFSI Technology Experts Convene in High Spirits,https://www.newsvoir.com/release/bfsi-technology-experts-convene-in-high-spirits-6811.html
236,CA Technologies Study Reveals Rapid Momentum of DevOps Adoption in India,https://www.newsvoir.com/release/ca-technologies-study-reveals-rapid-momentum-of-devops-adoption-in-india-6810.html
237,Infosys Partners with MTDC to Open a Tourism Pavilion at its Pune Development Center ,https://www.newsvoir.com/release/infosys-partners-with-mtdc-to-open-a-tourism-pavilion-at-its-pune-development-center-6808.html
238,TE Connectivity Opens High-Tech Test Competence Center in India to Further Support Automotive Customers and Innovation,https://www.newsvoir.com/release/te-connectivity-opens-high-tech-test-competence-center-in-india-to-further-support-automotive-customers-and-innovation-6805.html
