,title,link
365,Ingersoll Rand India Announces New Appointments to the Board,https://www.newsvoir.com/release/ingersoll-rand-india-announces-new-appointments-to-the-board-3205.html
366,"IRB Infrastructure Developers Limited – Q3FY15 Results for the Quarter Ended December 31, 2014.",https://www.newsvoir.com/release/irb-infrastructure-developers-limited-q3fy15-results-for-the-quarter-ended-december-31-2014--3204.html
367,JSW Group Debuts New Corporate Campaign,https://www.newsvoir.com/release/jsw-group-debuts-new-corporate-campaign-3186.html
368,Khaitan & Co. Power Sector Wish-list for Union Budget 2015,https://www.newsvoir.com/release/khaitan-co-power-sector-wish-list-for-union-budget-2015-3120.html
369,ACME Hands Over National Games Village,https://www.newsvoir.com/release/acme-hands-over-national-games-village-3074.html
370,"Cushman & Wakefield Report, 'Modern Urbanization – Challenges in Setting up Smart Cities', Identifies Five Crucial Elements to Create ‘Smart Cities’",https://www.newsvoir.com/release/cushman-wakefield-report-modern-urbanization-challenges-in-setting-up-smart-cities-identifies-five-crucial-elements-to-create-smart-cities--3012.html
371,Infosys to Set up Model ‘Smart City’ to Demonstrate Advances in Urban Development,https://www.newsvoir.com/release/infosys-to-set-up-model-smart-city-to-demonstrate-advances-in-urban-development-2884.html
372,IL&FS Infra Asset Management Ltd. Scales Up IDF Platform with Commitment of  Rs. 5.50 Billion In Its Second Set Of Schemes,https://www.newsvoir.com/release/il-fs-infra-asset-management-ltd-scales-up-idf-platform-with-commitment-of-rs-5-50-billion-in-its-second-set-of-schemes-2821.html
373,"Vice President Inaugurates Modernised BEL Software Technology Centre at Bengaluru
",https://www.newsvoir.com/release/vice-president-inaugurates-modernised-bel-software-technology-centre-at-bengaluru-2809.html
374,Brick Eagle Co-founder Forays Into Realty,https://www.newsvoir.com/release/brick-eagle-co-founder-forays-into-realty-2795.html
375,L&T Construction Wins Orders Valued Rs. 4006 Crores,https://www.newsvoir.com/release/l-t-construction-wins-orders-valued-rs-4006-crores-2783.html
376,L&T Construction Wins Orders Valued Rs. 2521 Crores,https://www.newsvoir.com/release/l-t-construction-wins-orders-valued-rs-2521-crores-2746.html
377,Godrej Properties Adds a New Project in Vikhroli,https://www.newsvoir.com/release/godrej-properties-adds-a-new-project-in-vikhroli-2745.html
378,ACME to Supply Telecom Passive Infra to PGCIL for Development of National Transmission Asset Management Centre (NTAMC),https://www.newsvoir.com/release/acme-to-supply-telecom-passive-infra-to-pgcil-for-development-of-national-transmission-asset-management-centre-ntamc-2716.html
379,World Trade Center Signs Agreement with GoI’s NIESBUD,https://www.newsvoir.com/release/world-trade-center-signs-agreement-with-goi-s-niesbud-2679.html
380,Emaar MGF Receives Industry Honour for Outstanding Contribution in Green Building Project,https://www.newsvoir.com/release/emaar-mgf-receives-industry-honour-for-outstanding-contribution-in-green-building-project-2661.html
381,Schneider Electric India Foundation’s ‘Conserve My Planet’ Program Declares Bangalore’s ‘Green Champion 2014’,https://www.newsvoir.com/release/schneider-electric-india-foundation-s-conserve-my-planet-program-declares-bangalore-s-green-champion-2014--2656.html
382,"Schneider Electric India Report 'ICT in Urban Governance' Says New Delhi’s Civic Agency will Spend About 0.5% of the Municipal Budget to Boost Information and Communication Technology Framework
",https://www.newsvoir.com/release/schneider-electric-india-report-ict-in-urban-governance-says-new-delhi-s-civic-agency-will-spend-about-0-5-of-the-municipal-budget-to-boost-information-and-communication-technology-framework--2654.html
383,Schneider Electric India Report 'ICT in Urban Governance' Says Major Indian Civic Agencies will Spend Between 0.5% and 5% of the Municipal Budget to Boost Information and Communication Technology Framework,https://www.newsvoir.com/release/schneider-electric-india-report-ict-in-urban-governance-says-major-indian-civic-agencies-will-spend-between-0-5-and-5-of-the-municipal-budget-to-boost-information-and-communication-technology-framework-2639.html
384,KPMG: Digital Infrastructure – The Next Mega Trend to Bring in More Efficiency and Possibilities in the Future,https://www.newsvoir.com/release/kpmg-digital-infrastructure-the-next-mega-trend-to-bring-in-more-efficiency-and-possibilities-in-the-future-2599.html
385,L&T Construction Wins Orders Valued Rs. 2008 Crores,https://www.newsvoir.com/release/l-t-construction-wins-orders-valued-rs-2008-crores-2563.html
386,Juniper Networks And VMware Collaborate on Cloud In APAC,https://www.newsvoir.com/release/juniper-networks-and-vmware-collaborate-on-cloud-in-apac-2512.html
387,Exim Bank’s GOI-Supported Line of Credit [LOC] of USD 1 Billion Extended to the Government of  Nepal,https://www.newsvoir.com/release/exim-bank-s-goi-supported-line-of-credit-loc-of-usd-1-billion-extended-to-the-government-of-nepal-2488.html
388,Sukaran Singh Appointed MD & CEO of Tata Advanced Systems,https://www.newsvoir.com/release/sukaran-singh-appointed-md-ceo-of-tata-advanced-systems-2454.html
389,"BEL Completes Akash Air Defence System Firing Trials Successfully
",https://www.newsvoir.com/release/bel-completes-akash-air-defence-system-firing-trials-successfully-2451.html
390,Transcend's Upgrade Kit for Mac is Now Available in Apple Premium Reseller,https://www.newsvoir.com/release/transcend-s-upgrade-kit-for-mac-is-now-available-in-apple-premium-reseller-2447.html
391,BSE to Make Even Bigger Investment in its New Iconic Tower at GIFT City in Gujarat ,https://www.newsvoir.com/release/bse-to-make-even-bigger-investment-in-its-new-iconic-tower-at-gift-city-in-gujarat-2439.html
392,NComputing Sets a New Milestone: Deploys 1.3 Million Seats in India,https://www.newsvoir.com/release/ncomputing-sets-a-new-milestone-deploys-1-3-million-seats-in-india-2427.html
393,Schneider Electric Launches Energy Efficient APC Mobile Power Pack for India,https://www.newsvoir.com/release/schneider-electric-launches-energy-efficient-apc-mobile-power-pack-for-india-2408.html
394,Schneider Electric’s New IT Infra Solution for Small and Medium Businesses (SMBs),https://www.newsvoir.com/release/schneider-electric-s-new-it-infra-solution-for-small-and-medium-businesses-smbs--2403.html
395,"Schneider Electric India Highlights Importance of ICT for Smart Cities, Citing an Independent Survey",https://www.newsvoir.com/release/schneider-electric-india-highlights-importance-of-ict-for-smart-cities-citing-an-independent-survey-2396.html
396,Nasscom Statement on DeitY’s Support International Patent Protection in Electronics & IT’ Scheme,https://www.newsvoir.com/release/nasscom-statement-on-deity-s-support-international-patent-protection-in-electronics-it-scheme-2391.html
397,Team from National Institute of Technology Agartala Wins Synopsys India’s Analog Design Contest 2014,https://www.newsvoir.com/release/team-from-national-institute-of-technology-agartala-wins-synopsys-india-s-analog-design-contest-2014-2382.html
398,Adani Power to Acquire Avantha Power’s Korba West Power Project in Chattisgarh ,https://www.newsvoir.com/release/adani-power-to-acquire-avantha-power-s-korba-west-power-project-in-chattisgarh--2371.html
399,"Avantha Power & Infrastructure Limited (APIL) Signs MoU with Adani Power Ltd
",https://www.newsvoir.com/release/avantha-power-infrastructure-limited-apil-signs-mou-with-adani-power-ltd-2370.html
400,ESG Lab Achieves Impressive Testing Results for Enterprise-Ready VDI Solution Based on EMC VSPEX Proven Infrastructure and Brocade Networking,https://www.newsvoir.com/release/esg-lab-achieves-impressive-testing-results-for-enterprise-ready-vdi-solution-based-on-emc-vspex-proven-infrastructure-and-brocade-networking-2355.html
401,2014 Brocade Global Survey Results: Channel Partners Ready to Lead in Software-Driven Networking,https://www.newsvoir.com/release/2014-brocade-global-survey-results-channel-partners-ready-to-lead-in-software-driven-networking-2337.html
402,JLT Independent Appoints Sanjay Radhakrishnan as CEO,https://www.newsvoir.com/release/jlt-independent-appoints-sanjay-radhakrishnan-as-ceo-2333.html
403,Synopsys Expands IP Accelerated Initiative with New DesignWare IP Prototyping Kits for 10 Interface Protocols,https://www.newsvoir.com/release/synopsys-expands-ip-accelerated-initiative-with-new-designware-ip-prototyping-kits-for-10-interface-protocols-2328.html
404,TCS UK Recognised for Investment in Talent and HR Excellence,https://www.newsvoir.com/release/tcs-uk-recognised-for-investment-in-talent-and-hr-excellence-2326.html
405,Mahindra Powerol Wins Deming Prize for 2014,https://www.newsvoir.com/release/mahindra-powerol-wins-deming-prize-for-2014-2322.html
406,"Synopsys’ IC Validator Adopted by Plastic Logic for Physical Verification of Advanced Displays
",https://www.newsvoir.com/release/synopsys-ic-validator-adopted-by-plastic-logic-for-physical-verification-of-advanced-displays--2302.html
407,BS Limited Q2FY14 Consolidated Revenues at Rs 713 Crore ,https://www.newsvoir.com/release/bs-limited-q2fy14-consolidated-revenues-at-rs-713-crore-2293.html
408,RAH Infotech Wins the “Emerging VAD of the Year” Award at the 13th Annual VARINDIA Star Nite Awards 2014,https://www.newsvoir.com/release/rah-infotech-wins-the-emerging-vad-of-the-year-award-at-the-13th-annual-varindia-star-nite-awards-2014-2286.html
409,ESDS Data Centre to Deploy the First True Cloud Video Surveillance Sentir Platform from Iveda in India,https://www.newsvoir.com/release/esds-data-centre-to-deploy-the-first-true-cloud-video-surveillance-sentir-platform-from-iveda-in-india-2284.html
410,Emaar MGF Commemorates ‘World Quality Day’,https://www.newsvoir.com/release/emaar-mgf-commemorates-world-quality-day--2281.html
411,eBay and PayPal Developers Help Nonprofits Solve Tech Problems,https://www.newsvoir.com/release/ebay-and-paypal-developers-help-nonprofits-solve-tech-problems-2275.html
412,Reliance Infrastructure Ltd's Q2 Financial Results,https://www.newsvoir.com/release/reliance-infrastructure-ltd-s-q2-financial-results-2268.html
413,Amplus Capital Invests In North Bangalore Project of Jain Heights and Structures Pvt. Ltd,https://www.newsvoir.com/release/amplus-capital-invests-in-north-bangalore-project-of-jain-heights-and-structures-pvt-ltd-2248.html
414,"Gartner Positions L&T Infotech as a ‘Niche Player’ in Magic Quadrant for SAP Application Management Service Providers, Worldwide Report",https://www.newsvoir.com/release/gartner-positions-l-t-infotech-as-a-niche-player-in-magic-quadrant-for-sap-application-management-service-providers-worldwide-report-2246.html
415,HCC Awarded Rs 278 Crore PWD Contract,https://www.newsvoir.com/release/hcc-awarded-rs-278-crore-pwd-contract-2224.html
416,"Adani Power Consolidated EBIDTA Rose to Rs. 1,246 crore in Q2FY15, up by 64%",https://www.newsvoir.com/release/adani-power-consolidated-ebidta-rose-to-rs-1-246-crore-in-q2fy15-up-by-64-2223.html
417,Larsen & Toubro Q2 FY15 Results,https://www.newsvoir.com/release/larsen-toubro-q2-fy15-results-2204.html
418,"Brocade Hires Mobile Networking Luminary, Kevin Shatzkamer",https://www.newsvoir.com/release/brocade-hires-mobile-networking-luminary-kevin-shatzkamer-2189.html
419,"HCC Awarded Contracts Worth Rs 634.79 Crore
",https://www.newsvoir.com/release/hcc-awarded-contracts-worth-rs-634-79-crore-2180.html
420,"Gartner Positions L&T Infotech as a ‘Challenger’ in Magic Quadrant for Oracle Application Management Service Providers, Worldwide Re-port",https://www.newsvoir.com/release/gartner-positions-l-t-infotech-as-a-challenger-in-magic-quadrant-for-oracle-application-management-service-providers-worldwide-re-port-2176.html
421,"L&T Construction Wins Orders Valued Rs. 1576 Crores
",https://www.newsvoir.com/release/l-t-construction-wins-orders-valued-rs-1576-crores-2174.html
422,L&T Technology Services and Tele2 Announce Strategic M2M/IoT Partnership for the Transportation Industry,https://www.newsvoir.com/release/l-t-technology-services-and-tele2-announce-strategic-m2m-iot-partnership-for-the-transportation-industry-2164.html
423,IDBI Bank Allies with the Indian Air Force for Channel Swimmathon as a Part of IAF’s 82nd Anniversary Celebration,https://www.newsvoir.com/release/idbi-bank-allies-with-the-indian-air-force-for-channel-swimmathon-as-a-part-of-iaf-s-82nd-anniversary-celebration-2137.html
424,RAH Infotech Becomes Exclusive India Disty for Garland Technology,https://www.newsvoir.com/release/rah-infotech-becomes-exclusive-india-disty-for-garland-technology-2131.html
425,"Views of Pradeep Jain, Chairman, Parsvnath Developers on FDI Relaxation",https://www.newsvoir.com/release/views-of-pradeep-jain-chairman-parsvnath-developers-on-fdi-relaxation-2127.html
426,"Views of M Murali, Shriram Properties on FDI Relaxations Announced by the Governement",https://www.newsvoir.com/release/views-of-m-murali-shriram-properties-on-fdi-relaxations-announced-by-the-governement-2124.html
427,"Mphasis Reports Revenues of  Rs. 1,465 Crore in Q2 FY15",https://www.newsvoir.com/release/mphasis-reports-revenues-of-rs-1-465-crore-in-q2-fy15-2112.html
428,TCS Recognized as a Leader in Business Intelligence Services by Independent Research Firm,https://www.newsvoir.com/release/tcs-recognized-as-a-leader-in-business-intelligence-services-by-independent-research-firm-2109.html
429,"IL&FS Engineering Services Receives LoA for Rs. 179.84 Crore EPC Port Project
",https://www.newsvoir.com/release/il-fs-engineering-services-receives-loa-for-rs-179-84-crore-epc-port-project-2097.html
430,Shriram Equipment Finance Celebrates Diwali with Underprivileged Ones,https://www.newsvoir.com/release/shriram-equipment-finance-celebrates-diwali-with-underprivileged-ones-2081.html
431,Important Clarification Regarding Privacy: Xiaomi India,https://www.newsvoir.com/release/important-clarification-regarding-privacy-xiaomi-india-2067.html
432,"Strate, South Africa Selects TCS BaNCS for Multi-Asset Class Depository Operations, Expands its Relationship with TCS",https://www.newsvoir.com/release/strate-south-africa-selects-tcs-bancs-for-multi-asset-class-depository-operations-expands-its-relationship-with-tcs-2061.html
433,Tata Consultancy Services Honored for Outstanding Contribution to the Germany-India Economic Relationship,https://www.newsvoir.com/release/tata-consultancy-services-honored-for-outstanding-contribution-to-the-germany-india-economic-relationship-2062.html
434,"TCS Launches User Experience Center of Excellence in Cincinnati, Ohio ",https://www.newsvoir.com/release/tcs-launches-user-experience-center-of-excellence-in-cincinnati-ohio-2054.html
435,Synopsys STAR Memory System Multi-memory Bus Processor Enables 10 Percent Die Size Reduction for Marvell SoC,https://www.newsvoir.com/release/synopsys-star-memory-system-multi-memory-bus-processor-enables-10-percent-die-size-reduction-for-marvell-soc-2048.html
436,Vocus Communications Increases Network Scalability and Port Density to Build 100 GbE Pathway with Brocade,https://www.newsvoir.com/release/vocus-communications-increases-network-scalability-and-port-density-to-build-100-gbe-pathway-with-brocade-2047.html
437,Synopsys Introduces Industry’s First On-Chip Memory Test and Repair Solution for Embedded Flash,https://www.newsvoir.com/release/synopsys-introduces-industry-s-first-on-chip-memory-test-and-repair-solution-for-embedded-flash-2044.html
438,HCC Wins Rs. 393 Crore Road Contract on the Indo-Nepal Border,https://www.newsvoir.com/release/hcc-wins-rs-393-crore-road-contract-on-the-indo-nepal-border-2040.html
439,Delhi Edition of TCS IT Wiz 2014 on November 8,https://www.newsvoir.com/release/delhi-edition-of-tcs-it-wiz-2014-on-november-8-2034.html
440,"Pinnacle Infotech Solutions to Standardize on Autodesk Tech for Architecture, Engineering & Construction Sectors",https://www.newsvoir.com/release/pinnacle-infotech-solutions-to-standardize-on-autodesk-tech-for-architecture-engineering-construction-sectors-2020.html
441,Make this Diwali Special for Your Friends and Family With Exciting Offers on Xbox One and Other Windows-Based Products,https://www.newsvoir.com/release/make-this-diwali-special-for-your-friends-and-family-with-exciting-offers-on-xbox-one-and-other-windows-based-products-2015.html
442,Quick Heal Reports Increased Incidents of the CryptoWall Ransomware Infection for Quarter 3,https://www.newsvoir.com/release/quick-heal-reports-increased-incidents-of-the-cryptowall-ransomware-infection-for-quarter-3-2009.html
443,CMC Limited Amalgamates with TCS,https://www.newsvoir.com/release/cmc-limited-amalgamates-with-tcs-2000.html
444,TCS Q2 Results FY 14-15: Strong Volumes Drive Steady Growth in Q2,https://www.newsvoir.com/release/tcs-q2-results-fy-14-15-strong-volumes-drive-steady-growth-in-q2-2001.html
445,Exim Bank’s Push for a Quantum Jump in India’s Project Exports ,https://www.newsvoir.com/release/exim-bank-s-push-for-a-quantum-jump-in-india-s-project-exports--1986.html
446,Juniper Networks and Akamai Technologies Demonstrate Elastic CDN Solution Over Virtualization Platforms,https://www.newsvoir.com/release/juniper-networks-and-akamai-technologies-demonstrate-elastic-cdn-solution-over-virtualization-platforms-1979.html
447,Synopsys Announced New DesignWare ARC HS38 Processor Doubles Performance for Embedded Linux Applications,https://www.newsvoir.com/release/synopsys-announced-new-designware-arc-hs38-processor-doubles-performance-for-embedded-linux-applications-1973.html
448,Brocade Collaborates with VMware to Support the New IP and Advance Adoption of the Software-Defined Data Center and Network Virtualization ,https://www.newsvoir.com/release/brocade-collaborates-with-vmware-to-support-the-new-ip-and-advance-adoption-of-the-software-defined-data-center-and-network-virtualization-1971.html
449,Fujitsu Forum 2014 Munich to Highlight Human Centric Innovation,https://www.newsvoir.com/release/fujitsu-forum-2014-munich-to-highlight-human-centric-innovation-1934.html
450,Schneider Electric Engages Smart City Proponents,https://www.newsvoir.com/release/schneider-electric-engages-smart-city-proponents-1923.html
451,"UAE Ministry of Justice Upgrades Network Infrastructure with Brocade to Increase Performance and Reliability, and Support Smart Government Initiatives",https://www.newsvoir.com/release/uae-ministry-of-justice-upgrades-network-infrastructure-with-brocade-to-increase-performance-and-reliability-and-support-smart-government-initiatives-1909.html
452,India’s Only Certification Course in Semiconductor Technology & Manufacturing Now Accepting Applications at IIT Bombay,https://www.newsvoir.com/release/india-s-only-certification-course-in-semiconductor-technology-manufacturing-now-accepting-applications-at-iit-bombay-1899.html
453,GlacialTech Announces Cold Forged Heatsinks Optimized for CoB and MPCB LEDs,https://www.newsvoir.com/release/glacialtech-announces-cold-forged-heatsinks-optimized-for-cob-and-mpcb-leds-1891.html
454,TSMC Selects Synopsys as “2014 Partner of the Year” for Interface IP and Joint Development of 16-Nanometer FinFET Plus Design Infrastructure,https://www.newsvoir.com/release/tsmc-selects-synopsys-as-2014-partner-of-the-year-for-interface-ip-and-joint-development-of-16-nanometer-finfet-plus-design-infrastructure-1889.html
455,ICICI Lombard Launches India’s First Self-Service Kiosk for General Insurance Customers,https://www.newsvoir.com/release/icici-lombard-launches-india-s-first-self-service-kiosk-for-general-insurance-customers-1888.html
456,Fujitsu Introduced New Petabyte-Scale ETERNUS LT260 Tape Library Combines Performance with Exceptionally High Data Capacity,https://www.newsvoir.com/release/fujitsu-introduced-new-petabyte-scale-eternus-lt260-tape-library-combines-performance-with-exceptionally-high-data-capacity-1877.html
457,L&T Construction Wins Rs. 1630 Crores Expressway Project in Uttar Pradesh,https://www.newsvoir.com/release/l-t-construction-wins-rs-1630-crores-expressway-project-in-uttar-pradesh-1868.html
458,BEL Launches 'Swachh Bharat' Campaign,https://www.newsvoir.com/release/bel-launches-swachh-bharat-campaign-1858.html
459,L&T Construction Wins Orders Valued Rs. 1423 Crores,https://www.newsvoir.com/release/l-t-construction-wins-orders-valued-rs-1423-crores-1829.html
460,HDIL Promoters Revoke All Pledged Equity Shares,https://www.newsvoir.com/release/hdil-promoters-revoke-all-pledged-equity-shares-1804.html
461,Professor Michael E. Porter Addressed the Gathering at Porter Prize 2014,https://www.newsvoir.com/release/professor-michael-e-porter-addressed-the-gathering-at-porter-prize-2014-1797.html
462,TCS Recognized by Reactions as the “Best Technology Provider” in North America,https://www.newsvoir.com/release/tcs-recognized-by-reactions-as-the-best-technology-provider-in-north-america-1783.html
463,L&T Technology Services & Cisco to Transform the Transport and Mass Transit Industry in India Through IoE Innovation,https://www.newsvoir.com/release/l-t-technology-services-cisco-to-transform-the-transport-and-mass-transit-industry-in-india-through-ioe-innovation-1778.html
464,HCC Awarded Contracts Worth Rs. 208 Crore,https://www.newsvoir.com/release/hcc-awarded-contracts-worth-rs-208-crore-1748.html
465,Tata Consultancy Services Recognized as Front Runner in Digital Transformation Services,https://www.newsvoir.com/release/tata-consultancy-services-recognized-as-front-runner-in-digital-transformation-services-1719.html
466,Infosys and Hitachi Data Systems Expand Partnership to Deliver Next-Generation Infrastructure and Data Center Transformation Solutions,https://www.newsvoir.com/release/infosys-and-hitachi-data-systems-expand-partnership-to-deliver-next-generation-infrastructure-and-data-center-transformation-solutions-1686.html
467,"Recommendations to the Hon’ble Tourism Minister– Infrastructure, IT and Skill Development Key to Success of the Buddhist Tourism Circuit",https://www.newsvoir.com/release/recommendations-to-the-hon-ble-tourism-minister-infrastructure-it-and-skill-development-key-to-success-of-the-buddhist-tourism-circuit-1685.html
468,"Infosys and Huawei Announce Global Partnership to Offer Cloud, Big Data and Communication Solutions",https://www.newsvoir.com/release/infosys-and-huawei-announce-global-partnership-to-offer-cloud-big-data-and-communication-solutions-1684.html
469,L&T Wins Order for Building Adam Airbase in Oman ,https://www.newsvoir.com/release/l-t-wins-order-for-building-adam-airbase-in-oman-1681.html
470,Tata Housing Signs Addendum Agreement with the Government of Maldives,https://www.newsvoir.com/release/tata-housing-signs-addendum-agreement-with-the-government-of-maldives-1672.html
471,Maulik Jasubhai Takes Charge of the Jasubhai Group as Vice Chairman,https://www.newsvoir.com/release/maulik-jasubhai-takes-charge-of-the-jasubhai-group-as-vice-chairman-1621.html
472,"L&T Wins Rs. 1,885 Crore Order from NTPC",https://www.newsvoir.com/release/l-t-wins-rs-1-885-crore-order-from-ntpc-1619.html
473,L&T acquires Ramboll’s Stake in L&T-Ramboll Consulting Engineers Limited,https://www.newsvoir.com/release/l-t-acquires-ramboll-s-stake-in-l-t-ramboll-consulting-engineers-limited-1591.html
474,"Tata Consultancy Services and Singapore Management University Announce Extension of SMU-TCS iCity Lab Partnership
",https://www.newsvoir.com/release/tata-consultancy-services-and-singapore-management-university-announce-extension-of-smu-tcs-icity-lab-partnership-1590.html
475,SunSwitch India Launches New Range of Solar Powered Products for Indian Market,https://www.newsvoir.com/release/sunswitch-india-launches-new-range-of-solar-powered-products-for-indian-market-1574.html
476,Exim Bank of India Collaborates with JBIC to Promote Infrastructure Development,https://www.newsvoir.com/release/exim-bank-of-india-collaborates-with-jbic-to-promote-infrastructure-development-1569.html
477,"Mahindra Launches the Most Technologically Advanced, All New Tractor –Arjun Novo in Delhi",https://www.newsvoir.com/release/mahindra-launches-the-most-technologically-advanced-all-new-tractor-arjun-novo-in-delhi-1556.html
478,India Gears Up For the Launch of First Ever Autodesk University,https://www.newsvoir.com/release/india-gears-up-for-the-launch-of-first-ever-autodesk-university-1531.html
479,Ballarpur Industries Limited (BILT):  Audited Financial Results for FY 2013-14,https://www.newsvoir.com/release/ballarpur-industries-limited-bilt-audited-financial-results-for-fy-2013-14-1521.html
480,Pilatus and Tata Advanced Systems Announce the Manufacturing of PC-12 “Green Aircraft” Aerostructures in India,https://www.newsvoir.com/release/pilatus-and-tata-advanced-systems-announce-the-manufacturing-of-pc-12-green-aircraft-aerostructures-in-india-1509.html
481,Intersection of Operational Excellence and Innovation Revealed as ‘Sweet Spot’ for Successful Business Transformations,https://www.newsvoir.com/release/intersection-of-operational-excellence-and-innovation-revealed-as-sweet-spot-for-successful-business-transformations-1505.html
482,L&T Infra Finance Checks in at Lavasa,https://www.newsvoir.com/release/l-t-infra-finance-checks-in-at-lavasa-1490.html
483,"L&T Construction Wins Water Project Orders Valued Rs. 1,283 Crore
",https://www.newsvoir.com/release/l-t-construction-wins-water-project-orders-valued-rs-1-283-crore-1482.html
484,NEST Enrolls More Than One Million Members on TCS BaNCS as Part of the UK’s Workplace Pension Reforms,https://www.newsvoir.com/release/nest-enrolls-more-than-one-million-members-on-tcs-bancs-as-part-of-the-uk-s-workplace-pension-reforms-1470.html
