,title,link
229,Tata Docomo Partners India’s Biggest Open Air Live Concert Series “Alive India In Concert”,https://www.newsvoir.com/release/tata-docomo-partners-india-s-biggest-open-air-live-concert-series-alive-india-in-concert--2715.html
230,World Trade Center Signs Agreement with GoI’s NIESBUD,https://www.newsvoir.com/release/world-trade-center-signs-agreement-with-goi-s-niesbud-2679.html
231,Nestlé India Signs an Agreement with Magic Bus India Foundation,https://www.newsvoir.com/release/nestl-india-signs-an-agreement-with-magic-bus-india-foundation-2632.html
232,Momentum Builds for NBASE-T Alliance with Ten New Participants,https://www.newsvoir.com/release/momentum-builds-for-nbase-t-alliance-with-ten-new-participants-2626.html
233,"Belvedere Vodka Announces Partnership with Spectre, the 24th James Bond Adventure: “Excellent Choice, Mr. Bond”",https://www.newsvoir.com/release/belvedere-vodka-announces-partnership-with-spectre-the-24th-james-bond-adventure-excellent-choice-mr-bond--2614.html
234,"Motherson Sumi Systems Limited (MSSL) Announces Acquisition of ""Assets of Scherer & Trier, Germany"" Through its Subsidiary Samvardhana Motherson Automotive Systems Group BV (SMRP BV)",https://www.newsvoir.com/release/motherson-sumi-systems-limited-mssl-announces-acquisition-of-assets-of-scherer-trier-germany-through-its-subsidiary-samvardhana-motherson-automotive-systems-group-bv-smrp-bv-2610.html
235,KPMG in India and CII Bring Together Experts for a Panel Discussion on the Latest Tax Policy Updates,https://www.newsvoir.com/release/kpmg-in-india-and-cii-bring-together-experts-for-a-panel-discussion-on-the-latest-tax-policy-updates-2592.html
236,Mphasis F1 Foundation Partners with Lokalex to Contribute to the National Digital Literacy Mission,https://www.newsvoir.com/release/mphasis-f1-foundation-partners-with-lokalex-to-contribute-to-the-national-digital-literacy-mission-2557.html
237,Hungama PRO Free for Aircel Subscribers,https://www.newsvoir.com/release/hungama-pro-free-for-aircel-subscribers-2546.html
238,Jaguar Land Rover Extends Castrol’s Global Lubricant Contract,https://www.newsvoir.com/release/jaguar-land-rover-extends-castrol-s-global-lubricant-contract-2536.html
239,Juniper Networks And VMware Collaborate on Cloud In APAC,https://www.newsvoir.com/release/juniper-networks-and-vmware-collaborate-on-cloud-in-apac-2512.html
240,Amadeus and Worldpay Partnership Further Simplifies Travel Payments,https://www.newsvoir.com/release/amadeus-and-worldpay-partnership-further-simplifies-travel-payments-2503.html
241,Za Now Available on Nykaa.com,https://www.newsvoir.com/release/za-now-available-on-nykaa-com-2449.html
242,"Lumax Industries Ltd. Celebrates Silver Jubilee at BSE and 30 Years of Strong Partnership with Stanley Electric Co. Ltd., Japan",https://www.newsvoir.com/release/lumax-industries-ltd-celebrates-silver-jubilee-at-bse-and-30-years-of-strong-partnership-with-stanley-electric-co-ltd-japan-2434.html
243,Puravankara Enters Into Prime Land Deal in Pune,https://www.newsvoir.com/release/puravankara-enters-into-prime-land-deal-in-pune-2405.html
244,IIMA & World Gold Council Join Hands to Set up India Gold Policy Centre,https://www.newsvoir.com/release/iima-world-gold-council-join-hands-to-set-up-india-gold-policy-centre-2402.html
245,"Kolte Patil Developers Brings Porcelanosa Group, Europe’s Largest Brand for the First Time to India",https://www.newsvoir.com/release/kolte-patil-developers-brings-porcelanosa-group-europe-s-largest-brand-for-the-first-time-to-india-2397.html
246,Adani Power to Acquire Avantha Power’s Korba West Power Project in Chattisgarh ,https://www.newsvoir.com/release/adani-power-to-acquire-avantha-power-s-korba-west-power-project-in-chattisgarh--2371.html
247,"Avantha Power & Infrastructure Limited (APIL) Signs MoU with Adani Power Ltd
",https://www.newsvoir.com/release/avantha-power-infrastructure-limited-apil-signs-mou-with-adani-power-ltd-2370.html
248,Apollo Hospitals & Fiji National University Agree to Work Together to Develop Healthcare in Fiji,https://www.newsvoir.com/release/apollo-hospitals-fiji-national-university-agree-to-work-together-to-develop-healthcare-in-fiji-2348.html
249,Amazon.in and The Label Corp Enter Into Exclusive Partnership,https://www.newsvoir.com/release/amazon-in-and-the-label-corp-enter-into-exclusive-partnership-2341.html
250,ESDS Data Centre to Deploy the First True Cloud Video Surveillance Sentir Platform from Iveda in India,https://www.newsvoir.com/release/esds-data-centre-to-deploy-the-first-true-cloud-video-surveillance-sentir-platform-from-iveda-in-india-2284.html
251,Intuit QuickBooks Partners with Paybooks to Offer Comprehensive Payroll Platform,https://www.newsvoir.com/release/intuit-quickbooks-partners-with-paybooks-to-offer-comprehensive-payroll-platform-2219.html
252,Eros International Acquires Worldwide Rights of Superstar Rajinikanth’s Lingaa,https://www.newsvoir.com/release/eros-international-acquires-worldwide-rights-of-superstar-rajinikanth-s-lingaa-2211.html
253,DTZ Becomes a Private Independent Global Property Services Company,https://www.newsvoir.com/release/dtz-becomes-a-private-independent-global-property-services-company-2185.html
254,L&T Infotech Acquired Pune-Based ISRC ,https://www.newsvoir.com/release/l-t-infotech-acquired-pune-based-isrc-2100.html
255,Emaar MGF Land Limited Associates with PayUMoney,https://www.newsvoir.com/release/emaar-mgf-land-limited-associates-with-payumoney-2068.html
256,Shriram Automall Alliances with State Bank of Bikaner & Jaipur ,https://www.newsvoir.com/release/shriram-automall-alliances-with-state-bank-of-bikaner-jaipur-2042.html
257,Realty Major Brigade Group to Invest Rs. 500 Crore in GIFT City as Co Developer,https://www.newsvoir.com/release/realty-major-brigade-group-to-invest-rs-500-crore-in-gift-city-as-co-developer-2016.html
258,"Harvard Business Publishing and IIMA Case Centre to Host Case Method Teaching Seminar
",https://www.newsvoir.com/release/harvard-business-publishing-and-iima-case-centre-to-host-case-method-teaching-seminar-1991.html
259,Gulf Petrochem Open Offer to Public Shareholders of Sah Petroleums Ltd at Rs15.70/share,https://www.newsvoir.com/release/gulf-petrochem-open-offer-to-public-shareholders-of-sah-petroleums-ltd-at-rs15-70-share-1907.html
260,"Carzonrent Partners with Tata Motors to Introduce ‘Myles-City Drive’ with Nano Twist in Delhi NCR
",https://www.newsvoir.com/release/carzonrent-partners-with-tata-motors-to-introduce-myles-city-drive-with-nano-twist-in-delhi-ncr--1895.html
261,Kingfisher Strong ‘Kings of Speed’ Nites gets fans’ Pulse Racing,https://www.newsvoir.com/release/kingfisher-strong-kings-of-speed-nites-gets-fans-pulse-racing-1867.html
262,L&T acquires Ramboll’s Stake in L&T-Ramboll Consulting Engineers Limited,https://www.newsvoir.com/release/l-t-acquires-ramboll-s-stake-in-l-t-ramboll-consulting-engineers-limited-1591.html
263,"Adani Power to Acquire Lanco Infratech’s Udupi Project for Rs 6000 Crore, Installed Capacity to Rise to 10,440 mw",https://www.newsvoir.com/release/adani-power-to-acquire-lanco-infratech-s-udupi-project-for-rs-6000-crore-installed-capacity-to-rise-to-10-440-mw-1429.html
264,Lanco Clicks Largest Deal in Thermal Power Sector by Selling its Udupi Power Plant to Adani,https://www.newsvoir.com/release/lanco-clicks-largest-deal-in-thermal-power-sector-by-selling-its-udupi-power-plant-to-adani-1426.html
