,title,link
0,Funds Advised by Convergent Finance LLP to Acquire a Controlling Stake in Jagsonpal Pharmaceuticals Limited,https://www.newsvoir.com/release/funds-advised-by-convergent-finance-llp-to-acquire-a-controlling-stake-in-jagsonpal-pharmaceuticals-limited-19459.html
1,TVS Motor Company Acquires Switzerland's Largest E-bike Player - Swiss E-Mobility Group AG (SEMG),https://www.newsvoir.com/release/tvs-motor-company-acquires-switzerlands-largest-e-bike-player-swiss-e-mobility-group-ag-semg-19173.html
2,Truecaller to Acquire Israeli App CallHero,https://www.newsvoir.com/release/truecaller-to-acquire-israeli-app-callhero-19053.html
3,Cuentas Signs Binding Letter of Intent to Purchase SDI Black 011 LLC and Mango Tel LLC for USD 3.2M,https://www.newsvoir.com/release/cuentas-signs-binding-letter-of-intent-to-purchase-sdi-black-011-llc-and-mango-tel-llc-for-usd-3-2m-19004.html
4,India-based Tamara Leisure Experiences Strengthens its German Portfolio with 4th Hotel Acquisition,https://www.newsvoir.com/release/india-based-tamara-leisure-experiences-strengthens-its-german-portfolio-with-4th-hotel-acquisition-18934.html
5,Equirus Advises Allygrow on its Acquisition by Ceinsys,https://www.newsvoir.com/release/equirus-advises-allygrow-on-its-acquisition-by-ceinsys-18838.html
6,"Renu Electronics Announces the Acquisition of Phoenix Contact HMI IPC Technology GmbH to Form Renu Electronics GmbH in Filderstadt, Germany",https://www.newsvoir.com/release/renu-electronics-announces-the-acquisition-of-phoenix-contact-hmi-ipc-technology-gmbh-to-form-renu-electronics-gmbh-in-filderstadt-germany-18806.html
7,"Badimarket, An Online News Aggregator Platform Acquired by Rashtra News Group",https://www.newsvoir.com/release/badimarket-an-online-news-aggregator-platform-acquired-by-rashtra-news-group-18756.html
8,"Mr Rajeev Baid Acquires One of the Oldest and Most Prized Tea Estate of Darjeeling, 'The Okayti'",https://www.newsvoir.com/release/mr-rajeev-baid-acquires-one-of-the-oldest-and-most-prized-tea-estate-of-darjeeling-the-okayti-18608.html
9,KGS Microsystems LLP Acquired by Government Advisory Firm Sapio Analytics,https://www.newsvoir.com/release/kgs-microsystems-llp-acquired-by-government-advisory-firm-sapio-analytics-18307.html
10,"Sapio Analytics Acquires Public Company, Targets 1 Billion USD Valuation",https://www.newsvoir.com/release/sapio-analytics-acquires-public-company-targets-1-billion-usd-valuation-18075.html
11,"Svast Inc. Forays Central Asia Market, Partners with CityMed, Tashkent",https://www.newsvoir.com/release/svast-inc-forays-central-asia-market-partners-with-citymed-tashkent-17930.html
12,"At 30th AGM, Best Agrolife Passes Resolution on Best Crop Science Acquisition",https://www.newsvoir.com/release/at-30th-agm-best-agrolife-passes-resolution-on-best-crop-science-acquisition-17862.html
13,Best Agrolife Limited Announces Acquisition of Best Crop Science Pvt. Ltd.,https://www.newsvoir.com/release/best-agrolife-limited-announces-acquisition-of-best-crop-science-pvt-ltd-17576.html
14,"Offbeet Media Group Acquires 101India, One of India's Pioneering Digital Content Brands ",https://www.newsvoir.com/release/offbeet-media-group-acquires-101india-one-of-india-s-pioneering-digital-content-brands-17530.html
15,Bangalore Based 'The Better Home' is Now a GlobalBees Brand,https://www.newsvoir.com/release/bangalore-based-the-better-home-is-now-a-globalbees-brand-17525.html
16,IMC Swarnaa Acquires Trillium Flow Technologies in Order to Diversify its Portfolio and Expand its Market Presence,https://www.newsvoir.com/release/imc-swarnaa-acquires-trillium-flow-technologies-in-order-to-diversify-its-portfolio-and-expand-its-market-presence-17321.html
17,"Whatfix Closes Nittio Learn Acquisition During Record Quarter in Q2, 2021",https://www.newsvoir.com/release/whatfix-closes-nittio-learn-acquisition-during-record-quarter-in-q2-2021-17283.html
18,"KGISL Completes Acquisition of AETINS, Expands Expertise in the Insurance Space
",https://www.newsvoir.com/release/kgisl-completes-acquisition-of-aetins-expands-expertise-in-the-insurance-space-16913.html
19,"CNH Industrial to Acquire Raven Industries, Enhancing Precision Agriculture Capabilities and Scale",https://www.newsvoir.com/release/cnh-industrial-to-acquire-raven-industries-enhancing-precision-agriculture-capabilities-and-scale-16859.html
20,"Chai Chun Plans Global Expansion, Acquires Renowned Okayti Tea Estate ",https://www.newsvoir.com/release/chai-chun-plans-global-expansion-acquires-renowned-okayti-tea-estate-16814.html
21,Blue Planet Secures Hat-trick with the Acquisition of Qube Renewables Ltd.,https://www.newsvoir.com/release/blue-planet-secures-hat-trick-with-the-acquisition-of-qube-renewables-ltd-16707.html
22,"Clarivate to Acquire ProQuest, a Leading Global Provider of Mission Critical Information and Data-driven Solutions for Science and Research",https://www.newsvoir.com/release/clarivate-to-acquire-proquest-a-leading-global-provider-of-mission-critical-information-and-data-driven-solutions-for-science-and-research-16548.html
23,"Optiemus Infracom Completes Acquisition of Shares in Optiemus Electronics from Wistron

",https://www.newsvoir.com/release/optiemus-infracom-completes-acquisition-of-shares-in-optiemus-electronics-from-wistron-16281.html
24,"emids Acquires Quovantis Technologies in Latest Expansion of Human-centered, Design-led Product Development and Software Engineering Capabilities",https://www.newsvoir.com/release/emids-acquires-quovantis-technologies-in-latest-expansion-of-human-centered-design-led-product-development-and-software-engineering-capabilities-16214.html
25,Blue Planet Strengthens its Position in Waste Management Sector in Singapore with Second Acquisition of a Leading Disaster Remediation Company,https://www.newsvoir.com/release/blue-planet-strengthens-its-position-in-waste-management-sector-in-singapore-with-second-acquisition-of-a-leading-disaster-remediation-company-16187.html
26,Prove Acquires MEDICI Global,https://www.newsvoir.com/release/prove-acquires-medici-global-16108.html
27,Blue Planet Announces Flagship Singapore Investment with the Acquisition of Leading Waste Player Wah & Hua ,https://www.newsvoir.com/release/blue-planet-announces-flagship-singapore-investment-with-the-acquisition-of-leading-waste-player-wah-hua-16088.html
28,Omega Healthcare Acquires himagine Solutions ,https://www.newsvoir.com/release/omega-healthcare-acquires-himagine-solutions-16071.html
29,ADVIK Acquires Hanon Bangalore Operations Pvt. Ltd. from Hanon Systems specializing in Vacuum Pump and Water Pump,https://www.newsvoir.com/release/advik-acquires-hanon-bangalore-operations-pvt-ltd-from-hanon-systems-specializing-in-vacuum-pump-and-water-pump-15841.html
30,Esper Partners with 'Teach For India' and 'iTeach Schools' to Bring Education to Kids,https://www.newsvoir.com/release/esper-partners-with-apos-teach-for-india-apos-and-apos-iteach-schools-apos-to-bring-education-to-kids-15510.html
31,Ace Turtle to Partner with Kontoor Brands to Lead Integrated Strategy for Lee and Wrangler in India ,https://www.newsvoir.com/release/ace-turtle-to-partner-with-kontoor-brands-to-lead-integrated-strategy-for-lee-and-wrangler-in-india-15499.html
32,ANAROCK Acquires Society and Apartment Management Technology Platform ApnaComplex,https://www.newsvoir.com/release/anarock-acquires-society-and-apartment-management-technology-platform-apnacomplex-15495.html
33,Vikas EcoTech Ltd. Board to Consider Rights Issue and Corporate Debt Reduction,https://www.newsvoir.com/release/vikas-ecotech-ltd-board-to-consider-rights-issue-and-corporate-debt-reduction-15496.html
34,"GiveIndia Ties The Knot with Wedding Wishlist to Offer Charity Gift Registries for Weddings, Anniversaries and Birthdays",https://www.newsvoir.com/release/giveindia-ties-the-knot-with-wedding-wishlist-to-offer-charity-gift-registries-for-weddings-anniversaries-and-birthdays-15484.html
35,Wishfin Acquires Fintech Startup Ladders,https://www.newsvoir.com/release/wishfin-acquires-fintech-startup-ladders-15469.html
36,Vikas Multicorp Ltd. to Enter Pharma and Healthcare Business; Board in Principally Approves Acquisition,https://www.newsvoir.com/release/vikas-multicorp-ltd-to-enter-pharma-and-healthcare-business-board-in-principally-approves-acquisition-15460.html
37,"Migsun Acquires Stakes of HDFC and Ansal API in 37.5 Acre Ansal IT City Park, Greater Noida",https://www.newsvoir.com/release/migsun-acquires-stakes-of-hdfc-and-ansal-api-in-37-5-acre-ansal-it-city-park-greater-noida-15394.html
38,Cyril Amarchand Mangaldas Advises Senvion Group in Relation to Global Renewal Energy Development's Acquisition of Multiple Group Companies in India,https://www.newsvoir.com/release/cyril-amarchand-mangaldas-advises-senvion-group-in-relation-to-global-renewal-energy-development-apos-s-acquisition-of-multiple-group-companies-in-india-15317.html
39,StratMed Partners with India's Key Hospital Chains to bring down Healthcare Supply Chain Costs,https://www.newsvoir.com/release/stratmed-partners-with-india-apos-s-key-hospital-chains-to-bring-down-healthcare-supply-chain-costs-15313.html
40,Satia Industries Ltd. Plans Major Expansion cum Acquisition; Seeks Permission to Bid on Ballarpur Industries Ltd. Acquisition,https://www.newsvoir.com/release/satia-industries-ltd-plans-major-expansion-cum-acquisition-seeks-permission-to-bid-on-ballarpur-industries-ltd-acquisition-15309.html
41,"Vi, Bajaj Finance partner for financing offers on smartphones bundled with prepaid plans",https://www.newsvoir.com/release/vi-bajaj-finance-partner-for-financing-offers-on-smartphones-bundled-with-prepaid-plans-15265.html
42,"Satellite-based Narrowband-IoT Now a Reality in India

",https://www.newsvoir.com/release/satellite-based-narrowband-iot-now-a-reality-in-india-15225.html
43,SRAM & MRAM Ties Up with GODS RESORT to Become ASEAN's Leading OEM Glove Suppliers,https://www.newsvoir.com/release/sram-mram-ties-up-with-gods-resort-to-become-asean-apos-s-leading-oem-glove-suppliers-15209.html
44,ITC Hotels Partners with Magzter to Delight Guests with Unlimited Digital Content,https://www.newsvoir.com/release/itc-hotels-partners-with-magzter-to-delight-guests-with-unlimited-digital-content-15166.html
45,Razorpay and PayPal Partner to Help Indian MSME's and Freelancers go Global,https://www.newsvoir.com/release/razorpay-and-paypal-partner-to-help-indian-msme-apos-s-and-freelancers-go-global-15161.html
46,Vision Plus Acquires IL&FS Stake in CPG BPM,https://www.newsvoir.com/release/vision-plus-acquires-il-fs-stake-in-cpg-bpm-15159.html
47,Inspira Enterprise Acquires SmartCirqls Infotech's Splunk Business,https://www.newsvoir.com/release/inspira-enterprise-acquires-smartcirqls-infotech-apos-s-splunk-business-15083.html
48,HDFC ERGO General Insurance Completes Merger of HDFC ERGO Health Insurance with itself,https://www.newsvoir.com/release/hdfc-ergo-general-insurance-completes-merger-of-hdfc-ergo-health-insurance-with-itself-15054.html
49,Pharma Firm 'Alliance' Partners with Alniche to Market Nizral & Nizoral in India ,https://www.newsvoir.com/release/pharma-firm-apos-alliance-apos-partners-with-alniche-to-market-nizral-nizoral-in-india-14765.html
50,Cyril Amarchand Mangaldas Advises Bharti AXA on Merger of General Insurance Business with ICICI Lombard,https://www.newsvoir.com/release/cyril-amarchand-mangaldas-advises-bharti-axa-on-merger-of-general-insurance-business-with-icici-lombard-14513.html
51,Vikas Multicorp Enters FMCG Segment; Plans Investment of Over Rs. 100 Cr.,https://www.newsvoir.com/release/vikas-multicorp-enters-fmcg-segment-plans-investment-of-over-rs-100-cr-14414.html
52,Cyril Amarchand Mangaldas Advises Editorji on Investment by RP-SG Group,https://www.newsvoir.com/release/cyril-amarchand-mangaldas-advises-editorji-on-investment-by-rp-sg-group-14206.html
53,Cyril Amarchand Mangaldas Advises QBE in Relation to Paytm's Acquisition of Raheja QBE General Insurance,https://www.newsvoir.com/release/cyril-amarchand-mangaldas-advises-qbe-in-relation-to-paytm-apos-s-acquisition-of-raheja-qbe-general-insurance-14162.html
54,Cyril Amarchand Mangaldas Advises ITC Limited (ITC) on Acquisition of 100% Stake in Sunrise Foods Private Limited,https://www.newsvoir.com/release/cyril-amarchand-mangaldas-advises-itc-limited-itc-on-acquisition-of-100-stake-in-sunrise-foods-private-limited-13919.html
55,Cyril Amarchand Mangaldas Advises Axis Bank on Acquisition of up to 30% Stake in Max Life,https://www.newsvoir.com/release/cyril-amarchand-mangaldas-advises-axis-bank-on-acquisition-of-up-to-30-stake-in-max-life-13887.html
56,Hero Electronix's Tessolve Acquires T&VS; Strengthens Chip Design Capabilities and Expands Market Footprint,https://www.newsvoir.com/release/hero-electronix-apos-s-tessolve-acquires-t-vs-strengthens-chip-design-capabilities-and-expands-market-footprint-13641.html
57,Mitsui Sumitomo to Acquire 21.87% Stake in Max Financial Services through a Share Swap,https://www.newsvoir.com/release/mitsui-sumitomo-to-acquire-21-87-stake-in-max-financial-services-through-a-share-swap-13550.html
58,Rattan Deep Singh Completes 10 Years with Alliances Galore,https://www.newsvoir.com/release/rattan-deep-singh-completes-10-years-with-alliances-galore-13540.html
59,JHS Retail to Exclusively Set up Patanjali Stores Across All Indian Airports,https://www.newsvoir.com/release/jhs-retail-to-exclusively-set-up-patanjali-stores-across-all-indian-airports-13460.html
60,"Max India Limited Reports Strong Q3FY2020 Financial Results; Max Healthcare’s EBITDA of 
Rs. 121 Cr., Grows 92%",https://www.newsvoir.com/release/max-india-limited-reports-strong-q3fy2020-financial-results-max-healthcare-s-ebitda-of-rs-121-cr-grows-92-13384.html
61,Nirma Group Announces the Acquisition of Emami Cement ,https://www.newsvoir.com/release/nirma-group-announces-the-acquisition-of-emami-cement-13374.html
62,"Tech Data Signs Definitive Agreement to Acquire the Business of Inflow Technologies
",https://www.newsvoir.com/release/tech-data-signs-definitive-agreement-to-acquire-the-business-of-inflow-technologies-13063.html
63,Manipal Global Academy of BFSI Partners with Sundaram Finance,https://www.newsvoir.com/release/manipal-global-academy-of-bfsi-partners-with-sundaram-finance-12927.html
64,"Max Financial Services H1FY20 Consolidated Revenue Grows 10% to Rs. 8,635 Cr.; Max Life Reports Strong Growth in Sales, Value of New Business and Margin ",https://www.newsvoir.com/release/max-financial-services-h1fy20-consolidated-revenue-grows-10-to-rs-8-635-cr-max-life-reports-strong-growth-in-sales-value-of-new-business-and-margin-12793.html
65,"Composite Merger Scheme Involving Radiant Life Care, Max Healthcare and Max India Gets 99% Minority Shareholders Approval",https://www.newsvoir.com/release/composite-merger-scheme-involving-radiant-life-care-max-healthcare-and-max-india-gets-99-minority-shareholders-approval-12779.html
66,Pebble and Vodafone-Idea Join Hands to Provide a One-stop Destination to Customers to Experience Innovative Mobile-related Products and Services,https://www.newsvoir.com/release/pebble-and-vodafone-idea-join-hands-to-provide-a-one-stop-destination-to-customers-to-experience-innovative-mobile-related-products-and-services-12392.html
67,"Max Financial Services Embedded Value at Rs. 9,314 Cr., Grows 22% y-o-y",https://www.newsvoir.com/release/max-financial-services-embedded-value-at-rs-9-314-cr-grows-22-y-o-y-12246.html
68,"Manipal Global Academy of BFSI Ties up with HomeFirst to Skill 500 Freshers
",https://www.newsvoir.com/release/manipal-global-academy-of-bfsi-ties-up-with-homefirst-to-skill-500-freshers-12169.html
69,SCIEX Announces Co-marketing Agreement with Elucidata to Break Down Barriers Faced by Metabolomics Researchers,https://www.newsvoir.com/release/sciex-announces-co-marketing-agreement-with-elucidata-to-break-down-barriers-faced-by-metabolomics-researchers-12029.html
70,DIACOLOR Acquires The Lion Emerald ‘The Inkalamu’,https://www.newsvoir.com/release/diacolor-acquires-the-lion-emerald-the-inkalamu--11974.html
71,Aditya Birla Fashion and Retail Announces its Foray into the Branded Ethnic Market through 100% Acquisition of Jaypore,https://www.newsvoir.com/release/aditya-birla-fashion-and-retail-announces-its-foray-into-the-branded-ethnic-market-through-100-acquisition-of-jaypore-11965.html
72,Eight Capital and Emso Join J.C. Flowers and Co.'s ARC in India,https://www.newsvoir.com/release/eight-capital-and-emso-join-j-c-flowers-and-co-s-arc-in-india-11908.html
73,Jackson Records Digital Merges its TVOD Platform ScreenPremiere with IBTN9 TV,https://www.newsvoir.com/release/jackson-records-digital-merges-its-tvod-platform-screenpremiere-with-ibtn9-tv-11879.html
74,Business Assets of TE4B Acquired by Version 1 to Enhance Global Delivery Model with Centre of Excellence in Bangalore,https://www.newsvoir.com/release/business-assets-of-te4b-acquired-by-version-1-to-enhance-global-delivery-model-with-centre-of-excellence-in-bangalore-11545.html
75,True North to Acquire Controlling Stake in Max Bupa Health Insurance from Max India,https://www.newsvoir.com/release/true-north-to-acquire-controlling-stake-in-max-bupa-health-insurance-from-max-india-11420.html
76,Schaeffler Successfully Completes Merger of Indian Entities,https://www.newsvoir.com/release/schaeffler-successfully-completes-merger-of-indian-entities-10869.html
77,IndiGrid Delivers Another Robust Quarter with EBITDA Up by 24%,https://www.newsvoir.com/release/indigrid-delivers-another-robust-quarter-with-ebitda-up-by-24-10848.html
78,PokerDangal Acquires PokerMet to Create India’s Fastest Growing Online Gaming Platform,https://www.newsvoir.com/release/pokerdangal-acquires-pokermet-to-create-india-s-fastest-growing-online-gaming-platform-10712.html
79,MovieChain Ties up with AYGL Group to Explore GCC Market,https://www.newsvoir.com/release/moviechain-ties-up-with-aygl-group-to-explore-gcc-market-10617.html
80,Elan Group Joins Hand with Mitsubishi,https://www.newsvoir.com/release/elan-group-joins-hand-with-mitsubishi-10614.html
81,"Ozone Enterprise Acquires 'Wallcam', Diversifies into the Fast Growing Security and Surveillance Business",https://www.newsvoir.com/release/ozone-enterprise-acquires-wallcam-diversifies-into-the-fast-growing-security-and-surveillance-business-10459.html
82,IndiGrid Q1 EBITDA up 9.9% Q-on-Q and Maintains FY19 DPU Guidance,https://www.newsvoir.com/release/indigrid-q1-ebitda-up-9-9-q-on-q-and-maintains-fy19-dpu-guidance-10453.html
83,Max Group Promoters Clarify Position on SEBI Order Regarding Consolidation of Shareholdings under Family Trust,https://www.newsvoir.com/release/max-group-promoters-clarify-position-on-sebi-order-regarding-consolidation-of-shareholdings-under-family-trust-10419.html
84,The Mosaic and Huddle Collaborate to Power-up the Startup Ecosystem,https://www.newsvoir.com/release/the-mosaic-and-huddle-collaborate-to-power-up-the-startup-ecosystem-10358.html
85,Millennium City's Realty May See a New Scenario by 2020s ,https://www.newsvoir.com/release/millennium-city-s-realty-may-see-a-new-scenario-by-2020s--10249.html
86,Sahil Vachani Appointed as Director on the Boards of Max Financial Services and Max Life Insurance ,https://www.newsvoir.com/release/sahil-vachani-appointed-as-director-on-the-boards-of-max-financial-services-and-max-life-insurance-10242.html
87,"Shardul Amarchand Mangaldas Advises Monsanto on Securing CCI Approval Relating to its 
USD 63 Billion Global Acquisition by Bayer AG
",https://www.newsvoir.com/release/shardul-amarchand-mangaldas-advises-monsanto-on-securing-cci-approval-relating-to-its-usd-63-billion-global-acquisition-by-bayer-ag-10224.html
88,"Shardul Amarchand Mangaldas Advises Walmart on Acquisition of Majority Stake in Flipkart for USD 16 Billion

",https://www.newsvoir.com/release/shardul-amarchand-mangaldas-advises-walmart-on-acquisition-of-majority-stake-in-flipkart-for-usd-16-billion-10169.html
89,"IndiGrid Q4FY18 Revenue up 16.8%  to 1,480 Million",https://www.newsvoir.com/release/indigrid-q4fy18-revenue-up-16-8-to-1-480-million-10120.html
90,"Former Tax Head of KPMG Indian Girish Vanvari Sets Up Boutique Tax, Regulatory and Business Advisory Firm Transaction Square",https://www.newsvoir.com/release/former-tax-head-of-kpmg-indian-girish-vanvari-sets-up-boutique-tax-regulatory-and-business-advisory-firm-transaction-square-10075.html
91,Shardul Amarchand Mangaldas Advises Neev Fund on Investment in Leap India Food & Logistics Private Limited Group,https://www.newsvoir.com/release/shardul-amarchand-mangaldas-advises-neev-fund-on-investment-in-leap-india-food-logistics-private-limited-group-10046.html
92,Shardul Amarchand Mangaldas Advises Tata Chemicals in Relation to the INR 123 Crore Acquisition of Precipitated Silica Business of Allied Silica ,https://www.newsvoir.com/release/shardul-amarchand-mangaldas-advises-tata-chemicals-in-relation-to-the-inr-123-crore-acquisition-of-precipitated-silica-business-of-allied-silica-10045.html
93,Shardul Amarchand Mangaldas Announces Partner Promotions,https://www.newsvoir.com/release/shardul-amarchand-mangaldas-announces-partner-promotions-10012.html
94,Shardul Amarchand Mangaldas Advises Blackstone Group on INR 4750 Crore Investment in Indiabulls Real Estate ,https://www.newsvoir.com/release/shardul-amarchand-mangaldas-advises-blackstone-group-on-inr-4750-crore-investment-in-indiabulls-real-estate-10006.html
95,Shardul Amarchand Mangaldas Advises Indiabulls Ventures on its INR 2000 Crore Rights Issue,https://www.newsvoir.com/release/shardul-amarchand-mangaldas-advises-indiabulls-ventures-on-its-inr-2000-crore-rights-issue-9995.html
96,Shardul Amarchand Mangaldas Advises Pepperfry in Raising INR 250 Crore in Fresh Funding Round from State Street Global Advisors,https://www.newsvoir.com/release/shardul-amarchand-mangaldas-advises-pepperfry-in-raising-inr-250-crore-in-fresh-funding-round-from-state-street-global-advisors-9956.html
97,Shardul Amarchand Mangaldas Wins Inaugural Edition of Suresh and Bharati Shroff Memorial T20 Cricket League ,https://www.newsvoir.com/release/shardul-amarchand-mangaldas-wins-inaugural-edition-of-suresh-and-bharati-shroff-memorial-t20-cricket-league-9946.html
98,Jivi Mobile Launches Cheapest 4g Volte Smart Phone in India at Effective Price of INR 699 Only ,https://www.newsvoir.com/release/jivi-mobile-launches-cheapest-4g-volte-smart-phone-in-india-at-effective-price-of-inr-699-only-9843.html
99,Shardul Amarchand Mangaldas Advises ONGC in Acquisition of 51.11% Shares of HPCL from the President of India,https://www.newsvoir.com/release/shardul-amarchand-mangaldas-advises-ongc-in-acquisition-of-51-11-shares-of-hpcl-from-the-president-of-india-9834.html
100,Shardul Amarchand Mangaldas Advised Emami Limited in Acquisition of 26% Stake in Brillare Science Private Limited,https://www.newsvoir.com/release/shardul-amarchand-mangaldas-advised-emami-limited-in-acquisition-of-26-stake-in-brillare-science-private-limited-9793.html
101,Inaugural Edition of Suresh and Bharati Shroff Memorial T20 Cricket League gets Underway,https://www.newsvoir.com/release/inaugural-edition-of-suresh-and-bharati-shroff-memorial-t20-cricket-league-gets-underway-9787.html
102,Shardul Amarchand Mangaldas Advises Newgen Software Technologies in Relation to its INR 425 Crore IPO,https://www.newsvoir.com/release/shardul-amarchand-mangaldas-advises-newgen-software-technologies-in-relation-to-its-inr-425-crore-ipo-9783.html
103,Shardul Amarchand Mangaldas Advises Colfax Corporation on Acquisition of the Welding Wire Business of Sandvik Asia Private Limited,https://www.newsvoir.com/release/shardul-amarchand-mangaldas-advises-colfax-corporation-on-acquisition-of-the-welding-wire-business-of-sandvik-asia-private-limited-9778.html
104,Vodafone CEO Compliments Indian Government for Marked Improvement in ease of doing Business ,https://www.newsvoir.com/release/vodafone-ceo-compliments-indian-government-for-marked-improvement-in-ease-of-doing-business-9741.html
105,Shardul Amarchand Mangaldas Presents Suresh and Bharati Shroff Memorial T20 Cricket League to Mark 100 Years Amarchand Mangaldas,https://www.newsvoir.com/release/shardul-amarchand-mangaldas-presents-suresh-and-bharati-shroff-memorial-t20-cricket-league-to-mark-100-years-amarchand-mangaldas-9733.html
106,Shardul Amarchand Mangaldas Advises on Establishment of USD 1.5 Billion Secured Euro Medium Term Note Programme of Indiabulls Housing Finance,https://www.newsvoir.com/release/shardul-amarchand-mangaldas-advises-on-establishment-of-usd-1-5-billion-secured-euro-medium-term-note-programme-of-indiabulls-housing-finance-9694.html
107,Alexander Mann Solutions Partners with FlexAbility India (RPO Division of ABC Consultants),https://www.newsvoir.com/release/alexander-mann-solutions-partners-with-flexability-india-rpo-division-of-abc-consultants-9681.html
108,Shardul Amarchand Mangaldas Advises Visionary RCM Infotech on Investment by Carlyle Group,https://www.newsvoir.com/release/shardul-amarchand-mangaldas-advises-visionary-rcm-infotech-on-investment-by-carlyle-group-9648.html
109,"Shardul Amarchand Mangaldas Advises PVR Limited on Strategic Partnership with iPic-Gold Class Entertainment, LLC",https://www.newsvoir.com/release/shardul-amarchand-mangaldas-advises-pvr-limited-on-strategic-partnership-with-ipic-gold-class-entertainment-llc-9562.html
110,Shardul Amarchand Mangaldas Advises Eris Life Sciences on Acquisition of India Business of Strides Shasun,https://www.newsvoir.com/release/shardul-amarchand-mangaldas-advises-eris-life-sciences-on-acquisition-of-india-business-of-strides-shasun-9517.html
111,Shardul Amarchand Mangaldas Advises Agrium and PotashCorp on CCI Approval of their USD 36 Billion Global Merger,https://www.newsvoir.com/release/shardul-amarchand-mangaldas-advises-agrium-and-potashcorp-on-cci-approval-of-their-usd-36-billion-global-merger-9445.html
