,title,link
112,Shardul Amarchand Mangaldas Advises Zee Entertainment Enterprises Limited on Acquisition of 9X Media,https://www.newsvoir.com/release/shardul-amarchand-mangaldas-advises-zee-entertainment-enterprises-limited-on-acquisition-of-9x-media-9327.html
113,Shardul Amarchand Mangaldas Crosses 100 Partners in its Centenary Year After Partner Promotions,https://www.newsvoir.com/release/shardul-amarchand-mangaldas-crosses-100-partners-in-its-centenary-year-after-partner-promotions-9311.html
114,Shardul Amarchand Mangaldas Advises JM Financial Products on Investment in Vendiman,https://www.newsvoir.com/release/shardul-amarchand-mangaldas-advises-jm-financial-products-on-investment-in-vendiman-9249.html
115,Shardul Amarchand Mangaldas Advises Jang Capital on Acquisition of a Minority Stake in Haida Technologies Private Limited,https://www.newsvoir.com/release/shardul-amarchand-mangaldas-advises-jang-capital-on-acquisition-of-a-minority-stake-in-haida-technologies-private-limited-9190.html
116,ANAROCK Property Consultants Acquires Leading Real Estate Broking Firm LJ Hooker’s Indian Operations - Redwoods,https://www.newsvoir.com/release/anarock-property-consultants-acquires-leading-real-estate-broking-firm-lj-hooker-s-indian-operations---redwoods-9151.html
117,Shardul Amarchand Mangaldas Advises in Relation to Acquisition of Preferred Brands International by Mars International,https://www.newsvoir.com/release/shardul-amarchand-mangaldas-advises-in-relation-to-acquisition-of-preferred-brands-international-by-mars-international-9107.html
118,Shardul Amarchand Mangaldas Welcomes Veena Sivaramakrishnan as Partner,https://www.newsvoir.com/release/shardul-amarchand-mangaldas-welcomes-veena-sivaramakrishnan-as-partner-9050.html
119,"ItzCash, Parent Ebix Inc. Commit a US$ 100 mn for Investments & Acquisitions",https://www.newsvoir.com/release/itzcash-parent-ebix-inc-commit-a-us-100-mn-for-investments-acquisitions-9018.html
120,Shardul Amarchand Mangaldas Advises GE on Sale of its Stake in the Indian Cards Business,https://www.newsvoir.com/release/shardul-amarchand-mangaldas-advises-ge-on-sale-of-its-stake-in-the-indian-cards-business-9010.html
121,Competition Commission of India Approves Vodafone-Idea Merger,https://www.newsvoir.com/release/competition-commission-of-india-approves-vodafone-idea-merger-9005.html
122,Shardul Amarchand Mangaldas Appoints Raghubir Menon as Regional Practice Head – M&A & Private Equity,https://www.newsvoir.com/release/shardul-amarchand-mangaldas-appoints-raghubir-menon-as-regional-practice-head-m-a-private-equity-8973.html
123,Shardul Amarchand Mangaldas Advises Capstone Polyweave on Strategic Partnership with Intertape Polymer Group,https://www.newsvoir.com/release/shardul-amarchand-mangaldas-advises-capstone-polyweave-on-strategic-partnership-with-intertape-polymer-group-8850.html
124,"Shardul Amarchand Mangaldas Announces Shuva Mandal, Partner, National Practice Head to Join TATA Group",https://www.newsvoir.com/release/shardul-amarchand-mangaldas-announces-shuva-mandal-partner-national-practice-head-to-join-tata-group-8735.html
125,Shardul Amarchand Mangaldas & Co. Advises HP on CCI Approval for Acquisition of Global Printer Business of Samsung Electronics ,https://www.newsvoir.com/release/shardul-amarchand-mangaldas-co-advises-hp-on-cci-approval-for-acquisition-of-global-printer-business-of-samsung-electronics-8718.html
126,Shardul Amarchand Mangaldas & Co. Advises in Relation to Rs. 729 Crore IPO of S Chand And Company,https://www.newsvoir.com/release/shardul-amarchand-mangaldas-co-advises-in-relation-to-rs-729-crore-ipo-of-s-chand-and-company-8696.html
127,Shardul Amarchand Mangaldas & Co. Advises Videocon d2H on Merger with Dish TV ,https://www.newsvoir.com/release/shardul-amarchand-mangaldas-co-advises-videocon-d2h-on-merger-with-dish-tv-8673.html
128,RSDC and B. S. Abdur Rahman Crescent University Join Hands for Programmes in Rubber Technology,https://www.newsvoir.com/release/rsdc-and-b-s-abdur-rahman-crescent-university-join-hands-for-programmes-in-rubber-technology-8636.html
129,Shardul Amarchand Mangaldas gives a Strategic Boost to its Corporate Practice,https://www.newsvoir.com/release/shardul-amarchand-mangaldas-gives-a-strategic-boost-to-its-corporate-practice-8592.html
130,"Accenture Completes Acquisition of iDefense Security Intelligence Services, Expands Ability to Provide Clients with Faster, More Complete Threat Intelligence ",https://www.newsvoir.com/release/accenture-completes-acquisition-of-idefense-security-intelligence-services-expands-ability-to-provide-clients-with-faster-more-complete-threat-intelligence-8493.html
131,"RSDC, Hindustan University tie-up for Skilling in Rubber ",https://www.newsvoir.com/release/rsdc-hindustan-university-tie-up-for-skilling-in-rubber-8172.html
132,Shardul Amarchand Mangaldas & Co Advises General Motors on Acquisition of 9.2% Shares from SAIC Motor HK Investment Limited,https://www.newsvoir.com/release/shardul-amarchand-mangaldas-co-advises-general-motors-on-acquisition-of-9-2-shares-from-saic-motor-hk-investment-limited-8131.html
133,Shardul Amarchand Mangaldas & Co. Successfully Represents Ashok Leyland and Hinduja Foundries before CCI ,https://www.newsvoir.com/release/shardul-amarchand-mangaldas-co-successfully-represents-ashok-leyland-and-hinduja-foundries-before-cci-7978.html
134,YES SECURITIES Acts as Exclusive Advisor to Fonroche Energie SAS for Sale of 22.3 MW Solar Projects in Rajasthan  ,https://www.newsvoir.com/release/yes-securities-acts-as-exclusive-advisor-to-fonroche-energie-sas-for-sale-of-22-3-mw-solar-projects-in-rajasthan-7954.html
135,Shardul Amarchand Mangaldas & Co. Advises on Rs. 450 Cr (USD 65 Mn) Investment by IFC in Apollo Health and Lifestyle Limited ,https://www.newsvoir.com/release/shardul-amarchand-mangaldas-co-advises-on-rs-450-cr-usd-65-mn-investment-by-ifc-in-apollo-health-and-lifestyle-limited-7915.html
136,KROHNE MARSHALL Expands Pune Operations,https://www.newsvoir.com/release/krohne-marshall-expands-pune-operations-7807.html
137,Shardul Amarchand Mangaldas & Co. Advises in Relation to the Rs. 2200 Crore OFS of NBCC (India) Limited,https://www.newsvoir.com/release/shardul-amarchand-mangaldas-co-advises-in-relation-to-the-rs-2200-crore-ofs-of-nbcc-india-limited-7725.html
138,HDFC ERGO Enters into a Tie-Up with Maruti Insurance to Offer Motor Insurance to the Buyers of Maruti Suzuki,https://www.newsvoir.com/release/hdfc-ergo-enters-into-a-tie-up-with-maruti-insurance-to-offer-motor-insurance-to-the-buyers-of-maruti-suzuki-7676.html
139,Shardul Amarchand Mangaldas & Co. Acts for Sistema Shyam TeleServices Ltd. in Relation to Structured Transfer of Business to Reliance Communications Limited,https://www.newsvoir.com/release/shardul-amarchand-mangaldas-co-acts-for-sistema-shyam-teleservices-ltd-in-relation-to-structured-transfer-of-business-to-reliance-communications-limited-7609.html
140,Shardul Amarchand Mangaldas & Co. Advises on Acquisition of AWS Truepower India,https://www.newsvoir.com/release/shardul-amarchand-mangaldas-co-advises-on-acquisition-of-aws-truepower-india-7564.html
141,SRam & MRam Ltd. (UK) and Kalam Media Forge $100 Million (Rs.670 crore) Joint Venture to form SRam & MRam Kalam Media Pvt. Ltd.,https://www.newsvoir.com/release/sram-mram-ltd-uk-and-kalam-media-forge-100-million-rs-670-crore-joint-venture-to-form-sram-mram-kalam-media-pvt-ltd-7515.html
142,Essel Propack to Acquire 100% Stake in Essel Deutschland Germany,https://www.newsvoir.com/release/essel-propack-to-acquire-100-stake-in-essel-deutschland-germany-7498.html
143,LeEco Partners with Reliance Jio for its “Jio Welcome Offer”,https://www.newsvoir.com/release/leeco-partners-with-reliance-jio-for-its-jio-welcome-offer--7454.html
144,PayU & Citrus Pay Agree to a $130M Landmark Deal in Indian Fintech,https://www.newsvoir.com/release/payu-citrus-pay-agree-to-a-130m-landmark-deal-in-indian-fintech-7452.html
145,"Infosys and PGIMER, Chandigarh, Sign MoU to Develop Remote Patient Monitoring Solution",https://www.newsvoir.com/release/infosys-and-pgimer-chandigarh-sign-mou-to-develop-remote-patient-monitoring-solution-7415.html
146,Tata Sons and Tata Companies Tie up with World’s Top Universities to Develop Breakthrough Technologies,https://www.newsvoir.com/release/tata-sons-and-tata-companies-tie-up-with-world-s-top-universities-to-develop-breakthrough-technologies-7357.html
147,"Department of School & Mass Education, Govt. of Odisha and Wadhwani Foundation’s Skills Development Network Sign MoU to Make Odisha a Leader in ‘Smart State’ Initiative",https://www.newsvoir.com/release/department-of-school-mass-education-govt-of-odisha-and-wadhwani-foundation-s-skills-development-network-sign-mou-to-make-odisha-a-leader-in-smart-state-initiative-7352.html
148,"Allcargo Announces Joint Venture with CCI Logistics Group, Forms Avvashya CCI Logistics Pvt. Ltd",https://www.newsvoir.com/release/allcargo-announces-joint-venture-with-cci-logistics-group-forms-avvashya-cci-logistics-pvt-ltd-7340.html
149,Gulf Petrochem to Distribute GP Petroleums IPOL in UAE & Oman,https://www.newsvoir.com/release/gulf-petrochem-to-distribute-gp-petroleums-ipol-in-uae-oman-7318.html
150,"Unilever Acquires Blueair, will Help Millions More People Fight Rising Urban Air Pollution by Creating Safer Indoor Environments",https://www.newsvoir.com/release/unilever-acquires-blueair-will-help-millions-more-people-fight-rising-urban-air-pollution-by-creating-safer-indoor-environments-7283.html
151,HDFC Life and Max Life to Merge their Life Insurance Businesses,https://www.newsvoir.com/release/hdfc-life-and-max-life-to-merge-their-life-insurance-businesses-7238.html
152,"Shardul Amarchand Mangaldas & Co. Advises TPG on its Acquisition of Majority Stake 
in Rhea Healthcare
",https://www.newsvoir.com/release/shardul-amarchand-mangaldas-co-advises-tpg-on-its-acquisition-of-majority-stake-in-rhea-healthcare-7153.html
153,"Teradata Acquires Big Data Partnership Consultancy, Expands open Source Analytics Services",https://www.newsvoir.com/release/teradata-acquires-big-data-partnership-consultancy-expands-open-source-analytics-services-7149.html
154,Shardul Amarchand Mangaldas & Co. Advises Future Consumer Enterprises on Rs. 134 Cr. Private Equity Investment by IFC,https://www.newsvoir.com/release/shardul-amarchand-mangaldas-co-advises-future-consumer-enterprises-on-rs-134-cr-private-equity-investment-by-ifc-7025.html
155,Corrected and Reissued: Shardul Amarchand Mangaldas & Co Advises Uber on Vehicle Purchase and Financing Arrangement with Tata Group,https://www.newsvoir.com/release/corrected-and-reissued-shardul-amarchand-mangaldas-co-advises-uber-on-vehicle-purchase-and-financing-arrangement-with-tata-group-6947.html
156,Eros International Forms Strategic Partnership with Vashu Bhagnani’s Puja Entertainment & Films Ltd,https://www.newsvoir.com/release/eros-international-forms-strategic-partnership-with-vashu-bhagnani-s-puja-entertainment-films-ltd-6931.html
157,Gaia Smart Cities Acquires IoT Division of netCORE Solutions,https://www.newsvoir.com/release/gaia-smart-cities-acquires-iot-division-of-netcore-solutions-6888.html
158,SBI Becomes the Top Merchant Acquiring Bank in the Country,https://www.newsvoir.com/release/sbi-becomes-the-top-merchant-acquiring-bank-in-the-country-6813.html
159,IFFCO Stand on Price Negotiations of Phos Acid for FY 2016,https://www.newsvoir.com/release/iffco-stand-on-price-negotiations-of-phos-acid-for-fy-2016-6807.html
160,Shardul Amarchand Mangaldas & Co. Advises on the First Indirect Acquisition Cum Delisting Proposal in India ,https://www.newsvoir.com/release/shardul-amarchand-mangaldas-co-advises-on-the-first-indirect-acquisition-cum-delisting-proposal-in-india-6690.html
161,IFC Leads Rs. 400 Crores Series D Investment in Lenskart to Expand Access to High-Quality Eyewear in India,https://www.newsvoir.com/release/ifc-leads-rs-400-crores-series-d-investment-in-lenskart-to-expand-access-to-high-quality-eyewear-in-india-6671.html
162,NEC and DMIC Trust Establish Joint Venture to Provide Logistics Visualization Services in India,https://www.newsvoir.com/release/nec-and-dmic-trust-establish-joint-venture-to-provide-logistics-visualization-services-in-india-6626.html
163,"Infosys Foundation Invests in Cancer Research through Fellowships at Tata Memorial Centre, Mumbai",https://www.newsvoir.com/release/infosys-foundation-invests-in-cancer-research-through-fellowships-at-tata-memorial-centre-mumbai-6610.html
164,Tata Sons Increases Stake in Air Asia India,https://www.newsvoir.com/release/tata-sons-increases-stake-in-air-asia-india-6445.html
165,Lenovo and Juniper Networks Announce Global Partnership,https://www.newsvoir.com/release/lenovo-and-juniper-networks-announce-global-partnership-6346.html
166,Shardul Amarchand Mangaldas Advises SUEZ on its Acquisition of Driplex Water Engineering,https://www.newsvoir.com/release/shardul-amarchand-mangaldas-advises-suez-on-its-acquisition-of-driplex-water-engineering-6338.html
167,Cox & Kings Partners with RBL Bank to Make Holidays Affordable ,https://www.newsvoir.com/release/cox-kings-partners-with-rbl-bank-to-make-holidays-affordable-6318.html
168,Gaia Smart Cities and Stream Sign a Collaboration Agreement for Smart Cities Network Across India,https://www.newsvoir.com/release/gaia-smart-cities-and-stream-sign-a-collaboration-agreement-for-smart-cities-network-across-india-6314.html
169,Gaia Smart Cities and Advantech Announce Strategic Alliance for India and SAARC Region,https://www.newsvoir.com/release/gaia-smart-cities-and-advantech-announce-strategic-alliance-for-india-and-saarc-region-6219.html
170,YES Bank Ties-up with Ultracash Technologies to Enable Sound Based Proximity Payments,https://www.newsvoir.com/release/yes-bank-ties-up-with-ultracash-technologies-to-enable-sound-based-proximity-payments-6178.html
171,"Tata Power Innovates with Toshiba and Cargill, to Design and Develop India’s First Pad Mount Substation",https://www.newsvoir.com/release/tata-power-innovates-with-toshiba-and-cargill-to-design-and-develop-india-s-first-pad-mount-substation-6140.html
172,Indian Institutions and Ontario Delegates Sign 16 New Agreements,https://www.newsvoir.com/release/indian-institutions-and-ontario-delegates-sign-16-new-agreements-6103.html
173,SBI Announces Partnership with Thomas Cook India,https://www.newsvoir.com/release/sbi-announces-partnership-with-thomas-cook-india-6091.html
174,Infogain Completes Acquisition of Blue Star Infotech’s IT Operations,https://www.newsvoir.com/release/infogain-completes-acquisition-of-blue-star-infotech-s-it-operations-6070.html
175,Godrej Takes Majority Stake of 51% in India Circus,https://www.newsvoir.com/release/godrej-takes-majority-stake-of-51-in-india-circus-6014.html
176,Jet Airways and Bangkok Airways Enter into Frequent Flier Partnership,https://www.newsvoir.com/release/jet-airways-and-bangkok-airways-enter-into-frequent-flier-partnership-5999.html
177,"SAM & Co Advises on 55% Stake Sale in Bright Power Project to Texmaco Rail & Engineering Limited 
",https://www.newsvoir.com/release/sam-co-advises-on-55-stake-sale-in-bright-power-project-to-texmaco-rail-engineering-limited-5976.html
178,"Steel Exchange of India (SEIL) Signs MOU with Government of Andhra Pradesh
",https://www.newsvoir.com/release/steel-exchange-of-india-seil-signs-mou-with-government-of-andhra-pradesh-5977.html
179,Shriram Automall Inks Tie-Up with Bank of India for Ranchi Zone,https://www.newsvoir.com/release/shriram-automall-inks-tie-up-with-bank-of-india-for-ranchi-zone-5973.html
180,Prestige Estates to Buyout Foreign Investor from Exora Business Park,https://www.newsvoir.com/release/prestige-estates-to-buyout-foreign-investor-from-exora-business-park-5877.html
181,Godrej Agrovet Forays into Dairy Business,https://www.newsvoir.com/release/godrej-agrovet-forays-into-dairy-business-5863.html
182,"SAM & Co Advises on India Leg of the GBP 480 Million 
              Acquisition of Xchanging plc by   
CSC Computer Sciences International Operations Limited

",https://www.newsvoir.com/release/sam-co-advises-on-india-leg-of-the-gbp-480-million-acquisition-of-xchanging-plc-by-csc-computer-sciences-international-operations-limited-5840.html
183,Reliance Infrastructure Proceeds to Complete the Acquisition of Pipavav Defence and Offshore Engineering Company Limited,https://www.newsvoir.com/release/reliance-infrastructure-proceeds-to-complete-the-acquisition-of-pipavav-defence-and-offshore-engineering-company-limited-5678.html
184,Apollo Tyres Acquires Reifencom GmbH for Euro 45.6 Million,https://www.newsvoir.com/release/apollo-tyres-acquires-reifencom-gmbh-for-euro-45-6-million-5675.html
185,Infosys to Acquire Noah Consulting for US$70 Million,https://www.newsvoir.com/release/infosys-to-acquire-noah-consulting-for-us-70-million-5527.html
186,Cox & Kings Acquires LateRooms from TUI Group,https://www.newsvoir.com/release/cox-kings-acquires-laterooms-from-tui-group-5495.html
187,NexGTv Collaborates with Viacom18 Motion Pictures for CineShorts 2,https://www.newsvoir.com/release/nexgtv-collaborates-with-viacom18-motion-pictures-for-cineshorts-2-5430.html
188,Shardul Amarchand Mangaldas & Co Advises ChrysCapital Backed Infogain Corporation and Infogain India on their Acquisition of Blue Star Infotech’s Information Technology Business,https://www.newsvoir.com/release/shardul-amarchand-mangaldas-co-advises-chryscapital-backed-infogain-corporation-and-infogain-india-on-their-acquisition-of-blue-star-infotech-s-information-technology-business-5423.html
189,Mebelkart Acquires 53central.com,https://www.newsvoir.com/release/mebelkart-acquires-53central-com-5393.html
190,Shardul Amarchand Mangaldas & Co Advises on Acquisition of Pizza Hut’s South and West India Franchise,https://www.newsvoir.com/release/shardul-amarchand-mangaldas-co-advises-on-acquisition-of-pizza-hut-s-south-and-west-india-franchise-5335.html
191,New Call Telecom gets Approval to Acquire Ozone Networks by FIPB,https://www.newsvoir.com/release/new-call-telecom-gets-approval-to-acquire-ozone-networks-by-fipb-5315.html
192,Reward Gateway Enters Partnership with Vantage Circle to Provide Employee Privileges to Clients in India,https://www.newsvoir.com/release/reward-gateway-enters-partnership-with-vantage-circle-to-provide-employee-privileges-to-clients-in-india-5274.html
193,Jet Lite to Merge with Jet Airways,https://www.newsvoir.com/release/jet-lite-to-merge-with-jet-airways-5227.html
194,Dineout to Provide End-to-end Restaurant Management Solution: Acquires inResto,https://www.newsvoir.com/release/dineout-to-provide-end-to-end-restaurant-management-solution-acquires-inresto-5204.html
195,Shardul Amarchand Mangaldas & Co. Advises on Acquisition of Controlling Stake in Involute Technologies Pvt. Ltd. by BMT Group,https://www.newsvoir.com/release/shardul-amarchand-mangaldas-co-advises-on-acquisition-of-controlling-stake-in-involute-technologies-pvt-ltd-by-bmt-group-5162.html
196,Symphony Ltd Announces Acquisition of Chinese Air Cooler Company ,https://www.newsvoir.com/release/symphony-ltd-announces-acquisition-of-chinese-air-cooler-company-5077.html
197,IDBI Bank Executes Agreement with MUDRA for Refinance under PMMY,https://www.newsvoir.com/release/idbi-bank-executes-agreement-with-mudra-for-refinance-under-pmmy-4769.html
198,Cedar Management Consulting Acquires IBS Publishing,https://www.newsvoir.com/release/cedar-management-consulting-acquires-ibs-publishing-4735.html
199,Amadeus to Acquire Navitaire from Accenture for US$830 Million; Amadeus and Accenture to Form Alliance to Focus on Digital Services for Airline Passengers,https://www.newsvoir.com/release/amadeus-to-acquire-navitaire-from-accenture-for-us-830-million-amadeus-and-accenture-to-form-alliance-to-focus-on-digital-services-for-airline-passengers-4733.html
200,Bharti Joins OneWeb’s Mission to Build a New Global Communications System to Provide Affordable Internet Access for All,https://www.newsvoir.com/release/bharti-joins-oneweb-s-mission-to-build-a-new-global-communications-system-to-provide-affordable-internet-access-for-all-4669.html
201,1mg.com Acquires Homeobuy.com; Major Expansion Plans on the Cards,https://www.newsvoir.com/release/1mg-com-acquires-homeobuy-com-major-expansion-plans-on-the-cards-4658.html
202,JetPrivilege Announces Frequent Flyer Agreement With Air Seychelles,https://www.newsvoir.com/release/jetprivilege-announces-frequent-flyer-agreement-with-air-seychelles-4618.html
203,Tata Teleservices Subsidiary mRupee and Manappuram Finance Announce Tie Up,https://www.newsvoir.com/release/tata-teleservices-subsidiary-mrupee-and-manappuram-finance-announce-tie-up-4453.html
204,"Indian Unicorns will Continue to Strengthen Through Acquisitions in Mobile, Marketplaces & Data Sciences ",https://www.newsvoir.com/release/indian-unicorns-will-continue-to-strengthen-through-acquisitions-in-mobile-marketplaces-data-sciences-4442.html
205,TCS Partners with Red Hat to Provide OpenStack-Based NFV Orchestration and Test Solution,https://www.newsvoir.com/release/tcs-partners-with-red-hat-to-provide-openstack-based-nfv-orchestration-and-test-solution-4379.html
206,Jet Airways and Air Seychelles Unveil Codeshare Partnership ,https://www.newsvoir.com/release/jet-airways-and-air-seychelles-unveil-codeshare-partnership-4156.html
207,BOM – UIIC Team up for Prime Minister Suraksha Bima Yojana (PMSBY),https://www.newsvoir.com/release/bom-uiic-team-up-for-prime-minister-suraksha-bima-yojana-pmsby--4009.html
208,Surana Telecom Acquires Arhyama Energy Private Limited ,https://www.newsvoir.com/release/surana-telecom-acquires-arhyama-energy-private-limited-3935.html
209,Sah Petroleums Becomes GP Petroleums Ltd.,https://www.newsvoir.com/release/sah-petroleums-becomes-gp-petroleums-ltd-3917.html
210,Shriram Automall Signs an Agreement with Corporation Bank,https://www.newsvoir.com/release/shriram-automall-signs-an-agreement-with-corporation-bank-3549.html
211,"Samsonite Strengthens its Global Retail Presence with Acquisition of Travel Retail Specialist Rolling Luggage
",https://www.newsvoir.com/release/samsonite-strengthens-its-global-retail-presence-with-acquisition-of-travel-retail-specialist-rolling-luggage-3420.html
212,Lakshmi Vilas Bank Enters into Strategic Alliance with NCML,https://www.newsvoir.com/release/lakshmi-vilas-bank-enters-into-strategic-alliance-with-ncml-3351.html
213,RInfra Signs MoU with US Based Innovari Inc. to Expand Automatic Demand Side Management (ADSM),https://www.newsvoir.com/release/rinfra-signs-mou-with-us-based-innovari-inc-to-expand-automatic-demand-side-management-adsm-3331.html
214,Exim Bank of India Signs MOC with All India Artisans and Craft Workers Welfare Association (AIACA),https://www.newsvoir.com/release/exim-bank-of-india-signs-moc-with-all-india-artisans-and-craft-workers-welfare-association-aiaca-3303.html
215,Network 18 Signs MoU with Commits under its Media Institute Initiative (MII),https://www.newsvoir.com/release/network-18-signs-mou-with-commits-under-its-media-institute-initiative-mii-3166.html
216,IndusInd Bank Announces the Launch of Chelsea FC Co-Brand Credit Card,https://www.newsvoir.com/release/indusind-bank-announces-the-launch-of-chelsea-fc-co-brand-credit-card-3081.html
217,ACCA Awards Pearson VUE Contract for Future Delivery of F5-F9 Computer Based Exams,https://www.newsvoir.com/release/acca-awards-pearson-vue-contract-for-future-delivery-of-f5-f9-computer-based-exams-3063.html
218,ErosNow Announces Tie-up with RailTel,https://www.newsvoir.com/release/erosnow-announces-tie-up-with-railtel-3059.html
219,Spice Group Furthers the Government’s Make in India Campaign; Announces an Investment of Rs 500 Crores to Build Manufacturing Unit in UP,https://www.newsvoir.com/release/spice-group-furthers-the-government-s-make-in-india-campaign-announces-an-investment-of-rs-500-crores-to-build-manufacturing-unit-in-up-3050.html
220,Mahindra Two Wheelers And Peugeot Motocycles Complete Strategic Partnership,https://www.newsvoir.com/release/mahindra-two-wheelers-and-peugeot-motocycles-complete-strategic-partnership-2979.html
221,Tata AIA Life and Citibank Partner to Serve Insurance Needs of Over 18.4 Million Households in India,https://www.newsvoir.com/release/tata-aia-life-and-citibank-partner-to-serve-insurance-needs-of-over-18-4-million-households-in-india-2975.html
222,"RSLDC and BSEI Sign MOU in Presence of CM, Rajasthan for Skill and Enterprise Development",https://www.newsvoir.com/release/rsldc-and-bsei-sign-mou-in-presence-of-cm-rajasthan-for-skill-and-enterprise-development-2962.html
223,Mphasis Collaborates with Aureus Analytics to Provide Big Data Analytics Solutions,https://www.newsvoir.com/release/mphasis-collaborates-with-aureus-analytics-to-provide-big-data-analytics-solutions-2954.html
224,SAMIL Signs an MOU with CLAAS Agricultural Machinery Private Limited (CAMPL),https://www.newsvoir.com/release/samil-signs-an-mou-with-claas-agricultural-machinery-private-limited-campl-2923.html
225,Rentrak Partners with Leading Indian Film Studio Eros International for Box Office Reporting,https://www.newsvoir.com/release/rentrak-partners-with-leading-indian-film-studio-eros-international-for-box-office-reporting-2828.html
226,Aircel Chennai Open Announces Partnership with Casa Grande,https://www.newsvoir.com/release/aircel-chennai-open-announces-partnership-with-casa-grande-2787.html
227,Amadeus Travel Agencies to Enjoy Full Altéa Benefits of Vistara Distribution Agreement,https://www.newsvoir.com/release/amadeus-travel-agencies-to-enjoy-full-alt-a-benefits-of-vistara-distribution-agreement-2748.html
228,APM Terminals Pipavav and NYK Auto Logistics (India) Creating RoRo Facility,https://www.newsvoir.com/release/apm-terminals-pipavav-and-nyk-auto-logistics-india-creating-roro-facility-2722.html
