,title,link
377,AlphaCorp Welcomes Festive Season with Great Deals for Alpha International City and MeerutOne,https://www.newsvoir.com/release/alphacorp-welcomes-festive-season-with-great-deals-for-alpha-international-city-and-meerutone-12454.html
378,Investors Clinic Rewards its Key Performing Employees with Gifts Worth INR 6 Crore ,https://www.newsvoir.com/release/investors-clinic-rewards-its-key-performing-employees-with-gifts-worth-inr-6-crore-12448.html
379,Max Group’s Real Estate Business Debut Wins Award for Environment Friendliness,https://www.newsvoir.com/release/max-group-s-real-estate-business-debut-wins-award-for-environment-friendliness-12446.html
380,Magicbricks is India’s First Real Estate Portal to Become a Superbrand,https://www.newsvoir.com/release/magicbricks-is-india-s-first-real-estate-portal-to-become-a-superbrand-12438.html
381,Columbia Pacific Communities Launches India’s First Senior Living Community Designed to International Standards,https://www.newsvoir.com/release/columbia-pacific-communities-launches-india-s-first-senior-living-community-designed-to-international-standards-12435.html
382,Deputy Chief Minister Mr. O. Panneerselvam Inaugurates the Club House of RMK Chola Gardens,https://www.newsvoir.com/release/deputy-chief-minister-mr-o-panneerselvam-inaugurates-the-club-house-of-rmk-chola-gardens-12424.html
383,Mahagun Adjudged Developer of the Year - North India at International Brand Equity Award,https://www.newsvoir.com/release/mahagun-adjudged-developer-of-the-year-north-india-at-international-brand-equity-award-12394.html
384,BBG Bangaru Talli Charitable Trust (BTCT) has Successfully Completed Empowerment of Over 5000 Girl Children through Various Educational Initiatives,https://www.newsvoir.com/release/bbg-bangaru-talli-charitable-trust-btct-has-successfully-completed-empowerment-of-over-5000-girl-children-through-various-educational-initiatives-12364.html
385,Commercial Segment Clocks Healthy Growth in Delhi-NCR,https://www.newsvoir.com/release/commercial-segment-clocks-healthy-growth-in-delhi-ncr-12357.html
386,MQDC Enters India Market with ‘Whizdom Club’ in New Delhi,https://www.newsvoir.com/release/mqdc-enters-india-market-with-whizdom-club-in-new-delhi-12344.html
387,"Vivarea, by K Raheja Corp, Now a Pentacle in Mumbai’s Skyline",https://www.newsvoir.com/release/vivarea-by-k-raheja-corp-now-a-pentacle-in-mumbai-s-skyline-12329.html
388,Shriram Properties Launches Phase II of Shriram 107 South East; Codename Dil Chahta hai Dobara,https://www.newsvoir.com/release/shriram-properties-launches-phase-ii-of-shriram-107-south-east-codename-dil-chahta-hai-dobara-12335.html
389,Bhutani Group Wins Top Honours at Estate Awards 2019,https://www.newsvoir.com/release/bhutani-group-wins-top-honours-at-estate-awards-2019-12334.html
390,MRG World Honoured at 11th Annual Estate Awards,https://www.newsvoir.com/release/mrg-world-honoured-at-11th-annual-estate-awards-12328.html
391,BBG Charitable Trust Believes in the Right to Education for Every Girl Child,https://www.newsvoir.com/release/bbg-charitable-trust-believes-in-the-right-to-education-for-every-girl-child-12293.html
392,"Sowparnika Launches ‘Spandan’, a Positive Homes Project in Coimbatore ",https://www.newsvoir.com/release/sowparnika-launches-spandan-a-positive-homes-project-in-coimbatore--12300.html
393,M3M Hosts A Star-studded Evening  ,https://www.newsvoir.com/release/m3m-hosts-a-star-studded-evening-12296.html
394,Clicbrics Raises Around $3 Mn in Pre-series A Funding for the Firm from Marquee Technology Investors Across the Globe,https://www.newsvoir.com/release/clicbrics-raises-around-3-mn-in-pre-series-a-funding-for-the-firm-from-marquee-technology-investors-across-the-globe-12290.html
395,Fintech Firm Clearwater Analytics Opens its First Office in India,https://www.newsvoir.com/release/fintech-firm-clearwater-analytics-opens-its-first-office-in-india-12283.html
396,Gaurs Group Initiates Plantation Drive along with Beti Bachao Beti Padhao Campaign,https://www.newsvoir.com/release/gaurs-group-initiates-plantation-drive-along-with-beti-bachao-beti-padhao-campaign-12276.html
397,SG Estates yet again Tops Customer Reviews Amongst Multiple Developers in Delhi/NCR,https://www.newsvoir.com/release/sg-estates-yet-again-tops-customer-reviews-amongst-multiple-developers-in-delhi-ncr-12273.html
398,Colive Launches Premium Property in Bangalore; Strengthens its Position in the Luxury Co-living Segment,https://www.newsvoir.com/release/colive-launches-premium-property-in-bangalore-strengthens-its-position-in-the-luxury-co-living-segment-12274.html
399,M3M Rendezvous with the Stars,https://www.newsvoir.com/release/m3m-rendezvous-with-the-stars-12268.html
400,MaxVIL Reports Strong Start to FY20 with Improved Performance from Real Estate and Speciality Films Business in Q1,https://www.newsvoir.com/release/maxvil-reports-strong-start-to-fy20-with-improved-performance-from-real-estate-and-speciality-films-business-in-q1-12264.html
401,Evolving Dynamics of Luxury Housing in India,https://www.newsvoir.com/release/evolving-dynamics-of-luxury-housing-in-india-12207.html
402,DLF Foundation and CGS Hospitals Bag Responsible Business Awards 2019,https://www.newsvoir.com/release/dlf-foundation-and-cgs-hospitals-bag-responsible-business-awards-2019-12156.html
403,"MQDC’s Whizdom Rolls out Two Innovative Programs to Promote Entrepreneurship amongst Young Professionals, Nurture ‘Innovative’ Talent",https://www.newsvoir.com/release/mqdc-s-whizdom-rolls-out-two-innovative-programs-to-promote-entrepreneurship-amongst-young-professionals-nurture-innovative-talent-12088.html
404,Adarsh Group Adjudged as the ‘Best Villa Developer’ @ Times Business Award 2018-19,https://www.newsvoir.com/release/adarsh-group-adjudged-as-the-best-villa-developer-times-business-award-2018-19-12074.html
405,"Vatika Business Centre Envisions Strong Expansion in Coming 5 years, says Gaurav Bhalla, MD, Vatika Group",https://www.newsvoir.com/release/vatika-business-centre-envisions-strong-expansion-in-coming-5-years-says-gaurav-bhalla-md-vatika-group-12045.html
406,DLF5`s Luxury Project The Crest Awarded LEED Gold Certificate by USGBC,https://www.newsvoir.com/release/dlf5-s-luxury-project-the-crest-awarded-leed-gold-certificate-by-usgbc-12033.html
407,"International Vacation Rental Management Company Vacasa, Achieves 80% more Productivity with Hiver ",https://www.newsvoir.com/release/international-vacation-rental-management-company-vacasa-achieves-80-more-productivity-with-hiver-11990.html
408,RICS Appoints Esteemed Industry Leaders to its South Asia Board,https://www.newsvoir.com/release/rics-appoints-esteemed-industry-leaders-to-its-south-asia-board-11981.html
409,"Student Housing Brand Stanza Living on an Expansion Spree, Begins Operations in Seven New Cities",https://www.newsvoir.com/release/student-housing-brand-stanza-living-on-an-expansion-spree-begins-operations-in-seven-new-cities-11948.html
410,DLF5 Residents Plant the Seeds for a Sustainable Future ,https://www.newsvoir.com/release/dlf5-residents-plant-the-seeds-for-a-sustainable-future-11942.html
411,Kid-centric Homes: A New-age Concept of Realty Market,https://www.newsvoir.com/release/kid-centric-homes-a-new-age-concept-of-realty-market-11880.html
412,"5th Smart Cities 2019 India expo Inaugurated by Shri Durga Shanker Mishra, Secretary, Ministry of Housing and Urban Affairs, at Pragati Maidan, New Delhi",https://www.newsvoir.com/release/5th-smart-cities-2019-india-expo-inaugurated-by-shri-durga-shanker-mishra-secretary-ministry-of-housing-and-urban-affairs-at-pragati-maidan-new-delhi-11868.html
413,Columbia Pacific Communities Expands its Opportunities in India,https://www.newsvoir.com/release/columbia-pacific-communities-expands-its-opportunities-in-india-11859.html
414,Elan Group Join Hands with Ajay Devgn's NY Cinemas,https://www.newsvoir.com/release/elan-group-join-hands-with-ajay-devgn-s-ny-cinemas-11850.html
415,M3M Group Introduces ‘Express Golf Tournament’ in Gurugram,https://www.newsvoir.com/release/m3m-group-introduces-express-golf-tournament-in-gurugram-11844.html
416,RICS has Colliers International as Knowledge Partner for Thought Leadership Events on Corporate Real Estate and Facility Management,https://www.newsvoir.com/release/rics-has-colliers-international-as-knowledge-partner-for-thought-leadership-events-on-corporate-real-estate-and-facility-management-11846.html
417,RICS thought Leadership Forums on Real Estate and Housing has Knight Frank as Knowledge Partner,https://www.newsvoir.com/release/rics-thought-leadership-forums-on-real-estate-and-housing-has-knight-frank-as-knowledge-partner-11811.html
418,DLF Bags Top Honors at Golden Globe Tigers Awards 2019,https://www.newsvoir.com/release/dlf-bags-top-honors-at-golden-globe-tigers-awards-2019-11797.html
419,"Kanakia Group Associates with Kiran Kumar Raju, Top MTB Rider
 
",https://www.newsvoir.com/release/kanakia-group-associates-with-kiran-kumar-raju-top-mtb-rider-11767.html
420,"Ashiana Housing Ltd. Hosted A Fun Evening for Seniors to Socialize
 
",https://www.newsvoir.com/release/ashiana-housing-ltd-hosted-a-fun-evening-for-seniors-to-socialize-11769.html
421,Karnal: Rising Destination for Senior Living,https://www.newsvoir.com/release/karnal-rising-destination-for-senior-living-11753.html
422,The Acquist Group - A Forerunner Across the Realty Sector,https://www.newsvoir.com/release/the-acquist-group-a-forerunner-across-the-realty-sector-11746.html
423,Online Sleep Solutions Brand Durfi Launches its Flagship Product ,https://www.newsvoir.com/release/online-sleep-solutions-brand-durfi-launches-its-flagship-product-11742.html
424,"Housing Schemes to Fuels Employment and Economic Growth says Dr. Niranjan Hiranandani, National President, NAREDCO",https://www.newsvoir.com/release/housing-schemes-to-fuels-employment-and-economic-growth-says-dr-niranjan-hiranandani-national-president-naredco-11736.html
425,A Starry Celebration of the ‘Epic’ Story,https://www.newsvoir.com/release/a-starry-celebration-of-the-epic-story-11731.html
426,The Ashiana School Launches “Artificial Intelligence” in Rajasthan at School Level,https://www.newsvoir.com/release/the-ashiana-school-launches-artificial-intelligence-in-rajasthan-at-school-level-11690.html
427,DLF Foundation: Setting New Benchmarks in CSR,https://www.newsvoir.com/release/dlf-foundation-setting-new-benchmarks-in-csr-11686.html
428,Max Group Enters Commercial Real Estate with the Opening of Max Towers on DND,https://www.newsvoir.com/release/max-group-enters-commercial-real-estate-with-the-opening-of-max-towers-on-dnd-11675.html
429,Chintels Group Launches Phase II of Luxury Project Chintels Serenity,https://www.newsvoir.com/release/chintels-group-launches-phase-ii-of-luxury-project-chintels-serenity-11657.html
430,"Doxa’s Co-working Office Space Launched in Hyderabad, Spread Over 25,000 Sq. ft.",https://www.newsvoir.com/release/doxa-s-co-working-office-space-launched-in-hyderabad-spread-over-25-000-sq-ft--11645.html
431,CHD Developers Launches Y Suites - India’s First Hybrid Smart Living Social Hub,https://www.newsvoir.com/release/chd-developers-launches-y-suites---india-s-first-hybrid-smart-living-social-hub-11588.html
432,Launch of URPA – World Ranking Series First Ever in India by Bulldog Sportz,https://www.newsvoir.com/release/launch-of-urpa-world-ranking-series-first-ever-in-india-by-bulldog-sportz-11574.html
433,"Sowparnika, First Real Estate Firm to Support Arm Wrestlers",https://www.newsvoir.com/release/sowparnika-first-real-estate-firm-to-support-arm-wrestlers-11556.html
434,HDFC ERGO Provides Title Insurance for Shraddha Landmark’s Project ,https://www.newsvoir.com/release/hdfc-ergo-provides-title-insurance-for-shraddha-landmark-s-project--11505.html
435,RICS World Built Environment Forum Summit 2019 Unites Global Leaders on Future of Investment in Real Estate,https://www.newsvoir.com/release/rics-world-built-environment-forum-summit-2019-unites-global-leaders-on-future-of-investment-in-real-estate-11520.html
436,"From the ‘Mall Mile’ to the Capital, the MGF Mall Journey",https://www.newsvoir.com/release/from-the-mall-mile-to-the-capital-the-mgf-mall-journey-11504.html
437,Ashiana Housing Ltd. Ranks on Top in Care & Consumer Connect Category in North India” - Says A Report by Track2realty,https://www.newsvoir.com/release/ashiana-housing-ltd-ranks-on-top-in-care-consumer-connect-category-in-north-india---says-a-report-by-track2realty-11501.html
438,DLF5 Celebrates Womanhood on International Women's Day,https://www.newsvoir.com/release/dlf5-celebrates-womanhood-on-international-women-s-day-11486.html
439,"Sowparnika Launches Sowparbee, the Community Change Driver, Delivering Happiness to the Masses",https://www.newsvoir.com/release/sowparnika-launches-sowparbee-the-community-change-driver-delivering-happiness-to-the-masses-11474.html
440,OCS India Scoops Five Awards at the ETNow Facilities Management Awards 2019,https://www.newsvoir.com/release/ocs-india-scoops-five-awards-at-the-etnow-facilities-management-awards-2019-11442.html
441,GST Reforms to Boost Realty Demand: Developers,https://www.newsvoir.com/release/gst-reforms-to-boost-realty-demand-developers-11434.html
442,"M3M, Vatika Share Views on Increased Global Investment in Commercial Realty",https://www.newsvoir.com/release/m3m-vatika-share-views-on-increased-global-investment-in-commercial-realty-11418.html
443,Alpha International City Awarded as Integrated Township of the Year,https://www.newsvoir.com/release/alpha-international-city-awarded-as-integrated-township-of-the-year-11409.html
444,Excellent Campus Placement for CEQS at RICS School of Built Environment          ,https://www.newsvoir.com/release/excellent-campus-placement-for-ceqs-at-rics-school-of-built-environment-11398.html
445,DLF5 Hosts a Book Discussion on Rakhshanda Jalil's Latest Book 'Kaifiyat' to Remember Kaifi Azmi ,https://www.newsvoir.com/release/dlf5-hosts-a-book-discussion-on-rakhshanda-jalil-s-latest-book-kaifiyat-to-remember-kaifi-azmi-11334.html
446,Smartworks Consolidates Leadership in Delhi NCR with Two New Centres,https://www.newsvoir.com/release/smartworks-consolidates-leadership-in-delhi-ncr-with-two-new-centres-11325.html
447,Industry Reactions -  Interim Budget 2019,https://www.newsvoir.com/release/industry-reactions-interim-budget-2019-11286.html
448,Buoyant Outlook for Indian Commercial Market in 2019: Reports,https://www.newsvoir.com/release/buoyant-outlook-for-indian-commercial-market-in-2019-reports-11265.html
449,DLF5 Hosts the Book Launch of Chitra Banerjee`s Latest Book at The Crest Clubhouse,https://www.newsvoir.com/release/dlf5-hosts-the-book-launch-of-chitra-banerjee-s-latest-book-at-the-crest-clubhouse-11238.html
450,"Vineet Nanda Joins CHD Developers as Director, Strategy, Sales, Marketing and Customer Experience",https://www.newsvoir.com/release/vineet-nanda-joins-chd-developers-as-director-strategy-sales-marketing-and-customer-experience-11234.html
451,Ozone Group Launches Convertible Homes,https://www.newsvoir.com/release/ozone-group-launches-convertible-homes-11228.html
452,Real Estate Company Gahlaut Buildcon Ventures into Entertainment Sector,https://www.newsvoir.com/release/real-estate-company-gahlaut-buildcon-ventures-into-entertainment-sector-11227.html
453,Ajay Choudhary of Ace Group Introduces Ace Golfshire’s Uber Luxury Show Flat Designed by Gauri Khan Designs,https://www.newsvoir.com/release/ajay-choudhary-of-ace-group-introduces-ace-golfshire-s-uber-luxury-show-flat-designed-by-gauri-khan-designs-11222.html
454,Housing Societies Ready to Join Hands with Governments and Local Bodies to Make Mumbai More Liveable City,https://www.newsvoir.com/release/housing-societies-ready-to-join-hands-with-governments-and-local-bodies-to-make-mumbai-more-liveable-city-11183.html
455,New Gurugram: A Vibrant Residential Hub in NCR,https://www.newsvoir.com/release/new-gurugram-a-vibrant-residential-hub-in-ncr-11174.html
456,ELAN EPIC: India’s First Luxury Retail Destination Launched by Superstar Salman Khan,https://www.newsvoir.com/release/elan-epic-india-s-first-luxury-retail-destination-launched-by-superstar-salman-khan-11168.html
457,"DRA Homes, the Chennai Based Real Estate Developer Felicitates the Unsung Heroes of the Construction Industry",https://www.newsvoir.com/release/dra-homes-the-chennai-based-real-estate-developer-felicitates-the-unsung-heroes-of-the-construction-industry-11162.html
458,DLF5 Turns into Santa`s Holiday Village this Christmas,https://www.newsvoir.com/release/dlf5-turns-into-santa-s-holiday-village-this-christmas-11164.html
459,A Star-studded Launch for Elan Epic,https://www.newsvoir.com/release/a-star-studded-launch-for-elan-epic-11157.html
460,Campus Placement Surge in RICS School of Built Environment,https://www.newsvoir.com/release/campus-placement-surge-in-rics-school-of-built-environment-11137.html
461,"Sowparnika Announces Positive Homes at Coimbatore, Revolutionizing the Realty Market",https://www.newsvoir.com/release/sowparnika-announces-positive-homes-at-coimbatore-revolutionizing-the-realty-market-11123.html
462,Sowparnika Celebrates 15 Successful Years ,https://www.newsvoir.com/release/sowparnika-celebrates-15-successful-years-11106.html
463,A Mysterious Folly at DLF Golf and Country Club Charms the Art Lovers,https://www.newsvoir.com/release/a-mysterious-folly-at-dlf-golf-and-country-club-charms-the-art-lovers-11101.html
464,Sambhav Group Decodes the DCPR 2034 Plan,https://www.newsvoir.com/release/sambhav-group-decodes-the-dcpr-2034-plan-11079.html
465,Sowparnika's Zero Campaign - Successfully Fetched 200 Deals in a Month,https://www.newsvoir.com/release/sowparnika-s-zero-campaign-successfully-fetched-200-deals-in-a-month-11037.html
466,"DLF Foundation's Scholar, Kartik Sawhney Inspires the Children of Gurugram",https://www.newsvoir.com/release/dlf-foundation-s-scholar-kartik-sawhney-inspires-the-children-of-gurugram-11027.html
467,"5,000 Migsun Buyers Benefit Under the Credit Linked Subsidy Scheme",https://www.newsvoir.com/release/5-000-migsun-buyers-benefit-under-the-credit-linked-subsidy-scheme-11014.html
468,"According to SEBI, Assured Return Schemes are Illegal, Said Parimal Tripathy, Legal Expert",https://www.newsvoir.com/release/according-to-sebi-assured-return-schemes-are-illegal-said-parimal-tripathy-legal-expert-10983.html
469,Karnal – an Ideal Destination for Investment,https://www.newsvoir.com/release/karnal-an-ideal-destination-for-investment-10957.html
470,"Max Ventures and Industries Limited Reports Consolidated Revenues of Rs. 267 Cr. in Q2 FY 2019, up 51% Y-o-Y",https://www.newsvoir.com/release/max-ventures-and-industries-limited-reports-consolidated-revenues-of-rs-267-cr-in-q2-fy-2019-up-51-y-o-y-10954.html
471,DLF Gardencity Organizes a Special Health Check up Camp Ahead of World Diabetes Day,https://www.newsvoir.com/release/dlf-gardencity-organizes-a-special-health-check-up-camp-ahead-of-world-diabetes-day-10944.html
472,DLF Golf and Country Club Awarded with the Asia Pacific Order of Zenith,https://www.newsvoir.com/release/dlf-golf-and-country-club-awarded-with-the-asia-pacific-order-of-zenith-10935.html
473,Vatika Confirms All Loans are Being Serviced as Per Schedule,https://www.newsvoir.com/release/vatika-confirms-all-loans-are-being-serviced-as-per-schedule-10859.html
474,Karle Infra Accorded at the Golden Bricks Award 2018 ,https://www.newsvoir.com/release/karle-infra-accorded-at-the-golden-bricks-award-2018-10858.html
475,Durga Puja Celebrations at DLF Club5 Come to an End with Visarjan,https://www.newsvoir.com/release/durga-puja-celebrations-at-dlf-club5-come-to-an-end-with-visarjan-10850.html
476,Vatika to Invest 8000 Cr. in Upcoming Township Vatika India Next 2,https://www.newsvoir.com/release/vatika-to-invest-8000-cr-in-upcoming-township-vatika-india-next-2-10845.html
477,Delhi NCR Hosted the Biggest Sports Event for Senior Citizens: Jashn 5,https://www.newsvoir.com/release/delhi-ncr-hosted-the-biggest-sports-event-for-senior-citizens-jashn-5-10824.html
478,Chennai’s Velachery Residents Can’t Stop Raving about Tuxedo,https://www.newsvoir.com/release/chennai-s-velachery-residents-can-t-stop-raving-about-tuxedo-10801.html
479,Cargo Airport to Boost the Real Estate Market of Bhiwadi,https://www.newsvoir.com/release/cargo-airport-to-boost-the-real-estate-market-of-bhiwadi-10792.html
480,Sowparnika Introduces Homes at ‘Zero Cost’ for the Buyers,https://www.newsvoir.com/release/sowparnika-introduces-homes-at-zero-cost-for-the-buyers-10777.html
481,‘Voyage to the Stars’ Launched in Pune,https://www.newsvoir.com/release/-voyage-to-the-stars-launched-in-pune-10737.html
482,K Raheja Corp Fortifies its Commitment to Green this World Green Building Week (Sept 24-30) in Partnership with GBCI,https://www.newsvoir.com/release/k-raheja-corp-fortifies-its-commitment-to-green-this-world-green-building-week-sept-24-30-in-partnership-with-gbci-10728.html
483,"IIFL Home Finance Ltd. Presents ‘KUTUMB - Chapter II’ in Indore, a Platform to Promote Benefits of Green Affordable Housing and Sustainable Living in India ",https://www.newsvoir.com/release/iifl-home-finance-ltd-presents-kutumb---chapter-ii-in-indore-a-platform-to-promote-benefits-of-green-affordable-housing-and-sustainable-living-in-india--10711.html
484,Commercial Realty of NCR and Top Cities to Witness Boost: CBRE,https://www.newsvoir.com/release/commercial-realty-of-ncr-and-top-cities-to-witness-boost-cbre-10696.html
485,Square Yards Facilitates Rs. 550 Crore Foreign Investment Across Yamuna Expressway Real Estate Projects,https://www.newsvoir.com/release/square-yards-facilitates-rs-550-crore-foreign-investment-across-yamuna-expressway-real-estate-projects-10693.html
486,Ashiana Housing Organises its 1st Kid-centric Homes Conclave,https://www.newsvoir.com/release/ashiana-housing-organises-its-1st-kid-centric-homes-conclave-10664.html
487,Speed Sprint XVIII held at DLF Gardencity ,https://www.newsvoir.com/release/speed-sprint-xviii-held-at-dlf-gardencity-10634.html
488,Casagrand Builder Clocks up Sale of Rs. 170 Cr. Worth Flats in 100 Hours,https://www.newsvoir.com/release/casagrand-builder-clocks-up-sale-of-rs-170-cr-worth-flats-in-100-hours-10629.html
489,Karle Infra Wins Big at the Realty Leaders’ Summit and Awards 2018,https://www.newsvoir.com/release/karle-infra-wins-big-at-the-realty-leaders-summit-and-awards-2018-10616.html
490,Elan Group Joins Hand with Mitsubishi,https://www.newsvoir.com/release/elan-group-joins-hand-with-mitsubishi-10614.html
491,Gurugram – The Emerging Entertainment Hub,https://www.newsvoir.com/release/gurugram-the-emerging-entertainment-hub-10596.html
492,DLF Foundation and Save the Himalayas Foundation Co-organize 1st International Conference; Saving Himalayas through Science and Spirituality,https://www.newsvoir.com/release/dlf-foundation-and-save-the-himalayas-foundation-co-organize-1st-international-conference-saving-himalayas-through-science-and-spirituality-10594.html
493,Global Indian Solutions to Address the USD 900 Bn NRI Assets Market in India,https://www.newsvoir.com/release/global-indian-solutions-to-address-the-usd-900-bn-nri-assets-market-in-india-10533.html
494,SGDC Expanding Footprint in India,https://www.newsvoir.com/release/sgdc-expanding-footprint-in-india-10525.html
495,Equity99.com Releases Buy Report on Bharat Agri Fert and Realty Ltd.,https://www.newsvoir.com/release/equity99-com-releases-buy-report-on-bharat-agri-fert-and-realty-ltd-10532.html
496,Mumbai’s biggest Integrated Realty Project OID Opens up Inventory to Delhi Investors,https://www.newsvoir.com/release/mumbai-s-biggest-integrated-realty-project-oid-opens-up-inventory-to-delhi-investors-10524.html
497,An Astounding Fashion Show Depicting Super Luxury at DLF5 Mesmerizes All ,https://www.newsvoir.com/release/an-astounding-fashion-show-depicting-super-luxury-at-dlf5-mesmerizes-all-10498.html
498,Gurugram – The Fastest Growing Retail Market of NCR: Innovest,https://www.newsvoir.com/release/gurugram-the-fastest-growing-retail-market-of-ncr-innovest-10442.html
499,"Club5, DLF5 Becomes the Sanctom Sanctorum of Art and Literature in Gurugram",https://www.newsvoir.com/release/club5-dlf5-becomes-the-sanctom-sanctorum-of-art-and-literature-in-gurugram-10431.html
500,"Brahma Group to Invest on Projects Worth Rs. 3,250 Cr in Gurugram",https://www.newsvoir.com/release/brahma-group-to-invest-on-projects-worth-rs-3-250-cr-in-gurugram-10401.html
501,Zenith Residences by Karle Infra was Presented with the Ultra Luxury Residential Project of the Year 2018 (Bangalore) ,https://www.newsvoir.com/release/zenith-residences-by-karle-infra-was-presented-with-the-ultra-luxury-residential-project-of-the-year-2018-bangalore-10398.html
502,Corporates and Startups to Boost Commercial Realty in Gurugram: Innovest,https://www.newsvoir.com/release/corporates-and-startups-to-boost-commercial-realty-in-gurugram-innovest-10355.html
503,The Mosaic and Huddle Collaborate to Power-up the Startup Ecosystem,https://www.newsvoir.com/release/the-mosaic-and-huddle-collaborate-to-power-up-the-startup-ecosystem-10358.html
504,Experion Launches the 25/75 Mega 'Move in Now Pay Later' Offer ,https://www.newsvoir.com/release/experion-launches-the-25-75-mega-move-in-now-pay-later-offer-10333.html
505,"Migsun Group, the Leaders in Affordable Housing Launches Migsun Vilaasa at Greater Noida",https://www.newsvoir.com/release/migsun-group-the-leaders-in-affordable-housing-launches-migsun-vilaasa-at-greater-noida-10319.html
506,Millennium City's Realty May See a New Scenario by 2020s ,https://www.newsvoir.com/release/millennium-city-s-realty-may-see-a-new-scenario-by-2020s--10249.html
