,title,link
252,Smartworks Partners with Routematic to Assist its Enterprise Clients Return to Work Safely,https://www.newsvoir.com/release/smartworks-partners-with-routematic-to-assist-its-enterprise-clients-return-to-work-safely-14876.html
253,"As Part of it's Customer-first Approach, Design Cafe Launches Fully Integrated Home-tech Platform for Customers ",https://www.newsvoir.com/release/as-part-of-it-apos-s-customer-first-approach-design-cafe-launches-fully-integrated-home-tech-platform-for-customers-14871.html
254,M3M Records 500 Crores of Sales within 14 Days of the Launch of 'Port Your Property' Campaign,https://www.newsvoir.com/release/m3m-records-500-crores-of-sales-within-14-days-of-the-launch-of-apos-port-your-property-apos-campaign-14862.html
255,Raheja Developers Adjudged 'Best Employer' in the Real Estate Category by IBRF,https://www.newsvoir.com/release/raheja-developers-adjudged-apos-best-employer-apos-in-the-real-estate-category-by-ibrf-14852.html
256,COVID-19 to Redefine Focus Towards Organized Retail and E-commerce,https://www.newsvoir.com/release/covid-19-to-redefine-focus-towards-organized-retail-and-e-commerce-14825.html
257,"Shared Workspaces are the New Normal, Says Desker Coworking CEO Sannat Chandhok",https://www.newsvoir.com/release/shared-workspaces-are-the-new-normal-says-desker-coworking-ceo-sannat-chandhok-14792.html
258,Livve Raises $1.5M in Seed Funding,https://www.newsvoir.com/release/livve-raises-1-5m-in-seed-funding-14761.html
259,"Atal Realtech Ltd. Launches IPO, to Close on 7th October",https://www.newsvoir.com/release/atal-realtech-ltd-launches-ipo-to-close-on-7th-october-14727.html
260,"For the 1st Time in Real Estate, Bhutani Group Offers an Advance Return Offer",https://www.newsvoir.com/release/for-the-1st-time-in-real-estate-bhutani-group-offers-an-advance-return-offer-14675.html
261,"Realty Majors Offer Possession, Sector Gets a Push",https://www.newsvoir.com/release/realty-majors-offer-possession-sector-gets-a-push-14626.html
262,Binswanger Partners with ANAROCK to Offer Focused Industrial Realty Services ,https://www.newsvoir.com/release/binswanger-partners-with-anarock-to-offer-focused-industrial-realty-services-14637.html
263,Bullmen Realty's First-of-its-kind Shield Campaign Receives Overwhelming Response,https://www.newsvoir.com/release/bullmen-realty-apos-s-first-of-its-kind-shield-campaign-receives-overwhelming-response-14625.html
264,"Omaxe Chowk Having Wholesale, Retail Stores, Food Court to Comes up at Chandni Chowk",https://www.newsvoir.com/release/omaxe-chowk-having-wholesale-retail-stores-food-court-to-comes-up-at-chandni-chowk-14607.html
265,Gulshan Dynasty Bags 'Luxury Project of the Year-North India',https://www.newsvoir.com/release/gulshan-dynasty-bags-apos-luxury-project-of-the-year-north-india-apos-14575.html
266,Migsun Group's MD Yash Miglani Co-produces Ali Abbas Zafar and Himanshu Mehra's 'Khaali Peeli',https://www.newsvoir.com/release/migsun-group-apos-s-md-yash-miglani-co-produces-ali-abbas-zafar-and-himanshu-mehra-apos-s-apos-khaali-peeli-apos-14567.html
267,"Bullmen Realty's First-of-its-kind Shield to Benefit More than 100,000 Homeseekers in Delhi NCR ",https://www.newsvoir.com/release/bullmen-realty-apos-s-first-of-its-kind-shield-to-benefit-more-than-100-000-homeseekers-in-delhi-ncr-14540.html
268,"Elan Foundation and Salman Khan Begins the Reconstruction of Houses for Flood-hit Victims at Kolhapur, Maharashtra",https://www.newsvoir.com/release/elan-foundation-and-salman-khan-begins-the-reconstruction-of-houses-for-flood-hit-victims-at-kolhapur-maharashtra-14537.html
269,Happy Homes Awarded Leading Real-estate Consultancy,https://www.newsvoir.com/release/happy-homes-awarded-leading-real-estate-consultancy-14534.html
270,IQI India Hosts Campaign #RunForHappiness During this Pandemic,https://www.newsvoir.com/release/iqi-india-hosts-campaign-runforhappiness-during-this-pandemic-14532.html
271,"M3M Unlocks Gurugram, Clocking 1150 Crores in Sales in July-August",https://www.newsvoir.com/release/m3m-unlocks-gurugram-clocking-1150-crores-in-sales-in-july-august-14526.html
272,Sodexo Education in India Debuts Student Living with Tribe Student Accommodation,https://www.newsvoir.com/release/sodexo-education-in-india-debuts-student-living-with-tribe-student-accommodation-14525.html
273,First-of-its-kind Shield for Realty Buyers by Bullmen Realty India,https://www.newsvoir.com/release/first-of-its-kind-shield-for-realty-buyers-by-bullmen-realty-india-14501.html
274,Small and Gated Societies New Magnet for Potential Investors in Post COVID World: Elante Group  ,https://www.newsvoir.com/release/small-and-gated-societies-new-magnet-for-potential-investors-in-post-covid-world-elante-group-14492.html
275,Generic Engineering Bags Orders Worth Rs. 101.95 Crore,https://www.newsvoir.com/release/generic-engineering-bags-orders-worth-rs-101-95-crore-14473.html
276,Real Estate Sector Witnesses Improved Market Sentiments in Unlock Phase,https://www.newsvoir.com/release/real-estate-sector-witnesses-improved-market-sentiments-in-unlock-phase-14470.html
277,Keystone Solutions Completed Turnkey Projects for ZOBET - Gastro-pub in Kolkata and Select CITYWALK in New Delhi,https://www.newsvoir.com/release/keystone-solutions-completed-turnkey-projects-for-zobet-gastro-pub-in-kolkata-and-select-citywalk-in-new-delhi-14431.html
278,Real Estate Sector is Ripe for Digital Disruption: Homes247.in Founder Mr. Priyatham Kumar ,https://www.newsvoir.com/release/real-estate-sector-is-ripe-for-digital-disruption-homes247-in-founder-mr-priyatham-kumar-14404.html
279,Nayan Raheja Named Amongst ''40 Under 40 Most Influential Indians 2019-20'' by AsiaOne Magazine ,https://www.newsvoir.com/release/nayan-raheja-named-amongst-apos-apos-40-under-40-most-influential-indians-2019-20-apos-apos-by-asiaone-magazine-14372.html
280,"Despite COVID-19 Disruptions, Ace Group Committed to Timely Delivery of Projects",https://www.newsvoir.com/release/despite-covid-19-disruptions-ace-group-committed-to-timely-delivery-of-projects-14367.html
281,"ANAROCK Retail Partners with UAE's Vindico for Post-COVID-19 Store Designs, Integrated Leasing and Tenant Coordination",https://www.newsvoir.com/release/anarock-retail-partners-with-uae-apos-s-vindico-for-post-covid-19-store-designs-integrated-leasing-and-tenant-coordination-14345.html
282,Karnal Smart City Projects in Full Swing ,https://www.newsvoir.com/release/karnal-smart-city-projects-in-full-swing-14331.html
283,Omaxe Chowk will Set an Example for Other Projects: North DMC Mayor,https://www.newsvoir.com/release/omaxe-chowk-will-set-an-example-for-other-projects-north-dmc-mayor-14246.html
284,KONE Elevator India Hosts One-of-its-kind Webinar for Architects,https://www.newsvoir.com/release/kone-elevator-india-hosts-one-of-its-kind-webinar-for-architects-14231.html
285,Raheja Developers Adjudged 'Best Iconic Brand in India for Real Estate' by Economic Times,https://www.newsvoir.com/release/raheja-developers-adjudged-apos-best-iconic-brand-in-india-for-real-estate-apos-by-economic-times-14208.html
286,Mace-ANAROCK Collaboration to Deliver Tech-driven Construction Solutions to Indian Real Estate,https://www.newsvoir.com/release/mace-anarock-collaboration-to-deliver-tech-driven-construction-solutions-to-indian-real-estate-14193.html
287,Oriental Trimex Limited to Benefit from Govt. Boost to Infra and Real Estate Sector,https://www.newsvoir.com/release/oriental-trimex-limited-to-benefit-from-govt-boost-to-infra-and-real-estate-sector-14164.html
288,Karda Constructions Ltd. Registers Impressive Growth in Q4 FY20 YOY,https://www.newsvoir.com/release/karda-constructions-ltd-registers-impressive-growth-in-q4-fy20-yoy-14153.html
289,Sensation Group Forms an SPV with Woke Life to Form Sensation Woke Hospitality - One of the First Propco & Opco Companies in the Co-living & Serviced Apartment Sector in India,https://www.newsvoir.com/release/sensation-group-forms-an-spv-with-woke-life-to-form-sensation-woke-hospitality-one-of-the-first-propco-opco-companies-in-the-co-living-serviced-apartment-sector-in-india-14148.html
290,Ace Group Presents a Unique Jai & Veeru Jodi Offer to Win Over Homebuyers for its New Project ,https://www.newsvoir.com/release/ace-group-presents-a-unique-jai-veeru-jodi-offer-to-win-over-homebuyers-for-its-new-project-14092.html
291,Commercial Realty will Leap Back to Normal by Q4: Experts,https://www.newsvoir.com/release/commercial-realty-will-leap-back-to-normal-by-q4-experts-14086.html
292,WTC Gift City Gears up to Accelerate the State's Economy,https://www.newsvoir.com/release/wtc-gift-city-gears-up-to-accelerate-the-state-apos-s-economy-14087.html
293,BBG (Building Blocks Group) Resumes its Operations Following the Guidelines Issued by the Government of Telangana,https://www.newsvoir.com/release/bbg-building-blocks-group-resumes-its-operations-following-the-guidelines-issued-by-the-government-of-telangana-14050.html
294,WTC Chandigarh Kick Starts the Economic Cycle of the Region,https://www.newsvoir.com/release/wtc-chandigarh-kick-starts-the-economic-cycle-of-the-region-14028.html
295,Sunshine Group Announces 1M sq. ft. 'Mixed-Use' Real Estate Development in Noida's  Downtown Sector 94,https://www.newsvoir.com/release/sunshine-group-announces-1m-sq-ft-apos-mixed-use-apos-real-estate-development-in-noida-apos-s-downtown-sector-94-13997.html
296,MaxVIL Back to Profits in FY20; Reports PAT of Rs. 441 Mn Versus Loss of Rs. 293 Mn in FY19,https://www.newsvoir.com/release/maxvil-back-to-profits-in-fy20-reports-pat-of-rs-441-mn-versus-loss-of-rs-293-mn-in-fy19-13975.html
297,Realtors Welcome the Central Government Economic Package to Tackle COVID-19,https://www.newsvoir.com/release/realtors-welcome-the-central-government-economic-package-to-tackle-covid-19-13921.html
298,"Khanvel Resort Turns ""Atmanirbhar"", Uses Resort Property to Grow Veggies",https://www.newsvoir.com/release/khanvel-resort-turns-quot-atmanirbhar-quot-uses-resort-property-to-grow-veggies-13904.html
299,Ace Group Launches Loan Free Pay-On Possession Plan to Serve Homebuyers During COVID-19 Crisis,https://www.newsvoir.com/release/ace-group-launches-loan-free-pay-on-possession-plan-to-serve-homebuyers-during-covid-19-crisis-13906.html
300,Commercial Real Estate Industry to Bounce Back in Last Quarter: Experts,https://www.newsvoir.com/release/commercial-real-estate-industry-to-bounce-back-in-last-quarter-experts-13825.html
301,WTC GIFT City Resumes the Construction Work ,https://www.newsvoir.com/release/wtc-gift-city-resumes-the-construction-work-13826.html
302,EROS Group Founder J.R Sood Passes Away at 94 ,https://www.newsvoir.com/release/eros-group-founder-j-r-sood-passes-away-at-94-13803.html
303,"During COVID-19 Crisis, ArchChat Makes it Possible for Architects & Designers to Work from Home ",https://www.newsvoir.com/release/during-covid-19-crisis-archchat-makes-it-possible-for-architects-designers-to-work-from-home-13730.html
304,AIPL Aids Daily Wage Workers and Stray Dogs in their Fight Against COVID-19 ,https://www.newsvoir.com/release/aipl-aids-daily-wage-workers-and-stray-dogs-in-their-fight-against-covid-19-13726.html
305,"COVID-19 to Reduce Housing Sales by 25-35%, Office Absorption to Fall 13-30% - ANAROCK",https://www.newsvoir.com/release/covid-19-to-reduce-housing-sales-by-25-35-office-absorption-to-fall-13-30-anarock-13702.html
306,"Amit Gossain, MD, KONE Elevator India Assumes Chairmanship of FINCHAM",https://www.newsvoir.com/release/amit-gossain-md-kone-elevator-india-assumes-chairmanship-of-fincham-13704.html
307,Elan Group Distributes One Month of Ration to Over 2000 Construction Workers,https://www.newsvoir.com/release/elan-group-distributes-one-month-of-ration-to-over-2000-construction-workers-13679.html
308,Gurugram Real Estate Developers Laud RBI Measures,https://www.newsvoir.com/release/gurugram-real-estate-developers-laud-rbi-measures-13672.html
309,DLF unveils State-of-the-art The Ultima Clubhouse at New Gurugram,https://www.newsvoir.com/release/dlf-unveils-state-of-the-art-the-ultima-clubhouse-at-new-gurugram-13636.html
310,Asian Paints Announces Winners of Delhi Beautiful Homes 2020 ,https://www.newsvoir.com/release/asian-paints-announces-winners-of-delhi-beautiful-homes-2020-13634.html
311,Ace Divino Presents Aesthetically Beautiful Apartments in the Lap of Luxury,https://www.newsvoir.com/release/ace-divino-presents-aesthetically-beautiful-apartments-in-the-lap-of-luxury-13619.html
312,"Townsip Housing, a Co-living Experience Launched Exclusively for Government Sector Employees in Pune",https://www.newsvoir.com/release/townsip-housing-a-co-living-experience-launched-exclusively-for-government-sector-employees-in-pune-13595.html
313,A Report by Association of Infrastructure Industry (India) and Colliers International Released at India Infrastructure Summit 2020,https://www.newsvoir.com/release/a-report-by-association-of-infrastructure-industry-india-and-colliers-international-released-at-india-infrastructure-summit-2020-13560.html
314,Salman Khan Lauds Gurugram-based Elan Group for Adopting Flood-affected Khidrapur Village ,https://www.newsvoir.com/release/salman-khan-lauds-gurugram-based-elan-group-for-adopting-flood-affected-khidrapur-village-13552.html
315,The Ultima by DLF Bags the Honour at ET Now 2020 Global Real Estate Congress,https://www.newsvoir.com/release/the-ultima-by-dlf-bags-the-honour-at-et-now-2020-global-real-estate-congress-13518.html
316,Golf Course Extension Road as Epicenter of Gurugram Realty,https://www.newsvoir.com/release/golf-course-extension-road-as-epicenter-of-gurugram-realty-13516.html
317,"Omaxe Chandni Chowk will be a Milestone for City: Shri Jai Prakash, Chairman Standing Committee, North Delhi Municipal Corporation",https://www.newsvoir.com/release/omaxe-chandni-chowk-will-be-a-milestone-for-city-shri-jai-prakash-chairman-standing-committee-north-delhi-municipal-corporation-13495.html
318,Whizdom Club Launches Whiz Cafe to Inspire Collaboration,https://www.newsvoir.com/release/whizdom-club-launches-whiz-cafe-to-inspire-collaboration-13486.html
319,BBG India's Growth Story with a Vision to Achieve One Million Happy families by the Year 2030,https://www.newsvoir.com/release/bbg-india-apos-s-growth-story-with-a-vision-to-achieve-one-million-happy-families-by-the-year-2030-13468.html
320,Wisteria Realty Ready to Tap into the Indian Real Estate Market,https://www.newsvoir.com/release/wisteria-realty-ready-to-tap-into-the-indian-real-estate-market-13458.html
321,The NextGen of Developers are Providing New Dimensions to Businesses,https://www.newsvoir.com/release/the-nextgen-of-developers-are-providing-new-dimensions-to-businesses-13451.html
322,"EROS Group Felicitated with the Prestigious ‘Brand of the Year’ Award at ET NOW Global Real Estate Congress 2020, in Mumbai",https://www.newsvoir.com/release/eros-group-felicitated-with-the-prestigious-brand-of-the-year-award-at-et-now-global-real-estate-congress-2020-in-mumbai-13446.html
323,"IRB Infra’s SPV, IRB Westcoast Tollway Ltd. Achieves COD for its Goa/Karnataka Border - Kundapur Four Laning Highway Project",https://www.newsvoir.com/release/irb-infra-s-spv-irb-westcoast-tollway-ltd-achieves-cod-for-its-goa-karnataka-border-kundapur-four-laning-highway-project-13424.html
324,MaxVIL Cements Footprint in Commercial RE in NCR,https://www.newsvoir.com/release/maxvil-cements-footprint-in-commercial-re-in-ncr-13386.html
325,Eros Group & House of AYNAT Lauds Arvind Kejriwal Ahead of Delhi Elections,https://www.newsvoir.com/release/eros-group-house-of-aynat-lauds-arvind-kejriwal-ahead-of-delhi-elections-13379.html
326,Raheja Developers Bags Multiple Awards at CNN News 18 Real Estate and Business Excellence Awards,https://www.newsvoir.com/release/raheja-developers-bags-multiple-awards-at-cnn-news-18-real-estate-and-business-excellence-awards-13370.html
327,Piramal Realty Launches “Ahan” at Piramal Aranya,https://www.newsvoir.com/release/piramal-realty-launches-ahan-at-piramal-aranya-13323.html
328,"'Housing Society Management Show 2020' to be held on 7th to 9th February 2020 at Nehru Centre, Worli, Mumbai Aims to Make Housing Societies a Better Living Place
",https://www.newsvoir.com/release/apos-housing-society-management-show-2020-apos-to-be-held-on-7th-to-9th-february-2020-at-nehru-centre-worli-mumbai-aims-to-make-housing-societies-a-better-living-place-13321.html
329,Roomsooms Makes Finding a Happy Home Easy & Affordable for Professionals & Students ,https://www.newsvoir.com/release/roomsooms-makes-finding-a-happy-home-easy-affordable-for-professionals-students-13291.html
330,Whizdom Club’s ‘Inspiration Hub’ Vision Wins National Co-Working Award,https://www.newsvoir.com/release/whizdom-club-s-inspiration-hub-vision-wins-national-co-working-award-13273.html
331,Colive Recognized as ‘The Promising Brand’ of the Year by Economic Times,https://www.newsvoir.com/release/colive-recognized-as-the-promising-brand-of-the-year-by-economic-times-13237.html
332,Budget 2020 - Industry Expectations from the Government,https://www.newsvoir.com/release/budget-2020-industry-expectations-from-the-government-13233.html
333,Experion Windchants Redefining Active Luxury Trends for India,https://www.newsvoir.com/release/experion-windchants-redefining-active-luxury-trends-for-india-13218.html
334,New Gurugram's Largest Big Bazaar to Come up in Vatika Township,https://www.newsvoir.com/release/new-gurugram-apos-s-largest-big-bazaar-to-come-up-in-vatika-township-13192.html
335,Milind Soman Takes a Luxury Escape at Experion Windchants,https://www.newsvoir.com/release/milind-soman-takes-a-luxury-escape-at-experion-windchants-13194.html
336,Union Cabinet Clears Proposed Change to Insolvency and Bankruptcy Amendment Bill,https://www.newsvoir.com/release/union-cabinet-clears-proposed-change-to-insolvency-and-bankruptcy-amendment-bill-13181.html
337,Your-Space Provides Premier Hostel Experience to PhD Students at IIT-Mumbai,https://www.newsvoir.com/release/your-space-provides-premier-hostel-experience-to-phd-students-at-iit-mumbai-13180.html
338,Milind Soman to Run on One of Asia's Largest Residential Skywalk at Experion Windchants,https://www.newsvoir.com/release/milind-soman-to-run-on-one-of-asia-s-largest-residential-skywalk-at-experion-windchants-13171.html
339,"UniAcco, International Student Accommodation Platform, Raises $1 Million",https://www.newsvoir.com/release/uniacco-international-student-accommodation-platform-raises-1-million-13170.html
340,CSR Foundations and NGOs Steer the Inclusive Growth Efforts,https://www.newsvoir.com/release/csr-foundations-and-ngos-steer-the-inclusive-growth-efforts-13166.html
341,"Mahagun India Leading the Pace in NCR Realty; Set to Deliver Over 3500 Flats in 2020
 
",https://www.newsvoir.com/release/mahagun-india-leading-the-pace-in-ncr-realty-set-to-deliver-over-3500-flats-in-2020-13165.html
342,Commercial Segment keeps Thriving; The Trend Likely to Continue in 2020,https://www.newsvoir.com/release/commercial-segment-keeps-thriving-the-trend-likely-to-continue-in-2020-13158.html
343,Corona Group Offers Lucrative Investment Options in Gurugram,https://www.newsvoir.com/release/corona-group-offers-lucrative-investment-options-in-gurugram-13152.html
344,Residential Real Estate on Path to Recovery,https://www.newsvoir.com/release/residential-real-estate-on-path-to-recovery-13143.html
345,2020 Looks Promising for New Gurugram Realty Market,https://www.newsvoir.com/release/2020-looks-promising-for-new-gurugram-realty-market-13137.html
346,JLL Facilitates Sale of Prime 8 Acre Land in Pune to Singapore Based Mapletree,https://www.newsvoir.com/release/jll-facilitates-sale-of-prime-8-acre-land-in-pune-to-singapore-based-mapletree-13116.html
347,Bhumika Group Bags 4 Prestigious Awards in 2019,https://www.newsvoir.com/release/bhumika-group-bags-4-prestigious-awards-in-2019-13106.html
348,"Technology will Bring Multi-fold Efficiency in Real Estate: Pradeep Misra, CMD, REPL",https://www.newsvoir.com/release/technology-will-bring-multi-fold-efficiency-in-real-estate-pradeep-misra-cmd-repl-13084.html
349,Sanguine Days Ahead for Real Estate in NCR,https://www.newsvoir.com/release/sanguine-days-ahead-for-real-estate-in-ncr-13087.html
350,Century Real Estate Unveils Century Horizon in North Bangalore on KIAL Road,https://www.newsvoir.com/release/century-real-estate-unveils-century-horizon-in-north-bangalore-on-kial-road-13041.html
351,IIFL Home Finance Ltd. Concluded it’s Fifth Installment of KUTUMB,https://www.newsvoir.com/release/iifl-home-finance-ltd-concluded-it-s-fifth-installment-of-kutumb-13039.html
352,Migsun Rooftop to be Delivered 2 Years before the Deadline,https://www.newsvoir.com/release/migsun-rooftop-to-be-delivered-2-years-before-the-deadline-13038.html
353,Tech Mahindra Bags INR 500 Crore Smart City Project from Pimpri Chinchwad Municipal Corporation,https://www.newsvoir.com/release/tech-mahindra-bags-inr-500-crore-smart-city-project-from-pimpri-chinchwad-municipal-corporation-13031.html
354,Wealth Clinic Expects Rs. 100 Crore Sales During Property Parade ,https://www.newsvoir.com/release/wealth-clinic-expects-rs-100-crore-sales-during-property-parade-12954.html
355,850 Cr Home Loans Pre-sanctioned at 29th CREDAI-MCHI Property Expo,https://www.newsvoir.com/release/850-cr-home-loans-pre-sanctioned-at-29th-credai-mchi-property-expo-12924.html
356,The 29th CREDAI MCHI Real Estate & Housing Finance Exhibition will be the Turning Point of MMR Real Estate,https://www.newsvoir.com/release/the-29th-credai-mchi-real-estate-housing-finance-exhibition-will-be-the-turning-point-of-mmr-real-estate-12901.html
357,India’s Leading PR Firm ICCPL Launches its Mumbai Operations,https://www.newsvoir.com/release/india-s-leading-pr-firm-iccpl-launches-its-mumbai-operations-12900.html
358,Rajkummar Rao Entralls the Audience Along with Shibani Dandekar at M3M Golfestate,https://www.newsvoir.com/release/rajkummar-rao-entralls-the-audience-along-with-shibani-dandekar-at-m3m-golfestate-12898.html
359,"Raheja Developers to Deliver 7,000 Units in the Next 1-2 Years",https://www.newsvoir.com/release/raheja-developers-to-deliver-7-000-units-in-the-next-1-2-years-12894.html
360,"Smartworks Expands Footprint, Signs India’s Largest Co-working Facility ",https://www.newsvoir.com/release/smartworks-expands-footprint-signs-india-s-largest-co-working-facility--12880.html
361,Migsun Group Registers Record Sales of 557 Units Worth Rs. 260 Crore During Festive Season,https://www.newsvoir.com/release/migsun-group-registers-record-sales-of-557-units-worth-rs-260-crore-during-festive-season-12872.html
362,"Gaurs Group Receives Astonishing Response During Festive Season, Registers Record Sales Over 1200 Units Worth Approx Rs. 500 Cr.",https://www.newsvoir.com/release/gaurs-group-receives-astonishing-response-during-festive-season-registers-record-sales-over-1200-units-worth-approx-rs-500-cr-12864.html
363,29th CREDAI-MCHI Exhibition Promises to be a Bonanza for the  Home Buyers,https://www.newsvoir.com/release/29th-credai-mchi-exhibition-promises-to-be-a-bonanza-for-the-home-buyers-12843.html
364,Acquist Realty Group banks on London Realty Connect to Reinforce its UK Presence ,https://www.newsvoir.com/release/acquist-realty-group-banks-on-london-realty-connect-to-reinforce-its-uk-presence-12844.html
365,Bangaru Talli Charitable Trust (BTCT) has Successfully Completed 10% Revamping of the 100 Government Schools Adopted to Provide Quality Education,https://www.newsvoir.com/release/bangaru-talli-charitable-trust-btct-has-successfully-completed-10-revamping-of-the-100-government-schools-adopted-to-provide-quality-education-12832.html
366,"SKV Presents Workplace Trends Conclave, India 
",https://www.newsvoir.com/release/skv-presents-workplace-trends-conclave-india-12840.html
367,Affordable and Mid-segment Houses will Continue to Drive the Realty Market: Realty Experts,https://www.newsvoir.com/release/affordable-and-mid-segment-houses-will-continue-to-drive-the-realty-market-realty-experts-12830.html
368,MaxVIL Back to Strong Profits in Q2; Q2 EBIDTA up 5.3x to Develop Another Grade A+ Office Complex on Noida Expressway ,https://www.newsvoir.com/release/maxvil-back-to-strong-profits-in-q2-q2-ebidta-up-5-3x-to-develop-another-grade-a-office-complex-on-noida-expressway-12811.html
369,Raheja Revanta Bags the Award for Luxury Residential Project of the Year by Times of India,https://www.newsvoir.com/release/raheja-revanta-bags-the-award-for-luxury-residential-project-of-the-year-by-times-of-india-12765.html
370,Bhutani Infra Announces the Launch of Startup Nation – Bharat Badho Abhiyan,https://www.newsvoir.com/release/bhutani-infra-announces-the-launch-of-startup-nation-bharat-badho-abhiyan-12753.html
371,Saya Homes to Develop Uber Luxury Project in Indirapuram,https://www.newsvoir.com/release/saya-homes-to-develop-uber-luxury-project-in-indirapuram-12562.html
372,Saya Gold Avenue Touted to be Amongst Best in Delhi - NCR,https://www.newsvoir.com/release/saya-gold-avenue-touted-to-be-amongst-best-in-delhi-ncr-12548.html
373,Festive Season to bring Cheer to the Real Estate Market,https://www.newsvoir.com/release/festive-season-to-bring-cheer-to-the-real-estate-market-12547.html
374,"Festive Season Brings Optimism in the Realty Sector
 
",https://www.newsvoir.com/release/festive-season-brings-optimism-in-the-realty-sector-12546.html
375,"Karle Infra Launches Vario Homes at Karle Town Centre, Homes with Progressive Layouts™ ",https://www.newsvoir.com/release/karle-infra-launches-vario-homes-at-karle-town-centre-homes-with-progressive-layouts--12535.html
376,DRA Homes' Launched its Pond Restoration Effort ,https://www.newsvoir.com/release/dra-homes-launched-its-pond-restoration-effort-12443.html
