,title,link
507,Sahil Vachani Appointed as Director on the Boards of Max Financial Services and Max Life Insurance ,https://www.newsvoir.com/release/sahil-vachani-appointed-as-director-on-the-boards-of-max-financial-services-and-max-life-insurance-10242.html
508,"Sowparnika Introduces First of its Kind Homes in Realty Segment 

",https://www.newsvoir.com/release/sowparnika-introduces-first-of-its-kind-homes-in-realty-segment-10244.html
509,"Migsun to Provide 15,000 Affordable Houses in NCR by 2020",https://www.newsvoir.com/release/migsun-to-provide-15-000-affordable-houses-in-ncr-by-2020-10239.html
510,Max Life Insurance Concludes a Milestone Real Estate Investment in Indian Life Insurance Industry,https://www.newsvoir.com/release/max-life-insurance-concludes-a-milestone-real-estate-investment-in-indian-life-insurance-industry-10190.html
511,Delhi Daredevils Team Tee Off at 'DD - The Crest Celebrity Golf Tournament',https://www.newsvoir.com/release/delhi-daredevils-team-tee-off-at-dd-the-crest-celebrity-golf-tournament-10181.html
512,This Mother’s Day Magicbricks Strikes a Delicate Chord with #MyMomMyHome Campaign,https://www.newsvoir.com/release/this-mother-s-day-magicbricks-strikes-a-delicate-chord-with-mymommyhome-campaign-10184.html
513,Smartworks Expands in Bangalore; Becomes Largest Workspace Provider with 1 Million sq. ft. Footprint Across India,https://www.newsvoir.com/release/smartworks-expands-in-bangalore-becomes-largest-workspace-provider-with-1-million-sq-ft-footprint-across-india-10144.html
514,74% Homebuyers Unaware of How to Check RERA Status of Project: Reveals Magicbricks Consumer Choice Poll,https://www.newsvoir.com/release/74-homebuyers-unaware-of-how-to-check-rera-status-of-project-reveals-magicbricks-consumer-choice-poll-10123.html
515,NCR Emerges as Affordable Housing Destination in India,https://www.newsvoir.com/release/ncr-emerges-as-affordable-housing-destination-in-india-10114.html
516,DLF Announces Hand over of Gurgaon-based Luxury Project ‘The Skycourt’,https://www.newsvoir.com/release/dlf-announces-hand-over-of-gurgaon-based-luxury-project-the-skycourt--10071.html
517,Key Reforms to Boost Real Estate in the Year 2018,https://www.newsvoir.com/release/key-reforms-to-boost-real-estate-in-the-year-2018-10061.html
518,Bharathi Homes Launches RERA - Approved High-quality Affordable Homes in Vanagaram,https://www.newsvoir.com/release/bharathi-homes-launches-rera-approved-high-quality-affordable-homes-in-vanagaram-10018.html
519,DLF5 Bags Top Honours at Property Awards 2018,https://www.newsvoir.com/release/dlf5-bags-top-honours-at-property-awards-2018-10014.html
520,NBCC Set to Enter New Growth Phase After CMD A.K. Mittal’s Tenure Extended,https://www.newsvoir.com/release/nbcc-set-to-enter-new-growth-phase-after-cmd-a-k-mittal-s-tenure-extended-10011.html
521,Shardul Amarchand Mangaldas Advises Blackstone Group on INR 4750 Crore Investment in Indiabulls Real Estate ,https://www.newsvoir.com/release/shardul-amarchand-mangaldas-advises-blackstone-group-on-inr-4750-crore-investment-in-indiabulls-real-estate-10006.html
522,BDI in Line with Govt. Initiative to Boost Affordable Housing,https://www.newsvoir.com/release/bdi-in-line-with-govt-initiative-to-boost-affordable-housing-10005.html
523,"Fix GST at 5% & Rationalize Stamp Duty, Land Rates for Affordable Housing: PHD Chamber",https://www.newsvoir.com/release/fix-gst-at-5-rationalize-stamp-duty-land-rates-for-affordable-housing-phd-chamber-10003.html
524,Over 70K Potential Home Buying Interest and 20K Plus Contacted for Home Finance at Magicbricks - SBI Home Carnival,https://www.newsvoir.com/release/over-70k-potential-home-buying-interest-and-20k-plus-contacted-for-home-finance-at-magicbricks-sbi-home-carnival-9980.html
525,JMS Buildtech Launches Marine Square at Gurugram,https://www.newsvoir.com/release/jms-buildtech-launches-marine-square-at-gurugram-9975.html
526,"Karda Constructions IPO Opens on March 16, 2018",https://www.newsvoir.com/release/karda-constructions-ipo-opens-on-march-16-2018-9947.html
527,Horizon  Group Launches Luxurious Residential Projects in 'Golden Temple City' of Amritsar,https://www.newsvoir.com/release/horizon-group-launches-luxurious-residential-projects-in-golden-temple-city-of-amritsar-9888.html
528,The Crest’ Luxury Condominium by DLF at DLF5 Witnesses Record Sales,https://www.newsvoir.com/release/the-crest-luxury-condominium-by-dlf-at-dlf5-witnesses-record-sales-9866.html
529,The Crest Adjudged as ‘India’s Most Stylish Property’,https://www.newsvoir.com/release/the-crest-adjudged-as-india-s-most-stylish-property--9842.html
530,Zippserv Launches ‘PricePoint’: India’s First-Ever Platform for Transparent Pricing in Real Estate,https://www.newsvoir.com/release/zippserv-launches-pricepoint-india-s-first-ever-platform-for-transparent-pricing-in-real-estate-9836.html
531,Group Satellite Announces Flagship Affordable Housing Project “Aarambh” in Mumbai,https://www.newsvoir.com/release/group-satellite-announces-flagship-affordable-housing-project-aarambh-in-mumbai-9822.html
532,16000 Plus Choices in the 2nd Season of Magicbricks - SBI Big Bang Home Carnival,https://www.newsvoir.com/release/16000-plus-choices-in-the-2nd-season-of-magicbricks-sbi-big-bang-home-carnival-9816.html
533,18% of MMR's Housing Launches in 2017 Added in Thane - ANAROCK Report,https://www.newsvoir.com/release/18-of-mmr-apos-s-housing-launches-in-2017-added-in-thane-anarock-report-9799.html
534,Industry Experts React to Budget 2018,https://www.newsvoir.com/release/industry-experts-react-to-budget-2018-9774.html
535,Think WhyNot Ropes in Actors Asif Sheikh and Saumya Tandon for Tridhaatu Morya Ad Campaign,https://www.newsvoir.com/release/think-whynot-ropes-in-actors-asif-sheikh-and-saumya-tandon-for-tridhaatu-morya-ad-campaign-9729.html
536,Ex-JLL India Capital Markets MD Launches ANB Capital Advisors,https://www.newsvoir.com/release/ex-jll-india-capital-markets-md-launches-anb-capital-advisors-9722.html
537,Elan Group Hosts an Extravagant Success Party,https://www.newsvoir.com/release/elan-group-hosts-an-extravagant-success-party-9699.html
538,Magicbricks Spreads the Warmth again with the Second Season of “MagicBag” Initiative ,https://www.newsvoir.com/release/magicbricks-spreads-the-warmth-again-with-the-second-season-of-magicbag-initiative--9641.html
539,Ex-Miss World Diana Hayden Signed up as the Brand Ambassador for ‘Mini Homes’,https://www.newsvoir.com/release/ex-miss-world-diana-hayden-signed-up-as-the-brand-ambassador-for-mini-homes--9638.html
540,"India’s First Premium Wellness-Oriented Co-working Space, ‘THE MOSAIC’ Opens Doors in Mumbai",https://www.newsvoir.com/release/india-s-first-premium-wellness-oriented-co-working-space-the-mosaic-opens-doors-in-mumbai-9637.html
541,ANAROCK Launches Report on Affordable Housing in NCR,https://www.newsvoir.com/release/anarock-launches-report-on-affordable-housing-in-ncr-9610.html
542,Magicbricks Consumer Search Trends reveals Consumers are Now Looking for Bigger Larger Houses in 2&3 BHK Sizes,https://www.newsvoir.com/release/magicbricks-consumer-search-trends-reveals-consumers-are-now-looking-for-bigger-larger-houses-in-2-3-bhk-sizes-9605.html
543,Home Seekers’ Searching More Aggressively Reveals Magicbricks Consumer Search Trend Report,https://www.newsvoir.com/release/home-seekers-searching-more-aggressively-reveals-magicbricks-consumer-search-trend-report-9565.html
544,Emaar India Wins Developer and Employer of the Year Awards,https://www.newsvoir.com/release/emaar-india-wins-developer-and-employer-of-the-year-awards-9539.html
545,"Demonetisation, RERA and GST have been the Endurance Test for the Real Estate Industry ",https://www.newsvoir.com/release/demonetisation-rera-and-gst-have-been-the-endurance-test-for-the-real-estate-industry-9500.html
546,"Magicbricks Generates 40,000 Intending Buyers for Properties Worth Rs. 5,000 Crore During Dream Homes Festival-Season 3",https://www.newsvoir.com/release/magicbricks-generates-40-000-intending-buyers-for-properties-worth-rs-5-000-crore-during-dream-homes-festival-season-3-9485.html
547,Mumbai Real-Estate Industry Displays Affinity for PM’s Vision of Housing for All,https://www.newsvoir.com/release/mumbai-real-estate-industry-displays-affinity-for-pm-s-vision-of-housing-for-all-9433.html
548,"Dubai Property Show Opens to Overwhelming Response in Mumbai

",https://www.newsvoir.com/release/dubai-property-show-opens-to-overwhelming-response-in-mumbai-9424.html
549,Nakheel Showcases Diverse Range of Ready-to-Occupy Homes at Dubai Property Show in Mumbai,https://www.newsvoir.com/release/nakheel-showcases-diverse-range-of-ready-to-occupy-homes-at-dubai-property-show-in-mumbai-9423.html
550,ANAROCK Launches Report ‘Mumbai Redefined’ at Economic Times’ ACETECH,https://www.newsvoir.com/release/anarock-launches-report-mumbai-redefined-at-economic-times-acetech-9416.html
551,The 1st Dubai Realty Roundtable Highlights the Vast Opportunities for Indian Investors,https://www.newsvoir.com/release/the-1st-dubai-realty-roundtable-highlights-the-vast-opportunities-for-indian-investors-9415.html
552,"Nohara Japan Enters India with EPS Samurai Wall Panel, a Faster and Space Saving Way to Build Walls",https://www.newsvoir.com/release/nohara-japan-enters-india-with-eps-samurai-wall-panel-a-faster-and-space-saving-way-to-build-walls-9400.html
553,Rahul Singla Conferred with 2017 Young Achiever’s Award,https://www.newsvoir.com/release/rahul-singla-conferred-with-2017-young-achiever-s-award-9386.html
554,Indians Ready to Capitalise on Dubai's Lucrative Real-Estate Industry,https://www.newsvoir.com/release/indians-ready-to-capitalise-on-dubai-s-lucrative-real-estate-industry-9366.html
555,M3M Recorded Sales of Over Rs. 200 Crores with Magicbricks During ‘My Bid My Home’ ,https://www.newsvoir.com/release/m3m-recorded-sales-of-over-rs-200-crores-with-magicbricks-during-my-bid-my-home--9343.html
556,Magicbricks Launches India’s First Online Property Bidding Platform,https://www.newsvoir.com/release/magicbricks-launches-india-s-first-online-property-bidding-platform-9322.html
557,Sophus Elevators Aim to Solve City Parking Issues,https://www.newsvoir.com/release/sophus-elevators-aim-to-solve-city-parking-issues-9298.html
558,Nitesh Kumar Promoted to CEO of TDI Infracorp Ltd.,https://www.newsvoir.com/release/nitesh-kumar-promoted-to-ceo-of-tdi-infracorp-ltd-9253.html
559,Generic Engineering Construction and Projects Bags Rs. 63 Cr Order,https://www.newsvoir.com/release/generic-engineering-construction-and-projects-bags-rs-63-cr-order-9248.html
560,Tata Housing Wins ‘Project of the Year’ at Project Management Institute (PMI) India Awards 2017 ,https://www.newsvoir.com/release/tata-housing-wins-project-of-the-year-at-project-management-institute-pmi-india-awards-2017--9241.html
561,"Magicbricks Launches ‘Property Ka Supermarket,’ India’s First Musical Ad Campaign in Online Real Estate Space",https://www.newsvoir.com/release/magicbricks-launches-property-ka-supermarket-india-s-first-musical-ad-campaign-in-online-real-estate-space-9199.html
562,Emaar Speeds up Work on 40 Projects to Deliver 11000 Flats by 2018,https://www.newsvoir.com/release/emaar-speeds-up-work-on-40-projects-to-deliver-11000-flats-by-2018-9120.html
563,Magicbricks PropIndex Reveals Positive Signs for Real Estate Especially in Southern Markets,https://www.newsvoir.com/release/magicbricks-propindex-reveals-positive-signs-for-real-estate-especially-in-southern-markets-9153.html
564,ANAROCK Property Consultants Acquires Leading Real Estate Broking Firm LJ Hooker’s Indian Operations - Redwoods,https://www.newsvoir.com/release/anarock-property-consultants-acquires-leading-real-estate-broking-firm-lj-hooker-s-indian-operations---redwoods-9151.html
565,Shardul Amarchand Mangaldas Advises DLF Limited on Sale of Stake in DLF Cyber City Developers Limited to GIC,https://www.newsvoir.com/release/shardul-amarchand-mangaldas-advises-dlf-limited-on-sale-of-stake-in-dlf-cyber-city-developers-limited-to-gic-9149.html
566,Magicbricks App Records 40% Rise in New Users in the Last Quarter,https://www.newsvoir.com/release/magicbricks-app-records-40-rise-in-new-users-in-the-last-quarter-9109.html
567,"CREDAI - CBRE Released a Joint Report “Indian Real Estate in 2017 and Beyond” at the CREDAI 17th NATCON 2017, London ",https://www.newsvoir.com/release/credai---cbre-released-a-joint-report-indian-real-estate-in-2017-and-beyond-at-the-credai-17th-natcon-2017-london--9090.html
568,Shri Parshottam Rupala and Shri Mansukh Mandaviya Present Curtain Raiser for 2nd Edition of Vibrant Ceramics,https://www.newsvoir.com/release/shri-parshottam-rupala-and-shri-mansukh-mandaviya-present-curtain-raiser-for-2nd-edition-of-vibrant-ceramics-9058.html
569,"Quote by Mr. Brotin Banerjee, MD & CEO, Tata Housing",https://www.newsvoir.com/release/quote-by-mr-brotin-banerjee-md-ceo-tata-housing-9047.html
570,CREDAI Appoints CBRE as its Knowledge Partner for the prestigious NATCON 2017,https://www.newsvoir.com/release/credai-appoints-cbre-as-its-knowledge-partner-for-the-prestigious-natcon-2017-9043.html
571,Ved Infratech Launches One More Budget Housing in Mulund,https://www.newsvoir.com/release/ved-infratech-launches-one-more-budget-housing-in-mulund-9019.html
572,VKJ Infra Developers to Enter into Land Pooling ,https://www.newsvoir.com/release/vkj-infra-developers-to-enter-into-land-pooling-8980.html
573,Diana Hayden to be the Face of Real Estate Project Estilo Patio in Goa,https://www.newsvoir.com/release/diana-hayden-to-be-the-face-of-real-estate-project-estilo-patio-in-goa-8936.html
574,Real Estate Developer Chintels Announces the Project Completion and Handover of Company’s First Group Housing Project Chintels Paradiso,https://www.newsvoir.com/release/real-estate-developer-chintels-announces-the-project-completion-and-handover-of-company-s-first-group-housing-project-chintels-paradiso-8931.html
575,Anuj Puri's ANAROCK Appoints Rahul Yadav as Chief Product & Technology Officer,https://www.newsvoir.com/release/anuj-puri-s-anarock-appoints-rahul-yadav-as-chief-product-technology-officer-8916.html
576,"Anuj Puri Launches ANAROCK Property Consultants Residential Brokerage, Fund & Investment Platform",https://www.newsvoir.com/release/anuj-puri-launches-anarock-property-consultants-residential-brokerage-fund-investment-platform-8884.html
577,IVCA Successfully Hosted its 2nd Real Estate and Infrastructure Conference,https://www.newsvoir.com/release/ivca-successfully-hosted-its-2nd-real-estate-and-infrastructure-conference-8859.html
578,Delhi’s Connaught Place is 9th Most Expensive Office Market in the World,https://www.newsvoir.com/release/delhi-s-connaught-place-is-9th-most-expensive-office-market-in-the-world-8849.html
579,Emaar India Celebrates ‘World Environment Day’ at its Project Sites in Gurgaon and Mohali,https://www.newsvoir.com/release/emaar-india-celebrates-world-environment-day-at-its-project-sites-in-gurgaon-and-mohali-8799.html
580,"Home Credit India Launches Mobile App, Customers to Access Loan and Repayment Details Instantly",https://www.newsvoir.com/release/home-credit-india-launches-mobile-app-customers-to-access-loan-and-repayment-details-instantly-8800.html
581,Realty Bytes: Bengaluru Leads Residential Sales in 2016 with 27% Market Share: CBRE,https://www.newsvoir.com/release/realty-bytes-bengaluru-leads-residential-sales-in-2016-with-27-market-share-cbre-8655.html
582,Amsterdam-born Creative Office Brand ‘Spaces’ Launches in India,https://www.newsvoir.com/release/amsterdam-born-creative-office-brand-spaces-launches-in-india-8609.html
583,Real Estate Outlook Positive for 2017: CBRE,https://www.newsvoir.com/release/real-estate-outlook-positive-for-2017-cbre-8602.html
584,Emaar India gets Occupancy for IT Park Project ‘Digital Greens’,https://www.newsvoir.com/release/emaar-india-gets-occupancy-for-it-park-project-digital-greens--8589.html
585,Schneider Electric to Make India’s First Integrated Green Field Smart City Project in Naya Raipur a Reality,https://www.newsvoir.com/release/schneider-electric-to-make-india-s-first-integrated-green-field-smart-city-project-in-naya-raipur-a-reality-8581.html
586,IndiQube Launches 4 New Centres for Shared Workspaces in Bangalore ,https://www.newsvoir.com/release/indiqube-launches-4-new-centres-for-shared-workspaces-in-bangalore-8579.html
587,"Home Credit India Recognized as a 2017 Regional Aon Best Employer, India",https://www.newsvoir.com/release/home-credit-india-recognized-as-a-2017-regional-aon-best-employer-india-8552.html
588,Real Estate Developer Chintels Announces Handover of Phase-1 of Company’s First Group Housing Project Chintels Paradiso,https://www.newsvoir.com/release/real-estate-developer-chintels-announces-handover-of-phase-1-of-company-s-first-group-housing-project-chintels-paradiso-8524.html
589,Bharti Realty’s Worldmark Conferred the ‘Best Commercial Project” Award at the 11th CNBC Awaaz Real Estate Awards 2016-17,https://www.newsvoir.com/release/bharti-realty-s-worldmark-conferred-the-best-commercial-project-award-at-the-11th-cnbc-awaaz-real-estate-awards-2016-17-8450.html
590,Tata Housing Celebrates GudiPadwa with the Cashback Revolution Campaign,https://www.newsvoir.com/release/tata-housing-celebrates-gudipadwa-with-the-cashback-revolution-campaign-8433.html
591,Real Estate Body NAREDCO Urges Haryana Government to Expedite Work on KMP Expressway,https://www.newsvoir.com/release/real-estate-body-naredco-urges-haryana-government-to-expedite-work-on-kmp-expressway-8381.html
592,Aerocity Consortium Organises Delhi Aerocity Run 2017,https://www.newsvoir.com/release/aerocity-consortium-organises-delhi-aerocity-run-2017-8368.html
593,"Ashiana Dwarka Honored as ""Budget Apartment Project of the Year”",https://www.newsvoir.com/release/ashiana-dwarka-honored-as-budget-apartment-project-of-the-year--8362.html
594,India’s “Organized Retail Market” Presents a Whopping $75 Billion Opportunity for Retailers,https://www.newsvoir.com/release/india-s-organized-retail-market-presents-a-whopping-75-billion-opportunity-for-retailers-8313.html
595,"Home Credit Completes 5 Successful Years in India, Targets 5 Million Customers by 2018",https://www.newsvoir.com/release/home-credit-completes-5-successful-years-in-india-targets-5-million-customers-by-2018-8294.html
596,Tata Housing Makes Homes Beautiful with Urban Ladder,https://www.newsvoir.com/release/tata-housing-makes-homes-beautiful-with-urban-ladder-8284.html
597,CBRE PropFair 2017 to be Organized in Pune,https://www.newsvoir.com/release/cbre-propfair-2017-to-be-organized-in-pune-8279.html
598,Essel Infraprojects Ltd. (EIL) Pledges Rs 5700 Cr for Jharkhand Government towards Infrastructure Development at Momentum Jharkhand,https://www.newsvoir.com/release/essel-infraprojects-ltd-eil-pledges-rs-5700-cr-for-jharkhand-government-towards-infrastructure-development-at-momentum-jharkhand-8269.html
599,Lubrizol and Finolex Industries Limited Join Hands to Process FlowGuard® Branded CPVC Pipes and Fittings in India,https://www.newsvoir.com/release/lubrizol-and-finolex-industries-limited-join-hands-to-process-flowguard-branded-cpvc-pipes-and-fittings-in-india-8260.html
600,"India’s First Expo on Housing Societies’ Management - ‘Housing Societies’ Management Show (HSMS) 2017’ to be Held on 10th, 11th  & 12th  March at Nehru Centre, Worli, Mumbai",https://www.newsvoir.com/release/india-s-first-expo-on-housing-societies-management---housing-societies-management-show-hsms-2017-to-be-held-on-10th-11th-12th-march-at-nehru-centre-worli-mumbai-8243.html
601,CBRE India Recognised as the Property Management Firm of the Year ,https://www.newsvoir.com/release/cbre-india-recognised-as-the-property-management-firm-of-the-year-8218.html
602,Comment by CBRE on Union Budget 2017-2018,https://www.newsvoir.com/release/comment-by-cbre-on-union-budget-2017-2018-8182.html
603,"Unfazed by Demonitsation, Retail Gets Over USD 0.7 Billion of Investment in 2016; Expected to Grow by 20% in 2017: CBRE",https://www.newsvoir.com/release/unfazed-by-demonitsation-retail-gets-over-usd-0-7-billion-of-investment-in-2016-expected-to-grow-by-20-in-2017-cbre-8142.html
604,Tata Value Homes Expands its Presence in NCR,https://www.newsvoir.com/release/tata-value-homes-expands-its-presence-in-ncr-8127.html
605,The Avenues and Grace by Emaar India Receives Completion Certificate from CMDA,https://www.newsvoir.com/release/the-avenues-and-grace-by-emaar-india-receives-completion-certificate-from-cmda-8106.html
606,Emaar India Conducts Clothes Distribution Drive to Ensure Warmth for its Construction Workers,https://www.newsvoir.com/release/emaar-india-conducts-clothes-distribution-drive-to-ensure-warmth-for-its-construction-workers-8002.html
607,Emaar India Awards Rs. 100 Cr Construction Contract for ‘Colonnade’,https://www.newsvoir.com/release/emaar-india-awards-rs-100-cr-construction-contract-for-colonnade--7981.html
608,Fella Homes an Emerging Start-up Changing Face of Ready to Move-in Rental Homes,https://www.newsvoir.com/release/fella-homes-an-emerging-start-up-changing-face-of-ready-to-move-in-rental-homes-7966.html
609,"Dubai Property Show Starts at BKC, Mumbai",https://www.newsvoir.com/release/dubai-property-show-starts-at-bkc-mumbai-7932.html
610,Dubai Properties to Showcase its World-class Destinations at Dubai Property Show India 2016,https://www.newsvoir.com/release/dubai-properties-to-showcase-its-world-class-destinations-at-dubai-property-show-india-2016-7907.html
611,Ansals Plaza Announces the Grand Opening of its Key Brands,https://www.newsvoir.com/release/ansals-plaza-announces-the-grand-opening-of-its-key-brands-7902.html
612,2nd Edition of Dubai Property Show to be Held in BKC from 9th to 11th December 2016,https://www.newsvoir.com/release/2nd-edition-of-dubai-property-show-to-be-held-in-bkc-from-9th-to-11th-december-2016-7900.html
613,Emaar India Celebrates World AIDS Day at its Project Sites,https://www.newsvoir.com/release/emaar-india-celebrates-world-aids-day-at-its-project-sites-7878.html
614,SARE Homes Raises Rs. 435 Crores from Altico Capital and KKR,https://www.newsvoir.com/release/sare-homes-raises-rs-435-crores-from-altico-capital-and-kkr-7868.html
615,"Indians Invested Rs 13,600 Crores ($2 Billion) in Dubai Realty in HI 2016",https://www.newsvoir.com/release/indians-invested-rs-13-600-crores-2-billion-in-dubai-realty-in-hi-2016-7860.html
616,Emaar India Bags Industry Honour at DNA Real Estate Awards 2016,https://www.newsvoir.com/release/emaar-india-bags-industry-honour-at-dna-real-estate-awards-2016-7857.html
617,"Assotech Realty Pvt Ltd. Organises Plantation Drive
",https://www.newsvoir.com/release/assotech-realty-pvt-ltd-organises-plantation-drive-7840.html
618,"Demystifying Popular Myths, Millennialsto Drive the Real Estate Market in India: CBRE Report",https://www.newsvoir.com/release/demystifying-popular-myths-millennialsto-drive-the-real-estate-market-in-india-cbre-report-7835.html
619,Emaar India Begins Handover of First Phase of Emerald Hills,https://www.newsvoir.com/release/emaar-india-begins-handover-of-first-phase-of-emerald-hills-7826.html
620,Nikulsan in Association with LinkedIn Organizes a Special Workshop on Digital Leads Optimisation in Real Estate Market,https://www.newsvoir.com/release/nikulsan-in-association-with-linkedin-organizes-a-special-workshop-on-digital-leads-optimisation-in-real-estate-market-7812.html
621,Propchill Bags 'Most Popular Website' Title in 2016,https://www.newsvoir.com/release/propchill-bags-most-popular-website-title-in-2016-7805.html
622,"Quote of Mr. Ashish Sarin, CEO, Alpha Corp on the Discontinuation of Rs 1000 and Rs 500 Notes and its Resultant Impact on the Real Estate Sector",https://www.newsvoir.com/release/quote-of-mr-ashish-sarin-ceo-alpha-corp-on-the-discontinuation-of-rs-1000-and-rs-500-notes-and-its-resultant-impact-on-the-real-estate-sector-7762.html
623,SARE Home's View on PM's Decision to Demonetise Rs 500 and Rs 1000 Currency,https://www.newsvoir.com/release/sare-home-s-view-on-pm-s-decision-to-demonetise-rs-500-and-rs-1000-currency-7761.html
624,Green Buildings Become Economically Viable - LEED in Motion 2016 Report,https://www.newsvoir.com/release/green-buildings-become-economically-viable-leed-in-motion-2016-report-7738.html
625,House of Hiranandani’s ‘Anchorage’ Takes You to New Heights in Chennai,https://www.newsvoir.com/release/house-of-hiranandani-s-anchorage-takes-you-to-new-heights-in-chennai-7632.html
626,3rd Edition of JASHN - India's Largest Senior Citizen Sports & Cultural Festival to be Held in October,https://www.newsvoir.com/release/3rd-edition-of-jashn-india-s-largest-senior-citizen-sports-cultural-festival-to-be-held-in-october-7603.html
627,JLL India's Top Leadership Attends WEF India Economic Summit 2016 in New Delhi,https://www.newsvoir.com/release/jll-india-s-top-leadership-attends-wef-india-economic-summit-2016-in-new-delhi-7593.html
628,Essel Infraprojects Felicatated with the Michael Porter-IFC Mint Strategy Award for Path Breaking Innovations,https://www.newsvoir.com/release/essel-infraprojects-felicatated-with-the-michael-porter-ifc-mint-strategy-award-for-path-breaking-innovations-7598.html
629,JLL India & HouseBolo.com Launch Online Home Carnival,https://www.newsvoir.com/release/jll-india-housebolo-com-launch-online-home-carnival-7586.html
630,"Quote on Monetary Policy - Mr. Gaurav Mittal, MD, CHD Developers Limited",https://www.newsvoir.com/release/quote-on-monetary-policy-mr-gaurav-mittal-md-chd-developers-limited-7579.html
631,"Magicbricks.com ‘Dream Homes Festival’, Comes Back 5 Times Bigger in Season 2 ",https://www.newsvoir.com/release/magicbricks-com-dream-homes-festival-comes-back-5-times-bigger-in-season-2--7575.html
