,title,link
0,OneRare Joins Forces with Massive Restaurants to Redefine the Landscape of Blockchain Industry in India,https://www.newsvoir.com/release/onerare-joins-forces-with-massive-restaurants-to-redefine-the-landscape-of-blockchain-industry-in-india-19392.html
1,Living Liquidz Launches Mansionz a New Lifestyle Concept Bungalow in Mumbai with Bangalore and Pune on the Horizon,https://www.newsvoir.com/release/living-liquidz-launches-mansionz-a-new-lifestyle-concept-bungalow-in-mumbai-with-bangalore-and-pune-on-the-horizon-19227.html
2,American Multinational QSR Chain Figaro's Pizza Announces its Master Franchise Partnership with FranGlobal to Expand its Presence in India,https://www.newsvoir.com/release/american-multinational-qsr-chain-figaro-s-pizza-announces-its-master-franchise-partnership-with-franglobal-to-expand-its-presence-in-india-19142.html
3,"Skyland Group Launches La Trio Pizza and Kathi Nation in Nawanshahr, Punjab",https://www.newsvoir.com/release/skyland-group-launches-la-trio-pizza-and-kathi-nation-in-nawanshahr-punjab-18336.html
4,Skyland Group Aims to Create 300 Solopreneurs by January 2022,https://www.newsvoir.com/release/skyland-group-aims-to-create-300-solopreneurs-by-january-2022-18042.html
5,Goa's KCCA Becomes First in India to Welcome French Master Chef in Faculty,https://www.newsvoir.com/release/goa-s-kcca-becomes-first-in-india-to-welcome-french-master-chef-in-faculty-17919.html
6,'Smokking Grillz' in Noida is One of the Best Dining Restaurants Started by a Couple - Mr. A.K. Saini and Mrs. Prema Saini,https://www.newsvoir.com/release/smokking-grillz-in-noida-is-one-of-the-best-dining-restaurants-started-by-a-couple-mr-a-k-saini-and-mrs-prema-saini-16462.html
7,Chevron Launched: A Great Place to be Stranded,https://www.newsvoir.com/release/chevron-launched-a-great-place-to-be-stranded-15103.html
8,"Accor, Hard Rock and Gordon Ramsey's Hell's Kitchen Setting the Benchmark with My Menu",https://www.newsvoir.com/release/accor-hard-rock-and-gordon-ramsey-apos-s-hell-apos-s-kitchen-setting-the-benchmark-with-my-menu-14895.html
9,"Restaurants Pivot To Direct-to-Consumer (D2C) Model, POSist Plays Technology Enabler with Online Ordering System ",https://www.newsvoir.com/release/restaurants-pivot-to-direct-to-consumer-d2c-model-posist-plays-technology-enabler-with-online-ordering-system-14411.html
10,Five Star Unveils Two Flagship Stores in Delhi NCR Region,https://www.newsvoir.com/release/five-star-unveils-two-flagship-stores-in-delhi-ncr-region-14060.html
11,Cloud Kitchen and Restaurant Technology Platform POSist to Empower Businesses with Digital Ordering and Industry-first Digital Postpaid Dining Experience,https://www.newsvoir.com/release/cloud-kitchen-and-restaurant-technology-platform-posist-to-empower-businesses-with-digital-ordering-and-industry-first-digital-postpaid-dining-experience-13938.html
12,#CustomerFirst - McDonald's India Upholds its Promise of Serving Safe and Hygienic Food ,https://www.newsvoir.com/release/customerfirst-mcdonald-apos-s-india-upholds-its-promise-of-serving-safe-and-hygienic-food-13613.html
13,"Bruxie, A Californian Brand Enters Indian Market with Waffle Chicken Sandwich",https://www.newsvoir.com/release/bruxie-a-californian-brand-enters-indian-market-with-waffle-chicken-sandwich-13299.html
14,"BrightStar, Franchise Partner of Californian Burger Chain, Carl's Jr. Plans to Triple its Footprint and Seek Investment in India ",https://www.newsvoir.com/release/brightstar-franchise-partner-of-californian-burger-chain-carl-s-jr-plans-to-triple-its-footprint-and-seek-investment-in-india-13155.html
15,Stable 2019 Paves Way for a Boisterous 2020,https://www.newsvoir.com/release/stable-2019-paves-way-for-a-boisterous-2020-13134.html
16,"Star & Endemol Shine India Bring Cricket and Food Together
",https://www.newsvoir.com/release/star-endemol-shine-india-bring-cricket-and-food-together-13092.html
17,"Sarovar Hotels Launches Sixth Hotel in Mumbai; Royal Hometel Suites, Dahisar 
",https://www.newsvoir.com/release/sarovar-hotels-launches-sixth-hotel-in-mumbai-royal-hometel-suites-dahisar-13005.html
18,US Cranberries Organizes Masterclass with Chef Saransh Goila,https://www.newsvoir.com/release/us-cranberries-organizes-masterclass-with-chef-saransh-goila-12937.html
19,Best Luxury Hotel in India Award from Hospitality India Travel Awards 2019 for JW Marriott Mussoorie Walnut Grove Resort & Spa,https://www.newsvoir.com/release/best-luxury-hotel-in-india-award-from-hospitality-india-travel-awards-2019-for-jw-marriott-mussoorie-walnut-grove-resort-spa-12869.html
20,Alliances Galore Hosts 5th Edition of Gourmet Fest,https://www.newsvoir.com/release/alliances-galore-hosts-5th-edition-of-gourmet-fest-12863.html
21,Subway to Celebrate World Sandwich Day with #GoodComesBack Campaign and Bogo Offer on November 1,https://www.newsvoir.com/release/subway-to-celebrate-world-sandwich-day-with-goodcomesback-campaign-and-bogo-offer-on-november-1-12741.html
22,Indian Culinary Forum Organises the 16th Annual Chef Awards the Oscars of Chef Awards in India,https://www.newsvoir.com/release/indian-culinary-forum-organises-the-16th-annual-chef-awards-the-oscars-of-chef-awards-in-india-12716.html
23,Subway® Adds Four New Flavours to Loaded Signature Wraps as Seasonal Offer ,https://www.newsvoir.com/release/subway-adds-four-new-flavours-to-loaded-signature-wraps-as-seasonal-offer--12627.html
24,McDonald’s Celebrates Founder’s Day in North and East India ,https://www.newsvoir.com/release/mcdonald-s-celebrates-founder-s-day-in-north-and-east-india--12609.html
25,McDonald’s India (West & South) Partners with RASCI to Further the Government’s “Skill India” Mission ,https://www.newsvoir.com/release/mcdonald-s-india-west-south-partners-with-rasci-to-further-the-government-s-skill-india-mission--12593.html
26,"A Nature Wonderland Awaits this Festive Season at Shangri-La’s Villingili Resort & Spa, Maldives",https://www.newsvoir.com/release/a-nature-wonderland-awaits-this-festive-season-at-shangri-la-s-villingili-resort-spa-maldives-12566.html
27,"US Cranberries Embark on a New Journey with Saransh Goila – Author, Restaurateur, and Maverick Chef ",https://www.newsvoir.com/release/us-cranberries-embark-on-a-new-journey-with-saransh-goila-author-restaurateur-and-maverick-chef--12564.html
28,HRANI Thanks Government for Rationalization of GST,https://www.newsvoir.com/release/hrani-thanks-government-for-rationalization-of-gst-12499.html
29,"EazyDiner Foodie Awards, Bengaluru 3rd Edition Recognizes Bengaluru’s Leading Restaurants and Chefs",https://www.newsvoir.com/release/eazydiner-foodie-awards-bengaluru-3rd-edition-recognizes-bengaluru-s-leading-restaurants-and-chefs-12384.html
30,"Aishwarya Bhende Honored for Conceptualizing 'Best Theme Based Restaurant' at Restaurant India Awards 2019
",https://www.newsvoir.com/release/aishwarya-bhende-honored-for-conceptualizing-best-theme-based-restaurant-at-restaurant-india-awards-2019-12343.html
31,LMSKIT and Queensline Organizes Annual HR Summit for Corporate Leaders,https://www.newsvoir.com/release/lmskit-and-queensline-organizes-annual-hr-summit-for-corporate-leaders-11925.html
32,"Burger Singh Launches New Menu 
",https://www.newsvoir.com/release/burger-singh-launches-new-menu-11757.html
33,Foodhall Partners with Scootsy: An On-demand Delivery Platform,https://www.newsvoir.com/release/foodhall-partners-with-scootsy-an-on-demand-delivery-platform-11702.html
34,Charcoal Eats Brings a Twist to its Menu with Mumbai-style Pav Wows and Rice Bowls,https://www.newsvoir.com/release/charcoal-eats-brings-a-twist-to-its-menu-with-mumbai-style-pav-wows-and-rice-bowls-11636.html
35,Zorambo Aims to Build the World’s Largest Caftaurant Chain ,https://www.newsvoir.com/release/zorambo-aims-to-build-the-world-s-largest-caftaurant-chain--11621.html
36,DARYAGANJ Restaurant - By the inventors of Butter Chicken and Dal Makhani,https://www.newsvoir.com/release/daryaganj-restaurant-by-the-inventors-of-butter-chicken-and-dal-makhani-11538.html
37,"Drunken Monkey Launches New Outlets in Navi Mumbai, Guwahati, Hyderabad and Rajahmundry",https://www.newsvoir.com/release/drunken-monkey-launches-new-outlets-in-navi-mumbai-guwahati-hyderabad-and-rajahmundry-11450.html
38,"Homegrown Food Brand, Charcoal Eats, Comes to Silicon Valley of India - Opens 34th Outlet in India",https://www.newsvoir.com/release/homegrown-food-brand-charcoal-eats-comes-to-silicon-valley-of-india-opens-34th-outlet-in-india-11160.html
39,"Ambuja Neotia Group Brings Authentic American Bar & Grill Experience of the Iconic Uno® Chicago Bar & Grill, to Bengaluru, India",https://www.newsvoir.com/release/ambuja-neotia-group-brings-authentic-american-bar-grill-experience-of-the-iconic-uno-chicago-bar-grill-to-bengaluru-india-11107.html
40,OYO Believes Budget Association Frenzy Misplaced; Will Lead to Price Increase Upto 40%,https://www.newsvoir.com/release/oyo-believes-budget-association-frenzy-misplaced-will-lead-to-price-increase-upto-40-11100.html
41,Biryani by Kilo to Raise USD 6-8 Million in its Series A funding Eyeing 100+ Outlets Pan-India and Abroad,https://www.newsvoir.com/release/biryani-by-kilo-to-raise-usd-6-8-million-in-its-series-a-funding-eyeing-100-outlets-pan-india-and-abroad-11051.html
42,"Ambuja Neotia Group brings Authentic American Bar & Grill Experience of the Iconic Uno® Chicago Bar & Grill, to India",https://www.newsvoir.com/release/ambuja-neotia-group-brings-authentic-american-bar-grill-experience-of-the-iconic-uno-chicago-bar-grill-to-india-11049.html
43,"Foodhall, a Premium Lifestyle Food Superstore by Future Group, has Expanded its Footprint in the National Capital Region",https://www.newsvoir.com/release/foodhall-a-premium-lifestyle-food-superstore-by-future-group-has-expanded-its-footprint-in-the-national-capital-region-11031.html
44,Toxic Lounge & Bar is Set to Groove Delhiites with Big Gigs Lined up for the Season,https://www.newsvoir.com/release/toxic-lounge-bar-is-set-to-groove-delhiites-with-big-gigs-lined-up-for-the-season-11039.html
45,Alliances Galore and Axis Bank Hosts the 4th Edition of Gourmet Fest,https://www.newsvoir.com/release/alliances-galore-and-axis-bank-hosts-the-4th-edition-of-gourmet-fest-11005.html
46,The ThickShake Factory Never Ceases to Impress,https://www.newsvoir.com/release/the-thickshake-factory-never-ceases-to-impress-10979.html
47,Mobikon Announces ‘Self Serve Loyalty’ for the QSR and Fast Casual Restaurants,https://www.newsvoir.com/release/mobikon-announces-self-serve-loyalty-for-the-qsr-and-fast-casual-restaurants-10884.html
48,Revel in the Music at Hype - Delhi's Best Night Club,https://www.newsvoir.com/release/revel-in-the-music-at-hype-delhi-s-best-night-club-10878.html
49,Big Musical Nights Ahead at Umang Tewari’s The Junkyard Café and Local in CP,https://www.newsvoir.com/release/big-musical-nights-ahead-at-umang-tewari-s-the-junkyard-caf-and-local-in-cp-10874.html
50,"UN's Sustainable Development Goals to Drive Discussions at 3rd Tasting India Symposium: 
December 13-16, 2018",https://www.newsvoir.com/release/un-s-sustainable-development-goals-to-drive-discussions-at-3rd-tasting-india-symposium-december-13-16-2018-10843.html
51,Charcoal Eats is the Hospitality Partner for Puneri Paltan,https://www.newsvoir.com/release/charcoal-eats-is-the-hospitality-partner-for-puneri-paltan-10836.html
52,"This Festive Season, Indulge in Fruity Delights Only at ‘The ThickShake Factory’",https://www.newsvoir.com/release/this-festive-season-indulge-in-fruity-delights-only-at-the-thickshake-factory--10813.html
53,The ThickShake Factory Opens its Door for Mumbaikars,https://www.newsvoir.com/release/the-thickshake-factory-opens-its-door-for-mumbaikars-10754.html
54,Burger Singh to Add 40 Franchise Stores to its Kitty,https://www.newsvoir.com/release/burger-singh-to-add-40-franchise-stores-to-its-kitty-10742.html
55,"Charcoal Eats brings Delicious Treats at Unbelievable Prices to Celebrate its 3rd Anniversary
",https://www.newsvoir.com/release/charcoal-eats-brings-delicious-treats-at-unbelievable-prices-to-celebrate-its-3rd-anniversary-10729.html
56,Pop Night with Alisha Chinai ft Anupam Amod on 21st Sept at The Junkyard Cafe,https://www.newsvoir.com/release/pop-night-with-alisha-chinai-ft-anupam-amod-on-21st-sept-at-the-junkyard-cafe-10690.html
57,The ThickShake Factory is Arriving on the Shores of Mumbai with Lip-smacking Delicious Shakes ,https://www.newsvoir.com/release/the-thickshake-factory-is-arriving-on-the-shores-of-mumbai-with-lip-smacking-delicious-shakes-10615.html
58,Charcoal Eats Salutes the Indian Armed Forces with a Special Discount Scheme,https://www.newsvoir.com/release/charcoal-eats-salutes-the-indian-armed-forces-with-a-special-discount-scheme-10539.html
59,"Paisabazaar.com, NeoGrowth Collaborate for SME Loans; Disburse Largest POS-based Loan to Bangalore Restaurant",https://www.newsvoir.com/release/paisabazaar-com-neogrowth-collaborate-for-sme-loans-disburse-largest-pos-based-loan-to-bangalore-restaurant-10540.html
60,Sodexo Ties-up with QSR Start-up Charcoal Eats,https://www.newsvoir.com/release/sodexo-ties-up-with-qsr-start-up-charcoal-eats-10510.html
61,Charcoal Eats Launches in Chennai; Brings Modern Indian Flavours to South India,https://www.newsvoir.com/release/charcoal-eats-launches-in-chennai-brings-modern-indian-flavours-to-south-india-10368.html
62,Select CITYWALK becomes the First Mall to Pledge Support towards Reducing Plastic Straws,https://www.newsvoir.com/release/select-citywalk-becomes-the-first-mall-to-pledge-support-towards-reducing-plastic-straws-10284.html
63,"The Crest, DLF5 Unveils State-of-the-art The Crest Clubhouse at Gurugram",https://www.newsvoir.com/release/the-crest-dlf5-unveils-state-of-the-art-the-crest-clubhouse-at-gurugram-10094.html
64,Relais & Châteaux Announces 10th April as the First Charity Day of the Indian Subcontinent,https://www.newsvoir.com/release/relais-ch-teaux-announces-10th-april-as-the-first-charity-day-of-the-indian-subcontinent-10037.html
65,JMS Buildtech Launches Marine Square at Gurugram,https://www.newsvoir.com/release/jms-buildtech-launches-marine-square-at-gurugram-9975.html
66,Edenred India Facilitating Easier Processes to Accelerate KYC,https://www.newsvoir.com/release/edenred-india-facilitating-easier-processes-to-accelerate-kyc-9939.html
67,"Hotel Sangeetha, DLF Branch, Chennai, Issues a Clarification on Food Pricing",https://www.newsvoir.com/release/hotel-sangeetha-dlf-branch-chennai-issues-a-clarification-on-food-pricing-9502.html
68,"Shangri-La Hotel, Colombo Set to Introduce a New Level of Luxury in Sri Lanka",https://www.newsvoir.com/release/shangri-la-hotel-colombo-set-to-introduce-a-new-level-of-luxury-in-sri-lanka-9129.html
69,Food Hospitality World Show Plays Host to the Biggest Culinary and Mixology Competition in Bangalore,https://www.newsvoir.com/release/food-hospitality-world-show-plays-host-to-the-biggest-culinary-and-mixology-competition-in-bangalore-9095.html
70,The Grand New Flagship Period Dining Experience of Oudh 1590 Opened its Door at Southern Avenue,https://www.newsvoir.com/release/the-grand-new-flagship-period-dining-experience-of-oudh-1590-opened-its-door-at-southern-avenue-9085.html
71,"Jugnoo Turns EBITDA Positive, on Track for INR 70 Crores Annual Net Revenue",https://www.newsvoir.com/release/jugnoo-turns-ebitda-positive-on-track-for-inr-70-crores-annual-net-revenue-8917.html
72,Chowman Awarded for “Best Foreign Cuisine Restaurant of the Year-Chinese” & Oudh 1590 for “Best Theme Based Restaurant of the Year”,https://www.newsvoir.com/release/chowman-awarded-for-best-foreign-cuisine-restaurant-of-the-year-chinese-oudh-1590-for-best-theme-based-restaurant-of-the-year--8885.html
73,Chowman Kolkata Adds Another Feather to its Cap,https://www.newsvoir.com/release/chowman-kolkata-adds-another-feather-to-its-cap-8783.html
74,Jugnoo Takes a Big Leap in Restaurant Aggregation; Launches Menus in 21 Cities,https://www.newsvoir.com/release/jugnoo-takes-a-big-leap-in-restaurant-aggregation-launches-menus-in-21-cities-8749.html
75,"Cox & Kings' Survey Reveals Dubai, UK and Singapore are the Top Vegetarian-Friendly Destinations for Indians",https://www.newsvoir.com/release/cox-kings-survey-reveals-dubai-uk-and-singapore-are-the-top-vegetarian-friendly-destinations-for-indians-8695.html
76,"OyeKidhar Launches App to Live-track Food, Courier Delivery, School & Office Transport etc on One Page",https://www.newsvoir.com/release/oyekidhar-launches-app-to-live-track-food-courier-delivery-school-office-transport-etc-on-one-page-8623.html
77,Dubai Parks and Resorts Announces its Summer Campaign – The ‘Amazing List’ for Indians,https://www.newsvoir.com/release/dubai-parks-and-resorts-announces-its-summer-campaign-the-amazing-list-for-indians-8625.html
78,Indian Participation Continues to Grow at SIAL China 2017,https://www.newsvoir.com/release/indian-participation-continues-to-grow-at-sial-china-2017-8578.html
79,Student of Chennais Amirta Makes the City Proud Winning Bronze Medal in National Level Culinary Art Competition,https://www.newsvoir.com/release/student-of-chennais-amirta-makes-the-city-proud-winning-bronze-medal-in-national-level-culinary-art-competition-8442.html
80,"Students of Chennais Amirta Create First-of-its-kind Record in the Employment History of Hospitality Sector with 2,587 Job offers in One Go",https://www.newsvoir.com/release/students-of-chennais-amirta-create-first-of-its-kind-record-in-the-employment-history-of-hospitality-sector-with-2-587-job-offers-in-one-go-8416.html
81,India’s Biggest Job Fair for Hospitality Industry Inaugurated at Chennais Amirta International Institute of Hotel Management ,https://www.newsvoir.com/release/india-s-biggest-job-fair-for-hospitality-industry-inaugurated-at-chennais-amirta-international-institute-of-hotel-management--8392.html
82,"Celebrate Valentines Week with the ‘Epitome of Love’ - Taj Mahal, Specially Created at Pacific Mall",https://www.newsvoir.com/release/celebrate-valentines-week-with-the-epitome-of-love---taj-mahal-specially-created-at-pacific-mall-8245.html
83,Sodexo Conducts the first-ever CXO Food Walk with Kalyan Karmakar,https://www.newsvoir.com/release/sodexo-conducts-the-first-ever-cxo-food-walk-with-kalyan-karmakar-8214.html
84,KFC gives Customers a Chance to Unlock the Legendary Taste of ‘Nashville Chicken’ Using the Power of their Minds,https://www.newsvoir.com/release/kfc-gives-customers-a-chance-to-unlock-the-legendary-taste-of-nashville-chicken-using-the-power-of-their-minds-8173.html
85,"InterContinental Hotels Group Appoints Sudeep Jain as Vice President, Development, South West Asia",https://www.newsvoir.com/release/intercontinental-hotels-group-appoints-sudeep-jain-as-vice-president-development-south-west-asia-8162.html
86,Celebrity Chef Shazia Khan at Phoenix Marketcity,https://www.newsvoir.com/release/celebrity-chef-shazia-khan-at-phoenix-marketcity-8084.html
87,FreeCharge and Food Tech Platform Faasos Tie Up for e-Wallet Payment Solution,https://www.newsvoir.com/release/freecharge-and-food-tech-platform-faasos-tie-up-for-e-wallet-payment-solution-8027.html
88,"Bring on the Year End Festivities at Ansal Plaza, Delhi’s First Mall",https://www.newsvoir.com/release/bring-on-the-year-end-festivities-at-ansal-plaza-delhi-s-first-mall-8026.html
89,FreeCharge Launches “Eat-Shop-Love” Festival,https://www.newsvoir.com/release/freecharge-launches-eat-shop-love-festival-8009.html
90,Frshly offers Hot Food on the Move,https://www.newsvoir.com/release/frshly-offers-hot-food-on-the-move-8001.html
91,"Top Industry Experts Discuss Trends and Usage of America’s Original Superfruit, US Cranberries ",https://www.newsvoir.com/release/top-industry-experts-discuss-trends-and-usage-of-america-s-original-superfruit-us-cranberries--7871.html
92,Delhi-Based QD's Raised Funds to Expand its Network of Restaurants,https://www.newsvoir.com/release/delhi-based-qd-s-raised-funds-to-expand-its-network-of-restaurants-7707.html
93,"Enjoy a 5-Star Wedding within Your Budget at Ritz Banquets
",https://www.newsvoir.com/release/enjoy-a-5-star-wedding-within-your-budget-at-ritz-banquets-7642.html
94,Budding Chefs and Mixologists Create Magic with U.S. Premium Agricultural Products at Seventh Edition of Restaurant & Catering Show,https://www.newsvoir.com/release/budding-chefs-and-mixologists-create-magic-with-u-s-premium-agricultural-products-at-seventh-edition-of-restaurant-catering-show-7574.html
95,"Top Industry Experts Discuss Trends and Usage of America’s Original Superfruit, US Cranberries",https://www.newsvoir.com/release/top-industry-experts-discuss-trends-and-usage-of-america-s-original-superfruit-us-cranberries-7549.html
96,The Battle of ‘The Goan Chef Award’ Won with Preethi Kitchen Appliances,https://www.newsvoir.com/release/the-battle-of-the-goan-chef-award-won-with-preethi-kitchen-appliances-7475.html
97,IHG Opens First Crowne Plaza® Hotel in Pune,https://www.newsvoir.com/release/ihg-opens-first-crowne-plaza-hotel-in-pune-6887.html
98,Holiday Inn® Turns New Kids Menu Dishes into Masterpieces,https://www.newsvoir.com/release/holiday-inn-turns-new-kids-menu-dishes-into-masterpieces-6880.html
99,Petrified Travellers Salute Punjabi Hospitality in Haryana,https://www.newsvoir.com/release/petrified-travellers-salute-punjabi-hospitality-in-haryana-6251.html
100,Indigo Live Music Bar Presents the Nirmika ‘Jhoote’ Tour,https://www.newsvoir.com/release/indigo-live-music-bar-presents-the-nirmika-jhoote-tour-6210.html
101,Palate Fest goes to Goa – Collaborates with the International Film Festival of India,https://www.newsvoir.com/release/palate-fest-goes-to-goa-collaborates-with-the-international-film-festival-of-india-5427.html
102,BridgeStreet Global Hospitality Named 2014 “Best serviced Apartments” by Association of Relocation Professionals,https://www.newsvoir.com/release/bridgestreet-global-hospitality-named-2014-best-serviced-apartments-by-association-of-relocation-professionals-1987.html
103,Displaying Photos and Responding to Feedback Makes Restaurants Pages on TripAdvisor  More Compelling to Potential Diners ,https://www.newsvoir.com/release/displaying-photos-and-responding-to-feedback-makes-restaurants-pages-on-tripadvisor-more-compelling-to-potential-diners-1952.html
104,Hyderabad Rock and Rolls at the ‘Kingfisher Premium –The Great Indian Octoberfest’,https://www.newsvoir.com/release/hyderabad-rock-and-rolls-at-the-kingfisher-premium-the-great-indian-octoberfest--1947.html
105,"Taste of Gods Own Country 
",https://www.newsvoir.com/release/taste-of-gods-own-country-1479.html
