,title,link
244,"Post Budget Reaction from Technology/Education/Retail, BFSI/Auto/ Real Estate",https://www.newsvoir.com/release/post-budget-reaction-from-technology-education-retail-bfsi-auto-real-estate-8186.html
245,"Airtel Payments Bank Rolls Out 360 Degree Launch Campaign to Showcase its Differentiated, Convenient Digital Banking Offerings",https://www.newsvoir.com/release/airtel-payments-bank-rolls-out-360-degree-launch-campaign-to-showcase-its-differentiated-convenient-digital-banking-offerings-8183.html
246,Tata Consultancy Services Achieves Oracle PartnerNetwork Cloud Elite Designation,https://www.newsvoir.com/release/tata-consultancy-services-achieves-oracle-partnernetwork-cloud-elite-designation-8177.html
247,VODAFONE SuperNetTM 4G Launched in Meerut,https://www.newsvoir.com/release/vodafone-supernettm-4g-launched-in-meerut-8175.html
248,VTech Phones Added to Alcatel-Lucent Enterprise Vertical Offer,https://www.newsvoir.com/release/vtech-phones-added-to-alcatel-lucent-enterprise-vertical-offer-8174.html
249,Intex Expands its E-Payment Services for Android Users on Google Play Store,https://www.newsvoir.com/release/intex-expands-its-e-payment-services-for-android-users-on-google-play-store-8166.html
250,CASHe Integrates Paytm Wallet for Direct Cash Transfers thereby Becoming India’s First Mobile-Enabled Instant Loan Application to Integrate a Mobile Wallet,https://www.newsvoir.com/release/cashe-integrates-paytm-wallet-for-direct-cash-transfers-thereby-becoming-india-s-first-mobile-enabled-instant-loan-application-to-integrate-a-mobile-wallet-8158.html
251,Infosys Positioned as a Leader and Star Performer 2016 in Big Data and Analytics Services in Global Banking PEAK Matrix™ by Everest Group,https://www.newsvoir.com/release/infosys-positioned-as-a-leader-and-star-performer-2016-in-big-data-and-analytics-services-in-global-banking-peak-matrix-by-everest-group-8145.html
252,Tata Consultancy Services Honored by the Best and Brightest 2016,https://www.newsvoir.com/release/tata-consultancy-services-honored-by-the-best-and-brightest-2016-8140.html
253,Unlimited Offers for Vodafone RED Postpaid Customers,https://www.newsvoir.com/release/unlimited-offers-for-vodafone-red-postpaid-customers-8136.html
254,"CASHe, Andromeda Ink Partnership Deal",https://www.newsvoir.com/release/cashe-andromeda-ink-partnership-deal-8133.html
255,Vodafone SupernetTM 4G Launched in Moradabad,https://www.newsvoir.com/release/vodafone-supernettm-4g-launched-in-moradabad-8129.html
256,Alibaba Group’s UCWeb Announces Investment of 2 Billion Rupees for India and Indonesia Market,https://www.newsvoir.com/release/alibaba-group-s-ucweb-announces-investment-of-2-billion-rupees-for-india-and-indonesia-market-8125.html
257,TCS Positioned as Leader Amongst Global Product Engineering Services,https://www.newsvoir.com/release/tcs-positioned-as-leader-amongst-global-product-engineering-services-8118.html
258,China Mobile Selects Brocade NFV Software Appliance to Support Internet Plus Mission,https://www.newsvoir.com/release/china-mobile-selects-brocade-nfv-software-appliance-to-support-internet-plus-mission-8115.html
259,Enjoy 4x Data on Vodafone Supernet 4GTM,https://www.newsvoir.com/release/enjoy-4x-data-on-vodafone-supernet-4gtm-8109.html
260,Vodafone SuperNetTM 4G Launched in Yamunanangar,https://www.newsvoir.com/release/vodafone-supernettm-4g-launched-in-yamunanangar-8075.html
261,"Ab Internet Kar Befikar, Vodafone Launches SuperHour",https://www.newsvoir.com/release/ab-internet-kar-befikar-vodafone-launches-superhour-8060.html
262,FreeCharge Appoints Mayank Kapoor as its New HR Head,https://www.newsvoir.com/release/freecharge-appoints-mayank-kapoor-as-its-new-hr-head-8053.html
263,Vodafone SuperNetTM 4G Launched in Uttarakhand & UP (West) Circle ,https://www.newsvoir.com/release/vodafone-supernettm-4g-launched-in-uttarakhand-up-west-circle-8052.html
264,Aircel Launches Exclusive Audio Content Created by Noted Filmmaker Vikram Bhatt on Mobile,https://www.newsvoir.com/release/aircel-launches-exclusive-audio-content-created-by-noted-filmmaker-vikram-bhatt-on-mobile-8049.html
265,‘Discover Gifts’ on MyVodafone App and ‘Unlock Data’ upto 1.7GB,https://www.newsvoir.com/release/-discover-gifts-on-myvodafone-app-and-unlock-data-upto-1-7gb-8031.html
266,Now Shop Online on eBay India Using FreeCharge,https://www.newsvoir.com/release/now-shop-online-on-ebay-india-using-freecharge-8019.html
267,Telenor India’s WebWise Report Reveals Internet Habits of School going Children,https://www.newsvoir.com/release/telenor-india-s-webwise-report-reveals-internet-habits-of-school-going-children-8015.html
268,Alibaba Group’s 9Apps Partners with Gameloft to Distribute Top Games in India,https://www.newsvoir.com/release/alibaba-group-s-9apps-partners-with-gameloft-to-distribute-top-games-in-india-8014.html
269,VOIZD Debuts Social Media Space with its Unique 30 Second Audio Messaging Wall,https://www.newsvoir.com/release/voizd-debuts-social-media-space-with-its-unique-30-second-audio-messaging-wall-8013.html
270,10digi to Start Delhi NCR Operations,https://www.newsvoir.com/release/10digi-to-start-delhi-ncr-operations-8005.html
271,BSNL Brings Free E-mail Address in 8 Indian Languages  with “Datamail” App  ,https://www.newsvoir.com/release/bsnl-brings-free-e-mail-address-in-8-indian-languages-with-datamail-app--7993.html
272,Vodafone Spreads Warmth this Winter,https://www.newsvoir.com/release/vodafone-spreads-warmth-this-winter-7990.html
273,FreeCharge Launches India’s First e-Wallet Protection Plan for its Users,https://www.newsvoir.com/release/freecharge-launches-india-s-first-e-wallet-protection-plan-for-its-users-7982.html
274,Integrated Marketing Agency Ignition Creative Announces Asia-Pacific Expansion ,https://www.newsvoir.com/release/integrated-marketing-agency-ignition-creative-announces-asia-pacific-expansion-7980.html
275,"UC Web Technology Trends 2017 - Mr. Kenny Ye, GM-Global Markets, Alibaba Mobile Business Group",https://www.newsvoir.com/release/uc-web-technology-trends-2017-mr-kenny-ye-gm-global-markets-alibaba-mobile-business-group-7976.html
276,Vodafone IoT and Ecolibrium Energy to Deliver Up to 30% Saving in Energy Costs for Industrial Consumers,https://www.newsvoir.com/release/vodafone-iot-and-ecolibrium-energy-to-deliver-up-to-30-saving-in-energy-costs-for-industrial-consumers-7957.html
277,Vodafone Introducing Vodafone M- Pesa Pay,https://www.newsvoir.com/release/vodafone-introducing-vodafone-m-pesa-pay-7946.html
278,FreeCharge Salutes Government’s Cashless Incentives with a Few of its Own,https://www.newsvoir.com/release/freecharge-salutes-government-s-cashless-incentives-with-a-few-of-its-own-7928.html
279,"Jee Bhar Ke Karo Baatein, Vodafone Offers Unlimited Calling",https://www.newsvoir.com/release/jee-bhar-ke-karo-baatein-vodafone-offers-unlimited-calling-7927.html
280,Airtel Offers Free Voice Calls to Anywhere in India,https://www.newsvoir.com/release/airtel-offers-free-voice-calls-to-anywhere-in-india-7921.html
281,"New Report by The George Institute Urges the mHealth Community to go Beyond the ""Quickfixes”",https://www.newsvoir.com/release/new-report-by-the-george-institute-urges-the-mhealth-community-to-go-beyond-the-quickfixes--7919.html
282,New Landmark Report Reveals Telenor Group’s Contribution to Asia’s Digital Future,https://www.newsvoir.com/release/new-landmark-report-reveals-telenor-group-s-contribution-to-asia-s-digital-future-7918.html
283,Vodafone Delights 4G Pre-Paid Customers with ‘Double Data’ Bonanza,https://www.newsvoir.com/release/vodafone-delights-4g-pre-paid-customers-with-double-data-bonanza-7916.html
284,Teleperformance India Recognized as a 2016 - Aon Best Employer,https://www.newsvoir.com/release/teleperformance-india-recognized-as-a-2016-aon-best-employer-7909.html
285,"Enjoy Game-A-Thon, The Ultimate Gaming Experience with Vodafone U",https://www.newsvoir.com/release/enjoy-game-a-thon-the-ultimate-gaming-experience-with-vodafone-u-7906.html
286,Coolpad Rolls Out Strong Retail Strategy for 2017,https://www.newsvoir.com/release/coolpad-rolls-out-strong-retail-strategy-for-2017-7898.html
287,Tata Communications Launches a New Brand Campaign in India,https://www.newsvoir.com/release/tata-communications-launches-a-new-brand-campaign-in-india-7895.html
288,Vodafone Launches Special Caller Tunes for Speech and Hearing Impaired on International Disability Day,https://www.newsvoir.com/release/vodafone-launches-special-caller-tunes-for-speech-and-hearing-impaired-on-international-disability-day-7888.html
289,Airtel Payments Bank Announces Additional Benefit on Savings Deposits,https://www.newsvoir.com/release/airtel-payments-bank-announces-additional-benefit-on-savings-deposits-7885.html
290,COAI Thanks the Modi Government for Allowing Prepaid Mobile Users to Continue Top-up Payments with Old Rs 500 Notes ,https://www.newsvoir.com/release/coai-thanks-the-modi-government-for-allowing-prepaid-mobile-users-to-continue-top-up-payments-with-old-rs-500-notes-7881.html
291,Countdown to Vodafone Rangasangeet 2016 Winner Announcement Begins,https://www.newsvoir.com/release/countdown-to-vodafone-rangasangeet-2016-winner-announcement-begins-7876.html
292,Vodafone SupernetTM 4G on Superior 1800 Mhz Launched in Kurukshetra,https://www.newsvoir.com/release/vodafone-supernettm-4g-on-superior-1800-mhz-launched-in-kurukshetra-7865.html
293,Flock Launches New Features to Reduce Noise and Communication Clutter,https://www.newsvoir.com/release/flock-launches-new-features-to-reduce-noise-and-communication-clutter-7861.html
294,Global Launch of Alcatel-Lucent Enterprise Cloud-Based Collaboration Platform ,https://www.newsvoir.com/release/global-launch-of-alcatel-lucent-enterprise-cloud-based-collaboration-platform-7858.html
295,COAI Thanks the Modi Government for Allowing Prepaid Mobile Users to Continue Top-up Payments with Old Rs 500 Notes ,https://www.newsvoir.com/release/coai-thanks-the-modi-government-for-allowing-prepaid-mobile-users-to-continue-top-up-payments-with-old-rs-500-notes-7852.html
296,Special Vodafone Store at Pamba to Serve Recharge Needs of Sabarimala Pilgrims ,https://www.newsvoir.com/release/special-vodafone-store-at-pamba-to-serve-recharge-needs-of-sabarimala-pilgrims-7851.html
297,Huawei's Ryan Ding: Countdown to 5G Starts Now,https://www.newsvoir.com/release/huawei-s-ryan-ding-countdown-to-5g-starts-now-7846.html
298,"Withdraw Cash from Over 120,000 Outlets Across the Country with Vodafone M-Pesa ",https://www.newsvoir.com/release/withdraw-cash-from-over-120-000-outlets-across-the-country-with-vodafone-m-pesa-7844.html
299,Capture Life’s Brilliance from Every Angle with the Launch of the HTC Desire 10 Pro,https://www.newsvoir.com/release/capture-life-s-brilliance-from-every-angle-with-the-launch-of-the-htc-desire-10-pro-7843.html
300,Huawei Rotating CEO Ken Hu Announces X Labs for Mobile Broadband Research,https://www.newsvoir.com/release/huawei-rotating-ceo-ken-hu-announces-x-labs-for-mobile-broadband-research-7841.html
301,Vodafone India Welcomes Government’s Continuing Initiatives to Enhance Ease of Doing Business and Support Telecom Sector Growth,https://www.newsvoir.com/release/vodafone-india-welcomes-government-s-continuing-initiatives-to-enhance-ease-of-doing-business-and-support-telecom-sector-growth-7824.html
302,Vodafone India Begins Free Sim Upgrade in Punjab Circle ,https://www.newsvoir.com/release/vodafone-india-begins-free-sim-upgrade-in-punjab-circle-7819.html
303,Global Content Distribution Platform SHAREit Strengthens India Presence,https://www.newsvoir.com/release/global-content-distribution-platform-shareit-strengthens-india-presence-7816.html
304,Telenor India to Engage with 3 Million Students to Spread Awareness Around Life Insurance Starting Children’s Day,https://www.newsvoir.com/release/telenor-india-to-engage-with-3-million-students-to-spread-awareness-around-life-insurance-starting-children-s-day-7800.html
305,YMS Mobitech Announces its Partnership with Mi India for Offline Accessories Distribution,https://www.newsvoir.com/release/yms-mobitech-announces-its-partnership-with-mi-india-for-offline-accessories-distribution-7798.html
306,"Demonetisation - Vodafone Extends Bill Payment Date for Post Paid Customers, by Three Days",https://www.newsvoir.com/release/demonetisation-vodafone-extends-bill-payment-date-for-post-paid-customers-by-three-days-7776.html
307,Airtel Appoints Vani Venkatesh as CEO - Retail,https://www.newsvoir.com/release/airtel-appoints-vani-venkatesh-as-ceo-retail-7755.html
308,YES BANK Launches YES MOBILE 2.0 Banking App ,https://www.newsvoir.com/release/yes-bank-launches-yes-mobile-2-0-banking-app-7730.html
309,Telenor to Roll Out e-KYC Across 2000 Stores,https://www.newsvoir.com/release/telenor-to-roll-out-e-kyc-across-2000-stores-7719.html
310,Vodafone Launches Supernettm 4G in Ahmedabad & Vadodara,https://www.newsvoir.com/release/vodafone-launches-supernettm-4g-in-ahmedabad-vadodara-7711.html
311,Airtel Launches 10 Day Packs for International Roaming with Unlimited Incoming Calls ,https://www.newsvoir.com/release/airtel-launches-10-day-packs-for-international-roaming-with-unlimited-incoming-calls-7704.html
312,File Transfer App Xender Clocks in 170 MN Users,https://www.newsvoir.com/release/file-transfer-app-xender-clocks-in-170-mn-users-7690.html
313,Telenor India Launches Next Generation Mobile App,https://www.newsvoir.com/release/telenor-india-launches-next-generation-mobile-app-7691.html
314,Vodafone India Announces Roaming Free from this Diwali Onwards,https://www.newsvoir.com/release/vodafone-india-announces-roaming-free-from-this-diwali-onwards-7675.html
315,Coolpad Note 5 Open Sale 25K Units Sold,https://www.newsvoir.com/release/coolpad-note-5-open-sale-25k-units-sold-7662.html
316,Taiwanese Brands Bullish About the Fast-Growing ICT Market in India,https://www.newsvoir.com/release/taiwanese-brands-bullish-about-the-fast-growing-ict-market-in-india-7659.html
317,Telenor India Launches 4G Services in Kanpur,https://www.newsvoir.com/release/telenor-india-launches-4g-services-in-kanpur-7639.html
318,The Airtel Girl is Back and This Time with a ‘Shortcut’ to the Digital World,https://www.newsvoir.com/release/the-airtel-girl-is-back-and-this-time-with-a-shortcut-to-the-digital-world-7638.html
319,Tata Communications Appoints James Parker as Global Head of Sales ,https://www.newsvoir.com/release/tata-communications-appoints-james-parker-as-global-head-of-sales-7636.html
320,YMS Mobitech Poised to be India’s Largest e-Distribution Network,https://www.newsvoir.com/release/yms-mobitech-poised-to-be-india-s-largest-e-distribution-network-7627.html
321,Freecharge Appoints Karthik Rajeshwaranas Director - Strategy,https://www.newsvoir.com/release/freecharge-appoints-karthik-rajeshwaranas-director-strategy-7621.html
322,Shardul Amarchand Mangaldas & Co. Acts for Sistema Shyam TeleServices Ltd. in Relation to Structured Transfer of Business to Reliance Communications Limited,https://www.newsvoir.com/release/shardul-amarchand-mangaldas-co-acts-for-sistema-shyam-teleservices-ltd-in-relation-to-structured-transfer-of-business-to-reliance-communications-limited-7609.html
323,"Airtel to Offer iPhone 7 and iPhone 7 Plus in India on October 7, 2016",https://www.newsvoir.com/release/airtel-to-offer-iphone-7-and-iphone-7-plus-in-india-on-october-7-2016-7606.html
324,Vodafone Acquires Spectrum for High Speed 4G Data Services in India,https://www.newsvoir.com/release/vodafone-acquires-spectrum-for-high-speed-4g-data-services-in-india-7604.html
325,Vodafone & Microsoft Empower Indian Enterprises with Office 365 ,https://www.newsvoir.com/release/vodafone-microsoft-empower-indian-enterprises-with-office-365-7584.html
326,GMR and Vodafone Create India’s Largest Wi-Fi Hotspot at Delhi Airport,https://www.newsvoir.com/release/gmr-and-vodafone-create-india-s-largest-wi-fi-hotspot-at-delhi-airport-7578.html
327,Vodafone Launches SuperNetTM 4G in Rajkot and Morbi,https://www.newsvoir.com/release/vodafone-launches-supernettm-4g-in-rajkot-and-morbi-7573.html
328,Capture Life’s Brilliance from Every Angle with the New HTC Desire 10 Lifestyle,https://www.newsvoir.com/release/capture-life-s-brilliance-from-every-angle-with-the-new-htc-desire-10-lifestyle-7557.html
329,Airtel Announces Free Incoming Calls on International Roaming,https://www.newsvoir.com/release/airtel-announces-free-incoming-calls-on-international-roaming-7548.html
330,Ola Adds Siri and Maps Integration for iPhone and iPad Users,https://www.newsvoir.com/release/ola-adds-siri-and-maps-integration-for-iphone-and-ipad-users-7547.html
331,HTC Renews Partnership with Football Franchise North East United FC (NEUFC) as Principal Sponsor,https://www.newsvoir.com/release/htc-renews-partnership-with-football-franchise-north-east-united-fc-neufc-as-principal-sponsor-7540.html
332,"MobiKwik’s Auto Recharge Service Registers 100,000 Users",https://www.newsvoir.com/release/mobikwik-s-auto-recharge-service-registers-100-000-users-7538.html
333,16th Vodafone Aagomoni Presents the Legends of Music Performing Live on the Eve of Mahalaya ,https://www.newsvoir.com/release/16th-vodafone-aagomoni-presents-the-legends-of-music-performing-live-on-the-eve-of-mahalaya-7530.html
334,Four Young Indian Social Innovators Shortlisted for Telenor Youth Forum 2016,https://www.newsvoir.com/release/four-young-indian-social-innovators-shortlisted-for-telenor-youth-forum-2016-7527.html
335,"Airtel Launches Special 90 Days Free Data for 4G Customers
",https://www.newsvoir.com/release/airtel-launches-special-90-days-free-data-for-4g-customers-7521.html
336,Pretr Introduces Pretr Exchange -  An Ecosystem for Malls and Retailers to Create Unified Experience for Customers,https://www.newsvoir.com/release/pretr-introduces-pretr-exchange-an-ecosystem-for-malls-and-retailers-to-create-unified-experience-for-customers-7516.html
337,"Vodafone Celebrates with its Largest Ever Equity Infusion of INR 47,700 Crore",https://www.newsvoir.com/release/vodafone-celebrates-with-its-largest-ever-equity-infusion-of-inr-47-700-crore-7513.html
338,BT Joins Forces with Microsoft to Simplify Hybrid Cloud,https://www.newsvoir.com/release/bt-joins-forces-with-microsoft-to-simplify-hybrid-cloud-7512.html
339,Freecharge Plans to Launch ‘Donations’ Category on its App in September,https://www.newsvoir.com/release/freecharge-plans-to-launch-donations-category-on-its-app-in-september-7509.html
340,"Telenor Group Survey: India’s Millennials Assess Future Careers, Digital Technology Impact and Robotic Replacement Risk ",https://www.newsvoir.com/release/telenor-group-survey-india-s-millennials-assess-future-careers-digital-technology-impact-and-robotic-replacement-risk--7508.html
341,Mobvista Announces Mintegral: Platform to Maximize Developer Revenue and Deliver 100% ad Spot Filling in Apps,https://www.newsvoir.com/release/mobvista-announces-mintegral-platform-to-maximize-developer-revenue-and-deliver-100-ad-spot-filling-in-apps-7507.html
342,MobiKwik Partners with Truecaller to Offer One Step Registration,https://www.newsvoir.com/release/mobikwik-partners-with-truecaller-to-offer-one-step-registration-7504.html
343,"Vodafone Signs Nawazuddin Siddiqui and Bobby Simha for Vodafone Flex, the New World of Prepaid",https://www.newsvoir.com/release/vodafone-signs-nawazuddin-siddiqui-and-bobby-simha-for-vodafone-flex-the-new-world-of-prepaid-7492.html
344,DT Mobile Communications Speed Breakthrough Achieved in Berlin Using Huawei LTE Advanced Pro (4.5G) Solution,https://www.newsvoir.com/release/dt-mobile-communications-speed-breakthrough-achieved-in-berlin-using-huawei-lte-advanced-pro-4-5g-solution-7484.html
345,Telenor India Launches 4G Services in Meerut,https://www.newsvoir.com/release/telenor-india-launches-4g-services-in-meerut-7462.html
346,LeEco Partners with Reliance Jio for its “Jio Welcome Offer”,https://www.newsvoir.com/release/leeco-partners-with-reliance-jio-for-its-jio-welcome-offer--7454.html
347,Telenor to Launch ‘Safe-A-Thon’ to Ensure Safe Digital Environment for Customers,https://www.newsvoir.com/release/telenor-to-launch-safe-a-thon-to-ensure-safe-digital-environment-for-customers-7445.html
348,MobiKwik Launches Deals on its Platform,https://www.newsvoir.com/release/mobikwik-launches-deals-on-its-platform-7441.html
349,Tata Docomo’s Ram Prasad Mamidi Adjudged as ‘CIO of the Year’ ,https://www.newsvoir.com/release/tata-docomo-s-ram-prasad-mamidi-adjudged-as-cio-of-the-year--7431.html
350,Flock’s Biggest Update is here - Introducing Teams and a Brand New Interface,https://www.newsvoir.com/release/flock-s-biggest-update-is-here---introducing-teams-and-a-brand-new-interface-7420.html
351,MobiKwik Launches One Step Offline Payments with 'Bubble Pin',https://www.newsvoir.com/release/mobikwik-launches-one-step-offline-payments-with-bubble-pin-7402.html
352,"Rudreswar Deka Emerges Winner of Run Raise Respond NorthEast- Guwahati Half-Marathon on Abhiruchi Sports Day
",https://www.newsvoir.com/release/rudreswar-deka-emerges-winner-of-run-raise-respond-northeast-guwahati-half-marathon-on-abhiruchi-sports-day-7396.html
353,MobiKwik and Samagra Launch M-Gullak to Saunch M-Gullak Over 100 Million Urban Poor in Indian Cities,https://www.newsvoir.com/release/mobikwik-and-samagra-launch-m-gullak-to-saunch-m-gullak-over-100-million-urban-poor-in-indian-cities-7381.html
354,Vodafone India Launches India’s Best International Roaming Plan for Post & Prepaid Customers,https://www.newsvoir.com/release/vodafone-india-launches-india-s-best-international-roaming-plan-for-post-prepaid-customers-7367.html
355,Telenor India Launches 4G Services in Guntur and Rajahmundry,https://www.newsvoir.com/release/telenor-india-launches-4g-services-in-guntur-and-rajahmundry-7365.html
356,ICICI Bank Launches ‘Unified Payments Interface’ (UPI) for its Mobile Banking Applications,https://www.newsvoir.com/release/icici-bank-launches-unified-payments-interface-upi-for-its-mobile-banking-applications-7364.html
357,MobiKwik Partners with 12 Eelectricity Boards in 8 States,https://www.newsvoir.com/release/mobikwik-partners-with-12-eelectricity-boards-in-8-states-7363.html
358,"Net1 to Invest $40 Million in MobiKwik, a Leading Digital Payment Platform in India",https://www.newsvoir.com/release/net1-to-invest-40-million-in-mobikwik-a-leading-digital-payment-platform-in-india-7349.html
359,Truecaller Users are Now Making Half a Billion Calls Per Month & Join’s Forces with Huawei to Bring the Next Generation Dialer Globally,https://www.newsvoir.com/release/truecaller-users-are-now-making-half-a-billion-calls-per-month-join-s-forces-with-huawei-to-bring-the-next-generation-dialer-globally-7348.html
360,Vodafone SuperNetTM 4G on Superior 1800 MHZ Launched in Haryana,https://www.newsvoir.com/release/vodafone-supernettm-4g-on-superior-1800-mhz-launched-in-haryana-7334.html
361,Telenor India pilots 4G in Dehradun,https://www.newsvoir.com/release/telenor-india-pilots-4g-in-dehradun-7327.html
362,New Smartphone Brand Soon to Launch in India,https://www.newsvoir.com/release/new-smartphone-brand-soon-to-launch-in-india-7321.html
363,Walk out Talking on Vodafone SuperNet TM with e-KYC,https://www.newsvoir.com/release/walk-out-talking-on-vodafone-supernet-tm-with-e-kyc-7319.html
364,"An Industry First, Mobikwik Launches Partial Payment for Bus Tickets Booking",https://www.newsvoir.com/release/an-industry-first-mobikwik-launches-partial-payment-for-bus-tickets-booking-7316.html
365,Hitachi Data Systems Appoints Russell Skingsley as New Chief Technology Officer for Asia Pacific,https://www.newsvoir.com/release/hitachi-data-systems-appoints-russell-skingsley-as-new-chief-technology-officer-for-asia-pacific-7260.html
366,Data Segment & Enterprise Segment: New Growth Areas for Saudi Arabia’s Telecom Market: Ken Research,https://www.newsvoir.com/release/data-segment-enterprise-segment-new-growth-areas-for-saudi-arabia-s-telecom-market-ken-research-7247.html
367,Airtel Makes Voice Calling Free,https://www.newsvoir.com/release/airtel-makes-voice-calling-free-7222.html
368,Vodafone Delights Bonanza,https://www.newsvoir.com/release/vodafone-delights-bonanza-7219.html
369,Vodafone and Huawei Trial New 4.5G Technologies to Prepare for 5G,https://www.newsvoir.com/release/vodafone-and-huawei-trial-new-4-5g-technologies-to-prepare-for-5g-7159.html
370,Residents of Punjab can Now Pay their Electricity bill ‘On the Go’ with Vodafone M-Pesa,https://www.newsvoir.com/release/residents-of-punjab-can-now-pay-their-electricity-bill-on-the-go-with-vodafone-m-pesa-7147.html
371,‘Small Cells Networks Summit 2016’ Concludes on a Successful Note,https://www.newsvoir.com/release/-small-cells-networks-summit-2016-concludes-on-a-successful-note-7146.html
372,ITC Infotech’s ‘iTech 2016’ Sets a New Benchmark in Augmented Reality and Virtual Reality ,https://www.newsvoir.com/release/itc-infotech-s-itech-2016-sets-a-new-benchmark-in-augmented-reality-and-virtual-reality--7114.html
373,Vodafone SuperNetTM Enhances 3G Experience For 1.14 Crore Customers in UP West & Uttarakhand,https://www.newsvoir.com/release/vodafone-supernettm-enhances-3g-experience-for-1-14-crore-customers-in-up-west-uttarakhand-7104.html
374,"SoftBank, Aeris Establish Joint Venture in Japan",https://www.newsvoir.com/release/softbank-aeris-establish-joint-venture-in-japan-7072.html
375,Tata Docomo Appoints Amitabh Bhatia to Head Business and Operations in Andhra Pradesh and Telangana,https://www.newsvoir.com/release/tata-docomo-appoints-amitabh-bhatia-to-head-business-and-operations-in-andhra-pradesh-and-telangana-7039.html
376,Policy Initiative Required for Indian App Market to Grow,https://www.newsvoir.com/release/policy-initiative-required-for-indian-app-market-to-grow-7035.html
