,title,link
499,Vodafone Business Services to Power Connectivity for JCB’s Construction Equipment in India,https://www.newsvoir.com/release/vodafone-business-services-to-power-connectivity-for-jcb-s-construction-equipment-in-india-5563.html
500,Vodafone to Commence 4G Services in Delhi/NCR by December 2015,https://www.newsvoir.com/release/vodafone-to-commence-4g-services-in-delhi-ncr-by-december-2015-5530.html
501,Tata Communications Aims to Interconnect Businesses to the Cloud using Office 365,https://www.newsvoir.com/release/tata-communications-aims-to-interconnect-businesses-to-the-cloud-using-office-365-5421.html
502,Aircel in Aggressive 3G Expansion Mode in Kolkata,https://www.newsvoir.com/release/aircel-in-aggressive-3g-expansion-mode-in-kolkata-5414.html
503,"Uninor Unveils New Global Identity, Changes Brand Name to Telenor",https://www.newsvoir.com/release/uninor-unveils-new-global-identity-changes-brand-name-to-telenor-5367.html
504,Aircel’s Astrology Service Registers Double Digit Revenue Growth in Maharashtra & Goa,https://www.newsvoir.com/release/aircel-s-astrology-service-registers-double-digit-revenue-growth-in-maharashtra-goa-5327.html
505,New Call Telecom gets Approval to Acquire Ozone Networks by FIPB,https://www.newsvoir.com/release/new-call-telecom-gets-approval-to-acquire-ozone-networks-by-fipb-5315.html
506,SCTE India Announces Awards for Technical Excellence and Innovation in Broadband,https://www.newsvoir.com/release/scte-india-announces-awards-for-technical-excellence-and-innovation-in-broadband-5313.html
507,"Nimbuzz, a Leading Global Mobile Technology Platform, Announced Today its Refreshed Branding and Colourful, Peppy New Look",https://www.newsvoir.com/release/nimbuzz-a-leading-global-mobile-technology-platform-announced-today-its-refreshed-branding-and-colourful-peppy-new-look-5301.html
508,Idea Cellular Clocks Positive Response on Contextual Marketing Powered by Mahindra Comviva,https://www.newsvoir.com/release/idea-cellular-clocks-positive-response-on-contextual-marketing-powered-by-mahindra-comviva-5276.html
509,Uninor Invites Application for Telenor Youth Forum,https://www.newsvoir.com/release/uninor-invites-application-for-telenor-youth-forum-5264.html
510,"Vodafone is now one of India’s Largest Retailers with over 9,800 Retail Stores",https://www.newsvoir.com/release/vodafone-is-now-one-of-india-s-largest-retailers-with-over-9-800-retail-stores-5226.html
511,Reliance and Jasper Partner to Deliver IoT Services Across India and Make Smart Cities a Reality,https://www.newsvoir.com/release/reliance-and-jasper-partner-to-deliver-iot-services-across-india-and-make-smart-cities-a-reality-5182.html
512,Vodafone Delights Pre-Paid Customers with Double Validity on Rate Cutters,https://www.newsvoir.com/release/vodafone-delights-pre-paid-customers-with-double-validity-on-rate-cutters-5177.html
513,Bharti Airtel and Uber Announce First-of-its-Kind Strategic Partnership,https://www.newsvoir.com/release/bharti-airtel-and-uber-announce-first-of-its-kind-strategic-partnership-5144.html
514,"Reliance Communications Announces Financial Results for the Quarter Ended June 30, 2015",https://www.newsvoir.com/release/reliance-communications-announces-financial-results-for-the-quarter-ended-june-30-2015-5093.html
515,Bharti Airtel Partners with ErosNow for Wynk Movies,https://www.newsvoir.com/release/bharti-airtel-partners-with-erosnow-for-wynk-movies-5073.html
516,Airtel Announces Bonanza for Home Broadband Customers,https://www.newsvoir.com/release/airtel-announces-bonanza-for-home-broadband-customers-5048.html
517,RCOM Unveils INDIA-UNLIMITED Voice and Data Plans in Gujarat,https://www.newsvoir.com/release/rcom-unveils-india-unlimited-voice-and-data-plans-in-gujarat-5033.html
518,Vodafone M-Pesa to Facilitate Monthly Remittances to Pensioners in Haryana,https://www.newsvoir.com/release/vodafone-m-pesa-to-facilitate-monthly-remittances-to-pensioners-in-haryana-5014.html
519,Airtel puts India on the Digital Superhighway,https://www.newsvoir.com/release/airtel-puts-india-on-the-digital-superhighway-5006.html
520,Manish Khera to be Appointed as CEO - Airtel Money,https://www.newsvoir.com/release/manish-khera-to-be-appointed-as-ceo-airtel-money-4980.html
521,"Vodafone M-Pesa to Facilitate Remittances of JSY in Madhya Pradesh, Under the National Rural Health Mission",https://www.newsvoir.com/release/vodafone-m-pesa-to-facilitate-remittances-of-jsy-in-madhya-pradesh-under-the-national-rural-health-mission-4938.html
522,Vodafone Business Services Powers Diabetacare’s Wireless Glucometer,https://www.newsvoir.com/release/vodafone-business-services-powers-diabetacare-s-wireless-glucometer-4916.html
523,"RCOM & Global Cloud Xchange Announce Appointment of Braham Singh as SVP, Global Product Management",https://www.newsvoir.com/release/rcom-global-cloud-xchange-announce-appointment-of-braham-singh-as-svp-global-product-management-4911.html
524,Vodafone Q1 FY15-16 Results,https://www.newsvoir.com/release/vodafone-q1-fy15-16-results-4907.html
525,Aircel Introduces Free Calling on Data Recharge,https://www.newsvoir.com/release/aircel-introduces-free-calling-on-data-recharge-4897.html
526,Bharti Airtel is the Best Mobile Network in Mumbai,https://www.newsvoir.com/release/bharti-airtel-is-the-best-mobile-network-in-mumbai-4891.html
527,RCOM Launches Next-Generation Content and Cloud Delivery Network in Five Cities Across India,https://www.newsvoir.com/release/rcom-launches-next-generation-content-and-cloud-delivery-network-in-five-cities-across-india-4876.html
528,Tata Docomo Reduces Local and STD Outgoing Tariffs while Roaming,https://www.newsvoir.com/release/tata-docomo-reduces-local-and-std-outgoing-tariffs-while-roaming-4854.html
529,"Airtel Digital TV Joins Govt’s Make in India Initiative, Launches ‘Made in India’ Set-top-boxes",https://www.newsvoir.com/release/airtel-digital-tv-joins-govt-s-make-in-india-initiative-launches-made-in-india-set-top-boxes-4850.html
530,Vodafone M-Pesa Partners with Walmart India for Hassle-free Cash Management,https://www.newsvoir.com/release/vodafone-m-pesa-partners-with-walmart-india-for-hassle-free-cash-management-4789.html
531,"Vodafone Demonstrates it is the Faster, Smarter, Better 3G Network in Delhi and NCR",https://www.newsvoir.com/release/vodafone-demonstrates-it-is-the-faster-smarter-better-3g-network-in-delhi-and-ncr-4782.html
532,NASSCOM and Telecom Equipment & Services Export Promotion Council Collaborate to Organise Indo- Africa ICT EXPO 2015,https://www.newsvoir.com/release/nasscom-and-telecom-equipment-services-export-promotion-council-collaborate-to-organise-indo-africa-ict-expo-2015-4768.html
533,Tata Teleservices Appoints Anuraag Srivastava as CFO,https://www.newsvoir.com/release/tata-teleservices-appoints-anuraag-srivastava-as-cfo-4760.html
534,Vodafone Partners with XOLO; Offers First-of-its Kind Product Experience for the Online Sub-brand - BLACK,https://www.newsvoir.com/release/vodafone-partners-with-xolo-offers-first-of-its-kind-product-experience-for-the-online-sub-brand-black-4756.html
535,COAI Stands Proud on the Nationwide Roll-out of Mobile Number Portability (MNP),https://www.newsvoir.com/release/coai-stands-proud-on-the-nationwide-roll-out-of-mobile-number-portability-mnp-4750.html
536,Aircel Rolls-out National Mobile Number Portability,https://www.newsvoir.com/release/aircel-rolls-out-national-mobile-number-portability-4749.html
537,Vodafone Rolls-out National Mobile Number Portability (NMNP) from July 3,https://www.newsvoir.com/release/vodafone-rolls-out-national-mobile-number-portability-nmnp-from-july-3-4732.html
538,"Airtel now Ready for National Mobile Number Portability, Announces Many Firsts Under its DNA of Customer First",https://www.newsvoir.com/release/airtel-now-ready-for-national-mobile-number-portability-announces-many-firsts-under-its-dna-of-customer-first-4729.html
539,Nokia Networks Inks 4-year Deal with Bharti Airtel India for 3G Network Rollout,https://www.newsvoir.com/release/nokia-networks-inks-4-year-deal-with-bharti-airtel-india-for-3g-network-rollout-4707.html
540,Vodafone is the Fastest 3G Network in Haryana,https://www.newsvoir.com/release/vodafone-is-the-fastest-3g-network-in-haryana-4674.html
541,Brocade Shows Leadership in Transition to New IP Networks with 2015 Leading Lights Awards for Most Innovative SDN Product Strategy and Best New Product for Mobile,https://www.newsvoir.com/release/brocade-shows-leadership-in-transition-to-new-ip-networks-with-2015-leading-lights-awards-for-most-innovative-sdn-product-strategy-and-best-new-product-for-mobile-4671.html
542,Vodafone Foundation Launches 'Mobile for Good Awards 2015' in Partnership with NASSCOM Foundation,https://www.newsvoir.com/release/vodafone-foundation-launches-mobile-for-good-awards-2015-in-partnership-with-nasscom-foundation-4655.html
543,"This Monsoon, Vodafone Launches Free 3G Data with Samsung Smartphones and Tablets Exclusively for Mumbaikars",https://www.newsvoir.com/release/this-monsoon-vodafone-launches-free-3g-data-with-samsung-smartphones-and-tablets-exclusively-for-mumbaikars-4639.html
544,Airtel Rolls out 4G Trials Exclusively for its Customers in Delhi NCR,https://www.newsvoir.com/release/airtel-rolls-out-4g-trials-exclusively-for-its-customers-in-delhi-ncr-4601.html
545,Vodafone M-Pesa Partners with WaterHealth India to Serve the Underserved ‘Bottom of the Pyramid’ Customers,https://www.newsvoir.com/release/vodafone-m-pesa-partners-with-waterhealth-india-to-serve-the-underserved-bottom-of-the-pyramid-customers-4600.html
546,Aircel Celebrates World Music Festival from June 21 – July 31; Offers Complimentary Limitless Music on the Occasion of World Music Day,https://www.newsvoir.com/release/aircel-celebrates-world-music-festival-from-june-21-july-31-offers-complimentary-limitless-music-on-the-occasion-of-world-music-day-4592.html
547,Vodafone Enhances Customer Experience through Network Expansion and Retail Transformation in Kerala,https://www.newsvoir.com/release/vodafone-enhances-customer-experience-through-network-expansion-and-retail-transformation-in-kerala-4588.html
548,Bell Labs and Technische Universitat Dresden Sign Agreement to Collaborate on Advancing the Development of 5G Networks,https://www.newsvoir.com/release/bell-labs-and-technische-universitat-dresden-sign-agreement-to-collaborate-on-advancing-the-development-of-5g-networks-4556.html
549,RCOM and AFK Sistema Enter into Exclusive Discussions to Consider Merger Between Indian Operations of SSTL and RCOM,https://www.newsvoir.com/release/rcom-and-afk-sistema-enter-into-exclusive-discussions-to-consider-merger-between-indian-operations-of-sstl-and-rcom-4552.html
550,Idea Launches Revolutionary New ‘Roll over 3G’ Feature,https://www.newsvoir.com/release/idea-launches-revolutionary-new-roll-over-3g-feature-4543.html
551,Vodafone Announces the Winner of “Recharge & Win A Bike Offer”,https://www.newsvoir.com/release/vodafone-announces-the-winner-of-recharge-win-a-bike-offer--4521.html
552,Tata Docomo Launches Internet on the Go ‘Photon Max Wi-Fi Duo’,https://www.newsvoir.com/release/tata-docomo-launches-internet-on-the-go-photon-max-wi-fi-duo--4496.html
553,Tata Teleservices Rings in World Environment Day with ‘Sustainability Month’ ,https://www.newsvoir.com/release/tata-teleservices-rings-in-world-environment-day-with-sustainability-month--4473.html
554,Tata Teleservices Subsidiary mRupee and Manappuram Finance Announce Tie Up,https://www.newsvoir.com/release/tata-teleservices-subsidiary-mrupee-and-manappuram-finance-announce-tie-up-4453.html
555,"Reliance Communications Announces Financial Results for the Quarter Ended March 31, 2015",https://www.newsvoir.com/release/reliance-communications-announces-financial-results-for-the-quarter-ended-march-31-2015-4406.html
556,Airtel Invites Customers on Other Networks to Experience Airtel 4G,https://www.newsvoir.com/release/airtel-invites-customers-on-other-networks-to-experience-airtel-4g-4401.html
557,Vodafone Invests INR 1050 Crores to Strengthen its Network Presence in Maharashtra and Goa,https://www.newsvoir.com/release/vodafone-invests-inr-1050-crores-to-strengthen-its-network-presence-in-maharashtra-and-goa-4372.html
558,Uninor Announces Leadership Changes in Circles,https://www.newsvoir.com/release/uninor-announces-leadership-changes-in-circles-4359.html
559,Aging Asia Left Behind by Mobile Revolution: Telenor Research,https://www.newsvoir.com/release/aging-asia-left-behind-by-mobile-revolution-telenor-research-4331.html
560,Vodafone India Full Year FY15 Results,https://www.newsvoir.com/release/vodafone-india-full-year-fy15-results-4287.html
561,Nokia Networks Shrinks an Entire LTE Network into a Box,https://www.newsvoir.com/release/nokia-networks-shrinks-an-entire-lte-network-into-a-box-4281.html
562,Aircel Reduces National Roaming Rates by up to 75%,https://www.newsvoir.com/release/aircel-reduces-national-roaming-rates-by-up-to-75--4163.html
563,"Vodafone Launches New, Responsive ‘M-Pesa App’ to Enable Convenient Payment of Bills & Recharging on the Move",https://www.newsvoir.com/release/vodafone-launches-new-responsive-m-pesa-app-to-enable-convenient-payment-of-bills-recharging-on-the-move-4146.html
564,Tata Docomo Reduces National Roaming Tariffs for its Customers,https://www.newsvoir.com/release/tata-docomo-reduces-national-roaming-tariffs-for-its-customers-4123.html
565,Vodafone Reduces National Roaming Tariffs for its Customers,https://www.newsvoir.com/release/vodafone-reduces-national-roaming-tariffs-for-its-customers-4114.html
566,Vodafone Foundation Instant Network Team Deployed to Nepal,https://www.newsvoir.com/release/vodafone-foundation-instant-network-team-deployed-to-nepal-4095.html
567,Aircel Committed to Construct Toilets and Provide Sanitation Facilities for Tamil Nadu Schools,https://www.newsvoir.com/release/aircel-committed-to-construct-toilets-and-provide-sanitation-facilities-for-tamil-nadu-schools-3997.html
568,Vodafone M-Pesa Customers get ‘Cash-back’ and ‘Free Transfers’ for Six Months,https://www.newsvoir.com/release/vodafone-m-pesa-customers-get-cash-back-and-free-transfers-for-six-months-3996.html
569,Vodafone Enhances Customer Experience with Retail Transformation and Simplified Digital Platform in Rajasthan,https://www.newsvoir.com/release/vodafone-enhances-customer-experience-with-retail-transformation-and-simplified-digital-platform-in-rajasthan-3983.html
570,Surana Telecom Acquires Arhyama Energy Private Limited ,https://www.newsvoir.com/release/surana-telecom-acquires-arhyama-energy-private-limited-3935.html
571,Airtel's Statement on Supporting Net Neutrality,https://www.newsvoir.com/release/airtel-s-statement-on-supporting-net-neutrality-3915.html
572,Airtel on Airtel Zero – Making Internet More Accessible and Driving Innovation,https://www.newsvoir.com/release/airtel-on-airtel-zero-making-internet-more-accessible-and-driving-innovation-3877.html
573,Vodafone Launches “Speed is Good” Campaign this T20 Season,https://www.newsvoir.com/release/vodafone-launches-speed-is-good-campaign-this-t20-season-3836.html
574,Vodafone Enhances Customer Experience in Bengaluru - Launches Two New Global Design Retail Stores,https://www.newsvoir.com/release/vodafone-enhances-customer-experience-in-bengaluru-launches-two-new-global-design-retail-stores-3823.html
575,Airtel Launches ‘Airtel Zero’: A Win-Win Platform for Customers and Marketers,https://www.newsvoir.com/release/airtel-launches-airtel-zero-a-win-win-platform-for-customers-and-marketers-3821.html
576,Aircel Launches Digital Engagement Initiatives with Chennai Super Kings,https://www.newsvoir.com/release/aircel-launches-digital-engagement-initiatives-with-chennai-super-kings-3815.html
577,Airtel Launches Platinum 3G in India; Mumbai will be the First City to Experience the Superior Connectivity,https://www.newsvoir.com/release/airtel-launches-platinum-3g-in-india-mumbai-will-be-the-first-city-to-experience-the-superior-connectivity-3807.html
578,"Tata Docomo Wins the Special Leadership Recognition Awards for Product Innovation, Marketing and Energy Management",https://www.newsvoir.com/release/tata-docomo-wins-the-special-leadership-recognition-awards-for-product-innovation-marketing-and-energy-management-3761.html
579,RCOM Becomes India’s First and Only Operator with Nationwide Footprint of Contiguous 800/850 MHz Spectrum,https://www.newsvoir.com/release/rcom-becomes-india-s-first-and-only-operator-with-nationwide-footprint-of-contiguous-800-850-mhz-spectrum-3741.html
580,Aircel Launches ‘My First Internet’ Service to Empower Customers and Promote Internet Adoption ,https://www.newsvoir.com/release/aircel-launches-my-first-internet-service-to-empower-customers-and-promote-internet-adoption--3700.html
581,Tata Docomo Launches Tata Photon Walky with Wi-Fi,https://www.newsvoir.com/release/tata-docomo-launches-tata-photon-walky-with-wi-fi-3695.html
582,Airtel Reboots ‘My Airtel’ Mobile Application to Deliver Enhanced Digital Experience for its Customers,https://www.newsvoir.com/release/airtel-reboots-my-airtel-mobile-application-to-deliver-enhanced-digital-experience-for-its-customers-3685.html
583,Aircel Customer Wins SUV in a Contest for Maximum Music Downloads,https://www.newsvoir.com/release/aircel-customer-wins-suv-in-a-contest-for-maximum-music-downloads-3676.html
584,RCOM Appoints Srinivas M as Circle Business Head (Wireless) for Tamil Nadu and Kerala ,https://www.newsvoir.com/release/rcom-appoints-srinivas-m-as-circle-business-head-wireless-for-tamil-nadu-and-kerala-3656.html
585,Truecaller Launches Premium Service Promotion for all Microsoft Lumia Devices in India,https://www.newsvoir.com/release/truecaller-launches-premium-service-promotion-for-all-microsoft-lumia-devices-in-india-3649.html
586,ACME Installed First Li-ion Based Energy Storage Solution,https://www.newsvoir.com/release/acme-installed-first-li-ion-based-energy-storage-solution-3648.html
587,Vodafone Business Services Announces Winners of the Ready for the Big League,https://www.newsvoir.com/release/vodafone-business-services-announces-winners-of-the-ready-for-the-big-league-3621.html
588,Alcatel-Lucent Demonstrates How its Virtualized Radio Access Network Technology will Transform Ultra-Broadband Mobile Access,https://www.newsvoir.com/release/alcatel-lucent-demonstrates-how-its-virtualized-radio-access-network-technology-will-transform-ultra-broadband-mobile-access-3550.html
589,Alcatel-Lucent Announces the World's First Deployment of its Enterprise Small Cell Technology,https://www.newsvoir.com/release/alcatel-lucent-announces-the-world-apos-s-first-deployment-of-its-enterprise-small-cell-technology-3546.html
590,Vodafone Partners with Delhi Traffic Police to Spread Road Safety Awareness,https://www.newsvoir.com/release/vodafone-partners-with-delhi-traffic-police-to-spread-road-safety-awareness-3430.html
591,Vodafone Foundation Drives Inclusive Growth Through World of Difference Programme in Delhi,https://www.newsvoir.com/release/vodafone-foundation-drives-inclusive-growth-through-world-of-difference-programme-in-delhi-3414.html
592,ACME to Invest Rs 600 Crore in Punjab,https://www.newsvoir.com/release/acme-to-invest-rs-600-crore-in-punjab-3399.html
593,Tata Docomo Launches ‘Freedom Plan’ for Postpay Customers in Andhra Pradesh and Telangana,https://www.newsvoir.com/release/tata-docomo-launches-freedom-plan-for-postpay-customers-in-andhra-pradesh-and-telangana-3388.html
594,"Reliance Communications Announces Financial Results for the Quarter (Q3) Ended December 31, 2014",https://www.newsvoir.com/release/reliance-communications-announces-financial-results-for-the-quarter-q3-ended-december-31-2014-3337.html
595,"Naveen Chopra to be Appointed as Chief Operating Officer, Vodafone India",https://www.newsvoir.com/release/naveen-chopra-to-be-appointed-as-chief-operating-officer-vodafone-india-3258.html
596, Airtel New TVC- 'myPlan Family' - One Mobile Plan that's Big Enough for the Whole Family,https://www.newsvoir.com/release/airtel-new-tvc-myplan-family-one-mobile-plan-that-s-big-enough-for-the-whole-family-3244.html
597,Vodafone Group: Interim Management Statement for the Quarter Ended 31 December 2014,https://www.newsvoir.com/release/vodafone-group-interim-management-statement-for-the-quarter-ended-31-december-2014-3197.html
598,Aircel Joins Hands with Kids in Mumbai to Save our Tigers,https://www.newsvoir.com/release/release/aircel-joins-hands-with-kids-in-mumbai-to-save-our-tigers-3182-3182.html
599,Uninor Gets Greentech CSR Gold Award,https://www.newsvoir.com/release/uninor-gets-greentech-csr-gold-award-3158.html
600,Official Statement from Vodafone India on Payments Bank,https://www.newsvoir.com/release/official-statement-from-vodafone-india-on-payments-bank-3155.html
601,"mRupee, in Partnership with RBL Bank, Launches PaySmart Prepaid Card ",https://www.newsvoir.com/release/mrupee-in-partnership-with-rbl-bank-launches-paysmart-prepaid-card-3061.html
602,Spice Group Furthers the Government’s Make in India Campaign; Announces an Investment of Rs 500 Crores to Build Manufacturing Unit in UP,https://www.newsvoir.com/release/spice-group-furthers-the-government-s-make-in-india-campaign-announces-an-investment-of-rs-500-crores-to-build-manufacturing-unit-in-up-3050.html
603,Tata Docomo Wins IDC Insights Award,https://www.newsvoir.com/release/tata-docomo-wins-idc-insights-award-3014.html
604,Vodafone is Back with the Seventh Edition of its Annual Golf Tournament ‘Vodafone Tee Walk’,https://www.newsvoir.com/release/vodafone-is-back-with-the-seventh-edition-of-its-annual-golf-tournament-vodafone-tee-walk--2937.html
605,"Vodafone India to Provide Unique Value Proposition Across the Entire iPhone Range
",https://www.newsvoir.com/release/vodafone-india-to-provide-unique-value-proposition-across-the-entire-iphone-range-2915.html
606,Essar Concludes yuMobile Transaction; Completes Monetization of Telecom Business for USD 6 Billion,https://www.newsvoir.com/release/essar-concludes-yumobile-transaction-completes-monetization-of-telecom-business-for-usd-6-billion-2912.html
607,Now Just Walk-in to an Airtel Store Near you to Buy a Redmi Note 4G ,https://www.newsvoir.com/release/now-just-walk-in-to-an-airtel-store-near-you-to-buy-a-redmi-note-4g-2907.html
608,Tata Docomo Launches Exciting Consumer Offer ,https://www.newsvoir.com/release/tata-docomo-launches-exciting-consumer-offer-2889.html
609,Aircel Launches ‘Grand Online Data Sale’ to Delight its Customers,https://www.newsvoir.com/release/aircel-launches-grand-online-data-sale-to-delight-its-customers-2806.html
610,Bihar CM Shri Jitan Ram Manjhi Inaugurates Additional Primary Health Centre at Mehkar,https://www.newsvoir.com/release/bihar-cm-shri-jitan-ram-manjhi-inaugurates-additional-primary-health-centre-at-mehkar-2727.html
611,Tata Docomo Partners India’s Biggest Open Air Live Concert Series “Alive India In Concert”,https://www.newsvoir.com/release/tata-docomo-partners-india-s-biggest-open-air-live-concert-series-alive-india-in-concert--2715.html
612,ACME to Supply Telecom Passive Infra to PGCIL for Development of National Transmission Asset Management Centre (NTAMC),https://www.newsvoir.com/release/acme-to-supply-telecom-passive-infra-to-pgcil-for-development-of-national-transmission-asset-management-centre-ntamc-2716.html
613,Ashok Ghose to Lead Tata Docomo’s Karnataka and Kerala Circles as MBU Head,https://www.newsvoir.com/release/ashok-ghose-to-lead-tata-docomo-s-karnataka-and-kerala-circles-as-mbu-head-2703.html
614,Tata Docomo Launches ‘FRC 51’ for Customers who Love to Talk More,https://www.newsvoir.com/release/tata-docomo-launches-frc-51-for-customers-who-love-to-talk-more-2688.html
615,Tata DOCOMO Conferred with ET Telecom Award 2014 for Excellence in Energy Management,https://www.newsvoir.com/release/tata-docomo-conferred-with-et-telecom-award-2014-for-excellence-in-energy-management-2674.html
616,Aircel Wins ET Telecom Award 2014 for Customer Service,https://www.newsvoir.com/release/aircel-wins-et-telecom-award-2014-for-customer-service-2644.html
617,Reliance Launches ‘Free Facebook Fridays’,https://www.newsvoir.com/release/reliance-launches-free-facebook-fridays--2574.html
618,Spice Launches Stellar 520n Exclusively on Amazon.in,https://www.newsvoir.com/release/spice-launches-stellar-520n-exclusively-on-amazon-in-2501.html
619,Tata Docomo Keeps the ‘Bhalai Ki Supply’ Flowing with Latest in TVC Series,https://www.newsvoir.com/release/tata-docomo-keeps-the-bhalai-ki-supply-flowing-with-latest-in-tvc-series-2418.html
620,RCOM Launches Disruptive Hi-Speed Unlimited Data Plans,https://www.newsvoir.com/release/rcom-launches-disruptive-hi-speed-unlimited-data-plans-2416.html
621,Aircel Launches ‘Extra Credit Service’ Across India,https://www.newsvoir.com/release/aircel-launches-extra-credit-service-across-india-2415.html
622,Aircel Customers Get Unique Opportunity to Meet Atlético de Kolkata,https://www.newsvoir.com/release/aircel-customers-get-unique-opportunity-to-meet-atl-tico-de-kolkata-2410.html
623,"RCOM Unveils ‘TalkLoan’ Facility to Ensure Uninterrupted Calling, Surfing for its Customers",https://www.newsvoir.com/release/rcom-unveils-talkloan-facility-to-ensure-uninterrupted-calling-surfing-for-its-customers-2375.html
624,Tata DOCOMO’s Project ‘Optimus’ Awarded the 2014 QualTech Prize for Sustainability,https://www.newsvoir.com/release/tata-docomo-s-project-optimus-awarded-the-2014-qualtech-prize-for-sustainability-2369.html
625,Uninor on a Network Expansion Drive in AP,https://www.newsvoir.com/release/uninor-on-a-network-expansion-drive-in-ap-2292.html
626,Indian App Wins the Best App in Asia at Telenor Digital Winners Conference,https://www.newsvoir.com/release/indian-app-wins-the-best-app-in-asia-at-telenor-digital-winners-conference-2258.html
