,title,link
125,CSPs See Cloud Technology Investments as Critical to Improving Customer Experience,https://www.newsvoir.com/release/csps-see-cloud-technology-investments-as-critical-to-improving-customer-experience-9270.html
126,Vodafone First Telecom Operator to Partner with ALTBalaji for Original Content on Vodafone Play,https://www.newsvoir.com/release/vodafone-first-telecom-operator-to-partner-with-altbalaji-for-original-content-on-vodafone-play-9260.html
127,Vodafone Partners LAVA to offer Complete Cash Back on Feature Phone,https://www.newsvoir.com/release/vodafone-partners-lava-to-offer-complete-cash-back-on-feature-phone-9239.html
128,"Big V Telecom, Incubated by TATA ELXSI, Expands its Footprints in Delhi/NCR  ",https://www.newsvoir.com/release/big-v-telecom-incubated-by-tata-elxsi-expands-its-footprints-in-delhi-ncr-9226.html
129,Study by Velocity MR Suggests Spike in Sales of Dual SIM Phones Following Reliance JIO Launch,https://www.newsvoir.com/release/study-by-velocity-mr-suggests-spike-in-sales-of-dual-sim-phones-following-reliance-jio-launch-9217.html
130,Airtel Forges Strategic Partnership with SK Telecom - the Most Advanced Mobile Broadband Operator in the World ,https://www.newsvoir.com/release/airtel-forges-strategic-partnership-with-sk-telecom-the-most-advanced-mobile-broadband-operator-in-the-world-9216.html
131,Vodafone Presents the Campus Survival Kit - an Initiative to Give College Students Value for Money Packs and Life Hacks to Save Pocket Money,https://www.newsvoir.com/release/vodafone-presents-the-campus-survival-kit-an-initiative-to-give-college-students-value-for-money-packs-and-life-hacks-to-save-pocket-money-9207.html
132,Airtel Launches VoLTE; Services go Live in Mumbai,https://www.newsvoir.com/release/airtel-launches-volte-services-go-live-in-mumbai-9204.html
133,Vodafone Play Partners with HOOQ to Bring the Best of Hollywood TV Shows on Your Mobile Phone,https://www.newsvoir.com/release/vodafone-play-partners-with-hooq-to-bring-the-best-of-hollywood-tv-shows-on-your-mobile-phone-9189.html
134,"Vodafone Presents the Campus Survival Kit - a First of its kind Initiative for Students, with Value for Money Plans and Life Hacks to Save Pocket Money",https://www.newsvoir.com/release/vodafone-presents-the-campus-survival-kit-a-first-of-its-kind-initiative-for-students-with-value-for-money-plans-and-life-hacks-to-save-pocket-money-9178.html
135,Intex Honoured by ASSOCHAM with Award for Excellence in Service 2017,https://www.newsvoir.com/release/intex-honoured-by-assocham-with-award-for-excellence-in-service-2017-9152.html
136,"Customers in Delhi-NCR will Now Enjoy Unlimited Local, STD and Roaming Calls + 1GB Data/Day with A Recharge of Just INR 392",https://www.newsvoir.com/release/customers-in-delhi-ncr-will-now-enjoy-unlimited-local-std-and-roaming-calls-1gb-data-day-with-a-recharge-of-just-inr-392-9147.html
137,Vodafone ‘Dangal’ Draws Participation from Leading Wrestlers in Haryana,https://www.newsvoir.com/release/vodafone-dangal-draws-participation-from-leading-wrestlers-in-haryana-9126.html
138,Vodafone Partners with Harvard Model United Nations India for Students to #BeSuper,https://www.newsvoir.com/release/vodafone-partners-with-harvard-model-united-nations-india-for-students-to-besuper-9087.html
139,HTC VIVE Announces Special Independence Day Bundle offer,https://www.newsvoir.com/release/htc-vive-announces-special-independence-day-bundle-offer-9082.html
140,Vodafone's #LookUp Movement to Keep Relationships Real is Winning Hearts Across India,https://www.newsvoir.com/release/vodafone-s-lookup-movement-to-keep-relationships-real-is-winning-hearts-across-india-9059.html
141,Vodafone Play Expands its Infotainment Section with the Bouquet of 12 Discovery Channels,https://www.newsvoir.com/release/vodafone-play-expands-its-infotainment-section-with-the-bouquet-of-12-discovery-channels-9052.html
142,Enterprises can Now Improve Field Force Productivity with Vodafone Mobile Workforce Essentials,https://www.newsvoir.com/release/enterprises-can-now-improve-field-force-productivity-with-vodafone-mobile-workforce-essentials-9017.html
143,Competition Commission of India Approves Vodafone-Idea Merger,https://www.newsvoir.com/release/competition-commission-of-india-approves-vodafone-idea-merger-9005.html
144,Vodafone Enhances Customer Experience with the Launch of its Global Design Store in Kanpur,https://www.newsvoir.com/release/vodafone-enhances-customer-experience-with-the-launch-of-its-global-design-store-in-kanpur-8988.html
145,Vodafone Introduces Gurugram’s First Wi-Fi Enabled Bus Shelter,https://www.newsvoir.com/release/vodafone-introduces-gurugram-s-first-wi-fi-enabled-bus-shelter-8984.html
146,Airtel Releases 2017 India Sustainability Report,https://www.newsvoir.com/release/airtel-releases-2017-india-sustainability-report-8978.html
147,Aircel Launches ‘Best Ever’ Data Offer in Karnataka - RC 333 Offers 30GB of 3G Data with No Daily Limits,https://www.newsvoir.com/release/aircel-launches-best-ever-data-offer-in-karnataka---rc-333-offers-30gb-of-3g-data-with-no-daily-limits-8976.html
148,Vodafone Launches Sakhi Pack In Up West and Uttarakhand,https://www.newsvoir.com/release/vodafone-launches-sakhi-pack-in-up-west-and-uttarakhand-8971.html
149,Aircel Launches Unlimited Calls and 84 GB Data with FRC 348 in UP (East),https://www.newsvoir.com/release/aircel-launches-unlimited-calls-and-84-gb-data-with-frc-348-in-up-east-8964.html
150,Salasar Techno Engineering Ltd. to Enter Capital Market with a Public Issue of 33.21 Lakh Equity Shares of Face Value of Rs. 10 Each Fully Paid for Cash at a Price of Rs. 108 per Equity Share,https://www.newsvoir.com/release/salasar-techno-engineering-ltd-to-enter-capital-market-with-a-public-issue-of-33-21-lakh-equity-shares-of-face-value-of-rs-10-each-fully-paid-for-cash-at-a-price-of-rs-108-per-equity-share-8953.html
151,"Huawei Telecommunications India Reiterates its CSR Focus; Equips the Government Hospital of Thoracic Medicine, Tambaram Sanatorium, Chennai with Critical Lifesaving Infrastructure Facilities ",https://www.newsvoir.com/release/huawei-telecommunications-india-reiterates-its-csr-focus-equips-the-government-hospital-of-thoracic-medicine-tambaram-sanatorium-chennai-with-critical-lifesaving-infrastructure-facilities-8952.html
152,"Airtel Announces ‘Project Next’ – its Digital Innovation Program to Make Customer Experience Simple, Interactive and Transparent",https://www.newsvoir.com/release/airtel-announces-project-next-its-digital-innovation-program-to-make-customer-experience-simple-interactive-and-transparent-8947.html
153,Vodafone and WhatsApp to Empower Customers to Chat In Language of their Choice,https://www.newsvoir.com/release/vodafone-and-whatsapp-to-empower-customers-to-chat-in-language-of-their-choice-8919.html
154,Vodafone Partners HMD Global; Rolls out Exciting Data Offers to Empower Customers to Make the Most of their New Nokia Smartphones,https://www.newsvoir.com/release/vodafone-partners-hmd-global-rolls-out-exciting-data-offers-to-empower-customers-to-make-the-most-of-their-new-nokia-smartphones-8894.html
155,Exclusive Offers on Data and Entertainment from Vodafone Available on OnePlus5 Smartphone,https://www.newsvoir.com/release/exclusive-offers-on-data-and-entertainment-from-vodafone-available-on-oneplus5-smartphone-8878.html
156,UCWeb Data Traffic Report: Cricket-related Content Consumption Soars 230% in 2017; Virat Kohli Most Popular Player,https://www.newsvoir.com/release/ucweb-data-traffic-report-cricket-related-content-consumption-soars-230-in-2017-virat-kohli-most-popular-player-8874.html
157,Aircel Launches Incredible Offer on its Website and App; Lucky Customer to Get Upto 20 Times the Recharge Value,https://www.newsvoir.com/release/aircel-launches-incredible-offer-on-its-website-and-app-lucky-customer-to-get-upto-20-times-the-recharge-value-8872.html
158,Vodafone Business Services Recognized as ‘Enterprise Telecom Service Provider of the Year - SMB Segment’ and M-Pesa as ‘Telecom Mobile Wallet of the Year’ at Frost & Sullivan India Digital Transformation Awards 2017,https://www.newsvoir.com/release/vodafone-business-services-recognized-as-enterprise-telecom-service-provider-of-the-year---smb-segment-and-m-pesa-as-telecom-mobile-wallet-of-the-year-at-frost-sullivan-india-digital-transformation-awards-2017-8858.html
159,"HTC Launches Flagship Smartphone HTC U11 Priced at INR 51,990 in India",https://www.newsvoir.com/release/htc-launches-flagship-smartphone-htc-u11-priced-at-inr-51-990-in-india-8847.html
160,Telenor Launches Global Stop Cyberbullying Campaign to Support ‘4 Million by 2020’ Goal,https://www.newsvoir.com/release/telenor-launches-global-stop-cyberbullying-campaign-to-support-4-million-by-2020-goal-8845.html
161,Vodafone Supernet to Enable Warkaris to Remain Connected,https://www.newsvoir.com/release/vodafone-supernet-to-enable-warkaris-to-remain-connected-8843.html
162,Tata Consultancy Services TAP Platform Recognized as a Strong Performer in eProcurement ,https://www.newsvoir.com/release/tata-consultancy-services-tap-platform-recognized-as-a-strong-performer-in-eprocurement-8835.html
163,Huawei Leads with Completion of China's Second-Phase 5G R&D Test,https://www.newsvoir.com/release/huawei-leads-with-completion-of-china-s-second-phase-5g-r-d-test-8827.html
164,Vodafone Customer from Pune Wins Bumper Prize,https://www.newsvoir.com/release/vodafone-customer-from-pune-wins-bumper-prize-8823.html
165,Internet Users in India to Double by 2021: Cisco Visual Networking Index (VNI),https://www.newsvoir.com/release/internet-users-in-india-to-double-by-2021-cisco-visual-networking-index-vni-8822.html
166,Unlimited Sharing & Caring offers by Vodafone this Ramzan for UP West Customers,https://www.newsvoir.com/release/unlimited-sharing-caring-offers-by-vodafone-this-ramzan-for-up-west-customers-8805.html
167,Airtel Business Launches First of its Kind Digital Platform to offer Integrated Solutions to Emerging Businesses,https://www.newsvoir.com/release/airtel-business-launches-first-of-its-kind-digital-platform-to-offer-integrated-solutions-to-emerging-businesses-8798.html
168,Aircel Pioneers the Concept of ‘Data on Demand’; Launches New Revolutionary Data Packs,https://www.newsvoir.com/release/aircel-pioneers-the-concept-of-data-on-demand-launches-new-revolutionary-data-packs-8792.html
169,Aircel Launches Special Ramzan Pack RC 786 in Tamil Nadu; Offers FREE Calls & 1GB Data Every Day for 70 Days,https://www.newsvoir.com/release/aircel-launches-special-ramzan-pack-rc-786-in-tamil-nadu-offers-free-calls-1gb-data-every-day-for-70-days-8776.html
170,Keep Your Mobile Number Secure with Vodafone Sakhi Recharge,https://www.newsvoir.com/release/keep-your-mobile-number-secure-with-vodafone-sakhi-recharge-8777.html
171,Mobile Broadcasting App BIGO LIVE Increases Focus on India Market,https://www.newsvoir.com/release/mobile-broadcasting-app-bigo-live-increases-focus-on-india-market-8764.html
172,Get Complimentary Insurance for Smartphones with Vodafone RED Shield,https://www.newsvoir.com/release/get-complimentary-insurance-for-smartphones-with-vodafone-red-shield-8758.html
173,Percept ICE Executes the Campaign for Vodafone IPL 2017,https://www.newsvoir.com/release/percept-ice-executes-the-campaign-for-vodafone-ipl-2017-8756.html
174,Aircel Brings Special Voice & Data offers in Assam on the Festive Occasion of Ramadan,https://www.newsvoir.com/release/aircel-brings-special-voice-data-offers-in-assam-on-the-festive-occasion-of-ramadan-8753.html
175,"U-Dictionary Now Supports Sentence Translation Inside Any App, Works Offline for 12 Indian Languages",https://www.newsvoir.com/release/u-dictionary-now-supports-sentence-translation-inside-any-app-works-offline-for-12-indian-languages-8751.html
176,Latest Version of Epicor ERP Extends Manufacturing Leadership with Launch of Powerful Cloud-Based Analytics and Global Electronic Compliance,https://www.newsvoir.com/release/latest-version-of-epicor-erp-extends-manufacturing-leadership-with-launch-of-powerful-cloud-based-analytics-and-global-electronic-compliance-8746.html
177,Unlimited Plans for Everyone - Vodafone Integrated Plans Break All Barriers,https://www.newsvoir.com/release/unlimited-plans-for-everyone-vodafone-integrated-plans-break-all-barriers-8744.html
178,MindHour Makes Its Way to Tamil Nadu with Digitized Learning and Announces Rs. 1 Cr Scholarships to School Students,https://www.newsvoir.com/release/mindhour-makes-its-way-to-tamil-nadu-with-digitized-learning-and-announces-rs-1-cr-scholarships-to-school-students-8741.html
179,TCS iON to Launch an Integrated Cloud Based Solution for Educational Institutions ,https://www.newsvoir.com/release/tcs-ion-to-launch-an-integrated-cloud-based-solution-for-educational-institutions-8729.html
180,Percept ICE Produces the Essel Group’s 90 Years Celebrations Event in Delhi,https://www.newsvoir.com/release/percept-ice-produces-the-essel-group-s-90-years-celebrations-event-in-delhi-8725.html
181,Telecom Sector Disappointed at the Announced GST Rate of 18%: COAI,https://www.newsvoir.com/release/telecom-sector-disappointed-at-the-announced-gst-rate-of-18-coai-8719.html
182,Aircel Launches First of its kind ‘JODI Pack’ in Odisha ,https://www.newsvoir.com/release/aircel-launches-first-of-its-kind-jodi-pack-in-odisha--8704.html
183,Airtel offers up to 100% more Data Across High Speed Broadband Plans to Drive India’s Digital Transformation,https://www.newsvoir.com/release/airtel-offers-up-to-100-more-data-across-high-speed-broadband-plans-to-drive-india-s-digital-transformation-8700.html
184,The Indian Standards for 5G Rollout to be Ready by 2018 ,https://www.newsvoir.com/release/the-indian-standards-for-5g-rollout-to-be-ready-by-2018-8682.html
185,Residents of Haryana can Now Pay their Electricity Bill ‘On the Go’ with Vodafone M-Pesa,https://www.newsvoir.com/release/residents-of-haryana-can-now-pay-their-electricity-bill-on-the-go-with-vodafone-m-pesa-8680.html
186,UC News Brings #MasalaCommentary with Celebrities for the Ongoing Cricket League,https://www.newsvoir.com/release/uc-news-brings-masalacommentary-with-celebrities-for-the-ongoing-cricket-league-8679.html
187,Aircel Introduces Exclusive Data and Calling Offers on its App,https://www.newsvoir.com/release/aircel-introduces-exclusive-data-and-calling-offers-on-its-app-8660.html
188,Vodafone Launches SuperWifi to Boost Digital Transformation of Organizations,https://www.newsvoir.com/release/vodafone-launches-superwifi-to-boost-digital-transformation-of-organizations-8652.html
189,Zendesk Launches Guide - A Next Generation Knowledge Solution - To Provide Smarter Customer Service ,https://www.newsvoir.com/release/zendesk-launches-guide-a-next-generation-knowledge-solution-to-provide-smarter-customer-service-8637.html
190,Telenor Reveals Password Habits of Indians on World Password Day ,https://www.newsvoir.com/release/telenor-reveals-password-habits-of-indians-on-world-password-day-8635.html
191,UTStarcom to Expand its Footprint in India,https://www.newsvoir.com/release/utstarcom-to-expand-its-footprint-in-india-8599.html
192,Vihaan Networks Limited bagged North East Connectivity Project of BSNL,https://www.newsvoir.com/release/vihaan-networks-limited-bagged-north-east-connectivity-project-of-bsnl-8596.html
193,UCWeb’s ‘Super 1000’ Outlines Detailed Qualification Process for its We-Media Platform,https://www.newsvoir.com/release/ucweb-s-super-1000-outlines-detailed-qualification-process-for-its-we-media-platform-8595.html
194,Vodafone Unveils Truly Unlimited Plans for International Travelers,https://www.newsvoir.com/release/vodafone-unveils-truly-unlimited-plans-for-international-travelers-8580.html
195,Vodafone is First Global IoT Provider to Pass 50 Million Connections,https://www.newsvoir.com/release/vodafone-is-first-global-iot-provider-to-pass-50-million-connections-8573.html
196,Now Enjoy the ‘Baahubali’ Experience on Airtel - India’s Fastest Mobile Network,https://www.newsvoir.com/release/now-enjoy-the-baahubali-experience-on-airtel---india-s-fastest-mobile-network-8570.html
197,Telenor India Spreads the Joy of Reading amongst Children to Celebrate World Book Day,https://www.newsvoir.com/release/telenor-india-spreads-the-joy-of-reading-amongst-children-to-celebrate-world-book-day-8562.html
198,Aircel app wins MoneyTech Award for Best Innovation in Data Solution ,https://www.newsvoir.com/release/aircel-app-wins-moneytech-award-for-best-innovation-in-data-solution-8551.html
199,"India’s Largest Analytics Forum SAS Forum India to be held on April 26, 2017 at The Grand Hyatt, Mumbai",https://www.newsvoir.com/release/india-s-largest-analytics-forum-sas-forum-india-to-be-held-on-april-26-2017-at-the-grand-hyatt-mumbai-8549.html
200,Infosys Foundation Joins Hands with ‘Sahapedia’ to Promote a Penchant for Cultural and Historical Knowledge of India among the Masses,https://www.newsvoir.com/release/infosys-foundation-joins-hands-with-sahapedia-to-promote-a-penchant-for-cultural-and-historical-knowledge-of-india-among-the-masses-8544.html
201,"Vodafone M-Pesa Felicitated by Uttar Pradesh CM, for Fulfilling PM’s Ideal Village Dream at Nagepur",https://www.newsvoir.com/release/vodafone-m-pesa-felicitated-by-uttar-pradesh-cm-for-fulfilling-pm-s-ideal-village-dream-at-nagepur-8543.html
202,Indian Bank Expands its Reach in Social Media,https://www.newsvoir.com/release/indian-bank-expands-its-reach-in-social-media-8532.html
203,Bosch Announces New Indian and Global Apps for Indian Customers on Its Smartphone Integration Solution - mySpin,https://www.newsvoir.com/release/bosch-announces-new-indian-and-global-apps-for-indian-customers-on-its-smartphone-integration-solution-myspin-8530.html
204,Cisco Inaugurates Cyber Range Lab in India,https://www.newsvoir.com/release/cisco-inaugurates-cyber-range-lab-in-india-8522.html
205,Aircel Launches Free Incoming Calls on National Roaming ,https://www.newsvoir.com/release/aircel-launches-free-incoming-calls-on-national-roaming-8521.html
206,Alibaba Group’s UC News Registers 100 Million Active Users in India and Indonesia,https://www.newsvoir.com/release/alibaba-group-s-uc-news-registers-100-million-active-users-in-india-and-indonesia-8514.html
207,Aircel Customer Wins a Premium Sedan in ‘Super Challenge Contest Season 2’ in Karnataka,https://www.newsvoir.com/release/aircel-customer-wins-a-premium-sedan-in-super-challenge-contest-season-2-in-karnataka-8509.html
208,"“Make the most of now” With the Data Strong Network, Says Vodafone’s New IPL Campaign",https://www.newsvoir.com/release/-make-the-most-of-now-with-the-data-strong-network-says-vodafone-s-new-ipl-campaign-8510.html
209,Enjoy World’s Largest 4G Network in over 40 Countries with Vodafone,https://www.newsvoir.com/release/enjoy-world-s-largest-4g-network-in-over-40-countries-with-vodafone-8495.html
210,Airtel Builds a Future Ready Network – Doubles Mobile Sites in Just Two Years,https://www.newsvoir.com/release/airtel-builds-a-future-ready-network-doubles-mobile-sites-in-just-two-years-8494.html
211,Second Edition of Annual 4.5G & 5G Innovation Summit to Address the Evolution of LTE to 5G,https://www.newsvoir.com/release/second-edition-of-annual-4-5g-5g-innovation-summit-to-address-the-evolution-of-lte-to-5g-8478.html
212,Vodafone & IPL: Celebrating a Decade of Cricketainment,https://www.newsvoir.com/release/vodafone-ipl-celebrating-a-decade-of-cricketainment-8462.html
213,Aircel App Witnesses 20% Surge in Downloads in the Last Quarter,https://www.newsvoir.com/release/aircel-app-witnesses-20-surge-in-downloads-in-the-last-quarter-8449.html
214,"Vodafone Supernet 4G is the Data Strong Network, says New Campaign ",https://www.newsvoir.com/release/vodafone-supernet-4g-is-the-data-strong-network-says-new-campaign-8432.html
215,Tata Capital’s One-of-a-Kind Mobile App Invites You to Check Your ‘myScore’ and Avail Easy Finance,https://www.newsvoir.com/release/tata-capital-s-one-of-a-kind-mobile-app-invites-you-to-check-your-myscore-and-avail-easy-finance-8425.html
216,Aircel Launches Data Packs with ‘Lowest Tariffs and Longest Validity’ in Bihar,https://www.newsvoir.com/release/aircel-launches-data-packs-with-lowest-tariffs-and-longest-validity-in-bihar-8424.html
217,Aircel Launches First of its Kind Unlimited Combo Packs; Offers Unlimited Calling and Data in Karnataka,https://www.newsvoir.com/release/aircel-launches-first-of-its-kind-unlimited-combo-packs-offers-unlimited-calling-and-data-in-karnataka-8414.html
218,Secure Your Prepaid Mobile Number with Vodafone Private Recharge,https://www.newsvoir.com/release/secure-your-prepaid-mobile-number-with-vodafone-private-recharge-8388.html
219,"According to Tata Consultancy Services Global Trend Study, Artificial Intelligence to have Dramatic Impact on Business by 2020",https://www.newsvoir.com/release/according-to-tata-consultancy-services-global-trend-study-artificial-intelligence-to-have-dramatic-impact-on-business-by-2020-8387.html
220,Broadband India Forum’s Response on TRAI Recommendations for Public WIFI,https://www.newsvoir.com/release/broadband-india-forum-s-response-on-trai-recommendations-for-public-wifi-8376.html
221,Vodafone SuperNetTM 4G with a Strong Presence in 440 Towns Now Available Across Haryana  ,https://www.newsvoir.com/release/vodafone-supernettm-4g-with-a-strong-presence-in-440-towns-now-available-across-haryana-8373.html
222,This Women’s Day Airtel Honours the Contribution of its Women Distributors ,https://www.newsvoir.com/release/this-women-s-day-airtel-honours-the-contribution-of-its-women-distributors--8358.html
223,Vodafone India Celebrates '#ConnectedSheCan' During International Women's Week 6th – 10th March,https://www.newsvoir.com/release/vodafone-india-celebrates-connectedshecan-during-international-women-s-week-6th-10th-march-8345.html
224,"Vodafone Foundation to Recognize 50 Bold, Brave & Brilliant Women of Pure Wonder",https://www.newsvoir.com/release/vodafone-foundation-to-recognize-50-bold-brave-brilliant-women-of-pure-wonder-8337.html
225,COAI Shows Power of ‘Microsecond’ on National Science Day,https://www.newsvoir.com/release/coai-shows-power-of-microsecond-on-national-science-day-8325.html
226,Vodafone SupernetTM 4G Launched in Pune ,https://www.newsvoir.com/release/vodafone-supernettm-4g-launched-in-pune-8323.html
227,Airtel Declares War on Roaming,https://www.newsvoir.com/release/airtel-declares-war-on-roaming-8316.html
228,Bharti Airtel to Acquire Telenor India,https://www.newsvoir.com/release/bharti-airtel-to-acquire-telenor-india-8298.html
229,HTC Launches U Series of Smartphones that are All about U,https://www.newsvoir.com/release/htc-launches-u-series-of-smartphones-that-are-all-about-u-8290.html
230,NEC Introduces Wireless Transport Solution with AI Analytics for the 5G Era,https://www.newsvoir.com/release/nec-introduces-wireless-transport-solution-with-ai-analytics-for-the-5g-era-8288.html
231,"CMR Research Report: Samsung, Apple and HTC Most Successful Global Premium Smartphone Brands over the Last Decade ",https://www.newsvoir.com/release/cmr-research-report-samsung-apple-and-htc-most-successful-global-premium-smartphone-brands-over-the-last-decade-8282.html
232,"LexisNexis and Legasis Expand Lexis® Practical Guidance Portfolio with Industry-Specific Enterprise Compliance Management Modules for Ecommerce, Pharmaceuticals and IT/ITES",https://www.newsvoir.com/release/lexisnexis-and-legasis-expand-lexis-practical-guidance-portfolio-with-industry-specific-enterprise-compliance-management-modules-for-ecommerce-pharmaceuticals-and-it-ites-8273.html
233,Airtel Rolls out Future Ready 4G Network Across Maharashtra and Goa,https://www.newsvoir.com/release/airtel-rolls-out-future-ready-4g-network-across-maharashtra-and-goa-8268.html
234,Gartner Positions Infosys as a ‘Leader’ In Magic Quadrant for SAP® Application Services,https://www.newsvoir.com/release/gartner-positions-infosys-as-a-leader-in-magic-quadrant-for-sap-application-services-8267.html
235,2nd Annual Future Generation Optical Transport Networks Summit 2017 Concludes on a Successful Note,https://www.newsvoir.com/release/2nd-annual-future-generation-optical-transport-networks-summit-2017-concludes-on-a-successful-note-8253.html
236,ARI Solutions Rides High on Ever Rising Demand for VAS by Telecos and Online Wave of Social Media,https://www.newsvoir.com/release/ari-solutions-rides-high-on-ever-rising-demand-for-vas-by-telecos-and-online-wave-of-social-media-8247.html
237,Tata Communications at 15 - Enabling A World of Digital Transformation,https://www.newsvoir.com/release/tata-communications-at-15-enabling-a-world-of-digital-transformation-8239.html
238,VODAFONE SuperNetTM 4G Launched in Mathura,https://www.newsvoir.com/release/vodafone-supernettm-4g-launched-in-mathura-8225.html
239,Vodafone SupernetTM 4G Launched in Haldwani,https://www.newsvoir.com/release/vodafone-supernettm-4g-launched-in-haldwani-8212.html
240,Airtel Crosses Two Million Home Broadband Customers Mark,https://www.newsvoir.com/release/airtel-crosses-two-million-home-broadband-customers-mark-8208.html
241,COMPUTEX to Showcase Latest ICT Technology at Convergence India 2017,https://www.newsvoir.com/release/computex-to-showcase-latest-ict-technology-at-convergence-india-2017-8195.html
242,"Budget Reaction Quote from  Mr. Jay Chen, CEO, Huawei India",https://www.newsvoir.com/release/budget-reaction-quote-from-mr-jay-chen-ceo-huawei-india-8192.html
243,Airtel Payments Bank Crosses One Lakh Savings Accounts Milestone in Uttar Pradesh within Two Weeks of Launch,https://www.newsvoir.com/release/airtel-payments-bank-crosses-one-lakh-savings-accounts-milestone-in-uttar-pradesh-within-two-weeks-of-launch-8191.html
