,title,link
0,Air Comm Delivers 25 percent Faster Customer Service with Hiver,https://www.newsvoir.com/release/air-comm-delivers-25-percent-faster-customer-service-with-hiver-18196.html
1,Mavenir to Deliver Cloud-based 5G Solutions on AWS,https://www.newsvoir.com/release/mavenir-to-deliver-cloud-based-5g-solutions-on-aws-16606.html
2,Made-in-India VideoMeet Brings AI in Video Conferencing,https://www.newsvoir.com/release/made-in-india-videomeet-brings-ai-in-video-conferencing-16480.html
3,"AGMs to Go Virtual in Future, Says India Inc.",https://www.newsvoir.com/release/agms-to-go-virtual-in-future-says-india-inc-16438.html
4,"Mavenir Extends AI and Analytics Portfolio to Enable Mobile Network Optimization, Automation & Security",https://www.newsvoir.com/release/mavenir-extends-ai-and-analytics-portfolio-to-enable-mobile-network-optimization-automation-security-15968.html
5,"Vi, Bajaj Finance partner for financing offers on smartphones bundled with prepaid plans",https://www.newsvoir.com/release/vi-bajaj-finance-partner-for-financing-offers-on-smartphones-bundled-with-prepaid-plans-15265.html
6,VectorMob Revolutionizes the Digital Ecosystem - Provides Marketing Turnkey Solutions for Leading Brands,https://www.newsvoir.com/release/vectormob-revolutionizes-the-digital-ecosystem-provides-marketing-turnkey-solutions-for-leading-brands-15100.html
7,Only 1 in 4 Global Organizations Keep Cardholder Payment Data Secure,https://www.newsvoir.com/release/only-1-in-4-global-organizations-keep-cardholder-payment-data-secure-14793.html
8,Huawei Marks 20 Years of Empowering Digital Transformation in India ,https://www.newsvoir.com/release/huawei-marks-20-years-of-empowering-digital-transformation-in-india-14720.html
9,Industrial 5G to Drive Industry 4.0 Revolution in India,https://www.newsvoir.com/release/industrial-5g-to-drive-industry-4-0-revolution-in-india-14438.html
10,Jump Networks Ltd. (JUMPNET) En-route to Achieve Higher Growth in FY 20-21,https://www.newsvoir.com/release/jump-networks-ltd-jumpnet-en-route-to-achieve-higher-growth-in-fy-20-21-14326.html
11,Indus Towers - VMC Enabled Fibre Network and Smart Poles Provide Enhanced Connectivity During COVID-19 Times,https://www.newsvoir.com/release/indus-towers-vmc-enabled-fibre-network-and-smart-poles-provide-enhanced-connectivity-during-covid-19-times-14134.html
12,IETE Conducts Mid-term Symposium on Digital Forensics and Information Security,https://www.newsvoir.com/release/iete-conducts-mid-term-symposium-on-digital-forensics-and-information-security-13910.html
13,IETE Inaugurates Centre of Excellence for Cyber Security ,https://www.newsvoir.com/release/iete-inaugurates-centre-of-excellence-for-cyber-security-13868.html
14,Work from Home – Innovative Practices and Solutions,https://www.newsvoir.com/release/work-from-home-innovative-practices-and-solutions-13861.html
15,Government to Announce New Cyber Security Policy Soon,https://www.newsvoir.com/release/government-to-announce-new-cyber-security-policy-soon-13591.html
16,Parallel Wireless Continues Winning Streak by Winning Prestigious Aegis Graham Bell Award 2020 Third Year in a Row ,https://www.newsvoir.com/release/parallel-wireless-continues-winning-streak-by-winning-prestigious-aegis-graham-bell-award-2020-third-year-in-a-row-13512.html
17,Digital FM Radio Could Redefine the Mobile Entertainment Landscape,https://www.newsvoir.com/release/digital-fm-radio-could-redefine-the-mobile-entertainment-landscape-13415.html
18,Robust Security Crucial for Adoption of Open Source,https://www.newsvoir.com/release/robust-security-crucial-for-adoption-of-open-source-13407.html
19,Amara Raja Batteries Limited Bags Two First Time Innovation Centric Awards at the Much Coveted CII Industrial Innovation Awards 2019,https://www.newsvoir.com/release/amara-raja-batteries-limited-bags-two-first-time-innovation-centric-awards-at-the-much-coveted-cii-industrial-innovation-awards-2019-13096.html
20,Indigenization of Data Centre to be Prioritized,https://www.newsvoir.com/release/indigenization-of-data-centre-to-be-prioritized-12896.html
21,BAK Regime to Foster Innovation and Safeguard Consumer Interests – TUG India,https://www.newsvoir.com/release/bak-regime-to-foster-innovation-and-safeguard-consumer-interests-tug-india-12747.html
22,Mavenir Wins 2 Awards for Innovation at India Mobile Congress 2019,https://www.newsvoir.com/release/mavenir-wins-2-awards-for-innovation-at-india-mobile-congress-2019-12658.html
23,Vodafone Idea and Mavenir Partner to Extend Network as a Platform,https://www.newsvoir.com/release/vodafone-idea-and-mavenir-partner-to-extend-network-as-a-platform-12639.html
24,ClinicSpots Integrates NLP - AI to Offer Enhanced Medical Experience,https://www.newsvoir.com/release/clinicspots-integrates-nlp-ai-to-offer-enhanced-medical-experience-12634.html
25,Parallel Wireless Helps to Deliver on Vodafone’s OpenRAN Vision in Asia and Africa,https://www.newsvoir.com/release/parallel-wireless-helps-to-deliver-on-vodafone-s-openran-vision-in-asia-and-africa-12596.html
26,KONE Opens New Technology and Innovation Center in Pune; Hires New Talent,https://www.newsvoir.com/release/kone-opens-new-technology-and-innovation-center-in-pune-hires-new-talent-12585.html
27,Mavenir Opens New Center of Innovation in Stockholm,https://www.newsvoir.com/release/mavenir-opens-new-center-of-innovation-in-stockholm-12590.html
28,Indian Team Makes Significant Contribution to Kirin 990,https://www.newsvoir.com/release/indian-team-makes-significant-contribution-to-kirin-990-12572.html
29,A 10% Increase in India’s Internet Traffic will bump up GDP Growth by 3.3%: FTTH India Summit 2019,https://www.newsvoir.com/release/a-10-increase-in-india-s-internet-traffic-will-bump-up-gdp-growth-by-3-3-ftth-india-summit-2019-12549.html
30,Tech Mahindra and Keysight Collaborate to Accelerate Adoption of 5G Devices Globally,https://www.newsvoir.com/release/tech-mahindra-and-keysight-collaborate-to-accelerate-adoption-of-5g-devices-globally-12542.html
31,Mavenir’s virtualized Radio Access Network (vRAN) Awarded 'Best RAN Technology' at 5G Asia for Second Year in a Row,https://www.newsvoir.com/release/mavenir-s-virtualized-radio-access-network-vran-awarded-best-ran-technology-at-5g-asia-for-second-year-in-a-row-12475.html
32,Parallel Wireless Expands Presence in India to Better Support Global Customer Base,https://www.newsvoir.com/release/parallel-wireless-expands-presence-in-india-to-better-support-global-customer-base-12467.html
33,Pebble and Vodafone-Idea Join Hands to Provide a One-stop Destination to Customers to Experience Innovative Mobile-related Products and Services,https://www.newsvoir.com/release/pebble-and-vodafone-idea-join-hands-to-provide-a-one-stop-destination-to-customers-to-experience-innovative-mobile-related-products-and-services-12392.html
34,Security and Interoperability are Key to the Success of Smart Cities in India,https://www.newsvoir.com/release/security-and-interoperability-are-key-to-the-success-of-smart-cities-in-india-12336.html
35,Schneider Electric’s Enhanced Data Center Operations Services Improve Operational Efficiencies and Reduce Risk,https://www.newsvoir.com/release/schneider-electric-s-enhanced-data-center-operations-services-improve-operational-efficiencies-and-reduce-risk-12315.html
36,TAC Security Named Startup of the Year by IT World Awards (USA),https://www.newsvoir.com/release/tac-security-named-startup-of-the-year-by-it-world-awards-usa-12255.html
37,"Huawei Y9 Prime 2019 Offline Sales to Begin Across 1000 Retails Stores in India from August 12, 2019 with Amazing Offers ",https://www.newsvoir.com/release/huawei-y9-prime-2019-offline-sales-to-begin-across-1000-retails-stores-in-india-from-august-12-2019-with-amazing-offers-12239.html
38,Entrepreneur India Felicitates Shailendra Naidu as the “Entrepreneur of the Year” in Money Services ,https://www.newsvoir.com/release/entrepreneur-india-felicitates-shailendra-naidu-as-the-entrepreneur-of-the-year-in-money-services--12166.html
39,Spring Edge - Giving Corporates the Edge in Modern Business Communication,https://www.newsvoir.com/release/spring-edge-giving-corporates-the-edge-in-modern-business-communication-12072.html
40,Opensignal Analyzes Smartphone Users’ Experience before Cyclone Fani and in its Aftermath,https://www.newsvoir.com/release/opensignal-analyzes-smartphone-users-experience-before-cyclone-fani-and-in-its-aftermath-12047.html
41,"International Vacation Rental Management Company Vacasa, Achieves 80% more Productivity with Hiver ",https://www.newsvoir.com/release/international-vacation-rental-management-company-vacasa-achieves-80-more-productivity-with-hiver-11990.html
42,techARC Launches Digital Programme ‘10 Years of Smartphone for All’,https://www.newsvoir.com/release/techarc-launches-digital-programme-10-years-of-smartphone-for-all--11964.html
43,Winner of UC Miss Cricket Debuts at New York Times Square Billboard,https://www.newsvoir.com/release/winner-of-uc-miss-cricket-debuts-at-new-york-times-square-billboard-11849.html
44,Chennai Ranks First Amongst 50 IPL Cities in India for 4G Video Download Speed: Opensignal Research,https://www.newsvoir.com/release/chennai-ranks-first-amongst-50-ipl-cities-in-india-for-4g-video-download-speed-opensignal-research-11810.html
45,Bharatpe  Launches India's First UPI Bahi Khata for Merchants,https://www.newsvoir.com/release/bharatpe-launches-india-s-first-upi-bahi-khata-for-merchants-11807.html
46,Own Your Location Pin With MyLoc,https://www.newsvoir.com/release/own-your-location-pin-with-myloc-11799.html
47,Parallel Wireless’ Unified Software Platform Bags Leading Lights Award for Most Innovative Mobile Product,https://www.newsvoir.com/release/parallel-wireless-unified-software-platform-bags-leading-lights-award-for-most-innovative-mobile-product-11792.html
48,Lava Doubles its Feature Phone Market Share to 13%,https://www.newsvoir.com/release/lava-doubles-its-feature-phone-market-share-to-13-11768.html
49,"Opensignal Releases Mobile Network Experience Report for India: Jio Increase its 4G Availability, Airtel Pulls Ahead in Download Speed Experience",https://www.newsvoir.com/release/opensignal-releases-mobile-network-experience-report-for-india-jio-increase-its-4g-availability-airtel-pulls-ahead-in-download-speed-experience-11704.html
50,CCA Partners with Parallel Wireless to Provide End-to-end Network Solutions for Mobile Operators ,https://www.newsvoir.com/release/cca-partners-with-parallel-wireless-to-provide-end-to-end-network-solutions-for-mobile-operators-11625.html
51,OBOPAY Launches App-based Meal Vouchering System for Enterprise Customers,https://www.newsvoir.com/release/obopay-launches-app-based-meal-vouchering-system-for-enterprise-customers-11626.html
52,Airtel Boosts its Digital Content Portfolio - Launches ‘Airtel Books’ to Bring an Exciting Reading Experience to Smartphone Users,https://www.newsvoir.com/release/airtel-boosts-its-digital-content-portfolio---launches-airtel-books-to-bring-an-exciting-reading-experience-to-smartphone-users-11624.html
53,Bahrain Aiming to Roll-out Commercial 5G by June,https://www.newsvoir.com/release/bahrain-aiming-to-roll-out-commercial-5g-by-june-11583.html
54,Tech Mahindra Launches “netOps.ai” to Accelerate 5G Adoption for Communication Service Providers,https://www.newsvoir.com/release/tech-mahindra-launches-netops-ai-to-accelerate-5g-adoption-for-communication-service-providers-11419.html
55,Comba Telecom Partners with Parallel Wireless to Deliver 4G and 5G Open vRAN Solutions,https://www.newsvoir.com/release/comba-telecom-partners-with-parallel-wireless-to-deliver-4g-and-5g-open-vran-solutions-11395.html
56,Zain Selects Parallel Wireless Open RAN to Modernize Existing 2G and 3G Infrastructure,https://www.newsvoir.com/release/zain-selects-parallel-wireless-open-ran-to-modernize-existing-2g-and-3g-infrastructure-11387.html
57,Singapore Based BIGO Technology Announces USD 100M Investment in India,https://www.newsvoir.com/release/singapore-based-bigo-technology-announces-usd-100m-investment-in-india-11374.html
58,Kalimat Telecom Selects Parallel Wireless for Network Build Out,https://www.newsvoir.com/release/kalimat-telecom-selects-parallel-wireless-for-network-build-out-11370.html
59,Parallel Wireless’s All-G Technology Ready to Transform Telecom Services in India,https://www.newsvoir.com/release/parallel-wireless-s-all-g-technology-ready-to-transform-telecom-services-in-india-11353.html
60,Wifi India Summit 2019 Delibrates on the Business Case for Public WiFi,https://www.newsvoir.com/release/wifi-india-summit-2019-delibrates-on-the-business-case-for-public-wifi-11318.html
61,"Shri Suresh Prabhu, Hon’ble Minister of Commerce & Industry and Civil Aviation to Inaugurate Convergence India 2019 Expo",https://www.newsvoir.com/release/shri-suresh-prabhu-hon-ble-minister-of-commerce-industry-and-civil-aviation-to-inaugurate-convergence-india-2019-expo-11199.html
62,Tech Data Signs Distribution Agreement with Fujitsu in India,https://www.newsvoir.com/release/tech-data-signs-distribution-agreement-with-fujitsu-in-india-11136.html
63,Vodafone Super Zoozoos are Back at Delhi Comic Con 2018,https://www.newsvoir.com/release/vodafone-super-zoozoos-are-back-at-delhi-comic-con-2018-11078.html
64,Pofco Solution Consultancy Services is Pushing Ahead with the Roll-out of n’cloud.swiss in India’s Cloud Market ,https://www.newsvoir.com/release/pofco-solution-consultancy-services-is-pushing-ahead-with-the-roll-out-of-n-cloud-swiss-in-india-s-cloud-market--11071.html
65,OVH Commences Operations in India and Grows Customer Database in Partnership with Intel and VMware,https://www.newsvoir.com/release/ovh-commences-operations-in-india-and-grows-customer-database-in-partnership-with-intel-and-vmware-10999.html
66,Rosenberger Closely Working with Leading Telecom Partners for 5G Deployment,https://www.newsvoir.com/release/rosenberger-closely-working-with-leading-telecom-partners-for-5g-deployment-10936.html
67,Mavenir Showcases Virtualized Solutions to Redefine the Mobile Network Economics for 5G,https://www.newsvoir.com/release/mavenir-showcases-virtualized-solutions-to-redefine-the-mobile-network-economics-for-5g-10873.html
68,"At IMC 2018, Rosenberger all Set to Showcase its 5G Solutions",https://www.newsvoir.com/release/at-imc-2018-rosenberger-all-set-to-showcase-its-5g-solutions-10834.html
69,The Stars Descended to Mesmerize the Audience at 18th Vodafone Aagomoni,https://www.newsvoir.com/release/the-stars-descended-to-mesmerize-the-audience-at-18th-vodafone-aagomoni-10786.html
70,Airtel Rolls out #PassTheTorch Campaign,https://www.newsvoir.com/release/airtel-rolls-out-passthetorch-campaign-10784.html
71,Data Centres are Central to Any Digital Strategy and the Industry has a Promising Future,https://www.newsvoir.com/release/data-centres-are-central-to-any-digital-strategy-and-the-industry-has-a-promising-future-10767.html
72,Srabanti Chatterjee visits Reliance Digital and My Jio stores,https://www.newsvoir.com/release/srabanti-chatterjee-visits-reliance-digital-and-my-jio-stores-10715.html
73,Elina Samantaray visits Reliance Digital and My Jio stores,https://www.newsvoir.com/release/elina-samantaray-visits-reliance-digital-and-my-jio-stores-10718.html
74,Tata Sky and Skyworth Digital to Partner on the Next Generation Set-top Box for India,https://www.newsvoir.com/release/tata-sky-and-skyworth-digital-to-partner-on-the-next-generation-set-top-box-for-india-10673.html
75,"7th Edition of IoT and AI Innovation Conclave, 2018: Enhancing Human Cognitive Outcomes",https://www.newsvoir.com/release/7th-edition-of-iot-and-ai-innovation-conclave-2018-enhancing-human-cognitive-outcomes-10667.html
76,"Bid an Environment Friendly Farewell to Dear Bappa, in Vodafone Eco Ponds
",https://www.newsvoir.com/release/bid-an-environment-friendly-farewell-to-dear-bappa-in-vodafone-eco-ponds-10658.html
77,‘HetNet and Small Cells are Important for Telcos in Digitally Driven Economy’ - Industry Experts,https://www.newsvoir.com/release/-hetnet-and-small-cells-are-important-for-telcos-in-digitally-driven-economy---industry-experts-10648.html
78,Need for Reliable Connectivity for Sustainable Smart City,https://www.newsvoir.com/release/need-for-reliable-connectivity-for-sustainable-smart-city-10586.html
79,WaveMaker Launches HyScale - a Delivery Automation Platform for the Digital Enterprise,https://www.newsvoir.com/release/wavemaker-launches-hyscale-a-delivery-automation-platform-for-the-digital-enterprise-10509.html
80,Tech Mahindra and Government of Telangana Collaborate to Launch India’s First Blockchain District to Foster Growth of Indian Blockchain Ecosystem,https://www.newsvoir.com/release/tech-mahindra-and-government-of-telangana-collaborate-to-launch-india-s-first-blockchain-district-to-foster-growth-of-indian-blockchain-ecosystem-10492.html
81,Cyber Security and Data Privacy are Critical for the Growth of Digital India ,https://www.newsvoir.com/release/cyber-security-and-data-privacy-are-critical-for-the-growth-of-digital-india-10345.html
82,Solutions Infini and Ubiquity Announces Global Rebrand to ‘Kaleyra’,https://www.newsvoir.com/release/solutions-infini-and-ubiquity-announces-global-rebrand-to-kaleyra--10335.html
83,STT GDC India Expands its Operations by Developing a New Data Centre in Bengaluru ,https://www.newsvoir.com/release/stt-gdc-india-expands-its-operations-by-developing-a-new-data-centre-in-bengaluru-10266.html
84,Vanu and HFCL Win Major BSNL Tender,https://www.newsvoir.com/release/vanu-and-hfcl-win-major-bsnl-tender-10136.html
85,"VNL Launches Tactical LTE, Smart ISR, and Camp and Perimeter Protection Solutions for the Armed Forces",https://www.newsvoir.com/release/vnl-launches-tactical-lte-smart-isr-and-camp-and-perimeter-protection-solutions-for-the-armed-forces-10091.html
86,"‘Third Annual 5G India Congress 2018’ to be Held in New Delhi on April 20, 2018 ",https://www.newsvoir.com/release/-third-annual-5g-india-congress-2018-to-be-held-in-new-delhi-on-april-20-2018--10077.html
87,"26th Convergence India 2018 Expo / 2nd IoT India 2018 Draws to an end; Record Footfall of over 20,000",https://www.newsvoir.com/release/26th-convergence-india-2018-expo-2nd-iot-india-2018-draws-to-an-end-record-footfall-of-over-20-000-9929.html
88,Union Telecom Minister Manoj Sinha Inaugurates 26th Convergence India 2018 Expo / 2nd Internet of Things India 2018 Expo,https://www.newsvoir.com/release/union-telecom-minister-manoj-sinha-inaugurates-26th-convergence-india-2018-expo-2nd-internet-of-things-india-2018-expo-9919.html
89,Karix Mobile launches its Cloud Communication Platform - karix.io,https://www.newsvoir.com/release/karix-mobile-launches-its-cloud-communication-platform-karix-io-9887.html
90,Telecom Minister Manoj Sinha to Inaugurate 26th Convergence India 2018 Expo,https://www.newsvoir.com/release/telecom-minister-manoj-sinha-to-inaugurate-26th-convergence-india-2018-expo-9882.html
91,Parallel Wireless Wins Graham Bell Award for Innovation in Telecom Infrastructure,https://www.newsvoir.com/release/parallel-wireless-wins-graham-bell-award-for-innovation-in-telecom-infrastructure-9876.html
92,Karix Mobile Gearing to Send a ‘Message’ on World Stage; Set to Participate in Mobile World Congress 2018 at Barcelona,https://www.newsvoir.com/release/karix-mobile-gearing-to-send-a-message-on-world-stage-set-to-participate-in-mobile-world-congress-2018-at-barcelona-9875.html
93,India’s First 4G LTE Telecom System Unveiled,https://www.newsvoir.com/release/india-s-first-4g-lte-telecom-system-unveiled-9873.html
94,"Connecting the Unconnect, The Biggest Challenge for WiFi",https://www.newsvoir.com/release/connecting-the-unconnect-the-biggest-challenge-for-wifi-9863.html
95,Jivi Mobile Launches Cheapest 4g Volte Smart Phone in India at Effective Price of INR 699 Only ,https://www.newsvoir.com/release/jivi-mobile-launches-cheapest-4g-volte-smart-phone-in-india-at-effective-price-of-inr-699-only-9843.html
96,UC Browser Registers 130 Million Monthly Active Users in India,https://www.newsvoir.com/release/uc-browser-registers-130-million-monthly-active-users-in-india-9797.html
97,3rd Edition of Future Generation Optical Transport Networks Summit to Address Latest Trends in Optical Tech Deployment,https://www.newsvoir.com/release/3rd-edition-of-future-generation-optical-transport-networks-summit-to-address-latest-trends-in-optical-tech-deployment-9770.html
98,Vodafone CEO Compliments Indian Government for Marked Improvement in ease of doing Business ,https://www.newsvoir.com/release/vodafone-ceo-compliments-indian-government-for-marked-improvement-in-ease-of-doing-business-9741.html
99,"Tejas Networks Announces Consolidated Results for Quarterended December 31, 2017",https://www.newsvoir.com/release/tejas-networks-announces-consolidated-results-for-quarterended-december-31-2017-9704.html
100,Future is Exciting for Vodafone Customers at Vodafone Premier Badminton League Season 3,https://www.newsvoir.com/release/future-is-exciting-for-vodafone-customers-at-vodafone-premier-badminton-league-season-3-9643.html
101,Vodafone M-Pesa Enables Rural Rajasthan Go Cashless,https://www.newsvoir.com/release/vodafone-m-pesa-enables-rural-rajasthan-go-cashless-9604.html
102,Countdown to Vodafone Rangasangeet 2017 Winner Announcement Begins,https://www.newsvoir.com/release/countdown-to-vodafone-rangasangeet-2017-winner-announcement-begins-9601.html
103,India Highly Vulnerable to be Hit by Cyber-Attacks Tsunami,https://www.newsvoir.com/release/india-highly-vulnerable-to-be-hit-by-cyber-attacks-tsunami-9588.html
104,Airtel and Intex Join Hands to Launch a Range of Affordable 4G Smartphones Starting at Just Rs. 1649,https://www.newsvoir.com/release/airtel-and-intex-join-hands-to-launch-a-range-of-affordable-4g-smartphones-starting-at-just-rs-1649-9567.html
105,Vodafone Introduces Noida’s First Free Wi-Fi Enabled Bus Shelter,https://www.newsvoir.com/release/vodafone-introduces-noida-s-first-free-wi-fi-enabled-bus-shelter-9555.html
106,Vodafone Guarantees Savings With New RED TOGETHER,https://www.newsvoir.com/release/vodafone-guarantees-savings-with-new-red-together-9540.html
107,The Eighth Edition of Vodafone Rangasangeet 2017 Kick Starts,https://www.newsvoir.com/release/the-eighth-edition-of-vodafone-rangasangeet-2017-kick-starts-9529.html
108,"Get SIM Upgrade and Aadhar Linking done at your Doorstep, through Vodafone Mobile Vans",https://www.newsvoir.com/release/get-sim-upgrade-and-aadhar-linking-done-at-your-doorstep-through-vodafone-mobile-vans-9516.html
109,Teleperformance in India Recognized as a 2017 Global Aon Best Employer,https://www.newsvoir.com/release/teleperformance-in-india-recognized-as-a-2017-global-aon-best-employer-9514.html
110,"Phonup Offers the Best Care of your Smartphone and Tablet

",https://www.newsvoir.com/release/phonup-offers-the-best-care-of-your-smartphone-and-tablet-9490.html
111,Vodafone Launches SuperIoT - An Industry-First End-to-end IoT Solution,https://www.newsvoir.com/release/vodafone-launches-superiot-an-industry-first-end-to-end-iot-solution-9484.html
112,Vodafone Chhota Champion - Stay Connected for an Entire Month at Only Rs. 38,https://www.newsvoir.com/release/vodafone-chhota-champion-stay-connected-for-an-entire-month-at-only-rs-38-9466.html
113,Airtel Launches India’s First Telecom Infra Project (TIP) Community Lab ,https://www.newsvoir.com/release/airtel-launches-india-s-first-telecom-infra-project-tip-community-lab--9455.html
114,Airtel Introduces New Postpaid and Prepaid Innovations,https://www.newsvoir.com/release/airtel-introduces-new-postpaid-and-prepaid-innovations-9441.html
115,SDN and NFV could be the Next Game Changer in India Telecom Sector: SDN & NFV India Congress 2017,https://www.newsvoir.com/release/sdn-and-nfv-could-be-the-next-game-changer-in-india-telecom-sector-sdn-nfv-india-congress-2017-9437.html
116,Vodafone Enables Reliance Communications Customers To Port Out and Continue Using their Number,https://www.newsvoir.com/release/vodafone-enables-reliance-communications-customers-to-port-out-and-continue-using-their-number-9435.html
117,CSB House Launches SIC Robo First-of if its-kind AI Powered Free Mobile App for Stock Traders,https://www.newsvoir.com/release/csb-house-launches-sic-robo-first-of-if-its-kind-ai-powered-free-mobile-app-for-stock-traders-9430.html
118,Service-oriented Data Centres are Rapidly Evolving in India,https://www.newsvoir.com/release/service-oriented-data-centres-are-rapidly-evolving-in-india-9419.html
119,Malaysia Airlines Reaches the Cloud with Tata Consultancy Services,https://www.newsvoir.com/release/malaysia-airlines-reaches-the-cloud-with-tata-consultancy-services-9399.html
120,"‘SDN & NFV India Congress 2017’ India’s Biggest Conference on SDN and NFV to be Held in Mumbai on November 1, 2017",https://www.newsvoir.com/release/-sdn-nfv-india-congress-2017-india-s-biggest-conference-on-sdn-and-nfv-to-be-held-in-mumbai-on-november-1-2017-9391.html
121,Vodafone Associates with HP India & KPMG (‘KPMG in India’) to offer GST Ready Solutions for Business for Enterprises,https://www.newsvoir.com/release/vodafone-associates-with-hp-india-kpmg-kpmg-in-india-to-offer-gst-ready-solutions-for-business-for-enterprises-9362.html
122,Trabug Launches India's First Mobility Solution for the Inbound Travellers ,https://www.newsvoir.com/release/trabug-launches-india-s-first-mobility-solution-for-the-inbound-travellers-9266.html
123,"Videocon Wallcam Partners with Vodafone, Announces Launch of Industry’s First 4G Enabled CCTV Solution",https://www.newsvoir.com/release/videocon-wallcam-partners-with-vodafone-announces-launch-of-industry-s-first-4g-enabled-cctv-solution-9296.html
124,Rosenberger to Showcase its Next Generation Technology at IMC 2017,https://www.newsvoir.com/release/rosenberger-to-showcase-its-next-generation-technology-at-imc-2017-9267.html
